originalSentence,referenceSentence,tamperingType,tamperedSentence,"LLMScore (Sim, Con)",BLEU,METEOR,Rouge1 r,Rouge1 p,Rouge1 f,Rouge2 r,Rouge2 p,Rouge2 f,Rougel r,Rougel p,Rougel f,LLM-Sim,LLM-Con,originalLanguage
or are they the potential victims of those whose promises to them ultimately result in their deaths?,"eller er de potentielle ofre for dem, hvis løfter i sidste ende bliver deres død.",Duplicate Token,or are they the potential victims of those whose promises to them ultimately ultimately result in their deaths?,"(0.99, 0.95)",0.8981075993548011,0.9938,1.0,1.0,0.999999995,0.9411764705882352,1.0,0.9696969647015612,1.0,1.0,0.999999995,0.99,0.95,en
what else can we do?,hvad kan vi ellers gøre?,Duplicate Token,what what else can we do?,"(0.95, 0.95)",0.846481724890614,0.9813,1.0,1.0,0.999999995,0.8,1.0,0.8888888839506174,1.0,1.0,0.999999995,0.95,0.95,en
because i think there is no development without security and no security without development.,"fordi jeg mener, at udvikling og sikkerhed hænger uløseligt sammen.",Swap characters,because i think there is no development without security and no security withotu development.,"(0.98, 0.95)",0.8242367502646054,0.9224,0.9090909090909092,1.0,0.9523809473922904,0.8461538461538461,0.8461538461538461,0.8461538411538462,0.9090909090909092,1.0,0.9523809473922904,0.98,0.95,en
"victims of terrorism require our full attention, and the ways to assist them are under discussion in a number of international fora.","ofrene for terrorisme kræver vores fulde opmærksomhed, og det drøftes i en række internationale fora, hvordan de kan hjælpes.",Swap words,"victims of terrorism require our full attention, and the ways to assist them are discussion under in a number of international fora. ","(0.95, 0.99)",0.8580511307421129,0.9977,0.9545454545454546,1.0,0.976744181049216,0.8181818181818182,0.8571428571428571,0.8372092973282856,0.9090909090909092,0.9523809523809524,0.9302325531422392,0.95,0.99,en
"dialogue between cultures and civilisations is also highly important, and i cannot agree that this should be restricted to extremist and fundamentalist islamists.","dialogen mellem kulturer og civilisationer er også meget vigtig, og jeg er ikke enig i, at dette er begrænset til ekstremistiske og fundamentalistiske islamister.",Negation,"dialogue between cultures and civilisations is also highly important, and i can agree that this should be restricted to extremist and fundamentalist islamists.","(0.95, 0.95)",0.8942255541978509,0.965,0.9523809523809524,0.9523809523809524,0.9523809473809524,0.9090909090909092,0.9090909090909092,0.9090909040909092,0.9523809523809524,0.9523809523809524,0.9523809473809524,0.95,0.95,en
"finally, it is in this spirit that the commission will also examine the very important remarks and recommendations that have been made and are included in this report.","til sidst vil jeg sige, at det er i denne ånd, at kommissionen vil undersøge de meget vigtige bemærkninger og henstillinger, der er blevet fremsat og indgår i denne betænkning.",Duplicate character,"finally, it is in this spirit that the commission will also examine the very importaant remarks and recommendations that have been made and are included in this report.","(0.99, 0.99)",0.9095930632220222,0.9665,0.9565217391304348,0.9565217391304348,0.9565217341304348,0.9230769230769232,0.9230769230769232,0.9230769180769232,0.9565217391304348,0.9565217391304348,0.9565217341304348,0.99,0.99,en
this is completely alien when dealing with terrorists.,"det er helt anderledes, når det drejer sig om terrorister.",Remove Token,is completely alien when dealing with terrorists.,"(0.95, 0.98)",0.8633400213704505,0.898,1.0,0.875,0.9333333283555556,1.0,0.8571428571428571,0.9230769181065088,1.0,0.875,0.9333333283555556,0.95,0.98,en
"for their own sake, but also because they are cornerstones of peace and human development, they are indeed agreed common values and the foundations of the long-term strategic partnership which the european union wants to have with russia.","på grund af deres natur, men også fordi de er afgørende for fred og menneskelig udvikling, er de helt afgjort fælles værdier, som der er enighed om, og de er grundlaget for det langsigtede strategiske partnerskab, som eu ønsker at have med rusland.",Add random word,"for their gibberish own sake, but also because they are cornerstones of peace and human development, they are indeed agreed common values and the foundations of the long-term strategic partnership which the european union wants to have with russia.","(0.95, 0.95)",0.9442187296037128,0.9975,0.9696969696969696,1.0,0.984615379616568,0.945945945945946,0.9722222222222222,0.9589041045899794,0.9696969696969696,1.0,0.984615379616568,0.95,0.95,en
all of those authorities are directly bound by the above-mentioned international instruments and their individual return decisions are subject to judicial review before national courts.,"alle disse myndigheder er direkte bundet af nævnte internationale instrumenter, og de enkelte tilbagesendelsesbeslutninger kan underkastes domstolsprøvelse ved nationale domstole.",Remove Character,all of those authorities are directly bound by the above-mentioned international instruments and their individual return decisins are subject to judicial review before national courts.,"(0.99, 0.95)",0.8942255541978509,0.9613,0.9583333333333334,0.9583333333333334,0.9583333283333336,0.9166666666666666,0.9166666666666666,0.9166666616666668,0.9583333333333334,0.9583333333333334,0.9583333283333336,0.99,0.95,en
"honourable members, the extension of our common borders after the eu enlargement has of course broadened the scope of our cooperation with russia.",udbredelsen af vores fælles grænser efter udvidelsen af eu har naturligvis også udvidet samarbejdet med rusland.,Duplicate character,"honourable membbers, the extension of our common borders after the eu enlargement has of course broadened the scope of our cooperation with russia.","(0.99, 0.99)",0.9244754047211334,0.9597,0.9444444444444444,0.9444444444444444,0.9444444394444445,0.9047619047619048,0.9047619047619048,0.9047618997619048,0.9444444444444444,0.9444444444444444,0.9444444394444445,0.99,0.99,en
how can travellers today still be required to register with the police at different places?,hvordan kan rejsende i dag stadig være forpligtede til at lade sig registrere hos politiet forskellige steder?,Duplicate character,how can travellers today still be required to register with the poliice at different places?,"(0.98, 0.99)",0.8153551038173115,0.9364,0.9333333333333332,0.9333333333333332,0.9333333283333336,0.8571428571428571,0.8571428571428571,0.8571428521428571,0.9333333333333332,0.9333333333333332,0.9333333283333336,0.98,0.99,en
"this represents a further step toward completing the creation of an area of freedom, security and justice, within the framework of the strategic partnership between the european union and russia.","den skal ses som et skridt fremad mod gennemførelsen af det fælles område med frihed, sikkerhed og retfærdighed inden for det strategiske partnerskab mellem eu og rusland.",Swap words,"this represents a further step toward completing the creation of area an of freedom, security and justice, within the framework of the strategic partnership between the european union and russia. ","(0.99, 0.99)",0.9005694513489713,0.9991,0.96,1.0,0.9795918317367764,0.8666666666666667,0.896551724137931,0.8813559272048264,0.92,0.9583333333333334,0.9387755052061642,0.99,0.99,en
"admittedly, these agreements enable progress to be made, in particular on the price of visas and the simplification of the procedure, but several problems remain.","med de to aftaler kan der ganske vist gøres fremskridt, særlig med hensyn til prisen på visa og forenkling af proceduren, men der resterer en række problemer.",Replace Token with Random Word,"admittedly, these agreements enable progress to be made, in particular on the price of visas eeling the simplification of the procedure, but several problems remain.","(0.98, 0.99)",0.9061874434879644,0.9653,0.9545454545454546,0.9545454545454546,0.9545454495454548,0.9166666666666666,0.9166666666666666,0.9166666616666668,0.9545454545454546,0.9545454545454546,0.9545454495454548,0.98,0.99,en
"we also requested clearer commitments for visas, which, in the long run, would have meant putting a stop to the invitation and registration system and simplifying the procedure for bona fide travellers.","vi har også anmodet om klarere forpligtelser for visa, hvilket i det lange løb ville have gjort en ende på invitations- og registreringsordningen og betydet en forenkling af proceduren for rejsende, der er i god tro.",Remove Token,"we also clearer commitments for visas, which, in the long run, would have meant putting a stop to the invitation and registration system and simplifying the procedure for bona fide travellers.","(0.95, 0.99)",0.9336312563108614,0.9748,1.0,0.9642857142857144,0.9818181768198349,0.9666666666666668,0.935483870967742,0.9508196671324912,1.0,0.9642857142857144,0.9818181768198349,0.95,0.99,en
"in spite of all the shortcomings, parliament has shown a constructive attitude.",til trods for alle manglerne har parlamentet udvist en konstruktiv holdning.,Swap characters,"in spite of all the shortcomings, parliament has shown a construtcive attitude.","(0.99, 0.95)",0.8091067115702212,0.9269,0.9166666666666666,0.9166666666666666,0.9166666616666668,0.8181818181818182,0.8181818181818182,0.8181818131818183,0.9166666666666666,0.9166666666666666,0.9166666616666668,0.99,0.95,en
"both issues are, of course, relevant to the general, overarching objective of the whole agreement, namely that of abolishing the visa system.","begge disse spørgsmål er fuldstændig på linje med det store overordnede mål for hele aftalen, nemlig at afskaffe visumsystemet.",Remove Token,"both issues are, of course, relevant to the general, overarching objective of the whole agreement, namely that of abolishing the visa.","(0.98, 0.95)",0.9304899483313592,0.9663,1.0,0.9444444444444444,0.9714285664326532,1.0,0.9523809523809524,0.9756097511005354,1.0,0.9444444444444444,0.9714285664326532,0.98,0.95,en
it is also difficult to understand why the joint readmission committee is not authorised to monitor compliance with human rights and why individuals seeking political asylum are covered by the agreement.,"det er også vanskeligt at forstå, hvorfor det blandede tilbagetagelsesudvalg ikke er bemyndiget til at overvåge overholdelsen af menneskerettighederne, og hvorfor personer, der søger politisk asyl, er omfattet af aftalen.",Negation,it is also difficult to understand why the joint readmission committee is authorised to monitor compliance with human rights and why individuals seeking political asylum are covered by the agreement.,"(0.95, 0.95)",0.9157103753711766,0.9717,1.0,0.9629629629629628,0.9811320704734782,0.9655172413793104,0.9333333333333332,0.949152537374318,1.0,0.9629629629629628,0.9811320704734782,0.95,0.95,en
"to facilitate the granting of visas, we first have to have reciprocal agreements, examples of which are the proposals now before us.","for at lette udstedelsen af visa må vi først have gensidige aftaler, og disse forslag er eksempler på dette.",Duplicate character,"to facilitate the granting of visas, we first have to have reciiprocal agreements, examples of which are the proposals now before us.","(1.00, 1.00)",0.8895260356363631,0.9597,0.9444444444444444,0.9444444444444444,0.9444444394444445,0.9047619047619048,0.9047619047619048,0.9047618997619048,0.9444444444444444,0.9444444444444444,0.9444444394444445,1.00,1.00,en
"(pl) mr president, reciprocity and solidarity are two values that should be crucial to relations between the european union and russia.","(pl) hr. formand! gensidighed og solidaritet er to værdier, som bør være afgørende for forbindelserne mellem eu og rusland.",Swap characters,"(pl) mr persident, reciprocity and solidarity are two values that should be crucial to relations between the european union and russia.","(1.00, 1.00)",0.8895260356363631,0.9597,0.95,0.95,0.949999995,0.9,0.9,0.899999995,0.95,0.95,0.949999995,1.00,1.00,en
"i believe there are two aspects that should be considered in relation to the second value, namely solidarity.","jeg mener, at der er to ting, som bør overvejes i forbindelse med den anden værdi, dvs. solidaritet.",Add random word,"i believe there are two aspects that should be considered in relation to the second value, seedbed namely solidarity.","(0.95, 0.95)",0.8680538146126793,0.9945,0.9473684210526316,1.0,0.9729729679766254,0.8888888888888888,0.9411764705882352,0.914285709289796,0.9473684210526316,1.0,0.9729729679766254,0.95,0.95,en
the second aspect to consider is the solidarity between the citizens of the union and the citizens of the russian federation.,"den anden ting, der bør overvejes, er solidariteten mellem eu's borgere og borgerne i den russiske føderation.",Replace Character,the second aspect to consider is the solidarity between the citizens of the union and rhe citizens of the russian federation.,"(0.99, 0.99)",0.8725129388059689,0.917,0.9333333333333332,1.0,0.9655172363852556,0.8888888888888888,0.9411764705882352,0.914285709289796,0.9333333333333332,1.0,0.9655172363852556,0.99,0.99,en
i should like to emphasise that the citizens of the new member states are particularly aware of what a blessing freedom of travel is.,"jeg vil gerne understrege, at borgerne fra de nye medlemsstater er særligt opmærksomme på, hvilken velsignelse frihed til at rejse er.",Duplicate character,i should like to emphasise that the citizens of thhe new member states are particularly aware of what a blessing freedom of travel is.,"(0.99, 1.00)",0.8895260356363631,0.9578,0.9545454545454546,1.0,0.976744181049216,0.9130434782608696,0.9130434782608696,0.9130434732608697,0.9545454545454546,1.0,0.976744181049216,0.99,1.00,en
there need to be continued efforts to commence talks.,der skal gøres en vedvarende indsats for at indlede forhandlingerne.,Duplicate character,there need tto be continued efforts to commence talks.,"(0.99, 0.99)",0.7071067811865475,0.8951,0.8888888888888888,1.0,0.9411764656055364,0.75,0.75,0.749999995,0.8888888888888888,1.0,0.9411764656055364,0.99,0.99,en
"(lv) ladies and gentlemen, resolving the issue of visa facilitation and readmission is an important task that would promote the consolidation of common values.","(lv) hr. formand, mine damer og herrer! løsningen af problemet med lettelse af udstedelsen af visa og tilbagetagelse er en vigtig opgave, som ville fremme konsolideringen af fælles værdier.",Swap words,"(lv) ladies and gentlemen, resolving the issue of visa facilitation and readmission is an important task that would promote the consolidation of values. common ","(0.95, 0.95)",0.9214109120166036,0.9994,1.0,1.0,0.999999995,0.9130434782608696,0.9130434782608696,0.9130434732608697,1.0,1.0,0.999999995,0.95,0.95,en
i believe that the demarcation of borders and the conclusion of a readmission agreement are preconditions for the signing of a visa facilitation agreement.,"jeg mener, at fastlæggelsen af grænserne og indgåelsen af en tilbagetagelsesaftale er forudsætninger for underskrivelse af en aftale om lettelse af visumreglerne.",Remove Token,i believe that the of borders and the conclusion of a readmission agreement are preconditions for the signing of a visa facilitation agreement.,"(0.98, 0.99)",0.8895260356363631,0.9636,1.0,0.9444444444444444,0.9714285664326532,0.9523809523809524,0.9090909090909092,0.9302325531422392,1.0,0.9444444444444444,0.9714285664326532,0.98,0.99,en
i believe the answer is yes.,"jeg mener, at svaret er ja.",Replace Token with Random Word,nanocephalia believe the answer is yes.,"(0.85, 0.95)",0.8091067115702212,0.8552,0.8333333333333334,0.8333333333333334,0.8333333283333335,0.8,0.8,0.7999999950000002,0.8333333333333334,0.8333333333333334,0.8333333283333335,0.85,0.95,en
lithuania has led the way as the first and only eu nation so far to have a readmission agreement with russia.,"litauen har ført an som den første og hidtil eneste eu-stat, der har en tilbagetagelsesaftale med rusland.",Add random word,lithuania has led the way snippetiest as the first and only eu nation so far to have a readmission agreement with russia.,"(0.95, 0.95)",0.880773500588743,0.9951,0.9523809523809524,1.0,0.9756097511005354,0.9047619047619048,0.95,0.9268292632956572,0.9523809523809524,1.0,0.9756097511005354,0.95,0.95,en
"i agree with a number of colleagues who have sharply criticised the agreement, especially for the lack of sufficient nexus to human rights and liberties.","jeg er enig med en række kolleger, som har kritiseret aftalen skarpt, navnlig for manglen på tilstrækkelig sammenhæng med menneskerettigheder og frihedsrettigheder.",Swap characters,"i agree with a number of colleagues who have sharpyl criticised the agreement, especially for the lack of sufficient nexus to human rights and liberties.","(0.99, 0.95)",0.8985396083419646,0.9627,0.9565217391304348,0.9565217391304348,0.9565217341304348,0.9166666666666666,0.9166666666666666,0.9166666616666668,0.9565217391304348,0.9565217391304348,0.9565217341304348,0.99,0.95,en
"nonetheless, it is a step in the right direction.",alligevel er den et skridt i den rigtige retning.,Replace Character,"nonetheless, it is a step in tte right direction.","(0.95, 0.99)",0.7016879391277372,0.9055,0.8888888888888888,0.8888888888888888,0.888888883888889,0.75,0.75,0.749999995,0.8888888888888888,0.8888888888888888,0.888888883888889,0.95,0.99,en
"this provision also applies in areas of codecision, so in my view the procedures set up by the ec treaty have been fully respected, both on readmission and on visa facilitation.","denne bestemmelse gælder også på områder, hvor den fælles beslutningsprocedure finder anvendelse, så efter min opfattelse er de procedurer, der er fastsat i ef-traktaten, blevet respekteret fuldt ud, både hvad angår tilbagetagelse og lettelse af udstedelsen af visa.",Remove Character,"this provision also applies in areas of codecision, so in my view the procedures set up by the ec treaty have been fully respected, both on reamission and on visa facilitation.","(0.98, 0.99)",0.9210500207490828,0.9705,0.9642857142857144,0.9642857142857144,0.9642857092857144,0.9333333333333332,0.9333333333333332,0.9333333283333336,0.9642857142857144,0.9642857142857144,0.9642857092857144,0.98,0.99,en
"you raised two topics, namely registration requirements and the removal of invitations.","der blev rejst to spørgsmål, nemlig registreringskrav og afskaffelse af invitationer.",Remove Character,"you raised two topics, namely registration requirements and the remoal of invitations.","(0.98, 0.95)",0.7825422900366437,0.9269,0.9166666666666666,0.9166666666666666,0.9166666616666668,0.8181818181818182,0.8181818181818182,0.8181818131818183,0.9166666666666666,0.9166666666666666,0.9166666616666668,0.98,0.95,en
"according to this law, an appearance in person will no longer be required for registration.",i henhold til denne lov er det ikke længere nødvendigt at møde op personligt for at blive registreret.,Remove Character,"according to this law, an appearance in persn will no longer be required for registration.","(0.99, 0.95)",0.8282477531331041,0.9403,0.9333333333333332,0.9333333333333332,0.9333333283333336,0.8571428571428571,0.8571428571428571,0.8571428521428571,0.9333333333333332,0.9333333333333332,0.9333333283333336,0.99,0.95,en
"in the case of asylum applications at the border, the principle of non refoulement has to be fully respected by member states in accordance with article 18 of the agreement.","hvis der er tale om asylansøgninger ved grænsen, skal medlemsstaterne fuldt ud respektere princippet om ikkeafvisning i overensstemmelse med aftalens artikel 18.",Duplicate Token,"in the case of asylum applications at the border, the principle of non refoulement has to be fully respected by member states states in accordance with article 18 of the agreement.","(0.99, 0.99)",0.9440368015398672,0.9968,1.0,1.0,0.999999995,0.9666666666666668,1.0,0.9830508424590636,1.0,1.0,0.999999995,0.99,0.99,en
"the agreement was intended as part of a process that was designed to strengthen relations between the parties through the creation of a common area founded on freedom, security and justice.","aftalen skulle være et led i en proces, som tog sigte på at styrke forbindelserne mellem parterne gennem oprettelsen af et fælles område med frihed, sikkerhed og retfærdighed.",Duplicate Token,"the agreement was intended as part of a process that was designed to strengthen relations between the parties through the creation of a common area founded on freedom freedom, security and justice.","(0.99, 0.99)",0.945776776063842,0.9969,0.9629629629629628,1.0,0.9811320704734782,0.9333333333333332,0.9655172413793104,0.949152537374318,0.9629629629629628,1.0,0.9811320704734782,0.99,0.99,en
the readmission agreement was proposed by parliament together with the visa facilitation agreement.,parlamentet foreslog tilbagetagelsesaftalen og aftalen om lettelse af udstedelsen af visa.,Add random word,the readmission agreement was katalyzer proposed by parliament together with the visa facilitation agreement.,"(0.95, 0.95)",0.8052253761904355,0.9915,0.9166666666666666,1.0,0.9565217341398866,0.8461538461538461,0.9166666666666666,0.879999995008,0.9166666666666666,1.0,0.9565217341398866,0.95,0.95,en
the next item is the joint debate on:,næste punkt på dagsordenen er forhandling under ét om,Replace Character,the next icem is the joint debate on:,"(0.95, 0.9)",0.6606328636027614,0.8819,0.8571428571428571,0.8571428571428571,0.8571428521428571,0.7142857142857143,0.7142857142857143,0.7142857092857143,0.8571428571428571,0.8571428571428571,0.8571428521428571,0.95,0.9,en
"firstly, one point made in it is that financial and economic policy needs to be better coordinated, especially within the euro zone.","de er nemlig blevet gentaget igen og igen i løbet af årene. men hvis man kigger nærmere på den aktuelle situation, kan man hurtigt fastslå, at der ikke er mangel på koordineringsprocedurer i den økonomiske og monetære union.",Duplicate character,"firstly, one point made in it is that financial and economic policy needs to be bettter coordinated, especially within the euro zone.","(1.00, 1.00)",0.8895260356363631,0.9597,0.9545454545454546,0.9545454545454546,0.9545454495454548,0.9047619047619048,0.9047619047619048,0.9047618997619048,0.9545454545454546,0.9545454545454546,0.9545454495454548,1.00,1.00,en
today's debate is taking place during the weeks leading up to the spring european council of 8 march and involves cooperating in the preparations for that council.,"dagens forhandling finder sted i ugerne op til det europæiske råds forårsmøde den 8. marts, og den drejer sig om samarbejde om forberedelsen af dette råd.",Remove Token,today's debate is taking place during the weeks leading up to the spring european council of 8 march involves cooperating in the preparations for that council.,"(1.00, 1.00)",0.9061874434879644,0.9687,1.0,0.9583333333333334,0.9787233992575828,0.96,0.9230769230769232,0.9411764655901576,1.0,0.9583333333333334,0.9787233992575828,1.00,1.00,en
"i shall end, mr president, by expressing my desire for this plenary to endorse the practically unanimous support of the respective committees for the reports by mr bullmann and mr andersson.","jeg slutter, hr. formand, med at give udtryk for mit ønske om, at parlamentets plenarforsamling bekræfter den praktisk taget enstemmige støtte, som hr. bullmanns og hr. anderssons betænkninger har fået i de respektive udvalg.",Duplicate Token,"i shall end, mr president, by expressing my desire for this plenary to endorse the practically unanimous support of the respective committees for the reports by mr mr bullmann and mr andersson.","(0.99, 0.95)",0.9474114688990278,0.9963,1.0,1.0,0.999999995,0.967741935483871,1.0,0.983606552378393,1.0,1.0,0.999999995,0.99,0.95,en
"that is something i really wish to emphasise, for there is a difference between the employment and the economic guidelines.","som hr. almunia sagde, forventer vi at kunne bruge lidt mere tid på dette, og vi har også behov for mere tid i parlamentet.",Replace Character,"that is momething i really wish to emphasise, for there is a difference between the employment and the economic guidelines.","(0.98, 0.99)",0.8867047947918724,0.9541,0.9444444444444444,0.9444444444444444,0.9444444394444445,0.8947368421052632,0.8947368421052632,0.8947368371052632,0.9444444444444444,0.9444444444444444,0.9444444394444445,0.98,0.99,en
"i attended the informal council of ministers meeting involving the employment ministers, a meeting that addressed another aspect of employment, namely that we want jobs that are actually better.","jeg deltog i det uformelle ministerrådsmøde med arbejdsministrene, hvor man tog fat i et andet aspekt, nemlig at vi vil have bedre job.",Duplicate character,"i attended the informal council of ministers meeting involving the employment ministers, a meeting that addressed another aspect of employment, naamely that we want jobs that are actually better.","(0.99, 0.99)",0.9157103753711766,0.9686,0.9583333333333334,0.9583333333333334,0.9583333283333336,0.9285714285714286,0.9285714285714286,0.9285714235714286,0.9583333333333334,0.9583333333333334,0.9583333283333336,0.99,0.99,en
