originalSentence,referenceSentence,tamperingType,tamperedSentence,"LLMScore (Sim, Con)",BLEU,METEOR,Rouge1 r,Rouge1 p,Rouge1 f,Rouge2 r,Rouge2 p,Rouge2 f,Rougel r,Rougel p,Rougel f,LLM-Sim,LLM-Con,originalLanguage
we will launch a broad and open consultation process in order to get the views of all the different parties interested.,vi vil lancere en bred og åben høringsprocedure for at høre synspunkterne fra alle interesserede parter.,Remove Character,we will launch a broad and open consultation process in order to get the views of all te different parties interested.,"(0.98, 0.95)",0.8725129388059689,0.9512,0.9523809523809524,1.0,0.9756097511005354,0.9,0.9,0.899999995,0.9523809523809524,1.0,0.9756097511005354,0.98,0.95,en
"this problem has been highlighted on several occasions, to whit in 1992, in 1995 and 1997.","forskellige gange er opmærksomheden henledt på dette problem, i 1992, i 1995 og i 1997.",Remove Token,"this problem has been highlighted on several occasions, whit in 1992, in 1995 and 1997.","(0.98, 0.95)",0.8492326635760689,0.9517,1.0,0.9333333333333332,0.9655172363852556,0.9285714285714286,0.8666666666666667,0.8965517191438764,1.0,0.9333333333333332,0.9655172363852556,0.98,0.95,en
the examples are all quoted in a resolution which lies before us.,"eksemplerne står alle sammen i et beslutningsforslag, som ligger foran os.",Replace Token with Random Word,the examples are all quoted in a resolution which lies cnemial us.,"(0.95, 0.90)",0.7910665071754358,0.9209,0.9166666666666666,0.9166666666666666,0.9166666616666668,0.8181818181818182,0.8181818181818182,0.8181818131818183,0.9166666666666666,0.9166666666666666,0.9166666616666668,0.95,0.90,en
"in fact, the obligation for coherence of policy was even included in the treaty of amsterdam in 1997.",i 1997 er forpligtelsen til sammenhæng mellem de forskellige politikker endda optaget i amsterdam-traktaten.,Swap characters,"in fact, the obligtaion for coherence of policy was even included in the treaty of amsterdam in 1997.","(0.99, 1.00)",0.8578928092681435,0.9494,0.9285714285714286,0.9285714285714286,0.9285714235714286,0.8823529411764706,0.8823529411764706,0.8823529361764706,0.9285714285714286,0.9285714285714286,0.9285714235714286,0.99,1.00,en
but what have we seen since then?,men hvad har vi set siden da?,Swap words,but what have we seen then? since ,"(0.85, 0.90)",0.6147881529512644,0.9736,1.0,1.0,0.999999995,0.6666666666666666,0.6666666666666666,0.6666666616666668,0.8571428571428571,0.8571428571428571,0.8571428521428571,0.85,0.90,en
"in order to prevent this cheap sugar from the developing countries from competing with the more expensive eu sugar, a considerable import levy is imposed on cane sugar.","for at hindre, at dette billige sukker fra udviklingslandene konkurrerer med det dyrere sukker fra eu, pålægges rørsukkeret en stor importafgift.",Remove Character,"in order to prevent this cheap sugar from the developing countries from competing with the more expensive eu sugar, a considerable import levy is impsed on cane sugar.","(0.99, 0.99)",0.9095930632220222,0.9665,0.96,0.96,0.959999995,0.925925925925926,0.925925925925926,0.925925920925926,0.96,0.96,0.959999995,0.99,0.99,en
this is also typical of a policy which makes citizens wonder what brussels actually does?,"det er også typisk den politik, hvorom vores borgere siger: hvad gør bruxelles egentlig?",Swap words,this is also typical of a policy which makes citizens what wonder brussels actually does? ,"(0.95, 0.99)",0.7700645773757425,0.9922,1.0,1.0,0.999999995,0.7857142857142857,0.7857142857142857,0.7857142807142857,0.9333333333333332,0.9333333333333332,0.9333333283333336,0.95,0.99,en
"why institute an oil boycott against haiti and not against burma, where an elected president is imprisoned, parliament has been sent home and some of the mps have been put in jail or even murdered?","hvorfor skal der være en olieboykot mod haiti og ikke mod burma, hvor en valgt præsident er tilbageholdt, et parlament er opløst, og en del af parlamentsmedlemmerne er fængslet eller endog myrdet?",Negation,"why institute an oil boycott against haiti and against burma, where an elected president is imprisoned, parliament has been sent home and some of the mps have been put in jail or even murdered?","(0.95, 0.95)",0.9299238452109287,0.9762,1.0,0.967741935483871,0.983606552378393,0.9696969696969696,0.9411764705882352,0.9552238755981288,1.0,0.967741935483871,0.983606552378393,0.95,0.95,en
"mr nielson, what we are waiting for is a good report on these inconsistencies and a number of specific proposals to eliminate these from the policy.","kommissær nielson, det, som vi venter på, er en god rapport om denne manglende sammenhæng og en række konkrete forslag med henblik på at skabe større sammenhæng mellem politikkerne.",Replace Character,"mr nielson, what we are waiting for is a good report on these inconsistencies and a number of specific proposals to eliminati these from the policy.","(0.99, 0.99)",0.9025139799587886,0.9641,0.9583333333333334,0.9583333333333334,0.9583333283333336,0.92,0.92,0.919999995,0.9583333333333334,0.9583333333333334,0.9583333283333336,0.99,0.99,en
i hope the message strikes home and i really hope that you will soon produce a report which contains measures.,"jeg håber, at dette budskab trænger rigtigt ind hos dem, og jeg håber virkelig, at de snart fremlægger en rapport med foranstaltninger.",Remove Character,i hope the message stikes home and i really hope that you will soon produce a report which contains measures.,"(1.00, 1.00)",0.8656030552541708,0.9519,0.9444444444444444,0.9444444444444444,0.9444444394444445,0.8947368421052632,0.8947368421052632,0.8947368371052632,0.9444444444444444,0.9444444444444444,0.9444444394444445,1.00,1.00,en
"mr president, mr president-in-office of the council, commissioner, ladies and gentlemen, following the same line as mrs maij-weggen, i believe that we have a number of representatives here who all feel passionate about contributing to this debate.","hr. formand, hr. formand for rådet, hr. kommissær, kære kolleger, jeg tror i lighed med min kollega fru maij-weggen, at der her er en række medlemmer, som alle sammen helhjertet vil komme ind på dette emne.",Add random word,"mr president, mr president-in-office of the council, commissioner, ladies and gentlemen, following untermed the same line as mrs maij-weggen, i believe that we have a number of representatives here who all feel passionate about contributing to this debate.","(0.99, 0.99)",0.9405662491609416,0.9976,0.9714285714285714,1.0,0.9855072413778618,0.945945945945946,0.9722222222222222,0.9589041045899794,0.9714285714285714,1.0,0.9855072413778618,0.99,0.99,en
"it is only natural that we in parliament guard the interests of our citizens, but it is also in the interest of our citizens to live in a stable, international environment, in which the goal of human safety is pursued.","naturligvis overvåger vi i parlamentet vores borgeres interesser, men det er også i vores borgeres interesse at leve i stabile internationale omgivelser, hvor der stræbes efter menneskenes sikkerhed.",Remove Character,"it is only natural that we in parliament guard the interests of our citizens, but it is also in the interest of our citizens to live in a stable, international environment, in which the goa of human safety is pursued.","(0.99, 0.99)",0.940028651976138,0.9772,0.9655172413793104,0.9655172413793104,0.9655172363793104,0.945945945945946,0.945945945945946,0.945945940945946,0.9655172413793104,0.9655172413793104,0.9655172363793104,0.99,0.99,en
"this is why we urge the commission, in this sharp and clear resolution, to develop specific instruments.",derfor opfordrer vi i dette skarpe og tydelige beslutningsforslag kommissionen til at udvikle konkrete instrumenter.,Remove Character,"this is why we urge the commission, in this sharp and clear resolution, to develop specfic instruments.","(1.00, 1.00)",0.8739351325046805,0.9494,0.9375,0.9375,0.937499995,0.875,0.875,0.874999995,0.9375,0.9375,0.937499995,1.00,1.00,en
"mr president, ladies and gentlemen, if our neighbour' s roof is leaking, we can lend him pots and pans to collect the water, but it is, of course, more effective to help him plug the leak in the roof.","hr. formand, kære kolleger, når vores naboers tag er utæt, kan vi give dem potter og pander til at opsamle vandet i, men naturligvis er det mere effektivt at hjælpe dem med at tætne taget.",Swap words,"mr president, ladies and gentlemen, if our neighbour' s roof is leaking, we can lend him pots and pans to collect the water, but it is, of course, more effective to help him plug leak the in the roof. ","(0.98, 0.95)",0.9321235367565792,0.9997,0.9705882352941176,1.0,0.9850746218667856,0.8974358974358975,0.9210526315789472,0.9090909040917524,0.9411764705882352,0.9696969696969696,0.9552238755981288,0.98,0.95,en
nor do we do much to really prevent human rights violations.,og man foretager sig ikke det store for virkelig at forhindre overtrædelser af menneskerettighederne.,Replace Token with Random Word,nor do we do much to really prevent human rights mahonias.,"(0.90, 0.95)",0.8265168183793802,0.9139,0.9,0.9,0.899999995,0.9,0.9,0.899999995,0.9,0.9,0.899999995,0.90,0.95,en
we must leave raw materials so that local manufacturers can process them.,"man må overlade råstofferne til de lokale producenter, så de kan forarbejde dem.",Swap characters,we must leave raw materials so that locla manufacturers can process them.,"(0.98, 0.99)",0.7611606003349892,0.9209,0.9166666666666666,0.9166666666666666,0.9166666616666668,0.8181818181818182,0.8181818181818182,0.8181818131818183,0.9166666666666666,0.9166666666666666,0.9166666616666668,0.98,0.99,en
"and yet, and this is the sixth area of incoherence, we do not defend the application of the current treaties.","derimod, og det er det sjette eksempel på manglende sammenhæng, forsvarer vi ikke anvendelsen af de eksisterende traktater.",Negation,"and yet, and this is the sixth area of incoherence, we do defend the application of the current treaties.","(0.95, 0.95)",0.8787419089273848,0.9603,1.0,0.9375,0.967741930489074,0.9444444444444444,0.8947368421052632,0.9189189139225714,1.0,0.9375,0.967741930489074,0.95,0.95,en
the eighth area of incoherence is of a political and practical nature.,det ottende eksempel på manglende sammenhæng er politisk og praktisk.,Swap words,eighth the area of incoherence is of a political and practical nature. ,"(0.98, 0.95)",0.8593887047640296,0.9939,0.9166666666666666,1.0,0.9565217341398866,0.75,0.8181818181818182,0.7826086906616257,0.8333333333333334,0.9090909090909092,0.8695652124007562,0.98,0.95,en
and yet we disregard local development agencies and prefer to negotiate with national governments and subsidise northern ngos at the expense of local programmes and southern ngos.,"dog ignorerer man de lokale aktører i udviklingen, idet man foretrækker at diskutere med de nationale regeringer og støtte ngo'er i norden på bekostning af lokale programmer og ngo'er i syden.",Duplicate character,and yet we disregard local development agencies aand prefer to negotiate with national governments and subsidise northern ngos at the expense of local programmes and southern ngos.,"(0.99, 0.99)",0.9025139799587886,0.9636,0.9565217391304348,1.0,0.977777772780247,0.9230769230769232,0.9230769230769232,0.9230769180769232,0.9565217391304348,1.0,0.977777772780247,0.99,0.99,en
"in the meantime, however, as has already been mentioned, the negotiations on the future of the lomé convention have been concluded.",i mellemtiden er som nævnt forhandlingerne om den kommende lomé-konvention blevet afsluttet.,Swap characters,"in the maentime, however, as has already been mentioned, the negotiations on the future of the lomé convention have been concluded.","(0.99, 0.99)",0.9016312132446728,0.9597,0.9411764705882352,0.9411764705882352,0.9411764655882354,0.9,0.9,0.899999995,0.9411764705882352,0.9411764705882352,0.9411764655882354,0.99,0.99,en
"yes, it does say: 'coherence of different union policies with development policy' .","jo, der står faktisk ""sammenhængen mellem unionens forskellige politikker og udviklingspolitikken"".",Duplicate Token,"yes, it does say: 'coherence of different union policies policies with development policy'.","(0.98, 0.95)",0.8844489226418503,0.9928,1.0,1.0,0.999999995,0.9166666666666666,1.0,0.9565217341398866,1.0,1.0,0.999999995,0.98,0.95,en
"i know that the commissioner himself has some strong and extremely reasonable opinions on coherence, and these are what i should like to have heard expressed here today.","jeg ved, at kommissæren selv har både stærke og yderst fornuftige synspunkter med hensyn til kohærens, og dem havde jeg gerne hørt udtrykt her i dag.",Add random word,"bradyseismism i know that the commissioner himself has some strong and extremely reasonable opinions on coherence, and these are what i should like to have heard expressed here today.","(1.00, 1.00)",0.9672161004820058,0.9967,0.9629629629629628,1.0,0.9811320704734782,0.9642857142857144,1.0,0.9818181768198349,0.9629629629629628,1.0,0.9811320704734782,1.00,1.00,en
"this is money which is helping to impede the development of the agricultural sector in the developing countries, which accounts for 69% of the total work force there compared with 1.7% in the eu.","penge, som er med til at hæmme udviklingen i landbrugssektoren i udviklingslandene, som her udgør 69% af den samlede arbejdsstyrke mod 1,7% i eu.",Swap characters,"this is money which is helping to impede the dveelopment of the agricultural sector in the developing countries, which accounts for 69% of the total work force there compared with 1.7% in the eu.","(0.99, 0.99)",0.9299238452109287,0.9736,0.9629629629629628,0.9629629629629628,0.9629629579629628,0.9375,0.9375,0.937499995,0.9629629629629628,0.9629629629629628,0.9629629579629628,0.99,0.99,en
there is neither coherence nor human decency here.,her er hverken kohærens eller anstændighed.,Add random word,camisade there is neither coherence nor human decency here.,"(1.00, 1.00)",0.8948393168143697,0.9883,0.8888888888888888,1.0,0.9411764656055364,0.875,1.0,0.9333333283555556,0.8888888888888888,1.0,0.9411764656055364,1.00,1.00,en
the prime minister of the united kingdom and his foreign secretary yesterday made statements on their policy in regard to the voting system within the council.,i går aflagde det forenede kongeriges premierminister og hans udenrigsminister redegørelser om deres politik vedrørende afstemningssystemet i rådet.,Remove Token,the prime minister of the united kingdom and his foreign secretary yesterday made statements their policy in regard to the voting system within the council.,"(0.99, 0.99)",0.8985396083419646,0.9663,1.0,0.9565217391304348,0.977777772780247,0.9583333333333334,0.92,0.9387755052061642,1.0,0.9565217391304348,0.977777772780247,0.99,0.99,en
"i personally feel that issues such as peace-building and conflict prevention and resolution are very much the domain of african heads of state, with capacity support from the european union and the oau acting as arbiter.","jeg føler personligt, at spørgsmål som fredsskabelse samt konfliktforebyggelse og -håndtering i høj grad er de afrikanske statschefers område med kapacitetsstøtte fra den europæiske union og med oau som voldgiftsmand.",Swap words,"i personally feel that issues such as peace-building and conflict prevention and resolution are very much the domain of african heads of state, with capacity support from the european union and oau the acting as arbiter. ","(0.99, 0.95)",0.91473325950086,0.9994,0.967741935483871,1.0,0.983606552378393,0.8888888888888888,0.9142857142857144,0.9014084457052172,0.935483870967742,0.9666666666666668,0.9508196671324912,0.99,0.95,en
"mr president, i too should like to thank the council and the commission for their reports and, in common with others, express my regret at the fact that coherence policy has not been given more prominence.","hr. formand, jeg vil også gerne takke rådet og kommissionen for deres redegørelser og ligesom andre beklage, at kohærenspolitikken ikke er kommet mere i centrum.",Negation,"mr president, i too should like to thank the council and the commission for their reports and, in common with others, express my regret at the fact that coherence policy has been given more prominence.","(0.95, 0.95)",0.933651069586263,0.9774,1.0,0.9705882352941176,0.9850746218667856,0.9705882352941176,0.9428571428571428,0.9565217341314852,1.0,0.9705882352941176,0.9850746218667856,0.95,0.95,en
this has everything to do with the difference of opinion which exists among various countries within the union regarding development cooperation.,dette har i høj grad at gøre med forskellen i holdningen til udviklingssamarbejde mellem forskellige lande i unionen.,Swap words,has this everything to do with the difference of opinion which exists among various countries within the union regarding development cooperation. ,"(0.95, 0.95)",0.9238852509542717,0.9987,0.9523809523809524,1.0,0.9756097511005354,0.8571428571428571,0.9,0.8780487754907793,0.9047619047619048,0.95,0.9268292632956572,0.95,0.95,en
"take the fishing agreements, where we recognise the unsustainability of current fishing practices within the eu waters.","tag f.eks. fiskeriaftalerne, hvor vi erkender den manglende bæredygtighed i den gældende fiskeripraksis i eu's farvande.",Duplicate character,"take the fishing agreements, where we recognise the unsustainability of currrent fishing practices within the eu waters.","(0.99, 0.95)",0.8492326635760689,0.9467,0.9285714285714286,0.9285714285714286,0.9285714235714286,0.875,0.875,0.874999995,0.9285714285714286,0.9285714285714286,0.9285714235714286,0.99,0.95,en
the results are certainly not what we expected.,"resultaterne er bestemt ikke, hvad vi havde forventet.",Negation,the results are certainly what we expected.,"(0.15, 0.95)",0.5969491792019646,0.8919,1.0,0.875,0.9333333283555556,0.8333333333333334,0.7142857142857143,0.7692307642603551,1.0,0.875,0.9333333283555556,0.15,0.95,en
"in most countries where the commission is active, development aid is also granted by the member states themselves.","i de fleste lande, hvor kommissionen er aktiv, giver medlemsstaterne også selv udviklingshjælp.",Duplicate character,"in most countries where the commission is active, development aid is also granted by the memmber states themselves.","(0.99, 0.99)",0.8578928092681435,0.9494,0.9375,0.9375,0.937499995,0.8823529411764706,0.8823529411764706,0.8823529361764706,0.9375,0.9375,0.937499995,0.99,0.99,en
"since amsterdam, three terms have taken centre stage: complementarity, coordination and cohesion.","siden amsterdam har tre begreber stået centralt: komplementaritet, koordinering og samhørighed.",Swap characters,"since amsterdam, three terms have taken centre stage: complementarity, coordination and coheison.","(0.98, 0.95)",0.8761560783209453,0.9364,0.9166666666666666,0.9166666666666666,0.9166666616666668,0.9090909090909092,0.9090909090909092,0.9090909040909092,0.9166666666666666,0.9166666666666666,0.9166666616666668,0.98,0.95,en
"i am anxious about the new stipulations in the partnership agreement with the acp countries, which might make it easier to expel immigrants, asylum seekers and refugees on flimsier grounds.","jeg er bekymret over de nye bestemmelser i partnerskabsaftalen med avs-landene, som skal gøre det lettere at udvise indvandrere, asylansøgere og flygtninge på et løsere grundlag.",Duplicate Token,"i am anxious about the new stipulations in the partnership agreement with the acp countries, which might make it easier to expel immigrants, asylum seekers and refugees on flimsier flimsier grounds.","(0.99, 0.99)",0.945776776063842,0.9969,1.0,1.0,0.999999995,0.9666666666666668,1.0,0.9830508424590636,1.0,1.0,0.999999995,0.99,0.99,en
three quarters of those who die are children under five years of age.,tre fjerdedele af dem er børn under fem år.,Replace Token with Random Word,three quarters of those who die are children under five years of butterless.,"(0.85, 0.95)",0.855526185871245,0.9269,0.9166666666666666,0.9166666666666666,0.9166666616666668,0.9166666666666666,0.9166666666666666,0.9166666616666668,0.9166666666666666,0.9166666666666666,0.9166666616666668,0.85,0.95,en
"i believe that patents on living organisms are designed only to control the global food supply, specifically for commercial purposes and for no other reason.","efter min mening har patent på levende organismer udelukkende til formål at kontrollere den globale levnedsmiddelforsyning, specielt i kommercielt øjemed, og ikke noget andet.",Duplicate Token,"i believe that patents on living organisms are designed only to control the global food supply, specifically for commercial purposes and and for no other reason.","(0.99, 0.99)",0.9333309921372168,0.9961,1.0,1.0,0.999999995,0.96,1.0,0.9795918317367764,1.0,1.0,0.999999995,0.99,0.99,en
"women appear to be completely absent from all areas, especially development policy when, of course, we are not in reality absent at all.","det virker, som om kvinder er fuldstændig fraværende i alle forbindelser, og ikke mindst inden for udviklingspolitikken, hvilket vi jo egentlig ikke er.",Negation,"women appear to be completely absent from all areas, especially development policy when, of course, we are in reality absent at all.","(0.95, 0.98)",0.8985396083419646,0.9663,1.0,0.9523809523809524,0.9756097511005354,0.9523809523809524,0.9090909090909092,0.9302325531422392,1.0,0.9523809523809524,0.9756097511005354,0.95,0.98,en
"this ought to be done with, in particular, a view to combating poverty and through investing in the development of capacity.",det bør ikke mindst ske med henblik på at bekæmpe fattigdommen og gennem at satse på en kapacitetsudvidelse.,Swap words,"this ought to be done with, in particular, a view to combating poverty and through in investing the development of capacity. ","(0.98, 0.95)",0.8580511307421129,0.9977,0.95,1.0,0.9743589693622616,0.8095238095238095,0.85,0.8292682876859013,0.95,1.0,0.9743589693622616,0.98,0.95,en
parliament' s resolution on the wto negotiations advocated a free import policy by the eu.,parlamentets beslutning om wto's forhandlinger slog til lyd for en fri importpolitik fra eu's side.,Duplicate Token,parliament' s resolution resolution on the wto negotiations advocated a free import policy by the eu.,"(1.00, 1.00)",0.8917143641551922,0.9933,1.0,1.0,0.999999995,0.9333333333333332,1.0,0.9655172363852556,1.0,1.0,0.999999995,1.00,1.00,en
"first, the committee on development and cooperation advocates the communitisation of the edf; clearly that is misguided.","for det første siger udvalget om udvikling og samarbejde, at de ønsker en regionalisering af den europæiske udviklingsfond, og det er tydeligt, at dette er en fejltagelse.",Replace Token with Random Word,"first, the committee on development and cooperation advocates the communitisation of the edf; clearly that is empale.","(0.85, 0.95)",0.9036020036098448,0.9494,0.9333333333333332,0.9333333333333332,0.9333333283333336,0.9375,0.9375,0.937499995,0.9333333333333332,0.9333333333333332,0.9333333283333336,0.85,0.95,en
"in our view, cooperation is, and should remain, an intergovernmental exercise.","vi mener, at samarbejdet er - og fortsat bør være - et internationalt anliggende.",Swap characters,"in our view, cooperation is, and should remain, an intergovernmental xeercise.","(0.99, 0.99)",0.8666415730847504,0.932,0.9090909090909092,0.9090909090909092,0.9090909040909092,0.9,0.9,0.899999995,0.9090909090909092,0.9090909090909092,0.9090909040909092,0.99,0.99,en
"lastly, the commission has, in the recent past, had trouble managing the funds for development and humanitarian aid transparently, as mrs maes has just reminded us so opportunely.","endelig har kommissionen for nylig, fru maes mindede om det, meget belejligt vist, hvilke vanskeligheder den har mødt med henblik på en gennemsigtig forvaltning af de bevillinger, som den tilkender udviklingsprogrammerne og de humanitære hjælpeprogrammer.",Swap characters,"lastly, the commission has, in the recent past, had troubel managing the funds for development and humanitarian aid transparently, as mrs maes has just reminded us so opportunely.","(0.99, 0.99)",0.9184678024441792,0.9696,0.9615384615384616,0.9615384615384616,0.9615384565384616,0.925925925925926,0.925925925925926,0.925925920925926,0.9615384615384616,0.9615384615384616,0.9615384565384616,0.99,0.99,en
"secondly, it will be important to approach development policies from a different angle in this context, taking advantage of their capacity for correcting imbalances and reducing inequality.","for det andet skal udviklingspolitikkerne i dette perspektiv have en anden dimension, og der skal lægges vægt på, at de bidrager til at afhjælpe ubalancer og mindske uligheder.",Replace Token with Random Word,"secondly, it will be important to approach development policies from a different angle resentless this context, taking advantage of their capacity for correcting imbalances and reducing inequality.","(0.98, 0.99)",0.9095930632220222,0.9665,0.9629629629629628,0.9629629629629628,0.9629629579629628,0.9230769230769232,0.9230769230769232,0.9230769180769232,0.9629629629629628,0.9629629629629628,0.9629629579629628,0.98,0.99,en
