originalSentence,referenceSentence,tamperingType,tamperedSentence,"LLMScore (Sim, Con)",BLEU,METEOR,Rouge1 r,Rouge1 p,Rouge1 f,Rouge2 r,Rouge2 p,Rouge2 f,Rougel r,Rougel p,Rougel f,LLM-Sim,LLM-Con,originalLanguage
we cannot support treating turkey differently and less favourably than other candidate states.,"vi kan ikke gå ind for en forskelsbehandling af tyrkiet, hvor landet stilles dårligere end andre kandidatlande.",Negation,we can support treating turkey differently and less favourably than other candidate states.,"(0.90, 0.95)",0.8242367502646054,0.9382,0.9230769230769232,0.9230769230769232,0.9230769180769232,0.8333333333333334,0.8333333333333334,0.8333333283333335,0.9230769230769232,0.9230769230769232,0.9230769180769232,0.90,0.95,en
"thus, freezing negotiations, as called for in the amendment in question, would delay the application of equality between the two sexes.","hvis forhandlingerne fastfryses, som det pågældende ændringsforslag kræver, vil det hæmme gennemførelsen af ligestilling mellem mænd og kvinder.",Replace Character,"thus, freezing negotiations, as called for in the amendment in question, woutd delay the application of equality between the two sexes.","(0.99, 0.99)",0.8895260356363631,0.9597,0.9444444444444444,0.9444444444444444,0.9444444394444445,0.9,0.9,0.899999995,0.9444444444444444,0.9444444444444444,0.9444444394444445,0.99,0.99,en
"according to unicef, 700 000 girls are prevented from attending school by their families every year.",ifølge unicef forhindrer familien hvert år 700.000 unge piger i at gå i skole.,Duplicate Token,"according to unicef, 700 000 girls girls are prevented from attending school by their families every year.","(0.99, 0.95)",0.8981075993548011,0.9938,1.0,1.0,0.999999995,0.9375,1.0,0.967741930489074,1.0,1.0,0.999999995,0.99,0.95,en
these are worrying figures when turkey's accession to the eu is arousing controversy.,"det er foruroligende tal, når tyrkiets tiltrædelse af eu skaber uenighed.",Remove Character,these are worrying figures when turkey's accession to the u is arousing controversy.,"(0.98, 0.95)",0.8003203203844999,0.932,0.9230769230769232,0.9230769230769232,0.9230769180769232,0.8333333333333334,0.8333333333333334,0.8333333283333335,0.9230769230769232,0.9230769230769232,0.9230769180769232,0.98,0.95,en
"following intensive preparatory work, which was characterised by very close and very fruitful cooperation with the commission, the meeting of the european council on 8 and 9 march is ready to be hammered into shape.","efter et intensivt forarbejde, som også har været præget af et meget nært og yderst frugtbart samarbejde med kommissionen, er vi nu nået ind i den afgørende fase i forberedelsen af det europæiske råds møde den 8.-9. marts.",Replace Token with Random Word,"following intensive preparatory work, which was characterised by very close and very fruitful cooperation with the commission, the meeting rontgen the european council on 8 and 9 march is ready to be hammered into shape.","(0.95, 0.95)",0.9299238452109287,0.9736,0.967741935483871,0.967741935483871,0.9677419304838712,0.9411764705882352,0.9411764705882352,0.9411764655882354,0.967741935483871,0.967741935483871,0.9677419304838712,0.95,0.95,en
"as the lawmaking authority, the council and parliament have a particular responsibility for ensuring that proposals from the commission for the simplification of legislation are both thoroughly scrutinised and promptly processed.","konkret handler det især om at forenkle eksisterende love og om at overveje, hvordan konsekvensvurdering som instrument kan forbedres. som lovgivere har rådet og parlamentet et særligt ansvar for, at kommissionens forslag til forenkling af retsforskrifter både bliver efterprøvet grundigt og behandlet hurtigt.",Replace Token with Random Word,"myotonus the lawmaking authority, the council and parliament have a particular responsibility for ensuring that proposals from the commission for the simplification of legislation are both thoroughly scrutinised and promptly processed.","(0.95, 0.99)",0.9682132340352988,0.9697,0.9615384615384616,0.9615384615384616,0.9615384565384616,0.9666666666666668,0.9666666666666668,0.9666666616666668,0.9615384615384616,0.9615384615384616,0.9615384565384616,0.95,0.99,en
europe has to take action.,eu er nødt til at gøre en indsats.,Duplicate character,euurope has to take action.,"(0.98, 0.99)",0.7598356856515925,0.83,0.8,0.8,0.7999999950000002,0.75,0.75,0.749999995,0.8,0.8,0.7999999950000002,0.98,0.99,en
"our international partners, investors and citizens are all looking to the european union for clear, determined action.","vores internationale partnere, investorer og borgere retter alle blikket mod eu i håbet om en klar og determineret indsats.",Swap characters,"our international partners, investors and citizens are all looking to the european union for clear, determined atcion.","(0.99, 0.99)",0.9036020036098448,0.9494,0.9411764705882352,0.9411764705882352,0.9411764655882354,0.9375,0.9375,0.937499995,0.9411764705882352,0.9411764705882352,0.9411764655882354,0.99,0.99,en
the scale of the problem is huge.,problemets omfang er enormt.,Add random word,the scale of the frohlich problem is huge.,"(0.85, 0.95)",0.6101950432112578,0.9799,0.8571428571428571,1.0,0.9230769181065088,0.7142857142857143,0.8333333333333334,0.7692307642603551,0.8571428571428571,1.0,0.9230769181065088,0.85,0.95,en
"however, we must also show both inside and outside the eu that we are prepared to act ourselves today.","vi må imidlertid også vise både i og uden for eu, at vi selv er parate til at gøre en indsats her og nu.",Remove Token,"however, we must also show both inside and the eu that we are prepared to act ourselves today.","(0.95, 0.95)",0.8656030552541708,0.9565,1.0,0.9444444444444444,0.9714285664326532,0.9411764705882352,0.8888888888888888,0.914285709289796,1.0,0.9444444444444444,0.9714285664326532,0.95,0.95,en
the comprehensive resolution that you adopted on 14 december last year reflects the essential role that parliament plays in this context.,"den omfattende beslutning, som de vedtog den 14. december 2006, afspejler parlamentets vigtige rolle i denne forbindelse.",Replace Token with Random Word,the comprehensive resolution that you adopted on 14 december last year reflects the essential role bridger parliament plays in this context.,"(0.95, 0.90)",0.8725129388059689,0.9512,0.95,1.0,0.9743589693622616,0.9,0.9,0.899999995,0.95,1.0,0.9743589693622616,0.95,0.90,en
europe needs to send the clearest of messages that it is committed to transforming the shape of european energy over the next few decades.,"eu skal sende et klart budskab om, at det er helt indstillet på at forandre eu's energisammensætning i de kommende årtier.",Swap words,europe needs to send the clearest of messages that it is committed to the transforming shape of european energy over the next few decades. ,"(0.99, 1.00)",0.8645000338766944,0.998,0.9523809523809524,1.0,0.9756097511005354,0.8333333333333334,0.8695652173913043,0.8510638247894976,0.9523809523809524,1.0,0.9756097511005354,0.99,1.00,en
"investors are ready to step in on a massive scale, but they need a clearer signal.","investorerne er klar til at træde til i stor skala, men de har brug for et tydeligere signal.",Replace Token with Random Word,"investors are ready to step in proreformist a massive scale, but they need a clearer signal.","(0.95, 0.95)",0.8394327083733336,0.9437,0.9333333333333332,0.9333333333333332,0.9333333283333336,0.8666666666666667,0.8666666666666667,0.8666666616666667,0.9333333333333332,0.9333333333333332,0.9333333283333336,0.95,0.95,en
"time is running out if we are to avoid the worst effects of climate change, tackle the global imbalance between energy supply and demand, and secure real modernisation.","tiden er ved at løbe ud, hvis vi skal undgå de værste effekter af klimaforandringer, håndtere den globale ubalance mellem energiudbud og -efterspørgsel og sikre en reel modernisering.",Swap characters,"time is running out if we are to aovid the worst effects of climate change, tackle the global imbalance between energy supply and demand, and secure real modernisation.","(0.99, 0.99)",0.9127592114472296,0.9676,0.9615384615384616,0.9615384615384616,0.9615384565384616,0.925925925925926,0.925925925925926,0.925925920925926,0.9615384615384616,0.9615384615384616,0.9615384565384616,0.99,0.99,en
this is a very good example from the presidency and from the commission.,det er et udmærket eksempel fra formandskabet og fra kommissionen.,Remove Token,this is a very good from the presidency and from the commission.,"(0.85, 0.95)",0.7825422900366437,0.9335,1.0,0.9090909090909092,0.9523809473922904,0.9,0.8181818181818182,0.8571428521541952,1.0,0.9090909090909092,0.9523809473922904,0.85,0.95,en
"with the spring summit in mind, we will be voting on a resolution tomorrow.",med henblik på forårstopmødet stemmes der i morgen om et forslag til beslutning.,Remove Token,"with the spring summit in mind, we will be voting a resolution tomorrow.","(0.95, 0.95)",0.8153551038173115,0.9423,1.0,0.9285714285714286,0.9629629579698218,0.9166666666666666,0.8461538461538461,0.879999995008,1.0,0.9285714285714286,0.9629629579698218,0.95,0.95,en
everyone concedes that the treaty of nice is no longer enough to ensure the effective governance of the eu-27.,"alle er enige om, at nice-traktaten ikke længere er nok til at sikre en effektiv forvaltning af unionen med 27 medlemmer.",Duplicate Token,everyone concedes that the treaty of nice is no longer enough to ensure the effective governance of of the eu-27.,"(0.99, 0.95)",0.9088452973719152,0.991,1.0,1.0,0.999999995,0.9473684210526316,1.0,0.9729729679766254,1.0,1.0,0.999999995,0.99,0.95,en
"all the analyses have been carried out, and all the problems are known.","alle analyser er klar, alle problemer er afdækket.",Swap words,"all the analyses have been carried out, and all the problems known. are ","(0.95, 0.95)",0.8385766789076257,0.996,1.0,1.0,0.999999995,0.8181818181818182,0.8181818181818182,0.8181818131818183,1.0,1.0,0.999999995,0.95,0.95,en
lisbon will only work if reform is made europe-wide.,lissabon kommer kun til at fungere med eu-dækkende reformer.,Duplicate character,lisbon willl only work if reform is made europe-wide.,"(0.99, 0.95)",0.7825422900366437,0.8951,0.8888888888888888,0.8888888888888888,0.888888883888889,0.75,0.75,0.749999995,0.8888888888888888,0.8888888888888888,0.888888883888889,0.99,0.95,en
"at the time, it was taken for granted that the right target for europe was to reduce energy consumption.","dengang gik man stadig ud fra, at det rigtige mål for europa var at sænke energiforbruget.",Replace Character,"ay the time, it was taken for granted that the right target for europe was to reduce energy consumption.","(1.00, 1.00)",0.948543837069451,0.9523,0.9375,0.9375,0.937499995,0.9444444444444444,0.9444444444444444,0.9444444394444445,0.9375,0.9375,0.937499995,1.00,1.00,en
"that would be a first, with atomstroyexport funding a power station in the european union with european money, which will enable people to act as if there were a renaissance in nuclear power.","det ville være første gang, at eksport af atomenergi finansierer et kraftværk i eu med eu-midler. så kan man lade, som om der var tale om en renæssance for atomenergien.",Swap words,"that would be a first, with atomstroyexport funding a power station in the european union with european money, will which enable people to act as if there were a renaissance in nuclear power. ","(0.99, 0.95)",0.9095824888332176,0.9993,0.9642857142857144,1.0,0.9818181768198349,0.8787878787878788,0.90625,0.8923076873088758,0.9285714285714286,0.9629629629629628,0.9454545404561984,0.99,0.95,en
"the german minister for european affairs, mr gloser, may talk about sustainability and energy policy - although i have to say that how he keeps a straight face when he talks about the already failed lisbon agenda is quite beyond me.","den tyske minister for europaspørgsmål, hr. gloser, taler måske nok om bæredygtighed og energipolitik, men jeg forstår ikke, hvordan han kan holde masken, når han taler om den allerede fejlslagne lissabon-dagsorden.",Swap characters,"the german minister for european affairs, mr gloser, may talk about sustainability and energy policy - although i have to say that how he keeps a straight face when he talks about the already failed lisbon agenda is quite beyodn me.","(0.99, 0.99)",0.9463168195735856,0.9772,0.9736842105263158,0.9736842105263158,0.973684205526316,0.95,0.95,0.949999995,0.9736842105263158,0.9736842105263158,0.973684205526316,0.99,0.99,en
"nor, i think, can it be intended that nuclear-generated electricity be used to produce environmentally sound energy, or that biofuel should lead to food shortages in the way in which it has done in mexico.","det kan efter min opfattelse heller ikke være formålet med den grønne energi, at man bruger strøm fra atomkraft til at fremstille den med, eller at biobrændstof fører til fødevareknaphed f.eks. i mexico.",Duplicate Token,"nor, i think, can it be intended that nuclear-generated electricity be used to produce environmentally sound energy energy, or that biofuel should lead to food shortages in the way in which it has done in mexico.","(0.99, 0.95)",0.9542969642914884,0.9974,0.9666666666666668,1.0,0.9830508424590636,0.9428571428571428,0.9705882352941176,0.9565217341314852,0.9666666666666668,1.0,0.9830508424590636,0.99,0.95,en
we will be simply pandering to the economic interests of those investors and countries that pay no regard to oxides and protocols.,"vi vil blot lefle for de økonomiske interesser hos de investorer og lande, der ikke tager hensyn til oxider og protokoller.",Remove Character,we will be simply pandering to the economic interests of those investors and countries that pay no regard to oxides and potocols.,"(0.99, 0.99)",0.9173176373893104,0.9562,0.95,0.95,0.949999995,0.9523809523809524,0.9523809523809524,0.9523809473809524,0.95,0.95,0.949999995,0.99,0.99,en
"the commission, too, has set new priorities for it.",også kommissionen har foretaget en ny prioritering på dette felt.,Swap words,"the commission, too, has new set priorities for it. ","(0.95, 0.95)",0.6636154805687886,0.9815,0.9,1.0,0.947368416066482,0.5555555555555556,0.625,0.5882352891349482,0.8,0.8888888888888888,0.8421052581717452,0.95,0.95,en
"the commission has still not yet complied with parliament's request - as articulated in over half a dozen resolutions - for an independent assessment of the impact of laws, yet this is something on which we insist.","kommissionen har stadig ikke opfyldt parlamentets ønske om en uafhængig konsekvensvurdering af lovgivningsprojekter, som er blevet udtrykt i over et halvt dusin beslutninger. men vi insisterer på det!",Negation,"the commission has still yet complied with parliament's request - as articulated in over half a dozen resolutions - for an independent assessment of the impact of laws, yet this is something on which we insist.","(0.98, 0.95)",0.933651069586263,0.9774,1.0,0.9696969696969696,0.984615379616568,0.9714285714285714,0.9444444444444444,0.9577464738742314,1.0,0.9696969696969696,0.984615379616568,0.98,0.95,en
"since, though, the constitution is not yet in place, we will have to endeavour to find another way of getting these greater energy policy powers, in particular - as mr gloser mentioned - in respect of external policy.","forfatningen indeholder en større energipolitisk kompetence til europa. vi har ikke forfatningen endnu, og derfor må vi forsøge at få denne større energipolitiske kompetence på andre måder, særligt, som hr. minister gloser nævnte, på den udenrigspolitiske side.",Negation,"since, though, the constitution is yet in place, we will have to endeavour to find another way of getting these greater energy policy powers, in particular - as mr gloser mentioned - in respect of external policy.","(0.95, 0.95)",0.9385522307631308,0.979,1.0,0.96875,0.984126979128244,0.9722222222222222,0.945945945945946,0.9589041045899794,1.0,0.96875,0.984126979128244,0.95,0.95,en
"how are we and russia supposed to have a proper relationship as equals if the european union cannot, on these matters, speak firmly and with a single voice?","hvordan skal vi kunne få et fornuftigt, ligeværdigt forhold til rusland, hvis ikke eu taler med en stærk, fælles stemme på dette punkt? rusland vil meget hellere forhandle med de enkelte lande og spille dem ud mod hinanden.",Negation,"how are we and russia supposed to have a proper relationship as equals if the european union can, on these matters, speak firmly and with a single voice?","(1.00, 1.00)",0.9157103753711766,0.9717,0.9615384615384616,0.9615384615384616,0.9615384565384616,0.925925925925926,0.925925925925926,0.925925920925926,0.9615384615384616,0.9615384615384616,0.9615384565384616,1.00,1.00,en
"secondly, as renewable energy helps to improve the security of energy supply, we urge that the proportion of renewable energy sources be increased to 50% by 2040.","for det andet bidrager vedvarende energi til en større energiforsyningssikkerhed. derfor kræver vi, at de vedvarende energiformers andel inden 2040 øges til 50 %.",Swap characters,"secondly, as renewable energy helps to improve the security of energy supply, we urge that the proportion of renewable energy sources be increased to 05% by 2040.","(0.95, 0.95)",0.9127592114472296,0.9676,0.9523809523809524,0.9523809523809524,0.9523809473809524,0.92,0.92,0.919999995,0.9523809523809524,0.9523809523809524,0.9523809473809524,0.95,0.95,en
"as mr barroso put it this morning, our credibility in the eyes of the public is conditional upon europe holding together, and on that we agree with him.","sammenholdet i europa er en forudsætning for vores troværdighed i forhold til borgerne, som kommissionsformand barroso sagde i morges. det tilslutter vi os.",Swap characters,"as mr barroso put it this morning, our credibility in the eyes of the public is conditional upon europe holding together, and on that we agere with him.","(0.95, 0.99)",0.9127592114472296,0.9676,0.9629629629629628,0.9629629629629628,0.9629629579629628,0.925925925925926,0.925925925925926,0.925925920925926,0.9629629629629628,0.9629629629629628,0.9629629579629628,0.95,0.99,en
"i should like, for my part, to address another point affecting the development of the labour market and taxation in europe.","jeg vil gerne for mit vedkommende nævne et andet punkt, som vedrører udviklingen på arbejdsmarkedet og skattesystemet i europa.",Add random word,"i should like, for my part, lordings to address another point affecting the development of the labour market and taxation in europe.","(0.95, 0.98)",0.891237063632542,0.9956,0.9523809523809524,1.0,0.9756097511005354,0.9047619047619048,0.95,0.9268292632956572,0.9523809523809524,1.0,0.9756097511005354,0.95,0.98,en
"in belgium, instead of losing 4 000 jobs, the volkswagen-forest factory will lose 3 000 and the employees will work a 38- rather than 35-hour week for the same salary, as well as being required to be more flexible.","det første er fra belgien, hvor volkswagen forest-fabrikken i stedet for at miste 4.000 arbejdspladser vil miste 3.000, og arbejderne vil gå fra en 35-timers arbejdsuge til en 38-timers arbejdsuge med samme løn og større fleksibilitet.",Swap words,"in belgium, instead losing of 4 000 jobs, the volkswagen-forest factory will lose 3 000 and the employees will work a 38- rather than 35-hour week for the same salary, as well as being required to be more flexible. ","(0.99, 0.95)",0.9253591193218051,0.9996,0.9714285714285714,1.0,0.9855072413778618,0.8974358974358975,0.9210526315789472,0.9090909040917524,0.9428571428571428,0.9705882352941176,0.9565217341314852,0.99,0.95,en
it can help by putting an end to the absolute scandal whereby somebody who is well-off can just take a trip from monaco to belgium via lichtenstein in order to escape the tax system and the progressive dimension of tax.,"det kan hjælpe til med at sætte en stopper for den absolutte skandale, at velhavende borgere kan dandere omkring fra monaco til belgien via liechtenstein for at undgå skattevæsenet og på den måde undgå progressivitet i skatten.",Replace Character,it can help by putting an end to the absolute scandal whereby somebody who is well-off can just take a trip from monaco to belgium via lichtanstein in order to escape the tax system and the progressive dimension of tax.,"(0.99, 0.95)",0.935369573102062,0.9755,0.9705882352941176,0.9705882352941176,0.9705882302941176,0.9487179487179488,0.9487179487179488,0.9487179437179488,0.9705882352941176,0.9705882352941176,0.9705882302941176,0.99,0.95,en
it shows very clearly that no one can reintroduce a mini-treaty on the sly now that the people have spoken.,"her konstaterer han, at forfatningstraktaten er afgået ved døden. han viser tydeligt, at intet kan genintroducere en minitraktat i det skjulte, når et folk har talt.",Add random word,it shows very clearly that no one can reintroduce a mini-treaty on rickets the sly now that the people have spoken.,"(0.98, 0.99)",0.8747394842931362,0.9948,0.9473684210526316,1.0,0.9729729679766254,0.9,0.9473684210526316,0.9230769180802104,0.9473684210526316,1.0,0.9729729679766254,0.98,0.99,en
"however, this reduction is in fact the consequence of a fall in the number of people of working age due to the aging of the population, rather than the result of a prosperous economy.","men nedgangen skyldes mere en nedgang i antallet af erhvervsaktive på grund af befolkningens aldring, end den skyldes en blomstrende økonomi.",Replace Token with Random Word,"however, this reduction is in fact the consequence of anoplanthus fall in the number of people of working age due to the aging of the population, rather than the result of a prosperous economy.","(0.99, 1.00)",0.9278982724420874,0.9729,0.96,1.0,0.9795918317367764,0.9393939393939394,0.96875,0.9538461488473374,0.96,1.0,0.9795918317367764,0.99,1.00,en
"with growth at half mast, a population growing at below replacement rate, and businesses relocating their activities, the european union is, unfortunately, continuing to decline economically.","med en vækst på halv kraft, en befolkning, der ikke fornyr sig selv, og virksomheder, der outsourcer deres aktiviteter, fortsætter eu desværre sin økonomiske nedtur.",Duplicate Token,"with growth at half mast, a population growing at below replacement rate, and businesses relocating their activities, the european union is, unfortunately, continuing to to decline economically.","(1.00, 1.00)",0.9440368015398672,0.9968,1.0,1.0,0.999999995,0.9615384615384616,1.0,0.9803921518646674,1.0,1.0,0.999999995,1.00,1.00,en
energy issues were ranked twelfth in a list of the most serious issues that europe should now confront.,"energispørgsmål kom ind på en tolvteplads på en liste over de alvorligste opgaver, som europa nu står over for.",Add random word,energy issues were ranked twelfth in a list of the most antitragic serious issues that europe should now confront.,"(0.95, 0.95)",0.8606031405392816,0.9942,0.9444444444444444,1.0,0.9714285664326532,0.8888888888888888,0.9411764705882352,0.914285709289796,0.9444444444444444,1.0,0.9714285664326532,0.95,0.95,en
"mr president, the meeting with the european council in berlin is an outstanding opportunity to send the message of what we have achieved together and what we need to achieve together in the coming years, the first step until 2009.","(en) hr. formand! mødet med det europæiske råd i berlin er en enestående mulighed for at udsende et budskab om, hvad vi sammen har udrettet, og hvad vi sammen skal udrette i de kommende år og i første omgang frem til 2009.",Replace Token with Random Word,"mr president, the meeting with the european council in berlin is an outstanding opportunity to send asperse message of what we have achieved together and what we need to achieve together in the coming years, the first step until 2009.","(0.95, 0.98)",0.9385522307631308,0.9753,0.96875,1.0,0.984126979128244,0.9473684210526316,0.9473684210526316,0.9473684160526316,0.96875,1.0,0.984126979128244,0.95,0.98,en
"we need to reduce greenhouse gases, but at the same time to secure a stable and prosperous economy which makes us able to meet future challenges.","vi skal reducere drivhusgasserne, men samtidig skal vi sikre en stabil og gunstig økonomi, der sætter os i stand til at løse fremtidige udfordringer.",Replace Token with Random Word,"we need to reduce greenhouse gases, but at the same time to secure a stable and prosperous economy which makes us able to meet concomitancy challenges.","(0.95, 0.95)",0.9130714940405412,0.9641,0.9583333333333334,0.9583333333333334,0.9583333283333336,0.92,0.92,0.919999995,0.9583333333333334,0.9583333333333334,0.9583333283333336,0.95,0.95,en
"for too many millions of our fellow citizens, flexicurity is seen as a threat.",for alt for mange millioner af vores medborgere betragter fleksibilitet og sikkerhed som en trussel.,Add random word,"for too many millions of our snared fellow citizens, flexicurity is seen as a threat.","(0.95, 0.90)",0.8320381765431424,0.9928,0.9333333333333332,1.0,0.9655172363852556,0.8571428571428571,0.9230769230769232,0.8888888838957477,0.9333333333333332,1.0,0.9655172363852556,0.95,0.90,en
this could result in there being nothing for mutual trade as there will be several global trade centres.,"det kan føre til, at der ikke er noget tilbage til gensidig handel, da der vil være adskillige globale handelscentre.",Add random word,this could result disfortune in there being nothing for mutual trade as there will be several global trade centres.,"(0.95, 0.95)",0.8606031405392816,0.9942,0.9411764705882352,1.0,0.9696969647015612,0.8888888888888888,0.9411764705882352,0.914285709289796,0.9411764705882352,1.0,0.9696969647015612,0.95,0.95,en
