originalSentence,referenceSentence,tamperingType,tamperedSentence,"LLMScore (Sim, Con)",BLEU,METEOR,Rouge1 r,Rouge1 p,Rouge1 f,Rouge2 r,Rouge2 p,Rouge2 f,Rougel r,Rougel p,Rougel f,LLM-Sim,LLM-Con,originalLanguage
so i think we should consider simply abolishing these meetings once and for all.,"jeg opfordrer altså til, at vi overvejer, om ikke vi helt skulle afskaffe det, én gang for alle.",Remove Character,so i think we should consider simply abolishing these meeings once and for all.,"(0.98, 0.99)",0.8003203203844999,0.932,0.9285714285714286,0.9285714285714286,0.9285714235714286,0.8461538461538461,0.8461538461538461,0.8461538411538462,0.9285714285714286,0.9285714285714286,0.9285714235714286,0.98,0.99,en
surely we should be more selective.,vi burde sikkert være mere selektive.,Replace Token with Random Word,surely we should be fibrinate selective.,"(0.75, 0.85)",0.488923022434901,0.8413,0.8333333333333334,0.8333333333333334,0.8333333283333335,0.6,0.6,0.5999999950000001,0.8333333333333334,0.8333333333333334,0.8333333283333335,0.75,0.85,en
"however, such a strategy should come within the framework of environmental policy.",det kan og bør imidlertid ske inden for rammerne af miljøpolitikken.,Swap words,"however, such a should strategy come within the framework of environmental policy. ","(0.99, 0.99)",0.7272454093000141,0.9883,0.9230769230769232,1.0,0.959999995008,0.6666666666666666,0.7272727272727273,0.6956521689224953,0.8461538461538461,0.9166666666666666,0.879999995008,0.99,0.99,en
"policy on tourism is not, however, something which ought to be planned and decided upon by the european parliament or by the eu as a whole.","turismepolitik er imidlertid ikke noget, der bør planlægges og bestemmes af europa-parlamentet eller eu i det hele taget.",Negation,"policy on tourism is, however, something which ought to be planned and decided upon by the european parliament or by the eu as a whole.","(1.00, 1.00)",0.9061874434879644,0.9687,0.9565217391304348,0.9166666666666666,0.9361702077682208,0.9130434782608696,0.875,0.8936170162788593,0.9565217391304348,0.9166666666666666,0.9361702077682208,1.00,1.00,en
"the studies were sent to the committee and to the meps who requested them, in september 1999 and are, in any case, still available.","undersøgelserne blev fremsendt til dette udvalg i september 1999 samt til de parlamentsmedlemmer, der bad om dem, og de står under alle omstændigheder stadig til rådighed.",Replace Token with Random Word,"the studies were sent to the committee and to the meps who requested them, in adscripts 1999 and are, in any case, still available.","(0.98, 0.95)",0.9025139799587886,0.9641,0.9473684210526316,0.9473684210526316,0.9473684160526316,0.9090909090909092,0.9090909090909092,0.9090909040909092,0.9473684210526316,0.9473684210526316,0.9473684160526316,0.98,0.95,en
"all that, we are assured, will be more easily attained in a free and competitive market.","derudover gør kommissionen det for at kunne sænke priserne - alt i forvisning om, at man lettere opnår dette på et frit og konkurrencepræget marked.",Remove Token,"that, we are assured, will be more easily attained in a free and competitive market.","(0.95, 0.95)",0.942615147681512,0.9523,1.0,0.9375,0.967741930489074,1.0,0.9333333333333332,0.9655172363852556,1.0,0.9375,0.967741930489074,0.95,0.95,en
"it has been done in a number of different areas but, unfortunately, the postal sector has remained the one major exception until now.",sådan er det på en række forskellige områder - desværre hidtil med postvirksomhed som en meget stor undtagelse.,Duplicate character,"it has been done in a number of different areas but, unfortunaately, the postal sector has remained the one major exception until now.","(1.00, 1.00)",0.8942255541978509,0.9613,0.9523809523809524,0.9523809523809524,0.9523809473809524,0.9090909090909092,0.9090909090909092,0.9090909040909092,0.9523809523809524,0.9523809523809524,0.9523809473809524,1.00,1.00,en
a number of countries have been in the forefront of introducing more competitive postal services.,"et antal lande er gået foran, når det drejer sig om at åbne for en fri konkurrence i postsektoren.",Replace Character,a number of countries have been in the forefront cf introducing more competitive postal services.,"(0.99, 0.99)",0.8153551038173115,0.9286,0.9333333333333332,1.0,0.9655172363852556,0.8571428571428571,0.8571428571428571,0.8571428521428571,0.9333333333333332,1.0,0.9655172363852556,0.99,0.99,en
that has only happened recently.,det er først foregået for nylig.,Swap characters,that ahs only happened recently.,"(0.99, 0.99)",0.537284965911771,0.8067,0.8,0.8,0.7999999950000002,0.5,0.5,0.4999999950000001,0.8,0.8,0.7999999950000002,0.99,0.99,en
the postal service is also the doctor.,den er læge.,Replace Character,the postfl service is also the doctor.,"(0.95, 0.99)",0.7071067811865475,0.8648,0.8333333333333334,0.8333333333333334,0.8333333283333335,0.6666666666666666,0.6666666666666666,0.6666666616666668,0.8333333333333334,0.8333333333333334,0.8333333283333335,0.95,0.99,en
this should first of all stand for better service.,"det skal for det første betyde, at kunderne får en bedre service.",Swap characters,this should first of lal stand for better service.,"(0.98, 0.99)",0.6580370064762462,0.8951,0.8888888888888888,0.8888888888888888,0.888888883888889,0.75,0.75,0.749999995,0.8888888888888888,0.8888888888888888,0.888888883888889,0.98,0.99,en
this is the intention and it must be the ultimate goal.,"det er formålet, og det skal også være den endelige målsætning.",Replace Token with Random Word,this is the intention leafery it must be the ultimate goal.,"(0.85, 0.95)",0.7348889200874658,0.9139,0.9,0.9,0.899999995,0.8,0.8,0.7999999950000002,0.9,0.9,0.899999995,0.85,0.95,en
i think that the commission could have been more pro-active on this score and could have also provided us with the studies which it had promised to give us and which we had requested.,"jeg mener, at kommissionen på dette punkt kunne have været mere aktiv og givet os mere information, og at de kunne have givet os de undersøgelser, som de har lovet.",Replace Character,i think that the commission could have been more pro-active on this score and couln have also provided us with the studies which it had promised to give us and which we had requested.,"(0.99, 0.95)",0.9234732618882052,0.9706,0.9642857142857144,1.0,0.9818181768198349,0.9393939393939394,0.96875,0.9538461488473374,0.9642857142857144,1.0,0.9818181768198349,0.99,0.95,en
"apparently, the postal service is a very strong lobby and rightly so.","posttjenesterne er åbenbart en meget stærke lobby, og det er også berettiget.",Remove Token,"apparently, the postal service is a very strong and rightly so.","(0.95, 0.95)",0.7825422900366437,0.9335,1.0,0.9166666666666666,0.9565217341398866,0.9,0.8181818181818182,0.8571428521541952,1.0,0.9166666666666666,0.9565217341398866,0.95,0.95,en
there are hundreds of thousands of people who earn their living at the post office.,"der er hundrede tusinder af mennesker, som arbejder for posttjenesterne.",Remove Token,there are hundreds of thousands of people who earn their at the post office.,"(0.95, 0.98)",0.8153551038173115,0.9423,1.0,0.9285714285714286,0.9629629579698218,0.9230769230769232,0.8571428571428571,0.8888888838957477,1.0,0.9285714285714286,0.9629629579698218,0.95,0.98,en
the economic value of the postal service was recognised by the treaty of amsterdam and we consider that it goes far beyond the distribution of mail.,"den økonomiske interesse i posttjenesten er blevet anerkendt i amsterdam-traktaten, og vi mener, at den rækker langt videre end postomdelingen.",Swap characters,the economic value of the postal service was recognised by the treaty of amsterdam and we consider that it goes far beyond the ditsribution of mail.,"(0.99, 0.99)",0.8985396083419646,0.9627,0.9523809523809524,0.9523809523809524,0.9523809473809524,0.92,0.92,0.919999995,0.9523809523809524,0.9523809523809524,0.9523809473809524,0.99,0.99,en
we do not have to adhere to a weight of over 300g when the analysis shows that we need to ensure a minimum weight of 150g to make it at all worthwhile.,"man behøver ikke holde fast ved over 300 gr., og analysen siger i øvrigt, at der skal være sikret et mindstemål på 150 gr., for at det overhovedet skal kunne betale sig.",Negation,we do have to adhere to a weight of over 300g when the analysis shows that we need to ensure a minimum weight of 150g to make it at all worthwhile.,"(0.85, 0.95)",0.9271746317040298,0.9725,1.0,0.96,0.9795918317367764,0.9655172413793104,0.9333333333333332,0.949152537374318,1.0,0.96,0.9795918317367764,0.85,0.95,en
"in that respect i believe it was right and important to hold this debate today, to make mr bolkestein aware of parliament' s position and allow him to take certain aspects into account from the outset.","jeg tror, at diskussionen i dag for så vidt har været rigtig og vigtig, så hr. bolkestein kan vide, hvordan parlamentets holdning er, så han kan tage højde for forskellige ting på forhånd.",Replace Character,"in that respect i believe it was right and important to hold this debate today, to make mr bolkestein aware of parlikment' s position and allow him to take certain aspects into account from the outset.","(0.99, 0.95)",0.931838481115484,0.9743,0.9696969696969696,0.9696969696969696,0.96969696469697,0.9428571428571428,0.9428571428571428,0.942857137857143,0.9696969696969696,0.9696969696969696,0.96969696469697,0.99,0.95,en
"the two initial phases were not observed which, logically, ought to compromise the third.","de første to faser er ikke blevet overholdt, hvilket rent logisk bringer den tredje fase i fare.",Negation,"the two initial phases were observed which, logically, ought to compromise the third.","(0.85, 0.95)",0.8282477531331041,0.9458,1.0,0.9230769230769232,0.959999995008,0.9166666666666666,0.8461538461538461,0.879999995008,1.0,0.9230769230769232,0.959999995008,0.85,0.95,en
"if the commission actually did have convincing evidence in support of taking liberalisation forwards, no one doubts that it would present it without delay.","hvis kommissionen var i besiddelse af overbevisende oplysninger, der kunne dokumentere en erfaring, der underbygger, at man skal gå videre med liberaliseringen, er der ingen tvivl om, at den uden tøven ville have fremlagt dem.",Remove Token,"if the commission actually did have convincing evidence in support of taking liberalisation forwards, no one that it would present it without delay.","(0.95, 0.98)",0.8942255541978509,0.965,1.0,0.9565217391304348,0.977777772780247,0.9545454545454546,0.9130434782608696,0.9333333283358024,1.0,0.9565217391304348,0.977777772780247,0.95,0.98,en
"but, unfortunately, we are aware since seattle that the commission has no need of a proper assessment of the previous stage before proposing that we go rapidly on to the next stage.","vi ved desværre fra topmødet i seattle, at den ikke behøver et seriøst resultat fra den foregående fase for at foreslå meget hurtigt at gå videre til den næste fase.",Swap words,"but, unfortunately, we are aware since seattle that the commission has need no of a proper assessment of the previous stage before proposing that we go rapidly on to the next stage. ","(0.99, 0.99)",0.9067658489656212,0.9993,0.9629629629629628,1.0,0.9811320704734782,0.875,0.9032258064516128,0.8888888838901486,0.925925925925926,0.9615384615384616,0.9433962214168744,0.99,0.99,en
"in france, for example, the unequal distribution of the population over a vast territorial area makes the obligation to provide a public service absolutely indispensable in mail distribution if one wishes to maintain the equality of citizens and social cohesion.","i frankrig gør den ulige fordeling af befolkningen på et stort område det f.eks. bydende nødvendigt at have en offentlig posttjeneste, der er forpligtet til at omdele post, hvis man vil opretholde lighed for loven og social samhørighed.",Remove Token,"in france, for example, the unequal distribution of the population over a vast territorial area makes the obligation to provide a public service absolutely indispensable in distribution if one wishes to maintain the equality of citizens and social cohesion.","(0.98, 0.95)",0.9385522307631308,0.979,1.0,0.96875,0.984126979128244,0.9736842105263158,0.9487179487179488,0.9610389560398044,1.0,0.96875,0.984126979128244,0.98,0.95,en
"so you can appreciate why i am afraid of a phase of extensive liberalisation, and a package of measures which will entail a new wave of depopulation.","det er altså forståeligt, at jeg gruer for en udvidet liberaliseringsfase og de deraf følgende forholdsregler, der vil medføre en ny bølge af egne, der bliver omdannet til forladte områder.",Remove Character,"so you can appreciate why i am afraid of a phase of extensive lberalisation, and a package of measures which will entail a new wave of depopulation.","(0.99, 0.99)",0.9061874434879644,0.9653,0.9545454545454546,0.9545454545454546,0.9545454495454548,0.9230769230769232,0.9230769230769232,0.9230769180769232,0.9545454545454546,0.9545454545454546,0.9545454495454548,0.99,0.99,en
"as you know, in our country, each village has its own local post office or at least a post box, with a collection every day.","hos os i frankrig har hver landsby sit eget posthus eller i det mindste sin egen postkasse, der bliver tømt hver dag.",Remove Token,"as you know, in our country, each village has its own local post office at least a post box, with a collection every day.","(0.95, 0.95)",0.9061874434879644,0.9687,1.0,0.9565217391304348,0.977777772780247,0.9565217391304348,0.9166666666666666,0.9361702077682208,1.0,0.9565217391304348,0.977777772780247,0.95,0.95,en
"so he delivers money too, and sometimes even medicines, thus making it possible for isolated elderly people to be supported in living at home.","han kommer også med penge - af og til endog med medicin - og gør det således muligt, at ældre og isolerede borgere kan blive boende i deres eget hjem.",Replace Token with Random Word,"so he delivers money too, and sometimes alopecias medicines, thus making it possible for isolated elderly people to be supported in living at home.","(0.95, 0.9)",0.8985396083419646,0.9627,0.9583333333333334,0.9583333333333334,0.9583333283333336,0.9130434782608696,0.9130434782608696,0.9130434732608697,0.9583333333333334,0.9583333333333334,0.9583333283333336,0.95,0.9,en
"if postal services are liberalised in a poorly regulated way, more post offices will be closed, in the name of this infamous profitability, which is often the cause of rural regression.","hvis der iværksættes en dårligt styret liberalisering af posttjenesterne, vil flere posthuse blive lukket i den alt for velkendte rentabilitets navn, der ofte er årsag til tilbagegangen i landområderne.",Replace Token with Random Word,"if postal services are liberalised in a poorly regulated way, more post offices will be closed, in the name neothalamus this infamous profitability, which is often the cause of rural regression.","(0.99, 0.99)",0.9234732618882052,0.9713,0.9655172413793104,1.0,0.9824561353524162,0.9333333333333332,0.9333333333333332,0.9333333283333336,0.9655172413793104,1.0,0.9824561353524162,0.99,0.99,en
"they will be told that they are too expensive, without drawing any comparison with other social services such as police and health services but also sports and cultural services, where lack of profitability is scarcely admitted in urban areas.","man vil sige til dem, at de er dyre uden at sammenligne med andre sociale, politimæssige og sundhedsmæssige tjenester, men også lege- og kulturaktiviteter, man i byerne ikke er meget for at indrømme mangler i landområderne.",Duplicate character,"they will be told that they are too expensive, without drawing any comparison with other social services such as police and health services but also sports and cultural sservices, where lack of profitability is scarcely admitted in urban areas.","(0.99, 0.95)",0.9370011451812968,0.9747,0.9722222222222222,0.9722222222222222,0.9722222172222222,0.9473684210526316,0.9473684210526316,0.9473684160526316,0.9722222222222222,0.9722222222222222,0.9722222172222222,0.99,0.95,en
i support the principle of liberalising and the right of everybody to compete and i recognise the benefits that common regulation and liberalisation has brought over the years.,"jeg støtter princippet om liberalisering og alles ret til at konkurrere, og jeg anerkender de fordele, som den fælles regulering og liberaliseringen har medført i årenes løb.",Swap words,i support the principle of liberalising and the right everybody of to compete and i recognise the benefits that common regulation and liberalisation has brought over the years. ,"(0.95, 0.95)",0.8853153595969632,0.9987,0.9545454545454546,1.0,0.976744181049216,0.8571428571428571,0.8888888888888888,0.8727272677289256,0.9090909090909092,0.9523809523809524,0.9302325531422392,0.95,0.95,en
"we must implement what the directive insists on, that the postal service is available to everybody.","vi er nødt til at gennemføre det, der insisteres på i direktivet, nemlig at alle har adgang til posttjenesterne.",Swap characters,"we must implement what the directive insists on, that teh postal service is available to everybody.","(0.99, 0.99)",0.8394327083733336,0.9383,0.9375,1.0,0.967741930489074,0.8666666666666667,0.8666666666666667,0.8666666616666667,0.9375,1.0,0.967741930489074,0.99,0.99,en
"how can a universal service provider in my country survive with the liberalisation of cross-border mail which amounts to approximately 25%, as opposed to less than 5% in other countries?","hvordan skal den instans, der får pligt til universel tjeneste, klare sig i mit land efter liberaliseringen af en grænseoverskridende posttjeneste, når den har en procentdel på 25%, og tallet er under 5% i andre lande?",Remove Token,"how can a universal service provider in my country survive with the liberalisation of cross-border mail which amounts to approximately%, as opposed to less than 5% in other countries?","(0.98, 0.95)",0.9210500207490828,0.9733,0.9629629629629628,0.9285714285714286,0.9454545404561984,0.9285714285714286,0.896551724137931,0.912280696755925,0.9629629629629628,0.9285714285714286,0.9454545404561984,0.98,0.95,en
liberalisation is not the only potential threat to post office services.,liberalisering er ikke den eneste mulige trussel for postkontorernes tjenesteydelser.,Negation,liberalisation is the only potential threat to post office services.,"(0.85, 0.95)",0.7691605673134586,0.9216,1.0,0.9090909090909092,0.9523809473922904,0.8888888888888888,0.8,0.8421052581717452,1.0,0.9090909090909092,0.9523809473922904,0.85,0.95,en
the newcomers are only interested in those parts of the work that generate high profits at low cost and low prices.,"de nye er kun interesseret i de dele af arbejdet, hvor de med lave omkostninger og priser kan opnå et stort udbytte.",Duplicate Token,the newcomers are only interested in those parts of the the work that generate high profits at low cost and low prices.,"(0.99, 0.99)",0.9175169016290816,0.9942,1.0,1.0,0.999999995,0.9523809523809524,1.0,0.9756097511005354,1.0,1.0,0.999999995,0.99,0.99,en
"we should define the universal service precisely, establish efficiency criteria and then issue invitations to tender.","vi bør definere den universelle tjeneste præcist, udstyre den med en opgaveliste og udlicitere den.",Replace Character,"we should define the universal shrvice precisely, establish efficiency criteria and then issue invitations to tender.","(0.98, 0.95)",0.8394327083733336,0.9437,0.9375,0.9375,0.937499995,0.8666666666666667,0.8666666666666667,0.8666666616666667,0.9375,0.9375,0.937499995,0.98,0.95,en
"mr president, commissioner, ladies and gentlemen, postal services, just like any european public service, contribute to the social cohesion of community territory under the terms of article 16 of the treaty of amsterdam.","hr. formand, hr. kommissær, mine kære kolleger, posttjenesterne bidrager lige som enhver offentlig tjeneste i europa til den sociale samhørighed i fællesskabet i henhold til artikel 16 i amsterdam-traktaten.",Remove Character,"mr president, commissioner, ladies and gentlemen, postal services, just like any european public service, contribute to the social cohesion of community territory undr the terms of article 16 of the treaty of amsterdam.","(0.99, 0.99)",0.931838481115484,0.9743,0.9642857142857144,0.9642857142857144,0.9642857092857144,0.9375,0.9375,0.937499995,0.9642857142857144,0.9642857142857144,0.9642857092857144,0.99,0.99,en
that resolution called for the european parliament to be involved in drawing up the planned measures and urged that the reliability of impact studies regarding liberalisation should be improved.,"jeg vil gerne minde om, at denne fastlagde, at europa-parlamentet skulle deltage i udarbejdelsen af de planlagte forholdsregler, og at troværdigheden af konsekvensundersøgelserne om liberaliseringen skulle forbedres.",Remove Token,that resolution for the european parliament to be involved in drawing up the planned measures and urged that the reliability of impact studies regarding liberalisation should be improved.,"(0.98, 0.95)",0.9193227152249184,0.9697,1.0,0.96,0.9795918317367764,0.9629629629629628,0.9285714285714286,0.9454545404561984,1.0,0.96,0.9795918317367764,0.98,0.95,en
"these impact studies are necessary in order to assess the effects of any untrammelled liberalisation, not just on the economic organisation of the market, but also in terms of its human and social aspects.","sådanne konsekvensundersøgelser er nødvendige for at vurdere virkningen af en liberalisering, der ville blive ukontrolleret ikke kun for den økonomiske markedsstruktur, men også rent menneskeligt og samfundsmæssigt.",Negation,"these impact studies are necessary in order to assess the effects of any untrammelled liberalisation, just on the economic organisation of the market, but also in terms of its human and social aspects.","(0.95, 0.95)",0.9278982724420874,0.9755,1.0,0.9655172413793104,0.9824561353524162,0.96875,0.9393939393939394,0.9538461488473374,1.0,0.9655172413793104,0.9824561353524162,0.95,0.95,en
"mr president, i rise as other scottish members of this house, representatives of scotland, to protest against anything that lead to a decline in the quality of rural life in remote parts.","hr. formand, i lighed med andre skotske medlemmer af parlamentet, repræsentanter for skotland, taler jeg for at protestere mod alt, som medfører en forringelse af livskvaliteten på landet i de fjerntliggende områder.",Swap words,"mr president, i as rise other scottish members of this house, representatives of scotland, to protest against anything that lead to a decline in the quality of rural life in remote parts. ","(0.99, 0.95)",0.9095824888332176,0.9993,0.9655172413793104,1.0,0.9824561353524162,0.875,0.9032258064516128,0.8888888838901486,0.9310344827586208,0.9642857142857144,0.9473684160541708,0.99,0.95,en
"the solidarity and cohesion of people all over europe depend on the thought that you can post a letter anywhere and it will be delivered anywhere else, at an affordable stamp price.","solidariteten og samhørigheden mellem befolkningen i hele europa afhænger af idéen om, at man kan poste et brev hvor som helst, som leveres et hvilket som helst sted, til en rimelig frimærkepris.",Replace Character,"the solidarity and cohesion of people all over europe depend on the thought that you can post a letter anywhere and it will be delivered anywhere else, ae an affordable stamp price.","(0.99, 0.99)",0.9210500207490828,0.9705,0.9655172413793104,0.9655172413793104,0.9655172363793104,0.935483870967742,0.935483870967742,0.935483865967742,0.9655172413793104,0.9655172413793104,0.9655172363793104,0.99,0.99,en
i think ours is a different approach!,"her tror jeg, vi har en anden indfaldsvinkel.",Remove Token,i think ours is a approach!,"(0.90, 0.95)",0.5946035575013605,0.8757,1.0,0.8571428571428571,0.9230769181065088,0.8,0.6666666666666666,0.7272727223140496,1.0,0.8571428571428571,0.9230769181065088,0.90,0.95,en
i believe a liberalised market will speed up this process more than a less liberalised market.,"jeg tror, det accelereres mere af et liberaliseret marked end af et mindre liberaliseret marked.",Duplicate Token,i believe a liberalised market will speed up this process more than a a less liberalised market.,"(1.00, 1.00)",0.8917143641551922,0.9877,1.0,1.0,0.999999995,0.9333333333333332,1.0,0.9655172363852556,1.0,1.0,0.999999995,1.00,1.00,en
it also offers some prospect of conveying a positive picture of european policy.,og det giver mulighed for at præsentere europæisk politik på en positiv måde.,Swap characters,it also offers some prospect of conveying a positive picture of euorpean policy.,"(0.98, 0.95)",0.8091067115702212,0.9269,0.9166666666666666,0.9166666666666666,0.9166666616666668,0.8333333333333334,0.8333333333333334,0.8333333283333335,0.9166666666666666,0.9166666666666666,0.9166666616666668,0.98,0.95,en
"we are in favour of competition as a component of the social market economy, and of course we are also in favour of it because we want this economic system to be as successful as possible.","vi går ind for konkurrencen som et element i den sociale markedsøkonomi - og det gør vi jo også, fordi vi vil føre dette økonomiske system til dets ypperste.",Add random word,"we symphycarpous are in favour of competition as a component of the social market economy, and of course we are also in favour of it because we want this economic system to be as successful as possible.","(0.99, 0.99)",0.9536532564141894,0.9973,0.9629629629629628,1.0,0.9811320704734782,0.9411764705882352,1.0,0.9696969647015612,0.9629629629629628,1.0,0.9811320704734782,0.99,0.99,en
