originalSentence,referenceSentence,tamperingType,tamperedSentence,"LLMScore (Sim, Con)",BLEU,METEOR,Rouge1 r,Rouge1 p,Rouge1 f,Rouge2 r,Rouge2 p,Rouge2 f,Rougel r,Rougel p,Rougel f,LLM-Sim,LLM-Con,originalLanguage
"det forekommer ret naturligt, at den nationale og europæiske solidaritet skal gøre sig gældende til fordel for de skadede regioner og de mennesker, der er hårdest ramt.","it seems quite natural that given such a disaster, national and european solidarity should go to the help of the devastated regions and those people who have been worst affected.",Duplicate character,"det forekommer ret natuurligt, at den nationale og europæiske solidaritet skal gøre sig gældende til fordel for de skadede regioner og de mennesker, der er hårdest ramt.",-1,0.9095930632220222,0.9665,0.96,0.96,0.9599999950000001,0.9230769230769231,0.9230769230769231,0.9230769180769233,0.96,0.96,0.9599999950000001,NULL,NULL,da
"jeg har en kopi, hvis de vil se det.",i can show you a copy if you wish.,Swap words,"jeg en har kopi, hvis de vil se det. ",-1,0.7348889200874658,0.976,0.9,1.0,0.9473684160664821,0.5555555555555556,0.625,0.5882352891349482,0.8,0.8888888888888888,0.8421052581717452,NULL,NULL,da
"det haster således med inden for rammerne af et supplerende budget at genetablere den budgetpost, som vi havde fået tildelt til anvendelse i tilfælde af naturkatastrofer.","as a matter of urgency, therefore, we must restore, within the framework of a supplementary budget, the budget line which was allocated to us for natural disasters.",Swap words,"det haster således med inden for rammerne af et supplerende budget at genetablere den budgetpost, som vi havde fået til tildelt anvendelse i tilfælde af naturkatastrofer. ",-1,0.8807379283931852,0.9985,0.9615384615384616,1.0,0.9803921518646674,0.8461538461538461,0.88,0.862745093041138,0.9230769230769231,0.96,0.9411764655901577,NULL,NULL,da
"jeg vil først og fremmest udtrykke min dybeste medfølelse for de familier, der er i sorg på grund af det uvejr, der hærgede europa i december.",i would first like to express my heartfelt condolences to the families in mourning as a result of the appalling weather conditions that devastated europe in december.,Swap words,"jeg vil først og fremmest udtrykke min dybeste medfølelse for de familier, der er i sorg på af grund det uvejr, der hærgede europa i december. ",-1,0.8853153595969632,0.9987,0.96,1.0,0.9795918317367763,0.8461538461538461,0.88,0.862745093041138,0.92,0.9583333333333334,0.9387755052061642,NULL,NULL,da
"det fælles handlingsprogram til beskyttelse af civile, der blev indført med rådets beslutning af 9. december, trådte i kraft fra den 1. januar 2000.","the community action programme for civil protection, established by a council decision on 9 december, was launched on 1 january 2000.",Replace Token with Random Word,"det fælles handlingsprogram til beskyttelse af civile, der blev indført med rådets beslutning af 9. december, trådte kny kraft fra den 1. januar 2000.",-1,0.8985396083419646,0.9627,0.9565217391304348,0.9565217391304348,0.9565217341304348,0.9130434782608695,0.9130434782608695,0.9130434732608695,0.9565217391304348,0.9565217391304348,0.9565217341304348,NULL,NULL,da
"handlen med emissionscertifikater er efter min mening umoralsk og løser ikke problemet, men udskyder det kun.","the trade in emissions rights is immoral to my mind and rather than solving the problem, it shelves it.",Negation,"handlen med emissionscertifikater er efter min mening umoralsk og løser problemet, men udskyder det kun.",-1,0.8394327083733336,0.9489,1.0,0.9375,0.967741930489074,0.9285714285714286,0.8666666666666667,0.8965517191438764,1.0,0.9375,0.967741930489074,NULL,NULL,da
"men jeg kommer selv fra et skovbrug i det nordlige tyskland, og jeg kan sige dem, at vi allerede nu kan mærke disse enorme skader.","however, i come from an area in northern germany where the forestry industry predominates and i can tell you that we are already feeling the effects of the immense damage.",Duplicate Token,"men jeg kommer selv fra et skovbrug i i det nordlige tyskland, og jeg kan sige dem, at vi allerede nu kan mærke disse enorme skader.",-1,0.9357893640502225,0.9963,1.0,1.0,0.999999995,0.96,1.0,0.9795918317367763,1.0,1.0,0.999999995,NULL,NULL,da
"jeg mener, at de har krav på solidaritet.",i say they have a right to solidarity.,Remove Character,"jeg mener, at d har krav på solidaritet.",-1,0.6580370064762462,0.8951,0.875,0.875,0.874999995,0.7142857142857143,0.7142857142857143,0.7142857092857143,0.875,0.875,0.874999995,NULL,NULL,da
"naturkatastrofer har været der altid, og de vil blive ved med at være der.",there have always been natural disasters and there always will be.,Replace Token with Random Word,"naturkatastrofer har været der altid, og de vil blive ved med pande være der.",-1,0.8153551038173115,0.9364,0.9230769230769231,0.9230769230769231,0.9230769180769233,0.8461538461538461,0.8461538461538461,0.8461538411538462,0.9230769230769231,0.9230769230769231,0.9230769180769233,NULL,NULL,da
denne er - hvor vanskeligt det end er at demonstrere de klimatiske forandringer med regneeksempler - til dels menneskeskabt.,"this is partly the work of human hand, as difficult as it is to demonstrate climate change using calculations.",Swap words,denne er - hvor vanskeligt det end er at demonstrere de klimatiske forandringer med regneeksempler - til menneskeskabt. dels ,-1,0.8852140475440834,0.9983,1.0,1.0,0.999999995,0.8888888888888888,0.8888888888888888,0.888888883888889,1.0,1.0,0.999999995,NULL,NULL,da
"det første tror jeg, at kommissæren implicit vedgår i sit indlæg, hvor han spørger sig selv, om katastroferne er naturlige eller ej.",i believe that the first one was implicitly recognised by the commissioner in his speech when he wondered whether these catastrophes are natural or not.,Swap characters,"det første tror jeg, at kommissæren implicit vdegår i sit indlæg, hvor han spørger sig selv, om katastroferne er naturlige eller ej.",-1,0.8942255541978509,0.9613,0.9545454545454546,0.9545454545454546,0.9545454495454547,0.9047619047619048,0.9047619047619048,0.9047618997619049,0.9545454545454546,0.9545454545454546,0.9545454495454547,NULL,NULL,da
"jeg mener, at denne budgetpost bør genindføres.",i think we should reinstate this budget line.,Duplicate Token,"jeg mener, at at denne budgetpost bør genindføres.",-1,0.7780106561124064,0.9836,1.0,1.0,0.999999995,0.8571428571428571,1.0,0.9230769181065088,1.0,1.0,0.999999995,NULL,NULL,da
"vi bør genindføre instrumentet, og vi bør lave reglerne stringente, så instrumentet kun kan bruges, når der er tale om alvorlige katastrofer.",we should reinstate that instrument and we should make the rules tight so that only in situations where grave disasters occur will we call up this particular instrument.,Duplicate character,"vi bør genindføre instrumentet, og vi bør lave reglerne stringente, så instrumentet kun kan bruges, når der er tale om alvorlige katastrofeer.",-1,0.9276077030810346,1.0,0.95,0.95,0.9499999950000001,0.95,0.95,0.9499999950000001,0.95,0.95,0.9499999950000001,NULL,NULL,da
det sande omfang af skaderne inden for skovbruget kender vi først om årtier.,decades will have gone by before we are able to determine the true extent of the damage sustained by the forestry industry.,Swap characters,det sande omfang af skaderne inden for skovburget kender vi først om årtier.,-1,0.7825422900366437,0.9269,0.9230769230769231,0.9230769230769231,0.9230769180769233,0.8333333333333334,0.8333333333333334,0.8333333283333335,0.9230769230769231,0.9230769230769231,0.9230769180769233,NULL,NULL,da
"her regner man i årtier, ikke i år.",the calculations are in decades rather than years.,Negation,"her regner man i årtier, i år.",-1,0.6580370064762462,0.9041,1.0,0.8571428571428571,0.9230769181065088,0.8333333333333334,0.7142857142857143,0.7692307642603551,1.0,0.8571428571428571,0.9230769181065088,NULL,NULL,da
"jeg talte med landmænd, hvis får aborterede, fordi de havde drukket forurenet vand.",i talked with farmers whose ewes were aborting their lambs due to drinking the infected water.,Swap characters,"jeg talte emd landmænd, hvis får aborterede, fordi de havde drukket forurenet vand.",-1,0.8371170098777919,0.9364,0.9230769230769231,0.9230769230769231,0.9230769180769233,0.8333333333333334,0.8333333333333334,0.8333333283333335,0.9230769230769231,0.9230769230769231,0.9230769180769233,NULL,NULL,da
jeg takker kommissæren og støtter ham meget i forslaget om en europæisk beskyttelsesstyrke.,i thank the commissioner and support him very much in his european protection force.,Duplicate character,jeg takker kommissæren og støtter ham meget i forslaget om en europæisk beskyttelsessttyrke.,-1,0.855526185871245,0.9269,0.9230769230769231,0.9230769230769231,0.9230769180769233,0.9166666666666666,0.9166666666666666,0.9166666616666667,0.9230769230769231,0.9230769230769231,0.9230769180769233,NULL,NULL,da
"for vi får jo en massiv påvirkning af skovbruget i alle områder af europa, og jeg mener, at man her skal tænke langsigtet og overveje, hvordan man fremover skal håndtere sådanne problemer.","for the storms will have major implications for the forestry industry in all areas of europe, and i believe we need, in the long-term, to give thought to how problems of this kind are to be dealt with in future.",Replace Token with Random Word,"for vi får jo en massiv påvirkning af skovbruget i alle områder smæk europa, og jeg mener, at man her skal tænke langsigtet og overveje, hvordan man fremover skal håndtere sådanne problemer.",-1,0.9257518071011758,0.9715,0.9655172413793104,1.0,0.9824561353524162,0.9354838709677419,0.9354838709677419,0.9354838659677419,0.9655172413793104,1.0,0.9824561353524162,NULL,NULL,da
"vi ønsker helt sikkert ingen markedsordning for skove, men vi skal eventuelt tage initiativ til et system, måske i samarbejde med den private forsikringssektor, så vi på en eller anden måde kan mildne virkningerne for de berørte.","we certainly do not want market organisation for forests, but maybe we should set up a system, perhaps in conjunction with the private insurance sector, which will make it possible to mitigate the implications for the victims in some way.",Duplicate character,"vi ønsker helt sikkert ingen markedsordning for skove, mmen vi skal eventuelt tage initiativ til et system, måske i samarbejde med den private forsikringssektor, så vi på en eller anden måde kan mildne virkningerne for de berørte.",-1,0.9353695731020621,0.9755,0.9705882352941176,0.9705882352941176,0.9705882302941177,0.9444444444444444,0.9444444444444444,0.9444444394444445,0.9705882352941176,0.9705882352941176,0.9705882302941177,NULL,NULL,da
ved min høring i september lovede jeg en hurtig offentliggørelse af denne hvidbog.,"at my hearing last september, i promised speedy delivery of this white paper.",Duplicate Token,ved min høring høring i september lovede jeg en hurtig offentliggørelse af denne hvidbog.,-1,0.8664515469216714,0.9915,1.0,1.0,0.999999995,0.9230769230769231,1.0,0.959999995008,1.0,1.0,0.999999995,NULL,NULL,da
"da jeg præsenterede hvidbogen i sidste uge, sagde jeg, at indkøbsvognen er et af de mest effektive våben på jordens overflade.",when i launched the white paper last week i said that the shopping trolley is one of the most potent weapons on the face of the earth.,Replace Token with Random Word,"da jeg præsenterede hvidbogen i sidste uge, vise jeg, at indkøbsvognen er et af de mest effektive våben på jordens overflade.",-1,0.8843865924896842,0.958,0.9523809523809523,0.9523809523809523,0.9523809473809525,0.9,0.9,0.899999995,0.9523809523809523,0.9523809523809523,0.9523809473809525,NULL,NULL,da
de mest afgørende beslutninger træffes af europas forbrugere.,the most discerning decisions are made by the consumers of europe.,Swap characters,de mest afgørende beslutninger træffes fa europas forbrugere.,-1,0.5969491792019646,0.8819,0.875,0.875,0.874999995,0.7142857142857143,0.7142857142857143,0.7142857092857143,0.875,0.875,0.874999995,NULL,NULL,da
"hvis deres tillid beskadiges, afspejles det i deres købsbeslutninger.",if their confidence is damaged this is reflected in shopping decisions.,Replace Character,"hvis deres tillid beskadiges, afspejles det i deres købsbeslutningek.",-1,0.8070557274927981,0.9055,0.875,0.875,0.874999995,0.875,0.875,0.874999995,0.875,0.875,0.874999995,NULL,NULL,da
jeg vender tilbage til høringsprocessen om et øjeblik.,i will return to this process of consultation in a few moments.,Duplicate character,jeg vender tilbage til høriingsprocessen om et øjeblik.,-1,0.5969491792019646,0.8819,0.875,0.875,0.874999995,0.7142857142857143,0.7142857142857143,0.7142857092857143,0.875,0.875,0.874999995,NULL,NULL,da
det første hovedprincip er uafhængighed.,the first key concern is independence.,Replace Token with Random Word,det lumske hovedprincip er uafhængighed.,-1,0.537284965911771,0.8067,0.8,0.8,0.7999999950000002,0.5,0.5,0.4999999950000001,0.8,0.8,0.7999999950000002,NULL,NULL,da
"vi regner med, at arbejdet inden for de eksisterende fem videnskabelige komitéer for fødevaresikkerhed vil blive overført til den nye myndighed.",we envisage that the work of the existing five scientific committees devoted to food safety will be transferred to the authority.,Swap words,"vi regner med, arbejdet at inden for de eksisterende fem videnskabelige komitéer for fødevaresikkerhed vil blive overført til den nye myndighed. ",-1,0.8509527625828,0.9974,0.9523809523809523,1.0,0.9756097511005354,0.8095238095238095,0.85,0.8292682876859013,0.9047619047619048,0.95,0.9268292632956573,NULL,NULL,da
"men hvis vi blot ville foreslå en ommøblering, ville det helt klart være utilstrækkeligt.","however, if we were merely to propose a simple moving of deckchairs, this would clearly not be enough.",Remove Token,"hvis vi blot ville foreslå en ommøblering, ville det helt klart være utilstrækkeligt.",-1,0.9306048591020997,0.9433,1.0,0.9230769230769231,0.959999995008,1.0,0.9230769230769231,0.959999995008,1.0,0.9230769230769231,0.959999995008,NULL,NULL,da
"vi planlægger også, at myndigheden som led i sine beføjelser skal stå for et forbedret tidligt varslingssystem for problemer med levnedsmidler og foderstoffer.",as part of its remit we also envisage the authority operating an enhanced rapid alert system for food and feed concerns.,Swap words,"vi planlægger også, at myndigheden som led i sine beføjelser skal stå for et forbedret tidligt varslingssystem for problemer levnedsmidler med og foderstoffer. ",-1,0.8645000338766944,0.998,0.9565217391304348,1.0,0.977777772780247,0.8260869565217391,0.8636363636363636,0.8444444394469136,0.9130434782608695,0.9545454545454546,0.9333333283358024,NULL,NULL,da
"jeg vil ikke undskylde for denne fremgangsmåde; jeg mener virkelig, at det er den rigtige.",i make no apology for this approach; i firmly believe that it is the correct one.,Negation,"jeg vil undskylde for denne fremgangsmåde; jeg mener virkelig, at det er den rigtige.",-1,0.8578928092681435,0.9489,1.0,0.9285714285714286,0.9629629579698218,0.9230769230769231,0.8571428571428571,0.8888888838957477,1.0,0.9285714285714286,0.9629629579698218,NULL,NULL,da
"hvordan kan en kommissær for sundhed og forbrugerbeskyttelse afvise eller ignorere en velbegrundet, uafhængig, videnskabelig rådgivning vedrørende fødevaresikkerhed?",how could a commissioner for health and consumer protection reject or ignore well-founded independent scientific advice in relation to food safety?,Duplicate character,"hvordan kan en kommissær for sundhed og forbrugerbeskyttelse afvise eller ignorere en velbegrundet, uafhængig, videnskabelig rådgivning vedrørende fødevaresikkerrhed?",-1,0.9086549610666288,0.9519,0.9411764705882353,0.9411764705882353,0.9411764655882354,0.9411764705882353,0.9411764705882353,0.9411764655882354,0.9411764705882353,0.9411764705882353,0.9411764655882354,NULL,NULL,da
det synes vanskeligt at forestille sig en sådan situation.,it seems difficult to envisage such a situation evolving.,Swap words,det synes vanskeligt at forestille en sig sådan situation. ,-1,0.5555238068023582,0.968,0.9,1.0,0.9473684160664821,0.5555555555555556,0.625,0.5882352891349482,0.8,0.8888888888888888,0.8421052581717452,NULL,NULL,da
myndigheden skal blive den autoritative kilde til videnskabelig rådgivning og information om spørgsmål vedrørende fødevaresikkerhed.,the authority must become the authoritative source of scientific advice and information on food safety issues.,Swap characters,myndigheden skal blive den autoritative kilde til videnskabelig rådgivning og information om spørsgmål vedrørende fødevaresikkerhed.,-1,0.8153551038173115,0.9364,0.9333333333333333,0.9333333333333333,0.9333333283333335,0.8571428571428571,0.8571428571428571,0.8571428521428571,0.9333333333333333,0.9333333333333333,0.9333333283333335,NULL,NULL,da
"den situation opstår ikke ved, at man blot opretter myndigheden, men vil udvikle sig med tiden, efterhånden som man får tillid til myndigheden selv.",this situation will not come about by the very creation of the authority but will evolve over time as confidence is gained in the authority itself.,Negation,"den situation opstår ved, at man blot opretter myndigheden, men vil udvikle sig med tiden, efterhånden som man får tillid til myndigheden selv.",-1,0.9025139799587886,0.9675,1.0,0.9565217391304348,0.977777772780247,0.9545454545454546,0.9130434782608695,0.9333333283358024,1.0,0.9565217391304348,0.977777772780247,NULL,NULL,da
"jeg mener ikke, at vi kan være deklaratoriske inden for videnskab og rådgivning baseret på videnskab.",i do not believe we can be prescriptive in the area of science and advice based on science.,Negation,"jeg mener, at vi kan være deklaratoriske inden for videnskab og rådgivning baseret på videnskab.",-1,0.8578928092681435,0.9489,0.9285714285714286,0.8666666666666667,0.8965517191438764,0.8571428571428571,0.8,0.8275862019024971,0.9285714285714286,0.8666666666666667,0.8965517191438764,NULL,NULL,da
hvidbogen indeholder også meget vigtige forslag med hensyn til kontrol.,the white paper also contains very important proposals in respect of controls.,Swap characters,hvidbogen indheolder også meget vigtige forslag med hensyn til kontrol.,-1,0.8070557274927981,0.9055,0.9,0.9,0.899999995,0.7777777777777778,0.7777777777777778,0.7777777727777778,0.9,0.9,0.899999995,NULL,NULL,da
"disse kunne omfatte tilbageholdelse af økonomisk støtte fra fællesskabet eller inddragelse af finansiering, der allerede er forpligtet til en medlemsstat.",these could include withholding community financial support or recouping funding already committed to a member state.,Duplicate character,"disse kunne omfatte tilbageholdelse af økonomisk støtte fra fællesskabet eller inddragelse af finansierinng, der allerede er forpligtet til en medlemsstat.",-1,0.8725129388059689,0.9541,0.9473684210526315,0.9473684210526315,0.9473684160526316,0.8947368421052632,0.8947368421052632,0.8947368371052632,0.9473684210526315,0.9473684210526315,0.9473684160526316,NULL,NULL,da
"de nye juridiske rammer vil omfatte dyrefoder, dyrevelfærd og hygiejne, smitstoffer og rester, nye fødevarer, tilsætningsstoffer, aromastoffer, emballage og bestråling.","the new legal framework will cover animal feed, animal health and welfare, hygiene, contaminants and residues, novel food, additives, flavourings, packaging and irradiation.",Swap characters,"de nye juridiske rammer vil omfatte dyerfoder, dyrevelfærd og hygiejne, smitstoffer og rester, nye fødevarer, tilsætningsstoffer, aromastoffer, emballage og bestråling.",-1,0.8985396083419646,0.9627,0.9411764705882353,0.9411764705882353,0.9411764655882354,0.8947368421052632,0.8947368421052632,0.8947368371052632,0.9411764705882353,0.9411764705882353,0.9411764655882354,NULL,NULL,da
"men jeg ved også, at vi får rig lejlighed til at drøfte hvidbogens forslag om myndigheden i løbet af de kommende måneder.",but i know too that we will have many further opportunities in the coming months to consider the white paper's proposals on the authority.,Replace Token with Random Word,"men jeg ved også, at vi maske rig lejlighed til at drøfte hvidbogens forslag om myndigheden i løbet af de kommende måneder.",-1,0.8843865924896842,0.958,0.9523809523809523,0.9523809523809523,0.9523809473809525,0.9047619047619048,0.9047619047619048,0.9047618997619049,0.9523809523809523,0.9523809523809523,0.9523809473809525,NULL,NULL,da
"jeg håber, at vi kan finde en løsning.",i hope that we can thrash this out.,Add random word,"lede jeg håber, at vi kan finde en løsning.",-1,0.9048374180359595,0.9896,0.8888888888888888,1.0,0.9411764656055364,0.875,1.0,0.9333333283555556,0.8888888888888888,1.0,0.9411764656055364,NULL,NULL,da
men jeg har noteret deres forslag og vil overveje det yderligere.,but i have taken on board your suggestion and i will give it further consideration.,Remove Token,men jeg har noteret deres forslag vil overveje det yderligere.,-1,0.7348889200874658,0.9216,1.0,0.9090909090909091,0.9523809473922903,0.8888888888888888,0.8,0.8421052581717452,1.0,0.9090909090909091,0.9523809473922903,NULL,NULL,da
"det er et af de spørgsmål, som vi tager op i bilaget til lovgivningen, og det er hensigten at etablere en positivliste for foderstoffer.","that is one of the issues that we address in the annex to the legislation, and the intention is to establish a positive list for feed material.",Remove Token,"det er et af spørgsmål, som vi tager op i bilaget til lovgivningen, og det er hensigten at etablere en positivliste for foderstoffer.",-1,0.8985396083419646,0.9663,1.0,0.9545454545454546,0.9767441810492159,0.9523809523809523,0.9090909090909091,0.9302325531422391,1.0,0.9545454545454546,0.9767441810492159,NULL,NULL,da
"udarbejdelsen af positivlisten er et af de spørgsmål, der omtales i bilaget sammen med en dato, 2002 rent faktisk.","the establishment of the positive list is one of the issues set out in the annex with a date attached to it, 2002 in fact.",Add random word,"udarbejdelsen af positivlisten er et af de spørgsmål, der omtales i bilaget sammen med en dato, 2002 rent faktisk lykke.",-1,0.9194384135170949,0.9951,0.9473684210526315,1.0,0.9729729679766254,0.9473684210526315,1.0,0.9729729679766254,0.9473684210526315,1.0,0.9729729679766254,NULL,NULL,da
"hr. kommissær, nogle medlemslandes uvidenhed har bragt os i europa ud i en stor levnedsmiddelkrise, og jeg bliver, desværre, endnu en gang irriteret over, at rådet i dag, hvor de fremlægger denne interessante betænkning, igen er fuldstændig fraværende.","commissioner, the ignorance of certain member states has landed us in a major food crisis here in europe, and i am afraid that once more i have cause to be angry at the fact that again no members of the council are in attendance, and that on the day that you present your interesting report.",Swap characters,"hr. kommissær, nogle medlemlsandes uvidenhed har bragt os i europa ud i en stor levnedsmiddelkrise, og jeg bliver, desværre, endnu en gang irriteret over, at rådet i dag, hvor de fremlægger denne interessante betænkning, igen er fuldstændig fraværende.",-1,0.9440602839389667,0.9787,0.9714285714285714,0.9714285714285714,0.9714285664285714,0.9459459459459459,0.9459459459459459,0.945945940945946,0.9714285714285714,0.9714285714285714,0.9714285664285714,NULL,NULL,da
"med hensyn til sammensætningen af myndigheden: først og fremmest skal der ansættes interne videnskabsfolk, der skal stå i forbindelse med videnskabsfolk, der er eksperter på netop det område, man beskæftiger sig med på det pågældende tidspunkt.",in relation to the makeup of the authority: first of all it will employ in-house scientists who will liaise with and consult with scientists who are experts in the particular field that is being considered at any particular time.,Replace Token with Random Word,"med hensyn til sammensætningen af myndigheden: først og fremmest skal der ansættes interne videnskabsfolk, der skal stå i forbindelse med videnskabsfolk, der er eksperter på netop det område, man beskæftiger sig med kravat det pågældende tidspunkt.",-1,0.9353695731020621,0.9751,0.9655172413793104,1.0,0.9824561353524162,0.9411764705882353,0.9411764705882353,0.9411764655882354,0.9655172413793104,1.0,0.9824561353524162,NULL,NULL,da
denne situation kan nås over en periode.,this situation can be achieved over a period of time.,Duplicate character,denne situattion kan nås over en periode.,-1,0.7071067811865475,0.8648,0.8571428571428571,0.8571428571428571,0.8571428521428571,0.6666666666666666,0.6666666666666666,0.6666666616666668,0.8571428571428571,0.8571428571428571,0.8571428521428571,NULL,NULL,da
"men kommissionen vil få mulighed for at sørge for, at myndighedens udtalelser i videnskabelige spørgsmål håndhæves gennem vedtagelse af lovgivning, hvilket er kommissionens, parlamentets og rådets funktion.","however, the commission will have the possibility of seeing that the opinions of the authority on scientific matters are enforced by way of passing legislation which is the function of the commission, parliament and council.",Remove Token,"kommissionen vil få mulighed for at sørge for, at myndighedens udtalelser i videnskabelige spørgsmål håndhæves gennem vedtagelse af lovgivning, hvilket er kommissionens, parlamentets og rådets funktion.",-1,0.9660520303055021,0.9709,1.0,0.9615384615384616,0.9803921518646674,1.0,0.9615384615384616,0.9803921518646674,1.0,0.9615384615384616,0.9803921518646674,NULL,NULL,da
