originalSentence,referenceSentence,tamperingType,tamperedSentence,"LLMScore (Sim, Con)",BLEU,METEOR,Rouge1 r,Rouge1 p,Rouge1 f,Rouge2 r,Rouge2 p,Rouge2 f,Rougel r,Rougel p,Rougel f,LLM-Sim,LLM-Con,originalLanguage
"this means that every member state must guarantee the establishment of effective, adequate penal sanctions, which act as a deterrent against the offences covered by the draft framework decision.","det vil således være den enkelte medlemsstat, der skal sørge for at fastsætte strafferetlige sanktioner, der er effektive, står i rimeligt forhold til overtrædelsen og har afskrækkende virkning for den slags handlinger, der betragtes som lovovertrædelser ifølge dette udkast til rammeafgørelse.",Replace Character,"this means that every member state must guarantee the establishment of effective, adequate penal sanctions, which act as a deterrent against uhe offences covered by the draft framework decision.","(0.98, 0.99)",0.9157103753711766,0.9677,0.9642857142857144,1.0,0.9818181768198349,0.9285714285714286,0.9285714285714286,0.9285714235714286,0.9642857142857144,1.0,0.9818181768198349,0.98,0.99,en
it is easy to counterfeit the euro.,det er nemlig alt sammen rigtigt og rammende.,Replace Character,it is easy tk counterfeit the euro.,"(0.95, 0.95)",0.5,0.8648,0.8571428571428571,0.8571428571428571,0.8571428521428571,0.6666666666666666,0.6666666666666666,0.6666666616666668,0.8571428571428571,0.8571428571428571,0.8571428521428571,0.95,0.95,en
we are going through a dangerous transitional phase in which a phenomenon has appeared in criminal law that is perhaps unique in monetary history.,euroen er nem at forfalske.,Remove Character,we are going through a dangerous transitional phase in which a phenomenon has appeared in criminal law that is perhaps unique in monetary hisory.,"(1.00, 1.00)",0.9244754047211334,0.9597,0.9523809523809524,0.9523809523809524,0.9523809473809524,0.9565217391304348,0.9565217391304348,0.9565217341304348,0.9523809523809524,0.9523809523809524,0.9523809473809524,1.00,1.00,en
"the manner in which the council, which is by far the most undemocratic institution in europe, consulted the european parliament makes a mockery of the concept of democracy.","europa-parlamentet er blevet konsulteret af rådet, der uden sammenligning er den mest udemokratiske institution i europa, på en måde, der er en hån mod begrebet demokrati.",Remove Character,"the manner in which the council, which is by far the most undemocratic institution in europe, consulted the european parliament makes a mockery of the concept of democrac.","(0.99, 0.95)",0.9400357170187866,0.9676,0.9523809523809524,0.9523809523809524,0.9523809473809524,0.9629629629629628,0.9629629629629628,0.9629629579629628,0.9523809523809524,0.9523809523809524,0.9523809473809524,0.99,0.95,en
"we concluded that it is not, but given the importance of the issue we nonetheless agreed to accept this procedure.","vi er nået frem til det resultat, at det er det ikke, men i betragtning af sagens vigtighed er vi blevet enige om at acceptere proceduren, som den er.",Negation,"we concluded that it is, but given the importance of the issue we nonetheless agreed to accept this procedure.","(0.95, 0.95)",0.8725129388059689,0.9585,0.9411764705882352,0.8888888888888888,0.914285709289796,0.8888888888888888,0.8421052631578947,0.8648648598685172,0.9411764705882352,0.8888888888888888,0.914285709289796,0.95,0.95,en
"the fact is people are suddenly going to lose all their currency references, and that means they will be at serious risk of easily accepting forged euros because they are not very familiar with the genuine article.","således er der fare for, at borgere, der pludselig mister deres valutamæssige referencer, let vil komme til at tage imod falske euro, fordi de ikke kender de ægte.",Negation,"the fact is people are suddenly going to lose all their currency references, and that means they will be at serious risk of easily accepting forged euros because they are very familiar with the genuine article.","(0.85, 0.95)",0.931838481115484,0.9768,1.0,0.9705882352941176,0.9850746218667856,0.9714285714285714,0.9444444444444444,0.9577464738742314,1.0,0.9705882352941176,0.9850746218667856,0.85,0.95,en
"in a way, this is deferred punishment for its lack of honesty, at the time, in presenting the maastricht treaty to the voters.","man kan sige, at det er rådets forsinkede straf for ikke at have været helt ærligt, da det fremlagde maastricht-traktaten for vælgerne.",Add random word,"in a way, this is deferred punishment for its lack of honesty, at the time, in presenting the maastricht treaty to yuletides the voters.","(0.95, 0.95)",0.9038693388414086,0.9961,0.9523809523809524,1.0,0.9756097511005354,0.9130434782608696,0.9545454545454546,0.9333333283358024,0.9523809523809524,1.0,0.9756097511005354,0.95,0.95,en
she would like to devise these sanctions jointly so as to arrive at a coherent criminal justice system for offences which have particular relevance for the eu.,"hun vil gerne udarbejde disse sanktioner i fællesskab for at nå frem til et kohærent strafferetligt system for overtrædelser, der har særlig relevans for eu.",Remove Token,she would like to devise sanctions jointly so as to arrive at a coherent criminal justice system for offences which have particular relevance for the eu.,"(1.00, 1.00)",0.9025139799587886,0.9675,1.0,0.96,0.9795918317367764,0.96,0.9230769230769232,0.9411764655901576,1.0,0.96,0.9795918317367764,1.00,1.00,en
"that is, after all, a question the people often ask.","det er jo et spørgsmål, der meget ofte stilles af befolkningen.",Remove Character,"that is, after all,  question the people often ask.","(1.00, 1.00)",0.7611606003349892,0.9281,1.0,0.9,0.947368416066482,0.875,0.7777777777777778,0.823529406782007,1.0,0.9,0.947368416066482,1.00,1.00,en
"for the safety of the euro is not just a matter of the stability and external value of the currency but, in fact, also of protecting the euro against counterfeiting.","spørgsmålet om, hvor sikker euroen er, drejer sig ikke kun om valutaens stabilitet og valutaens værdi, men derimod altså også om beskyttelsen af euroen mod forfalskninger.",Negation,"for the safety of the euro is just a matter of the stability and external value of the currency but, in fact, also of protecting the euro against counterfeiting.","(0.99, 1.00)",0.9184678024441792,0.9725,1.0,0.9545454545454546,0.976744181049216,0.96,0.9230769230769232,0.9411764655901576,1.0,0.9545454545454546,0.976744181049216,0.99,1.00,en
and that is what we are discussing at this late hour.,"det er jo det, det drejer sig på dette sene tidspunkt.",Replace Token with Random Word,and that is what we airliners discussing at this late hour.,"(0.85, 0.95)",0.7348889200874658,0.9139,0.9090909090909092,0.9090909090909092,0.9090909040909092,0.8,0.8,0.7999999950000002,0.9090909090909092,0.9090909090909092,0.9090909040909092,0.85,0.95,en
that is what this framework decision is about.,"det er det, det drejer sig om i forbindelse med den foreliggende rammeafgørelse.",Replace Character,that is what this framework dzcision is about.,"(0.99, 1.00)",0.5969491792019646,0.8819,0.8571428571428571,0.8571428571428571,0.8571428521428571,0.7142857142857143,0.7142857142857143,0.7142857092857143,0.8571428571428571,0.8571428571428571,0.8571428521428571,0.99,1.00,en
"mrs cederschiöld, let me offer you sincere thanks on behalf of the commission and, above all, let me also thank parliament for being prepared to give its position in the space of such a short time.","fru ordfører, på kommissionens vegne vil jeg gerne takke dem mange gange, og først og fremmest vil jeg også takke parlamentet for, at de i løbet af så kort tid var villige til at udarbejde denne udtalelse.",Replace Token with Random Word,"mrs cederschiöld, let me offer salwey sincere thanks on behalf of the commission and, above all, let me also thank parliament for being prepared to give its position in the space of such a short time.","(0.98, 0.99)",0.933651069586263,0.9749,0.96875,0.96875,0.968749995,0.9411764705882352,0.9411764705882352,0.9411764655882354,0.96875,0.96875,0.968749995,0.98,0.99,en
"that is a volume of funding that can be put to very effective use, a large amount; and of course the information campaign will also focus very strongly on protecting the euro against counterfeiting.","det er jo en bevillingsstørrelse, der kan anvendes meget effektivt, altså en stor bevilling, og naturligvis indgår beskyttelsen af euroen mod forfalskning som et helt afgørende punkt i denne informationskampagne.",Add random word,"that is a volume of funding that can be put to very effective use, a large amount; and of course the information campaign will edessan also focus very strongly on protecting the euro against counterfeiting.","(0.99, 0.99)",0.930648893393227,0.9972,0.9666666666666668,1.0,0.9830508424590636,0.9411764705882352,0.9696969696969696,0.9552238755981288,0.9666666666666668,1.0,0.9830508424590636,0.99,0.99,en
"as a new member of the european parliament, it has been very interesting and instructive for me to be given responsibility for this important matter.",som nyt medlem af europa-parlamentet har det været meget interessant og lærerigt at få ansvaret for dette vigtige område.,Duplicate Token,"as a new member of the european parliament, it has been very interesting and instructive for me to be given responsibility for this important matter matter.","(0.99, 0.95)",0.9437608901329096,0.9961,1.0,1.0,0.999999995,0.96,1.0,0.9795918317367764,1.0,1.0,0.999999995,0.99,0.95,en
"in the course of the 1980s, most markets in europe underwent drastic deregulation.",i 1980'erne oplevede de fleste markeder i europa en dramatisk deregulering.,Replace Character,"in the course of the 1980s, most markets in durope underwent drastic deregulation.","(0.95, 0.99)",0.8003203203844999,0.932,0.9090909090909092,0.9090909090909092,0.9090909040909092,0.8333333333333334,0.8333333333333334,0.8333333283333335,0.9090909090909092,0.9090909090909092,0.9090909040909092,0.95,0.99,en
the capital and securities market has continued to be developed.,kapital- og værdipapirmarkedet har fortsat udviklet sig.,Duplicate character,the capital annd securities market has continued to be developed.,"(0.98, 0.95)",0.7419446627365011,0.9055,0.9,0.9,0.899999995,0.7777777777777778,0.7777777777777778,0.7777777727777778,0.9,0.9,0.899999995,0.98,0.95,en
the commission' s proposal with which we are dealing today is in two parts.,"kommissionens forslag, som vi behandler i dag, består af to dele.",Duplicate Token,the commission' s s proposal with which we are dealing today is in two parts.,"(1.00, 1.00)",0.8844489226418503,0.9928,1.0,1.0,0.999999995,0.9285714285714286,1.0,0.9629629579698218,1.0,1.0,0.999999995,1.00,1.00,en
"in addition, the commission' s proposal puts forward special risk-spreading rules for funds whose aim is to replicate a particular stock index, a so-called index fund.","desuden indføres der særskilte risikospredningsregler for investeringsinstitutter, som har til hensigt at kopiere et aktieindeks, en såkaldt indeksfond.",Remove Character,"in addition, the commission' s poposal puts forward special risk-spreading rules for funds whose aim is to replicate a particular stock index, a so-called index fund.","(1.00, 1.00)",0.9095930632220222,0.9665,0.96,0.96,0.959999995,0.92,0.92,0.919999995,0.96,0.96,0.959999995,1.00,1.00,en
it is therefore important that regulation of derivatives is flexible so that the market is not tied down ahead of future developments.,"det er derfor vigtigt, at derivatbestemmelserne er fleksible, således at markederne ikke bliver låst for fremtiden.",Negation,it is therefore important that regulation of derivatives is flexible so that the market is tied down ahead of future developments.,"(0.95, 0.95)",0.8787419089273848,0.9603,1.0,0.9444444444444444,0.9714285664326532,0.95,0.9047619047619048,0.9268292632956572,1.0,0.9444444444444444,0.9714285664326532,0.95,0.95,en
they must be introduced to guarantee the protection of investors.,de skal indføres med henblik på at sikre beskyttelsen af investorerne.,Replace Token with Random Word,they must be introduced to guarantee porcelainize protection of investors.,"(0.90, 0.95)",0.7016879391277372,0.9055,0.9,0.9,0.899999995,0.7777777777777778,0.7777777777777778,0.7777777727777778,0.9,0.9,0.899999995,0.90,0.95,en
"one of the most important things, for me, personally, is that the common regulations should not cause smaller companies to go under.","for mig er det bl.a. vigtigt, at de fælles bestemmelser ikke slår de mindre institutter ud.",Negation,"one of the most important things, for me, personally, is that the common regulations should cause smaller companies to go under.","(0.00, 1.00)",0.8942255541978509,0.965,1.0,0.9523809523809524,0.9756097511005354,0.95,0.9047619047619048,0.9268292632956572,1.0,0.9523809523809524,0.9756097511005354,0.00,1.00,en
"mr president, i must firstly thank the rapporteur, mr schmidt, my colleague, mr goebbels, and mrs villiers and mrs lulling from my group. despite their differing opinions on some points, they have consistently worked in an extremely constructive manner.","hr. formand, mine første ord skal være en tak til ordføreren, hr. schmidt, til min kollega, hr. goebbels, og til mine kolleger fra gruppen, villiers og lulling, der, selvom de på visse områder fastholdt nogle afvigende standpunkter, altid har udvist en yderst konstruktiv holdning.",Remove Token,"mr president, i must firstly thank the rapporteur, mr schmidt, my colleague, mr goebbels, and mrs villiers and mrs lulling from my group . despite their differing on some points, they have consistently worked in an extremely constructive manner.","(0.99, 0.99)",0.9440602839389668,0.9808,1.0,0.9705882352941176,0.9850746218667856,0.9722222222222222,0.945945945945946,0.9589041045899794,1.0,0.9705882352941176,0.9850746218667856,0.99,0.99,en
"i believe in a social market economy based on a successful market operating subject to certain rules intended to guarantee the general interest. specifically, at the moment, this means the protection of investors.","det er min tro på den sociale markedsøkonomi, som bygger på et marked, der fungerer, men som er underlagt visse bestemte regler, som skal sikre den almene interesse, som lige i dette konkrete øjeblik og i denne konkrete sag kan afgrænses til forbrugerbeskyttelse.",Replace Token with Random Word,"i believe collywest a social market economy based on a successful market operating subject to certain rules intended to guarantee the general interest . specifically, at the moment, this means the protection of investors.","(0.95, 0.95)",0.9355359393782814,0.9729,0.9642857142857144,0.9642857142857144,0.9642857092857144,0.9375,0.9375,0.937499995,0.9642857142857144,0.9642857142857144,0.9642857092857144,0.95,0.95,en
"as this issue will be returning to this house at some stage, i must highlight the working method used between the commission and this parliament.","da dette spørgsmål ikke slutter her, men vil komme tilbage til parlamentet, vil jeg gerne komme med en hentydning til arbejdsmetoden mellem kommissionen og parlamentet.",Swap words,"as this issue will be returning to this house at some stage, i must highlight the method working used between the commission and this parliament. ","(0.98, 0.95)",0.8757780041302399,0.9984,0.9565217391304348,1.0,0.977777772780247,0.84,0.875,0.8571428521449397,0.9130434782608696,0.9545454545454546,0.9333333283358024,0.98,0.95,en
there is at present a surfeit of cash looking for a home.,"der findes for øjeblikket en alt for stor likviditet, der søger et afsætningsområde.",Replace Token with Random Word,there is at present a faldfee of cash looking for a home.,"(0.95, 0.98)",0.7611606003349892,0.9209,0.9090909090909092,0.9090909090909092,0.9090909040909092,0.8181818181818182,0.8181818181818182,0.8181818131818183,0.9090909090909092,0.9090909090909092,0.9090909040909092,0.95,0.98,en
the legislature has a duty to contain the risk inherent in the continuing deregulation of the european financial markets.,den lovgivende myndighed har i sit arbejde med at fremme liberaliseringen af eu's finansielle markeder pligt til at begrænse mulige risici.,Duplicate character,the legislature has a duty to contain the risk inherent in the continuuing deregulation of the european financial markets.,"(0.99, 0.99)",0.8578928092681435,0.9494,0.9375,0.9375,0.937499995,0.8888888888888888,0.8888888888888888,0.888888883888889,0.9375,0.9375,0.937499995,0.99,0.99,en
we have done away with so-called master-feeder structures.,vi har udelukket de såkaldte master-feeder-strukturer.,Duplicate Token,we have done away with so-called so-called master-feeder structures.,"(0.95, 0.95)",0.7780106561124064,0.9836,1.0,1.0,0.999999995,0.875,1.0,0.9333333283555556,1.0,1.0,0.999999995,0.95,0.95,en
"these feeder funds exist in the united states, which is an area with a single supervisory authority and a single legal system.","sådanne udviklingsfonde findes i usa, men på et område, der kun har en overvågende myndighed og et enkelt juridisk system.",Add random word,"these feeder funds exist in the united states, which is an area with a single supervisory authority and a territorialism single legal system.","(0.95, 0.95)",0.891237063632542,0.9956,0.9523809523809524,1.0,0.9756097511005354,0.9090909090909092,1.0,0.9523809473922904,0.9523809523809524,1.0,0.9756097511005354,0.95,0.95,en
"mr president, there is much talk at present of the principle of good governance.","hr. formand, man taler netop nu meget om princippet for god forvaltning.",Duplicate character,"mr president, there is muchh talk at present of the principle of good governance.","(0.99, 0.99)",0.8153551038173115,0.9364,0.9230769230769232,0.9230769230769232,0.9230769180769232,0.8461538461538461,0.8461538461538461,0.8461538411538462,0.9230769230769232,0.9230769230769232,0.9230769180769232,0.99,0.99,en
"despite their image of danger, derivatives are usually used by asset managers as insurance.",til trods for deres ry for at være farlige bliver de normalt brugt af forvaltere af investeringer som en forsikring.,Replace Character,"desprte their image of danger, derivatives are usually used by asset managers as insurance.","(0.99, 0.99)",0.9306048591020996,0.9374,0.9285714285714286,0.9285714285714286,0.9285714235714286,0.9230769230769232,0.9230769230769232,0.9230769180769232,0.9285714285714286,0.9285714285714286,0.9285714235714286,0.99,0.99,en
"imagine you have spent some months building up a portfolio of shares in companies in which you are confident: they have good management, good prospects and they are good investments.","forestil dem, at de har brugt nogle måneder til at opbygge en aktieportefølje i selskaber, som de har tillid til, de bliver forvaltet godt, har gode udsigter, og er gode investeringer.",Add random word,"imagine you have spent some months building up a portfolio of shares in companies in which you are confident: they have good management, good peltry prospects and they are good investments.","(0.95, 0.99)",0.9219602423775934,0.9969,0.9583333333333334,1.0,0.9787233992575828,0.9333333333333332,0.9655172413793104,0.949152537374318,0.9583333333333334,1.0,0.9787233992575828,0.95,0.99,en
heavy-handedness - a prescription of how private sector managers should invest and where they should invest - will merely reduce returns to savers.,"strenge bestemmelser - foreskrivelse af, hvordan og hvor lederne i den private sektor bør investere - vil bare reducere sparernes udbytte.",Swap characters,heavy-handedness - a prescription of how private sector managers should invest and where they should invest - will mereyl reduce returns to savers.,"(0.99, 0.99)",0.8843865924896842,0.958,0.95,0.95,0.949999995,0.9047619047619048,0.9047619047619048,0.9047618997619048,0.95,0.95,0.949999995,0.99,0.99,en
we shall therefore vote cautiously on all amendments limiting recourse to excessively derivative instruments and we shall vote in favour of all amendments which limit the excessive concentration of assets within a single financial group.,"vi vil derfor forsigtigt stemme for alle de ændringsforslag, der begrænser en tilflugt til instrumenter, der allerede er alt for udvandede, og for de ændringsforslag, der begrænser den overdrevne koncentration af aktiver inden for den samme finansielle gruppe.",Replace Token with Random Word,we shall therefore vote cautiously on all amendments limiting recourse to excessively derivative instruments and we shall vote in favour of all amendments which limit monopolizer excessive concentration of assets within a single financial group.,"(0.95, 0.9)",0.9257518071011758,0.9721,0.9655172413793104,0.9655172413793104,0.9655172363793104,0.9375,0.9375,0.937499995,0.9655172413793104,0.9655172413793104,0.9655172363793104,0.95,0.9,en
"for years certain countries, including great britain, have been blocking harmonisation and turning their financial centres into tax havens.","i årevis har visse lande, heriblandt storbritannien, blokeret for denne harmonisering og omdannet deres finansielle områder til skatteparadiser.",Replace Character,"for years certain countries, including great britain, have been bhocking harmonisation and turning their financial centres into tax havens.","(0.95, 0.95)",0.8725129388059689,0.9541,0.9473684210526316,0.9473684210526316,0.9473684160526316,0.8888888888888888,0.8888888888888888,0.888888883888889,0.9473684210526316,0.9473684210526316,0.9473684160526316,0.95,0.95,en
we must put an end to this.,dette må have en ende.,Duplicate Token,we must put an end to this this.,"(0.95, 0.95)",0.7974259693549226,0.9799,1.0,1.0,0.999999995,0.8571428571428571,1.0,0.9230769181065088,1.0,1.0,0.999999995,0.95,0.95,en
this brings us to the two proposals for directives.,dette har fået os til at fremsætte to forslag til direktivet.,Remove Token,this brings us to the proposals for directives.,"(0.95, 0.95)",0.6580370064762462,0.9041,1.0,0.8888888888888888,0.9411764656055364,0.8571428571428571,0.75,0.7999999950222222,1.0,0.8888888888888888,0.9411764656055364,0.95,0.95,en
"mr president, this is a vital issue for europe.","hr. formand, dette er et afgørende spørgsmål for europa.",Add random word,"mr president, this nonassent is a vital issue for europe.","(0.85, 0.90)",0.7426141117870939,0.988,0.9,1.0,0.947368416066482,0.7777777777777778,0.875,0.823529406782007,0.9,1.0,0.947368416066482,0.85,0.90,en
the radical step taken by this report is to allow ucits to use over-the-counter derivatives.,"det drastiske skridt, som tages i denne betænkning, er at tillade investeringsinstitutter at bruge otc-derivater.",Remove Character,the radical step taken by this report is to allow ucits to use over-the-conter derivatives.,"(0.99, 0.95)",0.8371170098777919,0.9364,0.9285714285714286,0.9285714285714286,0.9285714235714286,0.8571428571428571,0.8571428571428571,0.8571428521428571,0.9285714285714286,0.9285714285714286,0.9285714235714286,0.99,0.95,en
the preparatory work has largely consisted of a viable balance between increasing the efficacy and growth of the european investment markets and preserving a sufficient level of protection for consumers who buy fund units.,"under det forberedende arbejde har man for størstedelens vedkommende fundet en funktionel ligevægt til at få forøget effektiviteten og væksten på det europæiske investeringsmarked, uden dog at slække på kravet om en tilstrækkelig beskyttelse af den forbruger, der køber andele i investeringsinstitutter.",Swap words,the preparatory work largely has consisted of a viable balance between increasing the efficacy and growth of the european investment markets and preserving a sufficient level of protection for consumers who buy fund units. ,"(0.99, 0.99)",0.9067658489656212,0.9993,0.9655172413793104,1.0,0.9824561353524162,0.8823529411764706,0.9090909090909092,0.8955223830608153,0.9310344827586208,0.9642857142857144,0.9473684160541708,0.99,0.99,en
"it is quite clear that when businesses can more easily have access to their own capital-based finances their financial structure will be more firmly based, and, thus, opportunities for growth and investment will also improve.","det er jo klart, at når virksomhederne lettere får finansieret deres aktivitet ud af egenkapitalen, er der en sundere grobund for en ligelig sammensætning af virksomheder, og således forbedres også vækst- og investeringsmulighederne.",Duplicate Token,"it is quite clear that when businesses can more easily have access to their own capital-based finances their financial structure structure will be more firmly based, and, thus, opportunities for growth and investment will also improve.","(0.99, 0.95)",0.9542969642914884,0.9974,1.0,1.0,0.999999995,0.9714285714285714,1.0,0.9855072413778618,1.0,1.0,0.999999995,0.99,0.95,en
"mr president, i see two problems with this morning' s debate.","hr. formand, jeg ser to problemer ved debatten her til formiddag.",Remove Token,"mr president, i see two problems with this morning' debate.","(0.95, 0.98)",0.8091067115702212,0.9335,1.0,0.9090909090909092,0.9523809473922904,0.8888888888888888,0.8,0.8421052581717452,1.0,0.9090909090909092,0.9523809473922904,0.95,0.98,en
"firstly, when i came to this parliament many years ago i was told that if you had a difficult job you gave it to a liberal.","for det første, da jeg kom i parlamentet for mange år siden, fik jeg at vide, at hvis man havde et vanskeligt job, så gav man det til en liberal.",Duplicate Token,"firstly, when i came to this parliament many years ago i was told that if you had a difficult job you gave it it to a liberal.","(0.98, 0.95)",0.9357893640502224,0.9963,1.0,1.0,0.999999995,0.9615384615384616,1.0,0.9803921518646674,1.0,1.0,0.999999995,0.98,0.95,en
