originalSentence,referenceSentence,tamperingType,tamperedSentence,"LLMScore (Sim, Con)",BLEU,METEOR,Rouge1 r,Rouge1 p,Rouge1 f,Rouge2 r,Rouge2 p,Rouge2 f,Rougel r,Rougel p,Rougel f,LLM-Sim,LLM-Con,originalLanguage
let us hope that the financial resources will match the declared ambitions.,"lad os håbe, at de finansielle ressourcer vil matche de erklærede ambitioner.",Swap characters,let us hope that the financial resources will match the delcared ambitions.,"(0.99, 1.00)",0.7910665071754358,0.9209,0.9090909090909092,0.9090909090909092,0.9090909040909092,0.8181818181818182,0.8181818181818182,0.8181818131818183,0.9090909090909092,0.9090909090909092,0.9090909040909092,0.99,1.00,en
the vote will take place on thursday at 11.30 a.m.,afstemningen finder sted torsdag kl. 11.30.,Remove Character,the vot will take place on thursday at 11.30 a.m.,"(0.95, 0.98)",0.8070557274927981,0.9055,0.9166666666666666,0.9166666666666666,0.9166666616666668,0.8181818181818182,0.8181818181818182,0.8181818131818183,0.9166666666666666,0.9166666666666666,0.9166666616666668,0.95,0.98,en
"we are all paying, and we all would like to see the amount of pollution reduced.","vi er alle med til at betale, og vi vil alle gerne se forureningen bragt ned.",Replace Character,"we are all paying, and we all would like to see the amount of pollutnon reduced.","(0.99, 0.99)",0.8578928092681435,0.9437,0.9285714285714286,0.9285714285714286,0.9285714235714286,0.8666666666666667,0.8666666666666667,0.8666666616666667,0.9285714285714286,0.9285714285714286,0.9285714235714286,0.99,0.99,en
"in implementing three fundamental aspects of sustainable development, it is evident that the stimulation of economic growth and the elimination of poverty, together with ensuring the protection of the environment, are the greatest challenges to the eu development cooperation policy.","gennemførelsen af tre fundamentale aspekter af bæredygtig udvikling viser tydeligt, at stimuleringen af økonomisk vækst og udryddelsen af fattigdom sammen med beskyttelse af miljøet er de største udfordringer, som eu's politik for udviklingssamarbejde står over for.",Remove Character,"in implementing three fundamental aspects of sustainable development, it is evident that the stimulation of econmic growth and the elimination of poverty, together with ensuring the protection of the environment, are the greatest challenges to the eu development cooperation policy.","(0.99, 1.00)",0.940028651976138,0.9772,0.96875,0.96875,0.968749995,0.9487179487179488,0.9487179487179488,0.9487179437179488,0.96875,0.96875,0.968749995,0.99,1.00,en
"in addition, it is essential to involve the civil society, ngos and women in finding solutions for the problems of sustainable development, and in invigorating social dialogue.","desuden har det stor betydning at få involveret civilsamfundet, ngo'er og kvinder i at finde løsninger på problemerne med bæredygtig udvikling og i at tilføre ny energi til den sociale dialog.",Add random word,"in addition, it is essential to involve the civil society, ngos and women in finding solutions for the problems of sustainable development, and in invigorating social dialogue paromoeon.","(0.95, 0.99)",0.943085631039478,0.9967,0.9583333333333334,1.0,0.9787233992575828,0.9629629629629628,1.0,0.9811320704734782,0.9583333333333334,1.0,0.9787233992575828,0.95,0.99,en
"this is something on which there have been a number of amendments, which i do not regard as crucial, for they all have the same end in mind, that of protecting workers' rights.","det er et punkt, som har været genstand for en række ændringsforslag, som jeg ikke anser for væsentlige, for de har alle samme formål, nemlig at beskytte arbejdstagernes rettigheder.",Negation,"this is something on which there have been a number of amendments, which i do regard as crucial, for they all have the same end in mind, that of protecting workers' rights.","(0.85, 0.95)",0.9299238452109287,0.9762,1.0,0.9666666666666668,0.9830508424590636,0.967741935483871,0.9375,0.952380947382212,1.0,0.9666666666666668,0.9830508424590636,0.85,0.95,en
i note that your report and associated resolution are based on article 192 of the treaty calling on the commission to submit a legislative proposal.,"jeg bemærker, at deres betænkning og det tilhørende beslutningsforslag er baseret på traktatens artikel 192, hvorved kommissionen opfordres til at fremlægge et forslag til lovgivning.",Duplicate Token,i note that your report and associated resolution are based on article 192 of of the treaty calling on the commission to submit a legislative proposal.,"(0.99, 0.99)",0.9306757101384976,0.9959,1.0,1.0,0.999999995,0.96,1.0,0.9795918317367764,1.0,1.0,0.999999995,0.99,0.99,en
"upon conclusion of the impact assessment, i will report back to you on its results and the policy conclusions we draw from it.","når konsekvensvurderingen er færdig, vil jeg vende tilbage til dem med de resultater og politiske konklusioner, vi udleder af den.",Remove Token,"upon conclusion of the impact assessment, i will report back to you on its results and policy conclusions we draw from it.","(1.00, 1.00)",0.8895260356363631,0.9616,1.0,1.0,0.999999995,0.9523809523809524,0.9090909090909092,0.9302325531422392,1.0,1.0,0.999999995,1.00,1.00,en
"i believe that he has done a good job, but i would like to point out a couple of problems that we have.","jeg synes, at han har gjort en god indsats, men jeg vil gerne påpege et par problemer, vi har.",Add random word,"i believe that he has done a good job, but i monocotyledonous would like to point out a couple of problems that we have.","(0.95, 0.99)",0.8958039312312598,0.9958,0.9523809523809524,1.0,0.9756097511005354,0.9130434782608696,0.9545454545454546,0.9333333283358024,0.9523809523809524,1.0,0.9756097511005354,0.95,0.99,en
i do not want people to say 'here you are standing there as a brit not wanting any capital requirement'.,"jeg ønsker ikke, at folk skal sige ""her står de som en brite, der ikke ønsker nogen kapitalkrav"".",Negation,i do want people to say 'here you are standing there as a brit wanting any capital requirement'.,"(0.95, 0.95)",0.7552498655792421,0.9159,1.0,0.9473684210526316,0.9729729679766254,0.8823529411764706,0.7894736842105263,0.8333333283487654,1.0,0.9473684210526316,0.9729729679766254,0.95,0.95,en
"and, make no mistake, the fact that shareholders could potentially lose eur 10 000, even if not paid in at the start, does add an extra tier of financial expectation.","og tag ikke fejl, det forhold, at aktionærerne potentielt kan miste 10.000 euro, selv om de ikke er indbetalt fra starten, tilføjer et ekstra lag af økonomiske forventninger.",Negation,"and, make no mistake, the fact that shareholders could potentially lose eur 10 000, even if paid in at the start, does add an extra tier of financial expectation.","(0.95, 0.95)",0.9234732618882052,0.9741,1.0,0.9655172413793104,0.9824561353524162,0.9642857142857144,0.9310344827586208,0.9473684160541708,1.0,0.9655172413793104,0.9824561353524162,0.95,0.95,en
"in a single market, size must not matter.",på det indre marked må størrelsen ikke være afgørende.,Negation,"in a single market, size must matter.","(0.05, 0.95)",0.7071067811865475,0.9041,1.0,0.875,0.9333333283555556,0.8333333333333334,0.7142857142857143,0.7692307642603551,1.0,0.875,0.9333333283555556,0.05,0.95,en
i would counsel you and the commission to please keep your ill-informed noses out of small businesses!,jeg vil råde dem og kommissionen til at holde deres uvidende snuder væk fra de små virksomheder!,Duplicate Token,i would counsel you and the the commission to please keep your ill-informed noses out of small businesses!,"(0.99, 0.99)",0.8981075993548011,0.9938,1.0,1.0,0.999999995,0.9411764705882352,1.0,0.9696969647015612,1.0,1.0,0.999999995,0.99,0.99,en
after that it should stand well back.,derefter bør de holde sig i baggrunden.,Swap words,after that it should well stand back. ,"(0.95, 0.95)",0.4417918226831577,0.9375,0.875,1.0,0.9333333283555556,0.4285714285714285,0.5,0.4615384565680473,0.75,0.8571428571428571,0.7999999950222222,0.95,0.95,en
"the uk has a huge, permanent and growing deficit with the eu.","det forenede kongerige har et kæmpestort, permanent og voksende underskud over for eu.",Swap words,"the uk has a huge, permanent and growing deficit the with eu. ","(0.99, 0.95)",0.7558187924350542,0.9883,0.9166666666666666,1.0,0.9565217341398866,0.6666666666666666,0.7272727272727273,0.6956521689224953,0.9166666666666666,1.0,0.9565217341398866,0.99,0.95,en
how many of you here have ever started a new business at your own risk?,hvor mange her har nogensinde startet en virksomhed for egen regning og risiko?,Duplicate Token,how many of you here have ever ever started a new business at your own risk?,"(0.99, 0.99)",0.8844489226418503,0.9928,1.0,1.0,0.999999995,0.9333333333333332,1.0,0.9655172363852556,1.0,1.0,0.999999995,0.99,0.99,en
"(pl) madam president, i should like to thank the rapporteur for a very sound and detailed report.",(pl) fru formand! jeg vil gerne takke ordføreren for en meget forsvarlig og detaljeret betænkning.,Duplicate Token,"(pl) madam president, i should like to thank the the rapporteur for a very sound and detailed report.","(0.99, 0.99)",0.9133997866119974,0.9948,1.0,1.0,0.999999995,0.9411764705882352,1.0,0.9696969647015612,1.0,1.0,0.999999995,0.99,0.99,en
"i ran my own business for 15 years, and employed some 100 people.",jeg drev min egen virksomhed i 15 år og havde omkring 100 ansatte.,Replace Character,"i ron my own business for 15 years, and employed some 100 people.","(0.99, 0.95)",0.8666415730847504,0.932,0.9230769230769232,0.9230769230769232,0.9230769180769232,0.8333333333333334,0.8333333333333334,0.8333333283333335,0.9230769230769232,0.9230769230769232,0.9230769180769232,0.99,0.95,en
we should learn from the experience gained when introducing the legal form for the european company on to the common market.,vi bør tage ved lære af erfaringerne med indførelsen af selskabsformen for det europæiske selskab på det fælles marked.,Swap words,we should learn from the experience gained when introducing the legal form for european the company on to the common market. ,"(0.98, 0.95)",0.8431006187347456,0.997,0.9473684210526316,1.0,0.9729729679766254,0.8095238095238095,0.85,0.8292682876859013,0.8947368421052632,0.9444444444444444,0.9189189139225714,0.98,0.95,en
"fourthly, a european private company would be a very useful instrument for the implementation of the lisbon strategy, which places great emphasis on eliminating obstacles to the development of european entrepreneurship.","for det fjerde kan det europæiske private selskab være et meget nyttigt instrument til gennemførelse af lissabon-strategien, hvor der lægges stor vægt på at fjerne hindringerne for udviklingen af en iværksætterkultur i europa.",Replace Token with Random Word,"fourthly, a european private company would be a very useful instrument for the implementation of the lisbon strategy, which places great emphasis on eliminating obstacles to elegancies development of european entrepreneurship.","(0.95, 0.95)",0.9210500207490828,0.9677,0.9629629629629628,1.0,0.9811320704734782,0.9333333333333332,0.9333333333333332,0.9333333283333336,0.9629629629629628,1.0,0.9811320704734782,0.95,0.95,en
these reasons alone justify supporting the development of a european private company statute.,disse grunde alene er tilstrækkelige til at retfærdiggøre udarbejdelsen af en statut for det europæiske private selskab.,Swap characters,these reasons alone justify supporting the development of a european private company stattue.,"(0.98, 0.95)",0.855526185871245,0.9269,0.9230769230769232,0.9230769230769232,0.9230769180769232,0.9166666666666666,0.9166666666666666,0.9166666616666668,0.9230769230769232,0.9230769230769232,0.9230769180769232,0.98,0.95,en
looking at the legal form of companies that operate across borders can make an important contribution to this.,"en gennemgang af den juridiske virksomhedsform for de virksomheder, der opererer på tværs af grænserne, kan være et vigtigt bidrag i denne henseende.",Replace Character,looking at the legal ferm of companies that operate across borders can make an important contribution to this.,"(0.99, 0.99)",0.8492326635760689,0.9467,0.9444444444444444,0.9444444444444444,0.9444444394444445,0.8823529411764706,0.8823529411764706,0.8823529361764706,0.9444444444444444,0.9444444444444444,0.9444444394444445,0.99,0.99,en
"firstly, because the adoption of this statute will help remove one of the obstacles to smes' mobility.",for det første vil vedtagelsen af statutten bidrage til at fjerne en af forhindringerne for små og mellemstore virksomheders bevægelighed.,Replace Character,"firstly, because the adoption of this statute will help remove onj of the obstacles to smes' mobility.","(0.98, 0.99)",0.8578928092681435,0.9494,0.9333333333333332,0.9333333333333332,0.9333333283333336,0.875,0.875,0.874999995,0.9333333333333332,0.9333333333333332,0.9333333283333336,0.98,0.99,en
"i am therefore in favour of mr lehne's report, with one exception: its recommendation 7.","jeg støtter således hr. lehnes betænkning, dog med en enkelt undtagelse, nemlig henstilling 7.",Remove Token,"i am therefore in favour of mr lehne's report, one exception: its recommendation 7.","(0.95, 0.95)",0.8492326635760689,0.9517,1.0,0.9333333333333332,0.9655172363852556,0.9230769230769232,0.8571428571428571,0.8888888838957477,1.0,0.9333333333333332,0.9655172363852556,0.95,0.95,en
"with regard to the first point, the greater the geographical area covered by this agreement on government procurement the more valid it is.","hvad angår det første punkt, er denne aftale om offentlige indkøb mere værd, jo større et geografisk område den dækker.",Remove Token,"with regard to the first point, the greater the geographical area covered by this agreement government procurement the more valid it is.","(0.95, 0.98)",0.8895260356363631,0.9636,1.0,0.95,0.9743589693622616,0.9523809523809524,0.9090909090909092,0.9302325531422392,1.0,0.95,0.9743589693622616,0.95,0.98,en
the union's trade policy is geared towards greater opening up of all aspects of the international markets.,"den vej, som eu skal følge i sin handelspolitik, er en større åbning af de internationale markeder i alle henseender.",Add random word,the union's trade policy is geared towards greater opening up of all aspects o of the international markets.,"(0.99, 0.99)",0.8606031405392816,0.9942,0.9375,1.0,0.967741930489074,0.8823529411764706,0.9375,0.9090909040955004,0.9375,1.0,0.967741930489074,0.99,0.99,en
"madam president, the issue of the renegotiation of the wto government procurement agreement, known as the gpa, is important for europe as it should provide our companies with future opportunities outside the community.","fru formand! spørgsmålet om genforhandlingen af wto-aftalen om offentlige indkøb, kendt under betegnelsen gpa, er vigtig for europa, eftersom den bør give vores virksomheder flere muligheder uden for fællesskabet fremover.",Swap words,"madam president, the issue the of renegotiation of the wto government procurement agreement, known as the gpa, is important for europe as it should provide our companies with future opportunities outside the community. ","(0.99, 0.99)",0.9122335536579608,0.9994,0.9642857142857144,1.0,0.9818181768198349,0.8787878787878788,0.935483870967742,0.9062499950048828,0.9642857142857144,1.0,0.9818181768198349,0.99,0.99,en
we all want to see improved access for our companies to foreign countries' procurement markets.,"vi ønsker alle, at vores virksomheder skal have bedre adgang til markederne for offentlige indkøb i andre lande.",Swap characters,we all want to see improved access for our companies to foreign countries' procuremetn markets.,"(0.99, 0.99)",0.848219861937046,0.9403,0.9285714285714286,0.9285714285714286,0.9285714235714286,0.8571428571428571,0.8571428571428571,0.8571428521428571,0.9285714285714286,0.9285714285714286,0.9285714235714286,0.99,0.99,en
"on the prospects of extending the geographical scope of the agreement, eight wto members are in the process of acceding to it.",med hensyn til udsigten til at udvide aftalens geografiske dækningsområde er otte wto-medlemmer på vej til at tiltræde den.,Duplicate Token,"on the prospects of of extending the geographical scope of the agreement, eight wto members are in the process of acceding to it.","(1.00, 1.00)",0.9246707643923312,0.9956,1.0,1.0,0.999999995,0.9545454545454546,1.0,0.976744181049216,1.0,1.0,0.999999995,1.00,1.00,en
we need to put right this imbalance by obtaining a derogation on public procurement that favours european smes.,"der bør rådes bod på ubalancen ved at sikre, at små og mellemstore europæiske virksomheder opnår dispensation, hvad angår offentlige indkøb.",Duplicate Token,we need to put right this imbalance by obtaining a derogation on public procurement procurement that favours european smes.,"(1.00, 1.00)",0.903778850827967,0.9942,1.0,1.0,0.999999995,0.9444444444444444,1.0,0.9714285664326532,1.0,1.0,0.999999995,1.00,1.00,en
"it is not part of his portfolio, but does he consider that it is also worthwhile renegotiating the telecoms agreement, which is also ten years old this year?","det er ikke en del af hans ansvarsområde, men mener han, at det også kan betale sig at genforhandle telekommunikationsaftalen, som også fylder 10 år i år?",Negation,"it is part of his portfolio, but does he consider that it is also worthwhile renegotiating the telecoms agreement, which is also ten years old this year?","(0.85, 0.95)",0.922122069382768,0.9707,1.0,0.9583333333333334,0.9787233992575828,0.9583333333333334,0.92,0.9387755052061642,1.0,0.9583333333333334,0.9787233992575828,0.85,0.95,en
"with regard to the agreement on government procurement - which mr audy mentioned - we are very concerned about smes, because we know by experience that they are definitely having much more difficulty in accessing international markets.","med hensyn til aftalen om offentlige indkøb - som hr. audy nævnte - er vi meget bekymrede for smv'erne, for vi ved af erfaring, at de helt klart har sværere ved at få adgang til de internationale markeder.",Remove Character,"with regard to the agreement on government procurement - which mr audy mentioned - we are very concerned about smes, because we know by experience that they are definitely having much more dificulty in accessing international markets.","(0.99, 0.99)",0.931838481115484,0.9743,0.9705882352941176,0.9705882352941176,0.9705882302941176,0.9444444444444444,0.9444444444444444,0.9444444394444445,0.9705882352941176,0.9705882352941176,0.9705882302941176,0.99,0.99,en
"as far as our chinese partners are concerned, there are two sides to this coin, and it seems to me that we should also take into account the specific challenges that exist for the european market in this area.","der er to sider af denne sag i forhold til vores kinesiske partnere, og jeg mener, at vi også bør tage hensyn til de særlige udfordringer for det europæiske marked på dette område.",Remove Token,"as far as our chinese partners are concerned, there are two sides to this coin, and it seems to me that we should also take into account the specific challenges that for the european market in this area.","(0.98, 0.99)",0.9370011451812968,0.9785,1.0,0.9696969696969696,0.984615379616568,0.972972972972973,0.9473684210526316,0.9599999950008888,1.0,0.9696969696969696,0.984615379616568,0.98,0.99,en
it is very good to see you in the chair.,det er virkelig godt at se dem i formandsstolen.,Swap characters,it is very godo to see you in the chair.,"(0.99, 0.99)",0.7016879391277372,0.9055,0.9,0.9,0.899999995,0.7777777777777778,0.7777777777777778,0.7777777727777778,0.9,0.9,0.899999995,0.99,0.99,en
guaranteeing better access to public procurement contracts for innovative small and medium-sized enterprises is essential.,det er vigtigt at sikre innovative små og mellemstore virksomheder bedre adgang til offentlige indkøbskontrakter.,Remove Character,guaranteeing better access to public procurement contracts for innovative small and medium-sized entrprises is essential.,"(1.00, 1.00)",0.8153551038173115,0.9364,0.9333333333333332,0.9333333333333332,0.9333333283333336,0.8571428571428571,0.8571428571428571,0.8571428521428571,0.9333333333333332,0.9333333333333332,0.9333333283333336,1.00,1.00,en
china has now been giving consideration to the possibility of joining them.,kina overvejer nu muligheden af at slutte sig til dem.,Replace Token with Random Word,china has now been giving consideration to the condone of joining them.,"(0.70, 0.90)",0.7611606003349892,0.9209,0.9166666666666666,0.9166666666666666,0.9166666616666668,0.8181818181818182,0.8181818181818182,0.8181818131818183,0.9166666666666666,0.9166666666666666,0.9166666616666668,0.70,0.90,en
how many thousands of pages did it add to the mountain of legislation?,hvor mange tusind sider føjede man ikke til bjerget af lovgivning?,Replace Token with Random Word,unverificative many thousands of pages did it add to the mountain of legislation?,"(0.95, 0.95)",0.9193227152249184,0.9284,0.9166666666666666,0.9166666666666666,0.9166666616666668,0.9166666666666666,0.9166666666666666,0.9166666616666668,0.9166666666666666,0.9166666666666666,0.9166666616666668,0.95,0.95,en
"mr president, i should like to congratulate you on your appointment.",(en) hr. formand! jeg vil gerne ønske dem tillykke med deres udnævnelse.,Replace Character,"mr president, i should like mo congratulate you on your appointment.","(0.99, 0.99)",0.7611606003349892,0.9209,0.9090909090909092,0.9090909090909092,0.9090909040909092,0.8,0.8,0.7999999950000002,0.9090909090909092,0.9090909090909092,0.9090909040909092,0.99,0.99,en
it should in theory reduce government costs and increase transparency in government procurement and therefore cut out corruption.,dette burde i teorien reducere de offentlige udgifter og skabe større åbenhed inden for offentlige indkøb og derfor begrænse korruptionen.,Replace Token with Random Word,it should in theory reduce government costs and increase transparency in trichonosis procurement and therefore cut out corruption.,"(0.85, 0.95)",0.8492326635760689,0.9422,0.9375,1.0,0.967741930489074,0.8823529411764706,0.8823529411764706,0.8823529361764706,0.9375,1.0,0.967741930489074,0.85,0.95,en
it is clear that the african countries and other ldcs feel that the costs potentially outweigh the benefits of signing up to this agreement.,"det er klart, at de afrikanske lande og andre mindre udviklede lande føler, at omkostningerne er større end fordelene ved at underskrive denne aftale.",Remove Token,it is clear that the african countries and other ldcs feel that the costs outweigh the benefits of signing up to this agreement.,"(0.95, 0.95)",0.8895260356363631,0.9636,1.0,0.9523809523809524,0.9756097511005354,0.9523809523809524,0.9090909090909092,0.9302325531422392,1.0,0.9523809523809524,0.9756097511005354,0.95,0.95,en
"on the one hand i can see the advantage of opening up public procurement, but it is fraught with dangers and i hope the commission will examine these issues.","på den ene side kan jeg se fordelene ved at åbne de offentlige indkøb, men der findes mange risici, og jeg håber, at kommissionen vil undersøge disse spørgsmål.",Swap words,"on the one hand i can see the advantage of opening up public procurement, but it is fraught with dangers and i the hope commission will examine these issues. ","(0.99, 0.99)",0.8934877060849065,0.9989,0.9629629629629628,1.0,0.9811320704734782,0.8620689655172413,0.8928571428571429,0.8771929774576792,0.9629629629629628,1.0,0.9811320704734782,0.99,0.99,en
"the wto agreement is actually generally positive, as it is anti-protectionist, but it forbids measures which are needed to help small businesses.","wto-aftalen er faktisk hovedsagelig positiv, fordi den er anti-protektionistisk, men den forhindrer foranstaltninger, der er nødvendige for at hjælpe de små virksomheder.",Swap words,"the wto agreement is actually generally positive, as it is anti-protectionist, but it forbids measures are which needed to help small businesses. ","(0.98, 0.95)",0.8645000338766944,0.998,0.9523809523809524,1.0,0.9756097511005354,0.8181818181818182,0.8571428571428571,0.8372092973282856,0.9047619047619048,0.95,0.9268292632956572,0.98,0.95,en
"so while some member states want an opt-out, others rightly fear that this would increase protectionism.","så mens nogle medlemsstater ønsker at trække sig ud, frygter andre med rette, at dette vil forøge protektionismen.",Replace Token with Random Word,"so while some member owerword want an opt-out, others rightly fear that this would increase protectionism.","(0.98, 0.95)",0.8394327083733336,0.9437,0.9375,0.9375,0.937499995,0.8666666666666667,0.8666666666666667,0.8666666616666667,0.9375,0.9375,0.937499995,0.98,0.95,en
"i was rapporteur in this house on the reform of contracts, supplies and services, in this case directives 17 and 18.","jeg var parlamentets ordfører vedrørende reformen af kontrakter, leverancer og tjenesteydelser i forbindelse med direktiv 17 og 18.",Remove Character,"i was rapporteur in this house on the reform of contracts, supplies and services, in this case diretives 17 and 18.","(1.00, 1.00)",0.8843865924896842,0.958,0.9444444444444444,0.9444444444444444,0.9444444394444445,0.8947368421052632,0.8947368421052632,0.8947368371052632,0.9444444444444444,0.9444444444444444,0.9444444394444445,1.00,1.00,en
