originalSentence,referenceSentence,tamperingType,tamperedSentence,"LLMScore (Sim, Con)",BLEU,METEOR,Rouge1 r,Rouge1 p,Rouge1 f,Rouge2 r,Rouge2 p,Rouge2 f,Rougel r,Rougel p,Rougel f,LLM-Sim,LLM-Con,originalLanguage
de har udtrykt ønske om en debat om dette emne i løbet af mødeperioden.,"you have requested a debate on this subject in the course of the next few days, during this part-session.",Duplicate Token,de har udtrykt ønske om en debat om dette emne i løbet løbet af mødeperioden.,-1,0.8761151623788772,0.9922,1.0,1.0,0.999999995,0.9285714285714286,1.0,0.9629629579698218,1.0,1.0,0.999999995,NULL,NULL,da
jeg opfordrer dem til stående at iagttage et minuts stilhed.,"please rise, then, for this minute' s silence.",Duplicate Token,jeg opfordrer dem til stående at iagttage iagttage et minuts stilhed.,-1,0.8250796367302369,0.988,1.0,1.0,0.999999995,0.9,1.0,0.9473684160664821,1.0,1.0,0.999999995,NULL,NULL,da
(parlamentet iagttog stående et minuts stilhed,(the house rose and observed a minute' s silence),Duplicate character,(parlamentet iagttog ståeende et minuts stilhed,-1,8.44484326442819e-78,0.8413,0.8333333333333334,0.8333333333333334,0.8333333283333335,0.6,0.6,0.5999999950000001,0.8333333333333334,0.8333333333333334,0.8333333283333335,NULL,NULL,da
"alt dette er i tråd med de principper, vi altid har været tilhængere af.",this is all in accordance with the principles that we have always upheld.,Duplicate character,"alt dette err i tråd med de principper, vi altid har været tilhængere af.",-1,0.8371170098777919,0.9364,0.9285714285714286,0.9285714285714286,0.9285714235714286,0.8461538461538461,0.8461538461538461,0.8461538411538462,0.9285714285714286,0.9285714285714286,0.9285714235714286,NULL,NULL,da
"fru formand, jeg vil gerne først give dem en kompliment for den kendsgerning, at de har holdt deres ord, og at antallet af tv-kanaler på vores kontorer faktisk er udvidet enormt nu i denne første mødeperiode i det nye år.","madam president, i would firstly like to compliment you on the fact that you have kept your word and that, during this first part-session of the new year, the number of television channels in our offices has indeed increased considerably.",Duplicate Token,"fru formand, jeg vil gerne først give dem en kompliment for den kendsgerning, at de har holdt deres ord, og at at antallet af tv-kanaler på vores kontorer faktisk er udvidet enormt nu i denne første mødeperiode i det nye år.",-1,0.9595851092834937,0.9974,1.0,1.0,0.999999995,0.975,1.0,0.9873417671526998,1.0,1.0,0.999999995,NULL,NULL,da
"jeg vil således endnu en gang anmode dem om alligevel at sørge for, at vi også får en nederlandsk kanal.",i would therefore once more ask you to ensure that we get a dutch channel as well.,Duplicate character,"jeg vil således endnu en gaang anmode dem om alligevel at sørge for, at vi også får en nederlandsk kanal.",-1,0.8725129388059689,0.9541,0.9444444444444444,0.9444444444444444,0.9444444394444445,0.8947368421052632,0.8947368421052632,0.8947368371052632,0.9444444444444444,0.9444444444444444,0.9444444394444445,NULL,NULL,da
"det vil, håber jeg, blive behandlet i en positiv ånd.","it will, i hope, be examined in a positive light.",Swap words,"det vil, håber jeg, blive behandlet i en ånd. positiv ",-1,0.8070557274927981,0.9939,1.0,1.0,0.999999995,0.7777777777777778,0.7777777777777778,0.7777777727777778,1.0,1.0,0.999999995,NULL,NULL,da
"hvorfor er der ikke foretaget en undersøgelse af luftkvaliteten i denne bygning, siden vi blev valgt?",why has no air quality test been done on this particular building since we were elected?,Negation,"hvorfor er der foretaget en undersøgelse af luftkvaliteten i denne bygning, siden vi blev valgt?",-1,0.8394327083733336,0.9489,1.0,0.9375,0.967741930489074,0.9285714285714286,0.8666666666666667,0.8965517191438764,1.0,0.9375,0.967741930489074,NULL,NULL,da
vi havde en udførlig debat på formandskonferencen.,"in the conference of presidents, we had an in-depth discussion.",Swap characters,vi havde en udførlig debat på foramndskonferencen.,-1,0.7071067811865475,0.8648,0.8571428571428571,0.8571428571428571,0.8571428521428571,0.8333333333333334,0.8333333333333334,0.8333333283333335,0.8571428571428571,0.8571428571428571,0.8571428521428571,NULL,NULL,da
"kun deres gruppe repræsenterede det, som de siger nu.",your group was alone in advocating what you are saying now.,Duplicate Token,"kun deres gruppe repræsenterede det, som de siger nu nu.",-1,0.8574969146885869,0.988,1.0,1.0,0.999999995,0.8888888888888888,1.0,0.9411764656055364,1.0,1.0,0.999999995,NULL,NULL,da
"hver ordfører har jo lige så mange stemmer, som der er medlemmer i gruppen.","as you know, each chairman has the same number of votes as his group has members.",Swap words,"hver ordfører har jo lige så mange stemmer, der som er medlemmer i gruppen. ",-1,0.7700645773757425,0.9922,0.9333333333333333,1.0,0.9655172363852557,0.7142857142857143,0.7692307692307693,0.7407407357475996,0.8666666666666667,0.9285714285714286,0.8965517191438764,NULL,NULL,da
"ppe-de-gruppen ønsker, at dette punkt tages af dagsordenen.",the ppe-de group is requesting that this item be taken off the agenda.,Swap characters,"ppe-de-gruppen ønsker, at dette upnkt tages af dagsordenen.",-1,0.6580370064762462,0.8951,0.875,0.875,0.874999995,0.7142857142857143,0.7142857142857143,0.7142857092857143,0.875,0.875,0.874999995,NULL,NULL,da
"jeg ved ikke, om denne oplysning er rigtig, men ppe-de-gruppen ville i hvert fald være taknemmelig, hvis dette punkt blev annulleret, fordi parlamentet allerede har beskæftiget sig med dette spørgsmål flere gange.","i do not know whether this information is correct, but the ppe-de group would, in any case, be grateful if this item were removed because parliament has addressed this issue several times already.",Negation,"jeg ved, om denne oplysning er rigtig, men ppe-de-gruppen ville i hvert fald være taknemmelig, hvis dette punkt blev annulleret, fordi parlamentet allerede har beskæftiget sig med dette spørgsmål flere gange.",-1,0.9355359393782814,0.9755,0.9666666666666667,0.9354838709677419,0.9508196671324913,0.9333333333333333,0.9032258064516129,0.9180327818865898,0.9666666666666667,0.9354838709677419,0.9508196671324913,NULL,NULL,da
"for et øjeblik siden belærte han socialdemokraterne, fordi de ville ændre en klar beslutning truffet på formandskonferencen. imidlertid gør han det samme.","he has just been preaching to the group of the party of european socialists because they went back on a decision taken in a perfectly clear manner at the conference of presidents, and now he is doing just the same.",Duplicate character,"for et øjeblik siden belærte han socialdemokraterne, fordi de ville ændre en klar beslutning truffet på formandskonnferencen. imidlertid gør han det samme.",-1,0.8895260356363631,0.9597,0.9523809523809523,0.9523809523809523,0.9523809473809525,0.9047619047619048,0.9047619047619048,0.9047618997619049,0.9523809523809523,0.9523809523809523,0.9523809473809525,NULL,NULL,da
selvfølgelig vil protokollen for mødet i morgen tage hensyn til alle de supplerende forklaringer.,"of course, the minutes for tomorrow' s sitting will take into account any additional explanations.",Swap characters,selvfølgelig vil protokollen for mødet i morgen tage hensyn til alle de spuplerende forklaringer.,-1,0.8242367502646054,0.932,0.9285714285714286,0.9285714285714286,0.9285714235714286,0.8461538461538461,0.8461538461538461,0.8461538411538462,0.9285714285714286,0.9285714285714286,0.9285714235714286,NULL,NULL,da
vi vil derfor være meget opmærksomme på udarbejdelsen af protokollen.,"we shall pay particular attention to the wording of the minutes, as we always do, of course.",Duplicate character,vi vil derfor være meget opmærksomme på uudarbejdelsen af protokollen.,-1,0.7016879391277372,0.9055,0.9,0.9,0.899999995,0.7777777777777778,0.7777777777777778,0.7777777727777778,0.9,0.9,0.899999995,NULL,NULL,da
jeg beder om deres godkendelse.,i would urge you to endorse this.,Add random word,jeg serviet beder om deres godkendelse.,-1,0.6731821382417487,0.9654,0.8333333333333334,1.0,0.9090909041322315,0.6,0.75,0.6666666617283951,0.8333333333333334,1.0,0.9090909041322315,NULL,NULL,da
"jeg vil gerne komme ind på et sidste punkt: vi må ikke nøjes med at lukke endnu et hul i sikkerhedsnettet og lukke øjnene for, at der stadig er meget mere at gøre i forbindelse med temaet trafiksikkerhed i europa.","i should like to address one final point. we must not content ourselves with sealing another hole in the safety net and shutting our eyes to the fact that, where transport safety in europe is concerned, there is still much more to be done.",Negation,"jeg vil gerne komme ind på et sidste punkt: vi må nøjes med at lukke endnu et hul i sikkerhedsnettet og lukke øjnene for, at der stadig er meget mere at gøre i forbindelse med temaet trafiksikkerhed i europa.",-1,0.9385522307631307,0.979,1.0,0.9696969696969697,0.9846153796165681,0.9736842105263158,0.9487179487179487,0.9610389560398045,1.0,0.9696969696969697,0.9846153796165681,NULL,NULL,da
"betydningen af sikkerhed på veje, jernbaner eller indre vandveje er naturligvis meget stor, og i betragtning af denne transports internationale karakter skal uddannelserne til sikkerhedsrådgivere således også harmoniseres, ligesom kravene i f.eks. den kommende, nye adr-konvention.","needless to say, safety on roads, railways and inland waterways is of key importance and, given the international nature of these types of transport, training for safety advisors should also be harmonised, therefore, as well as the requirements of the new adr, for example, which is under way.",Add random word,"betydningen af sikkerhed på veje, jernbaner eller indre vandveje er naturligvis meget stor, og i betragtning af denne transports krans internationale karakter skal uddannelserne til sikkerhedsrådgivere således også harmoniseres, ligesom kravene i f.eks . den kommende, nye adr-konvention.",-1,0.9391156189585852,0.9976,0.9722222222222222,1.0,0.9859154879587383,0.9459459459459459,0.9722222222222222,0.9589041045899794,0.9722222222222222,1.0,0.9859154879587383,NULL,NULL,da
"det er vigtigt, men det er håndhævelse også, og der er naturligvis en række grunde til, at vi må lægge særlig vægt på dette.","this is important, but so is enforcement and there are, of course, a number of reasons why we need to pay particular attention to this.",Add random word,"det er vigtigt, men det er håndhævelse også, og der er naturligvis en række grunde til, at vi må spore lægge særlig vægt på dette.",-1,0.9074485692010054,0.9963,0.9545454545454546,1.0,0.9767441810492159,0.9130434782608695,0.9545454545454546,0.9333333283358024,0.9545454545454546,1.0,0.9767441810492159,NULL,NULL,da
"eller fragtførere med skibe fra østeuropa, som ligger ved siden af fragtførere her, og hvis farlige situationer kun er alt for tydelige.","or ships from eastern europe which moor adjacent to ships over here, with all the obvious risks that this entails.",Swap characters,"eller fragtførere med skibe fra østeuropa, som ligger ved siden af fragtførere her, og hvis farlgie situationer kun er alt for tydelige.",-1,0.8895260356363631,0.9597,0.9523809523809523,0.9523809523809523,0.9523809473809525,0.9047619047619048,0.9047619047619048,0.9047618997619049,0.9523809523809523,0.9523809523809523,0.9523809473809525,NULL,NULL,da
"arbejdet er der, nu mangler vi bare håndhævelsen.",the work is done. all that remains is the business of enforcement.,Replace Token with Random Word,"arbejdet er der, nu mangler vi bare muræne.",-1,0.7825422900366437,0.8951,0.875,0.875,0.874999995,0.8571428571428571,0.8571428571428571,0.8571428521428571,0.875,0.875,0.874999995,NULL,NULL,da
"det glæder mig, at der også er enighed med rådet om minimumsnormer for deres eksamen, selvom jeg hellere ville have haft, at der var fastlagt ensartede, faste normer og dele, således at eksamensbeviser ville være ens på internationalt plan.","i am very pleased that agreement has also been reached with the council on minimum standards regarding examinations, although i would have preferred it if uniform, set standards and modules had been established, so that certificates would be of equal value internationally.",Replace Character,"det glæder mig, ct der også er enighed med rådet om minimumsnormer for deres eksamen, selvom jeg hellere ville have haft, at der var fastlagt ensartede, faste normer og dele, således at eksamensbeviser ville være ens på internationalt plan.",-1,0.9414356817218077,0.9777,0.9722222222222222,1.0,0.9859154879587383,0.9473684210526315,0.972972972972973,0.9599999950008888,0.9722222222222222,1.0,0.9859154879587383,NULL,NULL,da
jeg vil kun komme med få bemærkninger.,i should like to make just a few comments.,Replace Token with Random Word,jeg vil kun komme merian få bemærkninger.,-1,0.5,0.8648,0.8571428571428571,0.8571428571428571,0.8571428521428571,0.6666666666666666,0.6666666666666666,0.6666666616666668,0.8571428571428571,0.8571428571428571,0.8571428521428571,NULL,NULL,da
"jeg er principielt af den opfattelse, at vi på mange trafikområder bør tilstræbe øget fleksibilitet og bestemmelser for de enkelte lande.","in principle, i believe that in many cases where transport is concerned we should be working towards increased flexibility and country-specific rules.",Duplicate character,"jeg er principielt af den opfattelse, at vi på mange trafikområder bør ttilstræbe øget fleksibilitet og bestemmelser for de enkelte lande.",-1,0.8787419089273848,0.9562,0.9523809523809523,0.9523809523809523,0.9523809473809525,0.9,0.9,0.899999995,0.9523809523809523,0.9523809523809523,0.9523809473809525,NULL,NULL,da
især kan bilag ikke tilpasses i overensstemmelse med den tekniske og industrielle udvikling.,"in particular, annexes cannot be adapted to take account of technical and industrial developments.",Negation,især kan bilag tilpasses i overensstemmelse med den tekniske og industrielle udvikling.,-1,0.7825422900366437,0.9335,1.0,0.9230769230769231,0.959999995008,0.9090909090909091,0.8333333333333334,0.8695652124007562,1.0,0.9230769230769231,0.959999995008,NULL,NULL,da
"jeg beklager dette, for vi skal være aktive, fordi andre ikke har gjort deres arbejde.",i regret this since we are having to take action because others have not done their job.,Negation,"jeg beklager dette, for vi skal være aktive, fordi andre har gjort deres arbejde.",-1,0.8394327083733336,0.9489,1.0,0.9333333333333333,0.9655172363852557,0.9230769230769231,0.8571428571428571,0.8888888838957477,1.0,0.9333333333333333,0.9655172363852557,NULL,NULL,da
"det forslag, som står til diskussion i dag, om en ændring af direktivet om transport af farligt gods ad vej stammer imidlertid fra maj 1999 og kunne således ikke tage højde for den aktuelle komitologiprocedure (forskriftsprocedure).","the proposal to be discussed today, to amend the directive on the transport of dangerous goods by road, dates from may 1999, however, and could not therefore take account of the latest comitology procedure.",Negation,"det forslag, som står til diskussion i dag, om en ændring af direktivet om transport af farligt gods ad vej stammer imidlertid fra maj 1999 og kunne således tage højde for den aktuelle komitologiprocedure (forskriftsprocedure).",-1,0.9353695731020621,0.9779,1.0,0.9705882352941176,0.9850746218667855,0.9705882352941176,0.9428571428571428,0.9565217341314851,1.0,0.9705882352941176,0.9850746218667855,NULL,NULL,da
dette direktiv er et bidrag hertil.,this directive is a contribution to this.,Remove Token,dette direktiv er et hertil.,-1,0.488923022434901,0.8535,1.0,0.8333333333333334,0.9090909041322315,0.75,0.6,0.6666666617283951,1.0,0.8333333333333334,0.9090909041322315,NULL,NULL,da
"hr. formand, den betænkning, som vi behandler her, medfører i sig selv ingen store forandringer.","mr president, the report we are discussing here does not, in itself, entail any major changes.",Replace Token with Random Word,"hr . formand, den betænkning, patrulje vi behandler her, medfører i sig selv ingen store forandringer.",-1,0.8578928092681435,0.9494,0.9333333333333333,0.9333333333333333,0.9333333283333335,0.8571428571428571,0.8571428571428571,0.8571428521428571,0.9333333333333333,0.9333333333333333,0.9333333283333335,NULL,NULL,da
på flere og flere områder indfører vi fælles minimumsregler for medlemslandene.,"in area after area, we are now obtaining common minimum regulations for the member states.",Swap characters,på flere og flere områder indføerr vi fælles minimumsregler for medlemslandene.,-1,0.7348889200874658,0.9139,0.9,0.9,0.899999995,0.8,0.8,0.7999999950000002,0.9,0.9,0.899999995,NULL,NULL,da
"det er meget positivt, og det giver anledning til at takke ordføreren, koch, for det arbejde, som han har udført.","this is extraordinarily positive, and there is cause to thank the rapporteur, mr koch, for the work he has put in on this issue.",Remove Character,"det er meget positivt, og det giver anledning til at akke ordføreren, koch, for det arbejde, som han har udført.",-1,0.8895260356363631,0.9597,0.9444444444444444,0.9444444444444444,0.9444444394444445,0.8947368421052632,0.8947368421052632,0.8947368371052632,0.9444444444444444,0.9444444444444444,0.9444444394444445,NULL,NULL,da
forudsætningerne er forskellige fra medlemsland til medlemsland.,"in many ways, the prerequisites differ from one member state to another.",Swap characters,forudsætningrene er forskellige fra medlemsland til medlemsland.,-1,0.8408964152537145,0.8737,0.8333333333333334,0.8333333333333334,0.8333333283333335,0.8333333333333334,0.8333333333333334,0.8333333283333335,0.8333333333333334,0.8333333333333334,0.8333333283333335,NULL,NULL,da
"næste punkt på dagsordenen er betænkning (a5-0108/1999) af schroedter for udvalget om regionalpolitik, transport og turisme om meddelelse fra kommissionen om strukturfondene og deres samordning med samhørighedsfonden - retningslinjer for programmer for perioden 2000-2006 (kom(1999)344 - c5-0122/1999 - 1999/2127(cos)).","the next item is the report (a5-0108/1999) by mrs schroedter, on behalf of the committee on regional policy, transport and tourism, on the communication from the commission in the field of the structural funds and their coordination with the cohesion fund: guidelines for programmes in the period 2000-2006 [com(1999)344 - c5-0122/1999 - 1999/2127(cos)].",Swap characters,"næste punkt på dagsordenen er betænkning (a5-0108/1999) af schroedter for udvalget om regionalpolitik, transport og turisme om emddelelse fra kommissionen om strukturfondene og deres samordning med samhørighedsfonden - retningslinjer for programmer for perioden 2000-2006 (kom(1999)344 - c5-0122/1999 - 1999/2127(cos)).",-1,0.9496952283401919,0.9807,0.96875,0.96875,0.968749995,0.9473684210526315,0.9473684210526315,0.9473684160526316,0.96875,0.96875,0.968749995,NULL,NULL,da
"en stor del af wales har, som mange ved, opnået status som mål 1-område under programmet om strukturfondene.","a major part of wales, as you know, has been granted objective 1 status under the structural funds programme.",Duplicate Token,"en stor stor del af wales har, som mange ved, opnået status som mål 1-område under programmet om strukturfondene.",-1,0.9273488558828634,0.9948,1.0,1.0,0.999999995,0.9444444444444444,1.0,0.9714285664326531,1.0,1.0,0.999999995,NULL,NULL,da
"vi er utilfredse med, at tallene på en eller anden måde har været skjult i tallene for det forenede kongerige.",we are dissatisfied with the fact that those figures seem to have been in some way hidden within uk figures.,Replace Character,"vi er utilfredse med, at tallene på en eller anden måde har været skjult i tallene fob det forenede kongerige.",-1,0.8725129388059689,0.9541,0.9473684210526315,0.9473684210526315,0.9473684160526316,0.8947368421052632,0.8947368421052632,0.8947368371052632,0.9473684210526315,0.9473684210526315,0.9473684160526316,NULL,NULL,da
"alt for meget af det, der foregår i parlamentet, er uigennemsigtigt.",too much of what takes place within this parliament is not transparent.,Replace Token with Random Word,"alt for meget af det, der foregår klore parlamentet, er uigennemsigtigt.",-1,0.7825422900366437,0.9269,0.9090909090909091,0.9090909090909091,0.9090909040909091,0.8,0.8,0.7999999950000002,0.9090909090909091,0.9090909090909091,0.9090909040909091,NULL,NULL,da
"ændringsforslagene afspejler også parlamentets opfattelse af, at social udstødelse er et alvorligt spørgsmål, der bør behandles konstruktivt.",these amendments also fit in with this parliament's view that social exclusion is a serious issue needing constructive action.,Duplicate Token,"ændringsforslagene afspejler også parlamentets opfattelse af, at social udstødelse er et alvorligt spørgsmål, der bør behandles behandles konstruktivt.",-1,0.9088452973719151,0.9945,1.0,1.0,0.999999995,0.9411764705882353,1.0,0.9696969647015611,1.0,1.0,0.999999995,NULL,NULL,da
"for os er det vigtigt, at kommissionen tager hensyn til de konklusioner, der vedtages i parlamentet, som minimum ånden i dem, for på dette niveau kunne det synes, som om vi her udfører et nyttesløst arbejde, ren retorik.","we feel that it is important that the commission takes account of the conclusions adopted by this parliament, at least in spirit, because at this stage, it might seem as though what we are doing here is a useless exercise, and nothing but hot air.",Swap characters,"for os er det vigtigt, at kommissionen tager hensyn til de konklusioner, der vedtages i parlametnet, som minimum ånden i dem, for på dette niveau kunne det synes, som om vi her udfører et nyttesløst arbejde, ren retorik.",-1,0.9414356817218077,0.9777,0.9705882352941176,0.9705882352941176,0.9705882302941177,0.9459459459459459,0.9459459459459459,0.945945940945946,0.9705882352941176,0.9705882352941176,0.9705882302941177,NULL,NULL,da
"hr. formand, det er min pligt at minde min kollega, hr. evans, om, hvorfor wales faktisk har opnået status som mål 1-område.","mr president, it is incumbent upon me to remind my colleague, mr evans, of why wales actually achieved objective 1 status.",Replace Character,"hr. formand, det er min pvigt at minde min kollega, hr. evans, om, hvorfor wales faktisk har opnået status som mål 1-område.",-1,0.9061874434879645,0.9653,0.95,0.95,0.9499999950000001,0.9047619047619048,0.9047619047619048,0.9047618997619049,0.95,0.95,0.9499999950000001,NULL,NULL,da
forhåbentlig kan parlamentets holdninger imidlertid stadig være til hjælp ved midtvejsevalueringen af programmerne og ved den praktiske gennemførelse.,"hopefully, the stands parliament has taken will help, however, in the mid-term appraisal of the programmes and in their practical implementation.",Duplicate Token,forhåbentlig kan parlamentets holdninger imidlertid stadig være til hjælp ved midtvejsevalueringen af programmerne og ved ved den praktiske gennemførelse.,-1,0.903778850827967,0.9901,1.0,1.0,0.999999995,0.9444444444444444,1.0,0.9714285664326531,1.0,1.0,0.999999995,NULL,NULL,da
"i denne fase er det vigtigst at koncentrere sig om at vurdere, hvordan unionens regionalpolitik kan styres, uden at glemme, at det er hensigten at udjævne de regionale uligheder.","at this stage it is more important to concentrate on assessing how we can use this process to steer union regional policy, bearing in mind that the aim is to reduce regional inequality.",Duplicate Token,"i denne fase er det vigtigst at koncentrere sig om at vurdere vurdere, hvordan unionens regionalpolitik kan styres, uden at glemme, at det er hensigten at udjævne de regionale uligheder.",-1,0.945776776063842,0.9969,0.9583333333333334,1.0,0.9787233992575827,0.9310344827586207,0.9642857142857143,0.9473684160541707,0.9583333333333334,1.0,0.9787233992575827,NULL,NULL,da
"af nogle betænkninger, som er blevet forelagt i parlamentet i dag, fremgår det klart, at de 25 mest gunstigt stillede europæiske regioner har fem gange mindre arbejdsløshed end de 25 mindst gunstigt stillede regioner.",it is clear from some of the reports that have been presented to parliament' s plenary sitting today that europe' s 25 most prosperous regions enjoy a level of unemployment which is five times lower than in the 25 least prosperous regions.,Remove Character,"af nogle betænkninger, som er blevet forelagt i parlamentet i dag, fremgår det klart, at de 25 mest gunstgt stillede europæiske regioner har fem gange mindre arbejdsløshed end de 25 mindst gunstigt stillede regioner.",-1,0.9299238452109287,0.9736,0.9655172413793104,1.0,0.9824561353524162,0.9375,0.967741935483871,0.9523809473822121,0.9655172413793104,1.0,0.9824561353524162,NULL,NULL,da
"men jeg mener ikke, at betænkningen kommer for sent.","i do not think, however, that this report has come too late.",Negation,"men jeg mener, at betænkningen kommer for sent.",-1,0.7016879391277372,0.9138,0.875,0.7777777777777778,0.823529406782007,0.7142857142857143,0.625,0.6666666616888889,0.875,0.7777777777777778,0.823529406782007,NULL,NULL,da
det sidste punkt er af stor betydning.,this latter point is of particular importance.,Swap words,det sidste punkt er stor af betydning. ,-1,0.4417918226831577,0.9375,0.875,1.0,0.9333333283555556,0.42857142857142855,0.5,0.4615384565680473,0.75,0.8571428571428571,0.7999999950222222,NULL,NULL,da
