originalSentence,referenceSentence,tamperingType,tamperedSentence,"LLMScore (Sim, Con)",BLEU,METEOR,Rouge1 r,Rouge1 p,Rouge1 f,Rouge2 r,Rouge2 p,Rouge2 f,Rougel r,Rougel p,Rougel f,LLM-Sim,LLM-Con,originalLanguage
"det er, hvad vores kultur 2000-program giver os.",this is what our european 'culture 2000' programme offers.,Swap characters,"det er, hvad vores kultur 2000-program gievr os.",-1,0.7071067811865475,0.8951,0.875,0.875,0.874999995,0.7142857142857143,0.7142857142857143,0.7142857092857143,0.875,0.875,0.874999995,NULL,NULL,da
"jeg tror godt, at vi endnu en gang kan takke vores ordfører.",i think we can also thank the rapporteur once again.,Swap words,"jeg godt, tror at vi endnu en gang kan takke vores ordfører. ",-1,0.7558187924350542,0.9883,0.9230769230769231,1.0,0.959999995008,0.6666666666666666,0.7272727272727273,0.6956521689224953,0.8461538461538461,0.9166666666666666,0.879999995008,NULL,NULL,da
"derfor er det i princippet rigtigt, at den europæiske union opstiller fælles spilleregler for, hvordan man genbruger og forarbejder disse ni millioner køretøjer om året.",it is therefore only right that the european union should draw up community rules on how these nine million vehicles every year are to be recycled and processed.,Duplicate character,"derfor er det i princippet rigtigt, at den europæiske union opstiller fælles spilleregler for, hvordan man ggenbruger og forarbejder disse ni millioner køretøjer om året.",-1,0.9025139799587886,0.9641,0.96,0.96,0.9599999950000001,0.9166666666666666,0.9166666666666666,0.9166666616666667,0.96,0.96,0.9599999950000001,NULL,NULL,da
"det ville betyde, at der skulle transporteres 400 kg mindre gange 200.000 km.","this would at least mean 400 kg times 200,000 km less transportation.",Swap characters,"det ville betyde, at der skulle transporteres 400 kg mindre gagne 200.000 km.",-1,0.8003203203844999,0.932,0.9285714285714286,0.9285714285714286,0.9285714235714286,0.8461538461538461,0.8461538461538461,0.8461538411538462,0.9285714285714286,0.9285714285714286,0.9285714235714286,NULL,NULL,da
"det er også, hvad min gruppe udtrykkeligt ønsker.",this too is a particular desire of my group.,Replace Character,"det er også, hvad min gruppe udtrykkeligt ønsqer.",-1,0.7825422900366437,0.8951,0.875,0.875,0.874999995,0.8571428571428571,0.8571428571428571,0.8571428521428571,0.875,0.875,0.874999995,NULL,NULL,da
"for den tilbagevirkende kraft, der foruroliger og bekymrer bilindustrien, er et seriøst problem, som vi på en passende måde må tage hensyn til.","the car industry is concerned about and half expecting repercussions, which is a serious problem which we must address accordingly.",Swap characters,"for den tilbagevirkende kraft, der foruroliger og bekymrer bilindustrien, er et seriøst problem, som vi på en psasende måde må tage hensyn til.",-1,0.8985396083419646,0.9627,0.9565217391304348,0.9565217391304348,0.9565217341304348,0.9090909090909091,0.9090909090909091,0.9090909040909091,0.9565217391304348,0.9565217391304348,0.9565217341304348,NULL,NULL,da
"kommissionen er kommet med nogle forslag, der var for strenge, og vi har opstillet nogle alternativer hertil.",the commission has put forward various proposals which are too stringent and we have come up with some alternatives.,Duplicate Token,"kommissionen er kommet med nogle forslag, der der var for strenge, og vi har opstillet nogle alternativer hertil.",-1,0.9088452973719151,0.9945,1.0,1.0,0.999999995,0.9411764705882353,1.0,0.9696969647015611,1.0,1.0,0.999999995,NULL,NULL,da
"det eneste gode ved dette direktiv er, at det forudsiger fremtiden.",the only merit of this directive is that it looks to the future.,Swap characters,"det eneste gode ved dette direktvi er, at det forudsiger fremtiden.",-1,0.7611606003349892,0.9209,0.9,0.9,0.899999995,0.8,0.8,0.7999999950000002,0.9,0.9,0.899999995,NULL,NULL,da
"ikke desto mindre er det ikke lykkedes at løse problemet med de køretøjer, der er i brug for øjeblikket, men som allerede er gamle, og som det er langt dyrere at genbruge.","it has not, however, been possible to solve the problem of vehicles currently being used but which are already old and which cost far more to recycle.",Negation,"desto mindre er det lykkedes at løse problemet med de køretøjer, der er i brug for øjeblikket, men som allerede er gamle, og som det er langt dyrere at genbruge.",-1,0.8966773400768917,0.9496,1.0,0.96,0.9795918317367763,0.9655172413793104,0.9032258064516129,0.933333328338889,1.0,0.96,0.9795918317367763,NULL,NULL,da
"det giver europa et miljømæssigt fremskridt, og vi kan være stolte af det, hvis vi får indflettet dette direktiv i lovgivningen og får det vedtaget.","it means ecological progress for europe, and we can be proud of ourselves if we succeed in enacting it and setting it in motion.",Remove Character,"det giver europa et miljømæssigt fremskridt, og vi kan være solte af det, hvis vi får indflettet dette direktiv i lovgivningen og får det vedtaget.",-1,0.9025139799587886,0.9641,0.9523809523809523,0.9523809523809523,0.9523809473809525,0.9166666666666666,0.9166666666666666,0.9166666616666667,0.9523809523809523,0.9523809523809523,0.9523809473809525,NULL,NULL,da
"vi foreslår derfor, at der oprettes en fond for gamle køretøjer, der skal dække omkostningerne i forbindelse med genindvinding af udrangerede køretøjer, således at princippet om omkostningsfritagelse sikres.","consequently, for end-of-life vehicles we propose setting up a fund to cover the costs of recycling end-of-life vehicles in order to safeguard the principle of freedom from costs.",Add random word,"vi foreslår derfor, at der oprettes en fond for gamle køretøjer, der skal dække omkostningerne i forbindelse med genindvinding af udrangerede køretøjer, således at princippet om omkostningsfritagelse sikres strø.",-1,0.944881578046407,0.9968,0.9615384615384616,1.0,0.9803921518646674,0.9642857142857143,1.0,0.9818181768198347,0.9615384615384616,1.0,0.9803921518646674,NULL,NULL,da
"jeg kan godt forstå, når kolleger fra lande, hvor der ikke bygges biler, siger ja, producenterne skal betale det hele, og problemet om konkurrenceforvridning med hensættelser interesser ikke os!",i can understand it when colleagues from countries which do not build cars advocate that manufacturers should pay the full whack and that they are not interested in the problem of distortions in competition when it comes to setting aside funds.,Negation,"jeg kan godt forstå, når kolleger fra lande, hvor der bygges biler, siger ja, producenterne skal betale det hele, og problemet om konkurrenceforvridning med hensættelser interesser os!",-1,0.853949172372797,0.9479,1.0,0.9642857142857143,0.9818181768198347,0.9230769230769231,0.8571428571428571,0.8888888838957477,1.0,0.9642857142857143,0.9818181768198347,NULL,NULL,da
"for det andet fordi dette direktiv kan stimulere genvinding, og det er vigtigt.","secondly, because it can promote recycling, which is important.",Duplicate character,"for det andet fordi dette direktiv kan stimulere genvindding, og det er vigtigt.",-1,0.8003203203844999,0.9999,0.9166666666666666,0.9166666666666666,0.9166666616666667,0.8333333333333334,0.8333333333333334,0.8333333283333335,0.9166666666666666,0.9166666666666666,0.9166666616666667,NULL,NULL,da
"få af disse hele biler er værdiløse, siger eksperterne.","according to the experts, few of these complete cars are of no value.",Duplicate Token,"få af af disse hele biler er værdiløse, siger eksperterne.",-1,0.8574969146885869,0.988,1.0,1.0,0.999999995,0.8888888888888888,1.0,0.9411764656055364,1.0,1.0,0.999999995,NULL,NULL,da
"det er også godt, at vi klart lægger ansvaret hos producenterne.","also, it is a good thing that we should clearly lay the burden of responsibility with the manufacturer.",Remove Token,"det er også godt, at vi lægger ansvaret hos producenterne.",-1,0.7611606003349892,0.9281,1.0,0.9090909090909091,0.9523809473922903,0.8888888888888888,0.8,0.8421052581717452,1.0,0.9090909090909091,0.9523809473922903,NULL,NULL,da
"jeg synes ikke, at vi fra vores side må bringe denne fælles holdning i fare, for dette er et direktiv, som vi absolut har brug for på grund af miljøet.","in my opinion, we should not jeopardise that common position, because it is a directive which we desperately need for environmental reasons.",Negation,"jeg synes, at vi fra vores side må bringe denne fælles holdning i fare, for dette er et direktiv, som vi absolut har brug for på grund af miljøet.",-1,0.9294623095457653,0.9733,0.9629629629629629,0.9285714285714286,0.9454545404561984,0.9285714285714286,0.896551724137931,0.912280696755925,0.9629629629629629,0.9285714285714286,0.9454545404561984,NULL,NULL,da
"hr. formand, kære kolleger, i dag skal vi træffe en vigtig beslutning.","mr president, we need to take an important decision today.",Swap characters,"hr. formand, kære oklleger, i dag skal vi træffe en vigtig beslutning.",-1,0.8153551038173115,0.9364,0.9166666666666666,0.9166666666666666,0.9166666616666667,0.8181818181818182,0.8181818181818182,0.8181818131818183,0.9166666666666666,0.9166666666666666,0.9166666616666667,NULL,NULL,da
emballager er stadig kaos i europa og en belastning for miljøet.,packaging still accounts for a mountain of rubbish in europe and is a burden upon the environment.,Duplicate character,emballager er stadig kaos i eeuropa og en belastning for miljøet.,-1,0.7348889200874658,0.9139,0.9090909090909091,0.9090909090909091,0.9090909040909091,0.8,0.8,0.7999999950000002,0.9090909090909091,0.9090909090909091,0.9090909040909091,NULL,NULL,da
"i sidste instans er det billigere, også for forbrugerne.","this is ultimately cheaper, also for the consumer.",Duplicate character,"i sidste instans er det billigere, også ffor forbrugerne.",-1,0.7419446627365011,0.9055,0.8888888888888888,0.8888888888888888,0.888888883888889,0.75,0.75,0.749999995,0.8888888888888888,0.8888888888888888,0.888888883888889,NULL,NULL,da
"vi i gue/ngl-gruppen ønsker derfor et regelsæt, der er så dækkende og konsekvent som overhovedet muligt.",we in the confederal group of the european united left/nordic green left therefore want as comprehensive and consistent a set of regulations as is humanly possible in this area.,Duplicate character,"vi i gue/ngl-gruppen ønsker derfor et regelsæt, der er så dækkende og konsekvent som ovverhovedet muligt.",-1,0.8578928092681435,0.9437,0.9375,0.9375,0.937499995,0.8666666666666667,0.8666666666666667,0.8666666616666667,0.9375,0.9375,0.937499995,NULL,NULL,da
der skal også være regler for eksisterende køretøjer.,there must be rules governing existing vehicles too.,Remove Character,der skal også vre regler for eksisterende køretøjer.,-1,0.5969491792019646,0.8819,0.875,0.875,0.874999995,0.7142857142857143,0.7142857142857143,0.7142857092857143,0.875,0.875,0.874999995,NULL,NULL,da
"jeg er nok en af de få her i parlamentet, der har stået ved et samlebånd og monteret biler.",i believe i am one of the few members of this parliament to have stood beside a production line and assembled cars.,Replace Character,"jeg er nok en af de få her i parlameitet, der har stået ved et samlebånd og monteret biler.",-1,0.8656030552541708,0.9519,0.9473684210526315,0.9473684210526315,0.9473684160526316,0.8888888888888888,0.8888888888888888,0.888888883888889,0.9473684210526315,0.9473684210526315,0.9473684160526316,NULL,NULL,da
"hr. formand, det glæder mig meget, at miljøbeskyttelse er blevet en af parlamentets prioriteter, da den i høj grad er en prioritet for de europæiske borgere.","mr president, i am very pleased that environmental protection is now a priority for this parliament, as indeed it is for the citizens of europe.",Replace Token with Random Word,"hr . formand, det glæder mig meget, at miljøbeskyttelse krukke blevet en af parlamentets prioriteter, da den i høj grad er en prioritet for de europæiske borgere.",-1,0.9127592114472297,0.9676,0.96,1.0,0.9795918317367763,0.92,0.92,0.9199999950000001,0.96,1.0,0.9795918317367763,NULL,NULL,da
"bilfabrikanterne, materialeleverandørerne og udstyrsproducenterne skal gøre en indsats for at begrænse brugen af farlige stoffer, og derfor skal de på designstadiet sikre sig, at der kan anvendes genbrugsmaterialer til bilproduktionen.","car manufacturers, the suppliers of materials and equipment manufacturers must make an effort to limit the use of hazardous substances and therefore must ensure at the design stage that recycled materials can be used in the manufacture of cars.",Duplicate Token,"bilfabrikanterne, materialeleverandørerne og udstyrsproducenterne skal gøre en indsats for at begrænse brugen af farlige stoffer, og derfor skal de på designstadiet sikre sig, at at der kan anvendes genbrugsmaterialer til bilproduktionen.",-1,0.9474114688990278,0.9963,1.0,1.0,0.999999995,0.9666666666666667,1.0,0.9830508424590635,1.0,1.0,0.999999995,NULL,NULL,da
"i den retning er vi uden tvivl på rette vej, men som nogle af vores kolleger allerede har understreget, er det egentlige problem risikoen for, at fabrikanterne hæfter solidarisk.","in this regard, we are certainly on the right track, but as some members have already stressed, the real issue here is the possibility that manufacturers' responsibility will become a shared responsibility.",Add random word,"i den retning er vi uden tvivl på rette vej, men som nogle af vores kolleger allerede har understreget, er det egentlige problem tjald risikoen for, at fabrikanterne hæfter solidarisk.",-1,0.9219602423775934,0.9969,0.9655172413793104,1.0,0.9824561353524162,0.9310344827586207,0.9642857142857143,0.9473684160541707,0.9655172413793104,1.0,0.9824561353524162,NULL,NULL,da
"hr. formand, dette direktiv omhandler det relativt beskedne, men voksende problem med skrottede biler og spørgsmålet om en mere struktureret bortskaffelse af alle udrangerede biler.","mr president, this directive deals with the comparatively small but growing problem of abandoned cars and the question of a more structured disposal of all cars at the end of their life.",Swap words,"hr. formand, dette direktiv omhandler det relativt beskedne, men voksende med problem skrottede biler og spørgsmålet om en mere struktureret bortskaffelse af alle udrangerede biler. ",-1,0.8853153595969632,0.9987,0.96,1.0,0.9795918317367763,0.84,0.875,0.8571428521449397,0.92,0.9583333333333334,0.9387755052061642,NULL,NULL,da
"derfor, kære kolleger, opfordrer jeg jer til at stemme for bernd langes ændringsforslag, der støttes af de europæiske socialdemokraters gruppe.","this is why, i urge you to support the amendments tabled by bernd lange.",Swap characters,"derfor, kære kolleger, opfordrer jeg jer til at stemme for bernd langes ændringsforslag, der støttes af de ueropæiske socialdemokraters gruppe.",-1,0.8843865924896842,0.958,0.95,0.95,0.9499999950000001,0.8947368421052632,0.8947368421052632,0.8947368371052632,0.95,0.95,0.9499999950000001,NULL,NULL,da
"biler er også en del af vores kulturelle arv, det tror jeg, at vi alle sammen er enige om.",cars are also part of our cultural heritage. i think we would all agree on that.,Replace Character,"biler er også en del af vores kulturelle arv, det tror jeg, at vi alle sammen er enige hm.",-1,0.9132027013286009,0.9541,0.9444444444444444,0.9444444444444444,0.9444444394444445,0.9444444444444444,0.9444444444444444,0.9444444394444445,0.9444444444444444,0.9444444444444444,0.9444444394444445,NULL,NULL,da
med forslaget om delt ansvar er det hensigten at udhule forårsagerprincippet og underminere produktfornyelser.,the proposed shared responsibility would undermine the polluter pays principle and detract from product innovation.,Duplicate Token,med forslaget om delt ansvar er det hensigten hensigten at udhule forårsagerprincippet og underminere produktfornyelser.,-1,0.8761151623788772,0.9922,1.0,1.0,0.999999995,0.9285714285714286,1.0,0.9629629579698218,1.0,1.0,0.999999995,NULL,NULL,da
"producenterne bør betale, selvom vi alle ved, at omkostningen måske til sidst alligevel vil ramme forbrugerne, og de bør påtage sig disse omkostninger før 2006, som det foreslås i nogle af ændringsforslagene.","producers must pay - although we all know that the consumer will ultimately suffer the consequences of this - and they must take responsibility for the costs before 2006, as some of the amendments propose.",Replace Character,"producenterne bør bekale, selvom vi alle ved, at omkostningen måske til sidst alligevel vil ramme forbrugerne, og de bør påtage sig disse omkostninger før 2006, som det foreslås i nogle af ændringsforslagene.",-1,0.9355359393782814,0.9729,0.967741935483871,0.967741935483871,0.9677419304838711,0.9354838709677419,0.9354838709677419,0.9354838659677419,0.967741935483871,0.967741935483871,0.9677419304838711,NULL,NULL,da
"hr. formand, kære kolleger, europa-parlamentet skal i dag påtage sig et reelt ansvar.","mr president, today the european parliament must face up to real responsibilities.",Replace Character,"hr. formand, kære kolleger, europa-barlamentet skal i dag påtage sig et reelt ansvar.",-1,0.8282477531331041,0.9403,0.9230769230769231,0.9230769230769231,0.9230769180769233,0.8333333333333334,0.8333333333333334,0.8333333283333335,0.9230769230769231,0.9230769230769231,0.9230769180769233,NULL,NULL,da
"hr. formand, europa-parlamentet med miljøudvalget i spidsen arbejder for det meste på at bedømme kommissionens eller rådets forslag kritisk og forbedre dem set ud fra en miljøsynsvinkel.","mr president, most of the time, the european parliament, spearheaded by environment committees, does its very best to make a critical assessment of the proposals submitted by the european commission or the council, so as to improve on them from an environmental point of view.",Duplicate character,"hr. formand, europa-parlamentet med miljøudvalget i spidsen arbejder for det meste på at bedømme kommissionens eeller rådets forslag kritisk og forbedre dem set ud fra en miljøsynsvinkel.",-1,0.9095930632220222,0.9665,0.9629629629629629,0.9629629629629629,0.9629629579629629,0.9230769230769231,0.9230769230769231,0.9230769180769233,0.9629629629629629,0.9629629629629629,0.9629629579629629,NULL,NULL,da
"jeg støtter derfor helhjertet de procentsatser for genbrug og genvinding, som rådet har foreslået.",i therefore welcome with open arms the percentage levels for re-use and recycling which have been proposed by the council.,Duplicate character,"jeg støtter derfoor helhjertet de procentsatser for genbrug og genvinding, som rådet har foreslået.",-1,0.8371170098777919,0.9364,0.9285714285714286,0.9285714285714286,0.9285714235714286,0.8461538461538461,0.8461538461538461,0.8461538411538462,0.9285714285714286,0.9285714285714286,0.9285714235714286,NULL,NULL,da
"dette indebærer, at vi går bort fra demontering af bilvrag.",this means that we move away from shredding.,Swap words,"dette at indebærer, vi går bort fra demontering af bilvrag. ",-1,0.7016879391277372,0.9815,0.9090909090909091,1.0,0.9523809473922903,0.6,0.6666666666666666,0.6315789423822715,0.8181818181818182,0.9,0.8571428521541952,NULL,NULL,da
"en besværlig forligsprocedure betyder en unødig forsinkelse, hvor miljøet må undgælde.","a laborious conciliation procedure would entail an unnecessary delay, at the expense of the environment.",Swap characters,"en besværlig forligsprocedure betyder en unødig forsinkelse, hvor miljøet må undgædle.",-1,0.842362674378975,0.9209,0.9,0.9,0.899999995,0.9,0.9,0.899999995,0.9,0.9,0.899999995,NULL,NULL,da
billobbyen har vildledt for mange.,the car lobby has led too many people up the garden path.,Add random word,knogle billobbyen har vildledt for mange.,-1,0.846481724890614,0.9813,0.8333333333333334,1.0,0.9090909041322315,0.8,1.0,0.8888888839506174,0.8333333333333334,1.0,0.9090909041322315,NULL,NULL,da
"dertil kommer, at hvis vi svækker producenternes ansvar i denne sag, så vil det også få alvorlige konsekvenser for senere sager på andre områder, f.eks. det kommende direktiv om elektronik- og computerskrot.","what is more, if we reduce manufacturers' liability on this issue, this will also have serious consequences for subsequent matters in other areas, for example the forthcoming directive on scrap from computers and other electronic equipment.",Remove Character,"dertil kommer, at hvis vi svækker producenternes ansvar i denne sag, så vil det også få alvorlige konsekvenser for senere sager på andr områder, f.eks. det kommende direktiv om elektronik- og computerskrot.",-1,0.9278982724420874,1.0,0.96875,0.96875,0.968749995,0.9375,0.9375,0.937499995,0.96875,0.96875,0.968749995,NULL,NULL,da
så kan vi nå frem til et miljømæssigt anstændigt resultat.,we shall then be able to achieve an environmentally respectable result.,Remove Character,så kan vi nå frem til et miljømæssigt ansændigt resultat.,-1,0.7419446627365011,0.9055,0.9,0.9,0.899999995,0.7777777777777778,0.7777777777777778,0.7777777727777778,0.9,0.9,0.899999995,NULL,NULL,da
"hr. formand, fru kommissær, kære kolleger, stik imod hvad man kunne tro, er denne debat ikke af teknisk karakter.","mr president, commissioner, this debate is not a technical debate, contrary to what we may think.",Negation,"hr . formand, fru kommissær, kære kolleger, stik imod hvad man kunne tro, er denne debat af teknisk karakter.",-1,0.8895260356363631,0.9636,1.0,0.9473684210526315,0.9729729679766254,0.9411764705882353,0.8888888888888888,0.9142857092897959,1.0,0.9473684210526315,0.9729729679766254,NULL,NULL,da
i går gjorde vi vores institution ære med en politisk debat.,yesterday we honoured our institution with a political debate.,Remove Token,i går gjorde vi vores institution ære med politisk debat.,-1,0.7348889200874658,0.9216,1.0,0.9090909090909091,0.9523809473922903,0.8888888888888888,0.8,0.8421052581717452,1.0,0.9090909090909091,0.9523809473922903,NULL,NULL,da
"det ville også være første gang, at europa-parlamentet slækkede på kravene i en holdning fra rådet, mens jeg mener, at vi generelt især plejer at beklage rådets holdninger.","it would also be the first time that the european parliament would be weakening a council position, whereas usually we are complaining that their position is not strong enough.",Remove Token,"det ville være første gang, at europa-parlamentet slækkede på kravene i en holdning fra rådet, mens jeg mener, at vi generelt især plejer at beklage rådets holdninger.",-1,0.9247332419808176,0.9717,1.0,0.9615384615384616,0.9803921518646674,0.9615384615384616,0.9259259259259259,0.9433962214168744,1.0,0.9615384615384616,0.9803921518646674,NULL,NULL,da
"hr. formand, ligesom mange af de andre talere mener jeg også, at det er en god foranstaltning.","mr president, like so many others here today, i believe this is a good measure.",Duplicate Token,"hr . formand, ligesom mange af de andre talere mener jeg også, at at det er en god foranstaltning.",-1,0.9133997866119974,0.9948,1.0,1.0,0.999999995,0.9411764705882353,1.0,0.9696969647015611,1.0,1.0,0.999999995,NULL,NULL,da
de fleste tekniske spørgsmål er afklaret.,most of the technical issues have been resolved.,Swap words,fleste de tekniske spørgsmål er afklaret. ,-1,0.668740304976422,0.9606,0.8571428571428571,1.0,0.9230769181065088,0.5,0.6,0.5454545404958678,0.7142857142857143,0.8333333333333334,0.7692307642603551,NULL,NULL,da
"under førstebehandlingen var det kun udvalget om økonomi og valutaspørgsmål, der stillede spørgsmålet, og det var kun mig selv, der som ordfører for udtalelsen fra dette udvalg, stillede spørgsmålet i parlamentet.",in the first reading debate it was only the economic and monetary affairs committee which asked this question and it was only myself as the draftsman of the opinion of that committee who posed that question in parliament.,Swap words,"under førstebehandlingen var det kun udvalget om økonomi og valutaspørgsmål, der stillede spørgsmålet, og det var kun mig selv, der som ordfører udtalelsen for fra dette udvalg, stillede spørgsmålet i parlamentet. ",-1,0.9095824888332177,0.9993,0.9615384615384616,1.0,0.9803921518646674,0.8709677419354839,0.9,0.8852458966406881,0.9230769230769231,0.96,0.9411764655901577,NULL,NULL,da
det lyder ganske enkelt: hvem skal betale?,that is quite simply: who pays?,Replace Token with Random Word,det lyder ganske enkelt: hvem tyst betale?,-1,0.6606328636027614,0.8819,0.8571428571428571,0.8571428571428571,0.8571428521428571,0.6666666666666666,0.6666666666666666,0.6666666616666668,0.8571428571428571,0.8571428571428571,0.8571428521428571,NULL,NULL,da
den fælles holdning er et fornuftigt kompromis.,the common position is a reasonable compromise.,Remove Token,den holdning er et fornuftigt kompromis.,-1,0.7071067811865475,0.8757,1.0,0.8571428571428571,0.9230769181065088,0.8,0.6666666666666666,0.7272727223140496,1.0,0.8571428571428571,0.9230769181065088,NULL,NULL,da
"nogle af ændringsforslagene er helt urimelige, idet de helt fjerner ansvaret fra bilfabrikanten med hensyn til at betale en del af bortskaffelsesomkostningerne for bilerne.",some of the amendments today are totally unreasonable in that they take away completely the responsibility from the car manufacturer of paying a little if any of the cost of disposal of cars on the road.,Swap characters,"nogle af ændringsforslagene er helt urimelige, idet de helt fjerner anvsaret fra bilfabrikanten med hensyn til at betale en del af bortskaffelsesomkostningerne for bilerne.",-1,0.8942255541978509,0.9613,0.9545454545454546,0.9545454545454546,0.9545454495454547,0.9130434782608695,0.9130434782608695,0.9130434732608695,0.9545454545454546,0.9545454545454546,0.9545454495454547,NULL,NULL,da
