originalSentence,referenceSentence,tamperingType,tamperedSentence,"LLMScore (Sim, Con)",BLEU,METEOR,Rouge1 r,Rouge1 p,Rouge1 f,Rouge2 r,Rouge2 p,Rouge2 f,Rougel r,Rougel p,Rougel f,LLM-Sim,LLM-Con,originalLanguage
i 1992 aftalte vi på konferencen i rio de janeiro at træffe bæredygtige foranstaltninger gennem verdensomspændende samarbejde med henblik på miljøet og udviklingen.,"during the earth summit in rio de janeiro in 1992, we agreed to take sustainable measures for the environment and development via world-wide cooperation.",Add random word,i 1992 aftalte vi på konferencen slynge i rio de janeiro at træffe bæredygtige foranstaltninger gennem verdensomspændende samarbejde med henblik på miljøet og udviklingen.,"(0.99, 0.95)",0.891237063632542,0.9956,0.9545454545454546,1.0,0.976744181049216,0.9130434782608696,0.9545454545454546,0.9333333283358024,0.9545454545454546,1.0,0.976744181049216,0.99,0.95,da
"hvad værre er, miljøet er ikke længere centrum for den offentlige - og derfor også politiske - opmærksomhed, selv om belastningen af miljøet er steget.","what is more, the environment has now disappeared from the public eye, and hence the political eye, while the strain on the environment has only increased.",Negation,"hvad værre er, miljøet er længere centrum for den offentlige - og derfor også politiske - opmærksomhed, selv om belastningen af miljøet er steget.","(0.98, 0.95)",0.9025139799587886,0.9675,1.0,0.9545454545454546,0.976744181049216,0.9545454545454546,0.9130434782608696,0.9333333283358024,1.0,0.9545454545454546,0.976744181049216,0.98,0.95,da
"det er på høje tid, at der gøres noget ved det.",it is high time we did something about this.,Swap words,"det er på tid, høje at der gøres noget ved det. ","(0.95, 0.90)",0.6360188027707555,0.9854,0.9090909090909092,1.0,0.9523809473922904,0.6363636363636364,0.7,0.6666666616780046,0.8181818181818182,0.9,0.8571428521541952,0.95,0.90,da
"hvis vi fortsat forsømmer miljøet, fører det uigenkaldeligt til (endnu flere) oversvømmelser, skovbrande, forurening og en dårlig sundhed for mange mennesker.","indeed, if we continue to neglect the environment, this will irrevocably lead to yet more floods, forest fires, pollution and poor health for a large number of people.",Add random word,"hvis vi fortsat forsømmer miljøet, fører det uigenkaldeligt til (spot endnu flere) oversvømmelser, skovbrande, forurening og en dårlig sundhed for mange mennesker.","(0.98, 0.95)",0.9038693388414086,0.9961,0.9090909090909092,0.9523809523809524,0.9302325531422392,0.8571428571428571,0.9,0.8780487754907793,0.9090909090909092,0.9523809523809524,0.9302325531422392,0.98,0.95,da
"det er dog nødvendigt at være på vagt over for risikoen for en fordrejning af dette begreb, som er genstand for ideologisk ordkløveri, som er omklamrende og besværgende, og som danner grundlag for tvivlsomme tekniske forslag.","nevertheless, we need to beware of this concept being hijacked and used with overweening ideological verbosity, encroaching on new areas and being intoned in support of questionable technical proposals.",Swap characters,"det er dog nødvendigt at være på vagt over for risikoen for en fordrejning af dette begreb, osm er genstand for ideologisk ordkløveri, som er omklamrende og besværgende, og som danner grundlag for tvivlsomme tekniske forslag.","(1.00, 1.00)",0.933651069586263,0.9749,0.9655172413793104,1.0,0.9824561353524162,0.9428571428571428,0.9705882352941176,0.9565217341314852,0.9655172413793104,1.0,0.9824561353524162,1.00,1.00,da
"den offentlige bistand er afgørende for at standse tendensen med affolkning af landbrugsområderne og forarmelsen af disse befolkningsgrupper i de store byer, som dernæst medføre en stigende håbløshed.","public money has a decisive role to play in halting the scourge of the rural exodus and people's descent into poverty when they reach the large cities, which leads to their emigrating out of despair.",Swap characters,"den offentlige bistand er afgørened for at standse tendensen med affolkning af landbrugsområderne og forarmelsen af disse befolkningsgrupper i de store byer, som dernæst medføre en stigende håbløshed.","(1.00, 1.00)",0.9095930632220222,0.9665,0.9629629629629628,0.9629629629629628,0.9629629579629628,0.925925925925926,0.925925925925926,0.925925920925926,0.9629629629629628,0.9629629629629628,0.9629629579629628,1.00,1.00,da
"udviklingen i dyrkningen af levnedsmiddelafgrøder og udviklingen af de grundlæggende offentlige tjenesteydelser, særligt på områder som sundhed, uddannelse og social beskyttelse, er den mest sikre vej at gå for at reducere fattigdommen ved at skabe arbejdspladser i landbrugsområderne.","developing food crops and fundamental public services, particularly in the areas of health, education and social protection, is the most likely way that poverty will be reduced because it will create jobs in rural areas.",Duplicate Token,"udviklingen i dyrkningen af levnedsmiddelafgrøder og og udviklingen af de grundlæggende offentlige tjenesteydelser, særligt på områder som sundhed, uddannelse og social beskyttelse, er den mest sikre vej at gå for at reducere fattigdommen ved at skabe arbejdspladser i landbrugsområderne.","(1.00, 1.00)",0.9576241467260528,0.9976,1.0,1.0,0.999999995,0.9736842105263158,1.0,0.9866666616675556,1.0,1.0,0.999999995,1.00,1.00,da
dengang var europa-parlamentet desværre kun repræsenteret med en meget lille delegation.,"unfortunately, the delegation representing the european parliament on that occasion was very small.",Replace Token with Random Word,dengang var europa-parlamentet desværre kun repræsenteret med en meget erindre delegation.,"(0.95, 0.90)",0.7691605673134586,0.9139,0.9090909090909092,0.9090909090909092,0.9090909040909092,0.8,0.8,0.7999999950000002,0.9090909090909092,0.9090909090909092,0.9090909040909092,0.95,0.90,da
jeg havde den ære at tilhøre denne lille delegation.,i was honoured to be one of its members.,Replace Character,jeg havde den ære at tilhøre denne lillz delegation.,"(0.95, 0.99)",0.7071067811865475,0.8951,0.8888888888888888,0.8888888888888888,0.888888883888889,0.75,0.75,0.749999995,0.8888888888888888,0.8888888888888888,0.888888883888889,0.95,0.99,da
"vi ved alt dette, og vi er miljøbevidste, men vi fortsætter alligevel med at øge forbruget, og det er os i den udviklede verden, som udgør 20% af verdens befolkning, der bruger 80% af ressourcerne.","we know all of this and we are environmentally aware, but we keep increasing consumption, and we in the developed world, which represents 20% of the world population but uses 80% of its resources, are the ones responsible for it.",Swap words,"vi ved alt dette, og vi er miljøbevidste, men vi fortsætter alligevel at med øge forbruget, og det er os i den udviklede verden, som udgør 20% af verdens befolkning, der bruger 80% af ressourcerne. ","(0.99, 0.95)",0.9253591193218051,0.9996,0.967741935483871,1.0,0.983606552378393,0.8857142857142857,0.9117647058823528,0.8985507196387313,0.935483870967742,0.9666666666666668,0.9508196671324912,0.99,0.95,da
"hr. formand, jeg har lidt blandede følelser, hvad denne forhandling og topmødet i johannesburg angår.","mr president, i have rather mixed feelings about this debate and about the johannesburg summit.",Remove Token,"hr . formand, jeg har lidt blandede følelser, hvad forhandling og topmødet i johannesburg angår.","(0.95, 0.98)",0.8492326635760689,0.9517,1.0,0.9333333333333332,0.9655172363852556,0.9230769230769232,0.8571428571428571,0.8888888838957477,1.0,0.9333333333333332,0.9655172363852556,0.95,0.98,da
"eu's strategi for en bæredygtig udvikling og meddelelsen forud for verdenstopmødet er også kommet meget sent, i betragtning af at emnet handler om vores fremtid og berører os alle.","the eu's sustainable development strategy and statement prior to the world summit have also come very late, given that the matter is about our future and concerns everyone.",Remove Token,"eu's strategi for en bæredygtig udvikling og meddelelsen forud for verdenstopmødet er også kommet meget sent, i af at emnet handler om vores fremtid og berører os alle.","(0.98, 0.95)",0.9157103753711766,0.9717,1.0,0.9629629629629628,0.9811320704734782,0.9629629629629628,0.9285714285714286,0.9454545404561984,1.0,0.9629629629629628,0.9811320704734782,0.98,0.95,da
"fra eu's side må vi også vise, at vi har en troværdig strategi for bæredygtig udvikling, så verdenstopmødet kan føre til det resultat, som er nødvendigt for at vende den aktuelle voksende miljøkrise.",we in the eu must also show that we have a credible sustainable development strategy to enable the world summit to obtain the result that is required if today's growing environmental crisis is to be averted.,Duplicate character,"fra eu's side må vi også vise, at vi har en troværdig strategi for bæredygtig udvikling, så verdenstopmødet kan fføre til det resultat, som er nødvendigt for at vende den aktuelle voksende miljøkrise.","(0.99, 0.99)",0.9299238452109287,0.9736,0.9666666666666668,0.9666666666666668,0.9666666616666668,0.9375,0.9375,0.937499995,0.9666666666666668,0.9666666666666668,0.9666666616666668,0.99,0.99,da
"fru formand, kære kommissærer og medlemmer af rådet, kære kolleger, i morges kunne man læse i aviserne, at en ny del af iskappen på antarktis havde revet sig løs, dér hvor 90% af verdens ferskvandsreserver findes.","madam president, members of the commission and the council, ladies and gentlemen, the media informed us this morning that another section of the antarctic icecap had come adrift; this is where 90% of the earth's reserves of fresh water are stored.",Duplicate character,"fru formand, kære kommissærer og medlemmer af rådet, kære kolleger, i morges kunne man læse i aviserne, at enn ny del af iskappen på antarktis havde revet sig løs, dér hvor 90% af verdens ferskvandsreserver findes.","(0.99, 0.99)",0.9385522307631308,0.9767,0.96875,0.96875,0.968749995,0.9428571428571428,0.9428571428571428,0.942857137857143,0.96875,0.96875,0.968749995,0.99,0.99,da
"oversvømmelser, ørkendannelser, de økologiske katastrofer fordobles og er i stigning, og det er med disse begivenheder og med presset fra en tid på nedtælling, at vi til september tager til johannesburg.","floods and ecological catastrophes are becoming ever more frequent; desertification is gathering pace, and it is against this background, with time running out, that we will go to johannesburg in september.",Duplicate character,"oversvømmelser, ørkendannelser, de økologiske katastrofer fordobles og er i stigning, og det er med disse begivenheder og med presset fra en tid på nedtælling, at vi til september tager ttil johannesburg.","(0.99, 0.95)",0.9336312563108614,0.9715,0.9629629629629628,1.0,0.9811320704734782,0.9333333333333332,0.9333333333333332,0.9333333283333336,0.9629629629629628,1.0,0.9811320704734782,0.99,0.95,da
jeg vil gerne sige to ting.,i should like to make two points.,Replace Token with Random Word,jeg vil gerne trold to ting.,"(0.95, 0.95)",8.444843264428189e-78,0.8413,0.8333333333333334,0.8333333333333334,0.8333333283333335,0.6,0.6,0.5999999950000001,0.8333333333333334,0.8333333333333334,0.8333333283333335,0.95,0.95,da
jeg ser frem til deres svar.,i look forward to your answer.,Replace Character,jeg ser frem til deres shar.,"(0.95, 0.95)",0.6434588841607617,0.8413,0.8333333333333334,0.8333333333333334,0.8333333283333335,0.8,0.8,0.7999999950000002,0.8333333333333334,0.8333333333333334,0.8333333283333335,0.95,0.95,da
"fru formand, hr. papayannakis, hr. lannoye, jeg vil gerne takke dem for det glimrende arbejde, de har udført, og jeg vil gerne takke kommissær nielson, som altid er opmærksom på de spørgsmål, der vedrører udviklingslandene.","madam president, rapporteurs, thank you for your excellent work. i would like to thank commissioner nielson too, who is always sensitive to issues concerning developing countries.",Replace Character,"fru formand, hr. papayannakis, hr. lannoye, jeg vil gerne takke dem for det glimrende arbejde, de har upført, og jeg vil gerne takke kommissær nielson, som altid er opmærksom på de spørgsmål, der vedrører udviklingslandene.","(0.99, 0.95)",0.9414356817218076,0.9777,0.9655172413793104,0.9655172413793104,0.9655172363793104,0.935483870967742,0.935483870967742,0.935483865967742,0.9655172413793104,0.9655172413793104,0.9655172363793104,0.99,0.95,da
stockholm-konferencen bragte generel bevidsthed om vores største overgreb på miljøet.,the stockholm summit led to a general increase in awareness about the major threats to our environment.,Duplicate character,stockholm-konferencen bragte geneerel bevidsthed om vores største overgreb på miljøet.,"(0.99, 0.99)",0.7419446627365011,0.9055,0.9,0.9,0.899999995,0.7777777777777778,0.7777777777777778,0.7777777727777778,0.9,0.9,0.899999995,0.99,0.99,da
"rio-konferencen definerede et nyt scenario, nemlig den bæredygtige udvikling.","the rio summit defined a new arena, that of sustainable development.",Swap words,"rio-konferencen definerede et scenario, nyt nemlig den bæredygtige udvikling. ","(0.95, 0.90)",0.5280972216470737,0.976,0.9,1.0,0.947368416066482,0.5555555555555556,0.625,0.5882352891349482,0.8,0.8888888888888888,0.8421052581717452,0.95,0.90,da
"fru formand, først en tak til kommissær nielson og tak for to gode betænkninger.","madam president, i should like first of all to thank commissioner nielson and also express my thanks for two commendable reports.",Swap characters,"fru formand, først en tak til kommissær nielson og atk for to gode betænkninger.","(0.99, 0.95)",0.8153551038173115,0.9286,0.9285714285714286,1.0,0.9629629579698218,0.8461538461538461,0.8461538461538461,0.8461538411538462,0.9285714285714286,1.0,0.9629629579698218,0.99,0.95,da
"vi bør afkoble forbindelsen mellem økonomisk vækst og øget miljøbelastning, navnlig gennem øget brug af vedvarende energi og renere teknologi.","we should break the link between economic growth and increased environmental damage, namely through the increased use of renewable energy and cleaner technology.",Replace Character,"vi bør afkoble forbindelsen mellem økonomisk vækst ol øget miljøbelastning, navnlig gennem øget brug af vedvarende energi og renere teknologi.","(0.99, 1.00)",0.8725129388059689,0.9541,0.9473684210526316,1.0,0.9729729679766254,0.8947368421052632,0.8947368421052632,0.8947368371052632,0.9473684210526316,1.0,0.9729729679766254,0.99,1.00,da
og hvem ellers end eu skulle være pioner her?,"i ask you this: who else, apart from the european union, should take the lead role here?",Replace Token with Random Word,grøble hvem ellers end eu skulle være pioner her?,"(0.85, 0.9)",0.8801117367933934,0.8994,0.8888888888888888,0.8888888888888888,0.888888883888889,0.875,0.875,0.874999995,0.8888888888888888,0.8888888888888888,0.888888883888889,0.85,0.9,da
man har nu forlænget den næste forberedende konference i indonesien lidt. den finder sted fra den 24. maj til den 7. juni.,"the forthcoming preparatory conference in indonesia has now been extended, and will now take place from 24 may to 7 june.",Remove Character,man har nu forlænget den næste forberedende konference i indonesien lidt. den finder sted fra den 24. maj til den 7. jni.,"(0.95, 0.99)",0.9210589320522864,0.958,0.9473684210526316,0.9473684210526316,0.9473684160526316,0.9523809523809524,0.9523809523809524,0.9523809473809524,0.9473684210526316,0.9473684210526316,0.9473684160526316,0.95,0.99,da
"sidste gang der var noget, der lignede en slags global økonomi, var i imperiernes periode, da det britiske, det franske, det italienske og det spanske imperium drog ud og skabte økonomisk aktivitet.","the last time there was a semblance of any sort of global economy was during the period of the empires, when the british, the french, the italians and the spanish empires went out and created economic activity.",Swap characters,"sidste gang der var noget, der lignede en slags global økonomi, vra i imperiernes periode, da det britiske, det franske, det italienske og det spanske imperium drog ud og skabte økonomisk aktivitet.","(1.00, 1.00)",0.9299238452109287,0.9731,0.9629629629629628,1.0,0.9811320704734782,0.935483870967742,0.935483870967742,0.935483865967742,0.9629629629629628,1.0,0.9811320704734782,1.00,1.00,da
"men selv det britiske east india company havde et socialt virksomhedsansvar: de byggede skoler, de skabte orden i bengalen, de byggede jernbaner, etablerede infrastruktur og skabte udlignende investeringer.",but even the british east india company had social corporative responsibility: they built schools; they cleaned up bengal; they built railways; they put infrastructure in and they created offset investments.,Replace Token with Random Word,"men selv det britiske east india company havde et socialt virksomhedsansvar: de byggede skoler, de skabte orden i bengalen, de byggede jernbaner, etablerede vrage og skabte udlignende investeringer.","(0.95, 0.95)",0.9184678024441792,0.9696,0.9583333333333334,0.9583333333333334,0.9583333283333336,0.9230769230769232,0.9230769230769232,0.9230769180769232,0.9583333333333334,0.9583333333333334,0.9583333283333336,0.95,0.95,da
"det er en måde, hvorpå man igen kan få verdens opmærksomhed henledt på disse spørgsmål.",it is a way of attracting the world's attention back to these issues.,Duplicate Token,"det er en måde, hvorpå man igen kan få verdens opmærksomhed henledt henledt på disse spørgsmål.","(0.95, 0.99)",0.8917143641551922,0.9933,1.0,1.0,0.999999995,0.9333333333333332,1.0,0.9655172363852556,1.0,1.0,0.999999995,0.95,0.99,da
"hvad angår vand, vil vi med henblik på at udnytte ressourcerne bedre og forbedre adgangen til sikkert drikkevand og tilstrækkelige sanitære foranstaltninger igangsætte et initiativ baseret på en integreret forvaltning af flodbækkener.","concerning water - with a view to better resource management and improving access to safe drinking water and to adequate sanitation, we will launch an initiative, based on integrated river basin management.",Replace Token with Random Word,"hvad angår vand, vil vi med henblik på at udnytte ressourcerne bedre og forbedre adgangen til sikkert drikkevand og tilstrækkelige sanitære fjerne igangsætte et initiativ baseret på en integreret forvaltning af flodbækkener.","(0.98, 0.95)",0.9210500207490828,0.9705,0.9666666666666668,0.9666666666666668,0.9666666616666668,0.935483870967742,0.935483870967742,0.935483865967742,0.9666666666666668,0.9666666666666668,0.9666666616666668,0.98,0.95,da
der vil blive lagt særlig vægt på mødres sundhed.,particular attention will be paid to maternal health.,Swap characters,der vil blive lagt særlig vægt på mødres usndhed.,"(0.95, 0.99)",0.7825422900366437,0.8951,0.8888888888888888,0.8888888888888888,0.888888883888889,0.875,0.875,0.874999995,0.8888888888888888,0.8888888888888888,0.888888883888889,0.95,0.99,da
"wto-medlemmer bør løse uoverensstemmelser om tvungne licenser og arbejde for at sikre, at lægemidlerne kan stilles til rådighed for udviklingslandene til den lavest mulige pris.",wto members should resolve differences on compulsory licences and work to ensure that pharmaceutical products can be made available to the developing world at the lowest possible prices.,Remove Token,"wto-medlemmer bør løse uoverensstemmelser om tvungne licenser og arbejde for at sikre, at lægemidlerne kan stilles til for udviklingslandene til den lavest mulige pris.","(1.00, 1.00)",0.8985396083419646,0.9663,1.0,0.9545454545454546,0.976744181049216,0.9565217391304348,0.9166666666666666,0.9361702077682208,1.0,0.9545454545454546,0.976744181049216,1.00,1.00,da
"hvad angår uddannelse, vil unionen også i løbet af de næste fem år forøge omfanget af udviklingsbistand inden for uddannelse og opfordre modtagerlandene til at udvikle politiske rammer til støtte herfor og passende nationale budgetter.","concerning education - the union will also increase, over the next five years, the volume of development assistance in education and invite recipient countries to develop supportive policy frameworks and appropriate national budgets.",Add random word,"hvad angår uddannelse, vil unionen også i løbet af de næste fem år forøge omfanget af udviklingsbistand skænde inden for uddannelse og opfordre modtagerlandene til at udvikle politiske rammer til støtte herfor og passende nationale budgetter.","(0.95, 0.95)",0.930648893393227,0.9972,0.9696969696969696,1.0,0.984615379616568,0.9428571428571428,0.9705882352941176,0.9565217341314852,0.9696969696969696,1.0,0.984615379616568,0.95,0.95,da
"hvad angår god regeringsførelse, vil unionen bidrage til en styrkelse af globale styringsstrukturer og institutioner på det økonomiske, sociale og miljømæssige område såvel som de forskellige forbindelser imellem dem for at sikre en sammenhængende politik, integration og øget effektivitet.","concerning governance - the union will contribute to the strengthening of global governance structures and institutions in the economic, social and environmental fields as well as their respective linkages, so as to ensure policy coherence, integration and increased effectiveness.",Replace Token with Random Word,"hvad angår god regeringsførelse, vil unionen bidrage hørme en styrkelse af globale styringsstrukturer og institutioner på det økonomiske, sociale og miljømæssige område såvel som de forskellige forbindelser imellem dem for at sikre en sammenhængende politik, integration og øget effektivitet.","(0.99, 0.99)",0.9385522307631308,0.9767,0.9722222222222222,0.9722222222222222,0.9722222172222222,0.9473684210526316,0.9473684210526316,0.9473684160526316,0.9722222222222222,0.9722222222222222,0.9722222172222222,0.99,0.99,da
det er også den største anstødssten mellem europa og usa.,this is also the main sticking point between europe and the united states.,Duplicate Token,det er er også den største anstødssten mellem europa og usa.,"(1.00, 1.00)",0.8574969146885869,0.988,1.0,1.0,0.999999995,0.9,1.0,0.947368416066482,1.0,1.0,0.999999995,1.00,1.00,da
"adskillige talere fra alle politiske grupper her i salen har nævnt, at vi må gøre fremskridt med hensyn til at reformere landbrugs- og fiskeripolitikken i europa for at kunne præsentere os troværdigt internationalt set på disse områder.","several speakers, from all political groups in this house, have mentioned that we need to make progress in reforming the agricultural policy and the fisheries policy in europe in order to be able to present ourselves in a credible manner internationally in these areas.",Duplicate Token,"adskillige talere fra alle politiske grupper her i salen har nævnt, at vi må gøre gøre fremskridt med hensyn til at reformere landbrugs- og fiskeripolitikken i europa for at kunne præsentere os troværdigt internationalt set på disse områder.","(1.00, 1.00)",0.9542969642914884,0.9974,1.0,1.0,0.999999995,0.972972972972973,1.0,0.986301364863952,1.0,1.0,0.999999995,1.00,1.00,da
"men i de sidste 25 år er den slags stort set kun forekommet i konfliktsituationer, og det virkelige problem er fejlernæring.","however, over the last 25 years that has been largely identified with conflict situations, and the real problem is malnutrition.",Remove Character,"men i de sidste 25 år er den slags stort set ku forekommet i konfliktsituationer, og det virkelige problem er fejlernæring.","(0.99, 1.00)",0.8787419089273848,0.9562,0.9473684210526316,0.9473684210526316,0.9473684160526316,0.9,0.9,0.899999995,0.9473684210526316,0.9473684210526316,0.9473684160526316,0.99,1.00,da
"vi satte os igen det mål at halvere dette antal inden udgangen af 2015, det vil sige i løbet af 20 år, en reduktion på 22 millioner om året.","we aimed again to halve that number by 2015: that means over 20 years, a reduction of 22 million a year.",Remove Token,"vi satte igen det mål at halvere dette antal inden udgangen af 2015, det vil sige i løbet af 20 år, en reduktion på 22 millioner om året.","(0.99, 0.99)",0.9247332419808176,0.9717,1.0,0.9629629629629628,0.9811320704734782,0.9629629629629628,0.9285714285714286,0.9454545404561984,1.0,0.9629629629629628,0.9811320704734782,0.99,0.99,da
"13 milliarder amerikanske dollars om året er, hvad vi i europa og amerika bruger på kosmetik.",usd 13 billion a year is what we in europe and america spend on cosmetics.,Replace Character,"13 milliarder amerikanske dollars om året er, hvad vi i europa og amerika bxuger på kosmetik.","(0.95, 0.98)",0.8394327083733336,0.9437,0.9375,0.9375,0.937499995,0.8666666666666667,0.8666666666666667,0.8666666616666667,0.9375,0.9375,0.937499995,0.95,0.98,da
"løsningen skal uden tvivl også findes i en bedre udnyttelse af vandet og en bevarelse af biodiversiteten, som forventes at blive erklæret for ""globale offentlige goder"" af det internationale samfund.","it also undoubtedly requires good use of water and the preservation of biodiversity, and we are expecting these to be declared 'inalienable public assets' by the international community.",Replace Character,"løsningen skal uden tvivl også findes i en bedre udnyutelse af vandet og en bevarelse af biodiversiteten, som forventes at blive erklæret for ""globale offentlige goder"" af det internationale samfund.","(1.00, 1.00)",0.9210500207490828,0.9705,0.9629629629629628,0.9629629629629628,0.9629629579629628,0.9310344827586208,0.9310344827586208,0.9310344777586208,0.9629629629629628,0.9629629629629628,0.9629629579629628,1.00,1.00,da
