originalSentence,referenceSentence,tamperingType,tamperedSentence,"LLMScore (Sim, Con)",BLEU,METEOR,Rouge1 r,Rouge1 p,Rouge1 f,Rouge2 r,Rouge2 p,Rouge2 f,Rougel r,Rougel p,Rougel f,LLM-Sim,LLM-Con,originalLanguage
we must remember that we are talking about increasing the employment rate to 65 % over five years.,"husk, at vi taler om at øge erhvervsraten til 65 % i løbet af fem år.",Swap words,we must remember that we are talking about increasing employment the rate to 65 % over five years. ,"(0.98, 0.95)",0.813572896213838,0.9953,0.9444444444444444,1.0,0.9714285664326532,0.7777777777777778,0.8235294117647058,0.7999999950040816,0.8888888888888888,0.9411764705882352,0.914285709289796,0.98,0.95,en
and that is the core of the guidelines we are presenting to you today.,"og det er kernen i de retningslinjer, som vi præsenterer dem for i dag.",Duplicate Token,and that is the core of the guidelines we are presenting to to you today.,"(0.99, 0.99)",0.8761151623788772,0.9922,1.0,1.0,0.999999995,0.9285714285714286,1.0,0.9629629579698218,1.0,1.0,0.999999995,0.99,0.99,en
we are talking here about tackling the problem of the long-term unemployed; and we are talking about tackling the problem of youth unemployment.,"vi taler her om bekæmpelse af langtidsledigheden, og vi taler om bekæmpelse af ungdomsarbejdsløsheden.",Replace Character,wp are talking here about tackling the problem of the long-term unemployed; and we are talking about tackling the problem of youth unemployment.,"(0.98, 0.99)",0.9573479717381596,0.96,0.9333333333333332,1.0,0.9655172363852556,0.9411764705882352,1.0,0.9696969647015612,0.9333333333333332,1.0,0.9655172363852556,0.98,0.99,en
"we want to see a guideline: and it is stated here quite specifically that every unemployed person will either be in a job, a skill experience or a training situation within twelve months of being unemployed.","vi ønsker retningslinjer, og der står heri helt specifikt, at alle arbejdsløse enten vil være i arbejde, i arbejdspraktik eller under uddannelse senest 12 måneder efter, at de er blevet arbejdsløse.",Remove Token,"we want to see a guideline: and it is stated here quite that every unemployed person will either be in a job, a skill experience or a training situation within twelve months of being unemployed.","(0.98, 0.95)",0.931838481115484,0.9768,1.0,0.96875,0.984126979128244,0.9705882352941176,0.9428571428571428,0.9565217341314852,1.0,0.96875,0.984126979128244,0.98,0.95,en
that is what has to be tackled if we are going to plug the skills gap that is bedevilling the whole labour market of europe.,"det er dette, som skal tackles, hvis vi skal udfylde den kvalifikationskløft, der plager hele det europæiske arbejdsmarked.",Add random word,that is what has to be tackled if we are going to plug the skills gap indigeneity that is bedevilling the whole labour market of europe.,"(0.95, 0.9)",0.9000001338525341,0.9959,0.9545454545454546,1.0,0.976744181049216,0.9166666666666666,0.9565217391304348,0.9361702077682208,0.9545454545454546,1.0,0.976744181049216,0.95,0.9,en
"mr president, we are currently in a transitional period until monetary union comes into effect, allowing us to become more competitive, and our economies to converge.","hr. formand, vi befinder os for øjeblikket i en overgangsperiode før igangsætningen af den monetære union, som vil blive det instrument, der vil give os mulighed for at være mere konkurrencedygtige og opnå konvergens i vores økonomier.",Swap characters,"mr president, we are currently in a transitional period until monetary union comes into effect, allowing us to become more comeptitive, and our economies to converge.","(0.99, 0.99)",0.9095930632220222,0.9665,0.96,0.96,0.959999995,0.92,0.92,0.919999995,0.96,0.96,0.959999995,0.99,0.99,en
"while today president santer and i have been focusing on the employment guidelines, we also approved two other documents.","selvom kommissionsformand santer og jeg i dag har koncentreret os om retningslinjerne for beskæftigelsen, har vi også godkendt to andre dokumenter.",Duplicate character,"whiile today president santer and i have been focusing on the employment guidelines, we also approved two other documents.","(0.99, 0.99)",0.948543837069451,0.9523,0.9473684210526316,0.9473684210526316,0.9473684160526316,0.9444444444444444,0.9444444444444444,0.9444444394444445,0.9473684210526316,0.9473684210526316,0.9473684160526316,0.99,0.99,en
the joint report is a collection of all the best practices submitted to us in the multiannual programmes and the submissions made to the luxembourgish president-in-office.,"den fælles rapport er en samling af alle de eksempler på god praksis, som er forelagt os i de flerårige programmer, og som er forelagt den luxembourgske formand.",Remove Token,the joint report is a collection of all the best practices submitted to us in the multiannual and the submissions made to the luxembourgish president-in-office.,"(0.95, 0.95)",0.8985396083419646,0.9663,1.0,0.9523809523809524,0.9756097511005354,0.9583333333333334,0.92,0.9387755052061642,1.0,0.9523809523809524,0.9756097511005354,0.95,0.95,en
"we should be wary of tax dumping or tax competition, with different member states chasing jobs and investment, unless progress is made in this area.","det kan frygtes, at det fører til beskatningsdumpning eller beskatningskonkurrence, når forskellige medlemslande ønsker arbejdspladser og investeringer, hvis der ikke på dette område gøres fremskridt.",Duplicate character,"we should be wary of tax dumping or tax competition, with different meember states chasing jobs and investment, unless progress is made in this area.","(0.99, 0.99)",0.9025139799587886,0.9641,0.9583333333333334,0.9583333333333334,0.9583333283333336,0.9166666666666666,0.9166666666666666,0.9166666616666668,0.9583333333333334,0.9583333333333334,0.9583333283333336,0.99,0.99,en
i would also like to ask a question which has already been asked several times here: what does the commission mean by wage flexibility being a good way of remedying the employment problem?,"jeg vil endvidere spørge om det, som der allerede er blevet spurgt om flere gange: hvad mener kommissionen med, at lønningsfleksibilitet er en succesfuld måde at tage sig af beskæftigelse på?",Remove Token,i would also like ask a question which has already been asked several times here: what does the commission mean by wage flexibility being a good way of remedying the employment problem?,"(1.00, 1.00)",0.9234732618882052,0.9741,1.0,0.967741935483871,0.983606552378393,0.967741935483871,0.9375,0.952380947382212,1.0,0.967741935483871,0.983606552378393,1.00,1.00,en
"however, in addition to this communication, another fiscal package was this morning identified by the commission within a different context.","men ud over denne meddelelse har kommissionen her til formiddag behandlet en anden skattepakke, men i en anden sammenhæng.",Swap words,"however, in addition to this communication, another fiscal package was this morning identified the by commission within a different context. ","(0.99, 0.99)",0.8509527625828,0.9974,0.95,1.0,0.9743589693622616,0.8,0.8421052631578947,0.8205128155161079,0.9,0.9473684210526316,0.9230769180802104,0.99,0.99,en
"thus we are at least assured of having succeeded, after two years of hard work, in unblocking the taxation package which, as you know, has been bogged down for quite a while.","på den måde er vi i det mindste sikre på, at det efter to års hårdt arbejde er lykkedes os at at ophæve blokeringen af skatte- og afgiftspakken, der, som de ved, har været kørt fast gennem nogen tid.",Swap characters,"thus we are at least assured of having succeeded, after two years of hard work, in unblocking the taxation package which, as you know, has eben bogged down for quite a while.","(0.99, 0.99)",0.9278982724420874,0.9729,0.967741935483871,0.967741935483871,0.9677419304838712,0.935483870967742,0.935483870967742,0.935483865967742,0.967741935483871,0.967741935483871,0.9677419304838712,0.99,0.99,en
"now, in the eyes of the citizens, the european union is not only a market, not only a single currency, but it also has a social dimension.","nu er efter borgernes opfattelse den europæiske union ikke kun et marked, ikke kun fælles valuta, men den har også en social dimension.",Negation,"now, in the eyes of the citizens, the european union is only a market, only a single currency, but it also has a social dimension.","(0.95, 0.95)",0.8293181259810137,0.9429,1.0,0.9523809523809524,0.9756097511005354,0.9130434782608696,0.875,0.8936170162788593,1.0,0.9523809523809524,0.9756097511005354,0.95,0.95,en
"and we here today have grasped what is necessary to move that on and to make the commitment really substantial, to get action plans that will deliver the goods over the next five years.","og her har vi i dag taget fat om, hvad der skal til for at fremme denne udvikling og opnå et virkelig betydeligt engagement og for at udarbejde handlingsplaner, der giver de ønskede resultater i løbet af de næste fem år.",Replace Token with Random Word,"and we here today have grasped what is necessary to move that on and to make the commitment really substantial, to get stethoscopy plans that will deliver the goods over the next five years.","(0.95, 0.95)",0.9257518071011758,0.9721,0.9642857142857144,0.9642857142857144,0.9642857092857144,0.9393939393939394,0.9393939393939394,0.9393939343939396,0.9642857142857144,0.9642857142857144,0.9642857092857144,0.95,0.95,en
"last year, commissioner liikanen's colleague, mrs wulf-mathies, together with the committee on the environment, gave clear priority to the better use of the structural funds and particularly to encouraging this durability.","kommissær liikanen's kollega, fru wulf-mathies, har sidste år i samarbejde med miljøudvalget gjort et stort arbejde for at forbedre udnyttelsen af strukturfondene, særligt for at fremme den vedvarende anvendelse.",Remove Token,"last year, commissioner liikanen's colleague, mrs wulf-mathies, together with the committee on the environment, gave clear to the better use of the structural funds and particularly to encouraging this durability.","(0.95, 0.95)",0.9278982724420874,0.9755,1.0,0.9629629629629628,0.9811320704734782,0.9655172413793104,0.9333333333333332,0.949152537374318,1.0,0.9629629629629628,0.9811320704734782,0.95,0.95,en
with regard to external policy there is fundamental change to the phare programmes.,med hensyn til den eksterne politik er der tale om en fundamental ændring af phare-programmerne.,Replace Token with Random Word,with overcontribute to external policy there is fundamental change to the phare programmes.,"(0.85, 0.95)",0.855526185871245,0.9269,0.9166666666666666,0.9166666666666666,0.9166666616666668,0.8333333333333334,0.8333333333333334,0.8333333283333335,0.9166666666666666,0.9166666666666666,0.9166666616666668,0.85,0.95,en
"this visit is the second meeting between delegations of the european parliament and the parliament of the former yugoslav republic of macedonia, and the first official visit by a delegation from the macedonian parliament to the european parliament.","dette besøg er det andet møde mellem europa-parlamentets delegation og delegationen fra den tidligere jugoslaviske republik makedoniens parlament, samt det første officielle besøg, som en delegation fra det makedonske parlament har aflagt i europa-parlamentet.",Duplicate Token,"this visit is the second meeting between delegations of the european parliament and and the parliament of the former yugoslav republic of macedonia, and the first official visit by a delegation from the macedonian parliament to the european parliament.","(1.00, 1.00)",0.9554627273815156,0.9974,1.0,1.0,0.999999995,0.9705882352941176,1.0,0.9850746218667856,1.0,1.0,0.999999995,1.00,1.00,en
"firstly, reconstruction in former yugoslavia.",for det første: genopbygningen af det tidligere jugoslavien.,Replace Token with Random Word,"firstly, intertrigo in former yugoslavia.","(0.75, 0.95)",0.488923022434901,0.8413,0.8,0.8,0.7999999950000002,0.5,0.5,0.4999999950000001,0.8,0.8,0.7999999950000002,0.75,0.95,en
"the money that we have made available for nuclear safety in central and eastern europe is only being used in dribs and drabs, or not at all.","de penge, som vi har bevilget til den nukleare sikkerhed i central- og østeuropa, anvendes stadig kun i ringe omfang eller slet ikke.",Negation,"the money that we have made available for nuclear safety in central and eastern europe is only being used in dribs and drabs, or at all.","(0.95, 0.95)",0.9061874434879644,0.9687,1.0,0.96,0.9795918317367764,0.96,0.9230769230769232,0.9411764655901576,1.0,0.96,0.9795918317367764,0.95,0.95,en
"for years we have been greatly concerned about exceeding milk quotas, and in 1992 we even had to postpone the final discharge.","vi har i årevis gjort os mange bekymringer om overskridelsen af mælkekvoterne, og i 1992 måtte vi endda udskyde dechargeafgørelsen.",Add random word,"for years we have been greatly concerned about exceeding milk quotas, and nelumbium in 1992 we even had to postpone the final discharge.","(0.95, 0.95)",0.891237063632542,0.9956,0.9545454545454546,1.0,0.976744181049216,0.9090909090909092,0.9523809523809524,0.9302325531422392,0.9545454545454546,1.0,0.976744181049216,0.95,0.95,en
"thanks to pressure from the european parliament, some projects have indeed been initiated since then.","efter at europa-parlamentet har presset på, er der sket en del på dette område.",Remove Character,"thanks to pressure from the european paliament, some projects have indeed been initiated since then.","(1.00, 1.00)",0.8282477531331041,0.9403,0.9333333333333332,0.9333333333333332,0.9333333283333336,0.8571428571428571,0.8571428571428571,0.8571428521428571,0.9333333333333332,0.9333333333333332,0.9333333283333336,1.00,1.00,en
"i would suggest that to start with we concentrate on the 20 % where it is not the member states who are the naughty boys, but the european commission itself.","i den forbindelse foreslår jeg, at vi først og fremmest koncentrerer os om de 20 %, hvor det ikke er medlemslandene, der er skurkene, men umiddelbart europa-kommissionen.",Negation,"i would suggest that to start with we concentrate on the 20% where it is the member states who are the naughty boys, but the european commission itself.","(0.95, 0.95)",0.9157103753711766,0.9717,0.96,0.8888888888888888,0.9230769180843196,0.8888888888888888,0.8275862068965517,0.8571428521492348,0.96,0.8888888888888888,0.9230769180843196,0.95,0.95,en
"so far we have not had an opportunity, because of the somewhat limited staff resources at our disposal, to go into the details here.","på grund af de også personalemæssigt lettere begrænsede ressourcer, som vi har til rådighed, har vi endnu ikke haft mulighed for at gå i detaljer.",Negation,"so far we have had an opportunity, because of the somewhat limited staff resources at our disposal, to go into the details here.","(0.00, 1.00)",0.8985396083419646,0.9663,1.0,0.9565217391304348,0.977777772780247,0.9545454545454546,0.9130434782608696,0.9333333283358024,1.0,0.9565217391304348,0.977777772780247,0.00,1.00,en
i have to say that it may be a good thing that we have not committed more than 20 % in the ukraine.,"jeg må sige, at det måske er meget godt, at vi ikke har bundet mere end 20 % i ukraine.",Negation,i have to say that it may be a good thing that we have committed more than 20% in the ukraine.,"(0.85, 0.95)",0.8843865924896842,0.962,0.9473684210526316,0.8571428571428571,0.8999999950125,0.85,0.7727272727272727,0.8095238045351475,0.9473684210526316,0.8571428571428571,0.8999999950125,0.85,0.95,en
i was pleased to see that there has been some progress in ensuring that the monitoring of expenditure is an important item.,"jeg er glad for at se, at der er sket en vis fremgang med hensyn til at betragte opfølgning af udgifter som et betydningsfuldt emne.",Swap characters,i was pleased to see thta there has been some progress in ensuring that the monitoring of expenditure is an important item.,"(0.99, 0.99)",0.8787419089273848,0.9562,0.9545454545454546,1.0,0.976744181049216,0.9047619047619048,0.9047619047619048,0.9047618997619048,0.9545454545454546,1.0,0.976744181049216,0.99,0.99,en
"you could have some eager bureaucrat who says: as long as i spend my money, parliament will vote me more, because it sees that utilization has actually been carried out.","man kan forestille sig en ivrig bureaukrat, som siger: så længe jeg bruger mine penge, bevilger parlamentet mig flere, for det kan se, at de rent faktisk anvendes.",Remove Token,"you could have some eager bureaucrat who says: as long as i spend my money, parliament will vote me more, because it sees that has actually been carried out.","(0.95, 0.95)",0.9210500207490828,0.9733,1.0,0.9655172413793104,0.9824561353524162,0.9642857142857144,0.9310344827586208,0.9473684160541708,1.0,0.9655172413793104,0.9824561353524162,0.95,0.95,en
i believe the committee on budgets of this parliament works meticulously on the use of credits.,"jeg mener, at europa-parlamentets budgetudvalg arbejder minutiøst med anvendelsen af bevillingerne.",Remove Character,i beieve the committee on budgets of this parliament works meticulously on the use of credits.,"(0.99, 0.99)",0.8843946454355334,0.9403,0.9230769230769232,0.9230769230769232,0.9230769180769232,0.8666666666666667,0.8666666666666667,0.8666666616666667,0.9230769230769232,0.9230769230769232,0.9230769180769232,0.99,0.99,en
it just wishes its work was followed up in the same way by the council and the commission.,"udvalget ville ønske, at dets arbejde blev fulgt op på samme måde af rådet og kommissionen.",Swap characters,it just wishes its work was flolowed up in the same way by the council and the commission.,"(0.99, 0.95)",0.8492326635760689,0.9467,0.9375,0.9375,0.937499995,0.8823529411764706,0.8823529411764706,0.8823529361764706,0.9375,0.9375,0.937499995,0.99,0.95,en
this is both worrying and surprising.,denne iagttagelse er både advarende og forbavsende.,Remove Token,this both worrying and surprising.,"(0.95, 0.95)",0.6434588841607617,0.8535,1.0,0.8333333333333334,0.9090909041322316,0.75,0.6,0.6666666617283951,1.0,0.8333333333333334,0.9090909041322316,0.95,0.95,en
"although the presentation of the resolution is very recent, it may be slightly out of date.","skønt beslutningsforslaget er meget frisk, har det nok nogle forsinkelser.",Swap characters,"although the presentation of the resolution is very recent, it may be slightly out of dtae.","(0.95, 0.99)",0.8915993127600096,0.9437,0.9285714285714286,0.9285714285714286,0.9285714235714286,0.9333333333333332,0.9333333333333332,0.9333333283333336,0.9285714285714286,0.9285714285714286,0.9285714235714286,0.95,0.99,en
"according to my information, finland has committed half the appropriation it got for this year's objective 6 programme.","efter hvad jeg ved, er det halve af dette års bundne finansbevillinger bundet i finland.",Replace Character,"according to my information, finland has committed ialf the appropriation it got for this year's objective 6 programme.","(0.95, 0.99)",0.8656030552541708,0.9519,0.9444444444444444,0.9444444444444444,0.9444444394444445,0.8823529411764706,0.8823529411764706,0.8823529361764706,0.9444444444444444,0.9444444444444444,0.9444444394444445,0.95,0.99,en
the employment situation in europe is alarmingly fragile.,europas beskæftigelsessituation er alarmerende dårlig.,Swap words,the employment situation in is europe alarmingly fragile. ,"(0.95, 0.99)",0.4596613576124592,0.9561,0.8888888888888888,1.0,0.9411764656055364,0.5,0.5714285714285714,0.5333333283555556,0.7777777777777778,0.875,0.823529406782007,0.95,0.99,en
"mr president, mr van den broek.","hr. formand, kære hr. van den broek!",Duplicate character,"mr prresident, mr van den broek.","(0.95, 0.98)",0.7071067811865475,0.8648,0.8,0.8,0.7999999950000002,0.6,0.6,0.5999999950000001,0.8,0.8,0.7999999950000002,0.95,0.98,en
"we made ecu 15 million available for 'europe for sarajevo' in 1997, of which ecu 623, 000 had been implemented by august.","vi har stillet ecu 15 millioner til rådighed for »europa for sarajevo« for 1997, og 623.000 er blevet anvendt frem til august.",Duplicate Token,"we made ecu 15 million available for 'europe for sarajevo' in 1997, of which ecu 623, 000 had been implemented by by august.","(0.99, 0.99)",0.9306757101384976,0.9959,1.0,1.0,0.999999995,0.9545454545454546,1.0,0.976744181049216,1.0,1.0,0.999999995,0.99,0.99,en
"so in the first place for me enlargement is an institutional debate, but in addition it is a fact that we must prepare ourselves for the financing of the european union after enlargement.","udvidelsen er således for mig i første instans en institutionel debat, men derudover er det selvfølgelig rigtigt, at vi skal forberede os på finansieringen af europa efter udvidelsen.",Remove Token,"so in the first place for me is an institutional debate, but in addition it is a fact that we must prepare ourselves for the financing of the european union after enlargement.","(0.98, 0.95)",0.9234732618882052,0.9741,1.0,1.0,0.999999995,0.967741935483871,0.9375,0.952380947382212,1.0,1.0,0.999999995,0.98,0.95,en
"in this connection a central feature is of course a more rational structural policy that cannot harm the underestimated, in my view, redistribution function that europe now already has and which is a good thing.","i den forbindelse er det centrale emne en rationel strukturpolitik, der ikke reducerer den efter min mening undervurderede omfordelingsfunktion, som europa allerede har, og som er en god ting.",Negation,"in this connection a central feature is of course a more rational structural policy that can harm the underestimated, in my view, redistribution function that europe now already has and which is a good thing.","(0.95, 0.99)",0.931838481115484,0.9768,0.9666666666666668,0.9666666666666668,0.9666666616666668,0.9411764705882352,0.9411764705882352,0.9411764655882354,0.9666666666666668,0.9666666666666668,0.9666666616666668,0.95,0.99,en
"may i mention, in parentheses, that the first snows already fell in northern sweden last week bringing 20 centimetres of snow.","i parentes kan jeg nævne, at den første sne allerede er faldet i det nordlige sverige, hvor det blev til 20 centimeter sne.",Duplicate character,"may ii mention, in parentheses, that the first snows already fell in northern sweden last week bringing 20 centimetres of snow.","(0.99, 0.99)",0.9210589320522864,0.958,0.95,0.95,0.949999995,0.9,0.9,0.899999995,0.95,0.95,0.949999995,0.99,0.99,en
"the execution of the budget as a whole at the end of september exceeds the level of previous years, in particular with regard to payment appropriations.","gennemførelsen af budgettet som helhed ved udgangen af september overskrider de tidligere års niveau, især med hensyn til betalingsbevillinger.",Swap words,"the execution of the budget a as whole at the end of september exceeds the level of previous years, in particular with regard to payment appropriations. ","(0.99, 0.99)",0.8807379283931852,0.9985,0.9545454545454546,1.0,0.976744181049216,0.8461538461538461,0.88,0.862745093041138,0.9090909090909092,0.9523809523809524,0.9302325531422392,0.99,0.99,en
"as far as the questions from mr virrankoski and mr holm on the execution of objective 6 are concerned, it looks very likely that the funds will be fully used by the end of the year.","hvad angår spørgsmålene fra hr. virrankoski og hr. holm om gennemførelsen af mål 6, er det meget sandsynligt, at midlerne vil være fuldt udnyttet inden udgangen af året.",Swap words,"as far as the questions from mr virrankoski and mr holm on the execution of objective are 6 concerned, it looks very likely that the funds will be fully used by the end of the year. ","(0.99, 0.95)",0.91473325950086,0.9994,0.9666666666666668,1.0,0.9830508424590636,0.8888888888888888,0.9142857142857144,0.9014084457052172,0.9333333333333332,0.9655172413793104,0.949152537374318,0.99,0.95,en
our information points in that direction.,vores oplysninger peger i den retning.,Remove Character,our information oints in that direction.,"(0.95, 0.95)",0.488923022434901,0.8413,0.8333333333333334,0.8333333333333334,0.8333333283333335,0.6,0.6,0.5999999950000001,0.8333333333333334,0.8333333333333334,0.8333333283333335,0.95,0.95,en
"in fact, within the sphere of new international relations, an agreement between europe and canada may be useful in bringing the necessary equilibrium to this complex of transatlantic relationships.",netop som led i de nye internationale forbindelser kan en forståelse mellem europa og canada være af betydning for ligevægten i de transatlantiske forbindelser som helhed.,Add random word,"in fact, within the sphere of new international relations, an agreement between europe and canada may be supposing useful in bringing the necessary equilibrium to this complex of transatlantic relationships.","(0.95, 0.98)",0.9194353966999144,0.9968,0.9629629629629628,1.0,0.9811320704734782,0.9310344827586208,0.9642857142857144,0.9473684160541708,0.9629629629629628,1.0,0.9811320704734782,0.95,0.98,en
