originalSentence,referenceSentence,tamperingType,tamperedSentence,"LLMScore (Sim, Con)",BLEU,METEOR,Rouge1 r,Rouge1 p,Rouge1 f,Rouge2 r,Rouge2 p,Rouge2 f,Rougel r,Rougel p,Rougel f,LLM-Sim,LLM-Con,originalLanguage
"derefter kan han eventuelt imødese ophævelse af sanktionerne, men ikke før.","after that he may be able to a look forward to the sanctions being lifted, but not before.",Negation,"derefter kan han eventuelt imødese ophævelse af sanktionerne, men før.","(0.95, 0.95)",0.7910665071754358,0.9281,1.0,0.9090909090909092,0.9523809473922904,0.8888888888888888,0.8,0.8421052581717452,1.0,0.9090909090909092,0.9523809473922904,0.95,0.95,da
"hr. formand, den midlertidige løsning, der tilsyneladende er fundet på krisen mellem irak og usa, har i sidste øjeblik afværget en langt alvorligere krise for det irakiske folk, nemlig vedvarende bombning fra luften og missilangreb fra usa's væbnede styrker.","mr president, at the eleventh hour the apparent temporary solution to the iraqi/united states crisis has avoided a tragedy of major dimensions for the iraqi people, that is, a prolonged air bombing and missile offensive by the united states armed forces.",Replace Character,"hr. formand, den midlertidige løsning, der tilsyneladende er fundet på krisen mellem irak og usa, har i sidste øjeblik afværget en langt alvorligere krise for det irakiske folk, nemlig vedvarende bombning fra luften og missilangreb fra usa's væbnede styøker.","(0.99, 0.95)",0.9604077584115636,0.9782,0.972972972972973,0.972972972972973,0.9729729679729732,0.9736842105263158,0.9736842105263158,0.973684205526316,0.972972972972973,0.972972972972973,0.9729729679729732,0.99,0.95,da
i denne side af parlamentet har vi ingen sympati for diktatoren i baghdad og hans desperate spil med befolkningens liv.,on this side of the house we nurture no sympathy for the baghdad dictator and his desperate gambles with the lives of his people.,Replace Token with Random Word,i denne side af parlamentet har vi ingen sympati for parasit i baghdad og hans desperate spil med befolkningens liv.,"(0.90, 0.95)",0.8656030552541708,0.9519,0.9473684210526316,0.9473684210526316,0.9473684160526316,0.8947368421052632,0.8947368421052632,0.8947368371052632,0.9473684210526316,0.9473684210526316,0.9473684160526316,0.90,0.95,da
"hr. formand, jeg bifalder kommissær van den broeks indledende bemærkning om, at dette er en sag for fn, så dette er ikke nødvendigvis det rigtige forum.","mr president, i welcome commissioner van den broek's opening remark that this is a un matter and this is not necessarily the most appropriate forum.",Negation,"hr . formand, jeg bifalder kommissær van den broeks indledende bemærkning om, at dette er en sag for fn, så dette er nødvendigvis det rigtige forum.","(0.95, 0.95)",0.9127592114472296,0.9707,1.0,0.9583333333333334,0.9787233992575828,0.9565217391304348,0.9166666666666666,0.9361702077682208,1.0,0.9583333333333334,0.9787233992575828,0.95,0.95,da
"hvis vi ønsker, at usa fortsat skal vise interesse for vores sikkerhedsproblemer, kunne man endnu en gang gøre det klart, at vi i en given kritisk situation føler solidaritet over for amerikanerne.","if we want the usa to show a continuing interest in our security problems, we should make it clear once more that we feel ourselves to be in a rather critical position vis a vis solidarity with america.",Duplicate character,"hvis vi ønsker, at usa fortsat skal vise interesse for vores sikkerrhedsproblemer, kunne man endnu en gang gøre det klart, at vi i en given kritisk situation føler solidaritet over for amerikanerne.","(1.00, 1.00)",0.9257518071011758,0.9721,0.9642857142857144,0.9642857142857144,0.9642857092857144,0.935483870967742,0.935483870967742,0.935483865967742,0.9642857142857144,0.9642857142857144,0.9642857092857144,1.00,1.00,da
"for det andet er jeg enig med dem, der har udtalt, at det i første omgang er medlemmerne af sikkerhedsrådet, der har ansvaret.","secondly, i agree with those who have said that this is first and foremost a responsibility for the members of the security council.",Add random word,"for det andet er jeg enig med dem løs, der har udtalt, at det i første omgang er medlemmerne af sikkerhedsrådet, der har ansvaret.","(0.99, 0.95)",0.9038693388414086,0.9961,0.9,0.9473684210526316,0.9230769180802104,0.8636363636363636,0.9047619047619048,0.8837209252352624,0.9,0.9473684210526316,0.9230769180802104,0.99,0.95,da
"offeret skal vide, at der også da et sted på jorden findes en instans, som kan udøve retfærdighed, og som, i hvert fald bagefter, kan gengive offeret, det lidende menneske, dets værdighed og straffe den skyldige.","the victim should know that even then there is, somewhere on earth, a court which can administer justice and which can restore to the suffering victim his dignity and punish the guilty party.",Replace Character,"offeret skal vide, at der også da et sted på jorden findes en instans, som kan udøve retfæjdighed, og som, i hvert fald bagefter, kan gengive offeret, det lidende menneske, dets værdighed og straffe den skyldige.","(1.00, 1.00)",0.940028651976138,0.9772,0.9705882352941176,0.9705882352941176,0.9705882302941176,0.9428571428571428,0.9428571428571428,0.942857137857143,0.9705882352941176,0.9705882352941176,0.9705882302941176,1.00,1.00,da
"derfor er jeg helt enig i dette forslag, og det er min gruppe også, selvom der naturligvis er en række problemer.","for that reason i fully support this motion, as does my group, even though there are obviously several problems.",Swap characters,"derfor er jeg helt enig i dette forslag, og det er min gruppe også, selvom dre naturligvis er en række problemer.","(0.99, 0.99)",0.8843865924896842,0.958,0.9473684210526316,0.9473684210526316,0.9473684160526316,0.9,0.9,0.899999995,0.9473684210526316,0.9473684210526316,0.9473684160526316,0.99,0.99,da
"men lad gå, det er et paradoks, som nu engang findes.","whatever the reason, that is a contradiction that does happen.",Swap words,"men lad gå, det er et paradoks, nu som engang findes. ","(0.95, 0.95)",0.7272454093000141,0.9883,0.9166666666666666,1.0,0.9565217341398866,0.6363636363636364,0.7,0.6666666616780046,0.8333333333333334,0.9090909090909092,0.8695652124007562,0.95,0.95,da
"jeg er ikke enig i den seneste afgørelse om, at en kroatisk minister ikke engang har pligt til at udtale sig.",i do not entirely agree either with the most recent decision that a croat minister is not even obliged to give evidence.,Negation,"jeg er enig i den seneste afgørelse om, at en kroatisk minister engang har pligt til at udtale sig.","(0.85, 0.95)",0.7674174160136337,0.9197,1.0,0.9473684210526316,0.9729729679766254,0.8888888888888888,0.8,0.8421052581717452,1.0,0.9473684210526316,0.9729729679766254,0.85,0.95,da
"i beslutningen tales der om den fremgang, der er opnået ved ad hoc-krigsforbryderdomstolene vedrørende jugoslavien og rwanda.",the resolution mentions the progress which has been made with the ad-hoc tribunals on yugoslavia and rwanda.,Duplicate Token,"i beslutningen tales der om den fremgang, der er opnået opnået ved ad hoc-krigsforbryderdomstolene vedrørende jugoslavien og rwanda.","(1.00, 1.00)",0.903778850827967,0.9942,1.0,1.0,0.999999995,0.9411764705882352,1.0,0.9696969647015612,1.0,1.0,0.999999995,1.00,1.00,da
"hr. formand, amerikanerne har allerede indtaget en reserveret holdning hertil.","well, mr president, america has already lodged a waiver on this.",Add random word,"hr . formand, amerikanerne har allerede indtaget en dele reserveret holdning hertil.","(0.95, 0.9)",0.7881929718099911,0.9906,0.9090909090909092,1.0,0.9523809473922904,0.8,0.8888888888888888,0.8421052581717452,0.9090909090909092,1.0,0.9523809473922904,0.95,0.9,da
"og så også spørgsmålet om, hvem der fanger, hvornår og hvordan morderne?","and then there is the question of who will arrest these murderers, and when and how?",Replace Token with Random Word,"og honning også spørgsmålet om, hvem der fanger, hvornår og hvordan morderne?","(0.95, 0.95)",0.8666415730847504,0.932,0.9090909090909092,0.9090909090909092,0.9090909040909092,0.8181818181818182,0.8181818181818182,0.8181818131818183,0.9090909090909092,0.9090909090909092,0.9090909040909092,0.95,0.95,da
"vi er i starten af en proces, der skal udarbejdes, udmærket, men lad det i hvert tilfælde aldrig blive til en domstol, som er sejrherrens domstol.","we are at the start of a process which needs to be developed, fine, but let it never become a court which is just a victor's court.",Add random word,"vi er i starten af en proces, der skal udarbejdes, udmærket, men lad det i hvert tilfælde aldrig blive til tejne en domstol, som er sejrherrens domstol.","(0.95, 0.95)",0.9167409308877168,0.9967,0.9583333333333334,1.0,0.9787233992575828,0.9230769230769232,0.96,0.9411764655901576,0.9583333333333334,1.0,0.9787233992575828,0.95,0.95,da
"til sidst, hr. formand, mener jeg, at den grundlæggende motivation for vores støtte til oprettelsen af en international domstol egentlig er den samme, som også lå til grund for vores støtte til ad hoc-krigsforbryderdomstolene.","to conclude, mr president, i think that the basic motivation behind our support for the establishment of an international court is in fact the same as the motivation behind our support for the creation of ad-hoc tribunals.",Swap words,"til sidst, hr. formand, mener jeg, at den grundlæggende motivation for vores støtte til oprettelsen af en international domstol egentlig er den samme, som også lå til grund for støtte vores til ad hoc-krigsforbryderdomstolene. ","(0.95, 0.95)",0.9193277448516328,0.9995,0.9642857142857144,1.0,0.9818181768198349,0.8823529411764706,1.0,0.9374999950195312,0.9642857142857144,1.0,0.9818181768198349,0.95,0.95,da
næste punkt på dagsordenen er forhandling under ét om følgende beslutningsforslag:,the next item is the joint debate on the following motions for resolutions:,Remove Token,næste punkt på dagsordenen er forhandling under ét følgende beslutningsforslag:,"(0.95, 0.9)",0.7348889200874658,0.9216,1.0,0.9090909090909092,0.9523809473922904,0.8888888888888888,0.8,0.8421052581717452,1.0,0.9090909090909092,0.9523809473922904,0.95,0.9,da
b4-0937/97 af bertens m.fl. for eldr-gruppen om togo; -b4-0949/97 af chanterie m.fl. for ppe-gruppen om situationen i togo; -b4-0952/97 af pettinari for gue/ngl-gruppen om situationen i togo; -b4-0988/97 af scarbonchi m.fl. for are-gruppen om situationen i togo.,"b4-0937/97 by mr bertens and others, on behalf of the group of the european liberal, democratic and reformist party, on togo; -b4-0949/97 by mr chanterie and others, on behalf of the group of the european people's party, on the situation in togo; -b4-0952/97 by mr pettinari, on behalf of the confederal group of the european united left - nordic green left, on the situation in togo; -b4-0988/97 by mr scarbonchi and others, on behalf of the group of the european radical alliance, on the situation in togo.",Replace Token with Random Word,b4-0937/97 af bertens m.fl . for eldr-gruppen om togo; -b4-0949/97 af chanterie m.fl . for ppe-gruppen om situationen i togo; -b4-0952/97 af pettinari for gue/ngl-gruppen om situationen i togo; -b4-0988/97 af scarbonchi fag . for are-gruppen om situationen i togo.,"(0.98, 0.95)",0.940028651976138,0.9759,0.9545454545454546,1.0,0.976744181049216,0.935483870967742,0.9666666666666668,0.9508196671324912,0.9545454545454546,1.0,0.976744181049216,0.98,0.95,da
"nu foreligger den rapport fra to europæiske eksperter, som er udarbejdet med henblik på valgforberedelsen.",the report by the two european experts on preparations for elections has now been presented.,Swap words,"nu foreligger den rapport fra to europæiske eksperter, er som udarbejdet med henblik på valgforberedelsen. ","(0.95, 0.95)",0.7867012086133773,0.9935,0.9375,1.0,0.967741930489074,0.7333333333333333,0.7857142857142857,0.7586206846611178,0.875,0.9333333333333332,0.903225801456816,0.95,0.95,da
"hr. formand, jeg tager kun ordet i denne forhandling, fordi jeg er forundret både personligt og på vegne af min gruppe over, at emnet togo er blevet opført til forhandling under den aktuelle og uopsættelige debat.","mr president, i would like to express my surprise, both personally and on behalf of my group, that the situation in togo appears among the urgent debates.",Replace Token with Random Word,"hr . formand, jeg tager kun ordet i denne forhandling, fordi jeg er forundret både personligt og på vegne af min gruppe over, såh emnet togo er blevet opført til forhandling under den aktuelle og uopsættelige debat.","(0.99, 0.95)",0.935369573102062,0.9755,0.9696969696969696,0.9696969696969696,0.96969696469697,0.9428571428571428,0.9428571428571428,0.942857137857143,0.9696969696969696,0.9696969696969696,0.96969696469697,0.99,0.95,da
"han talte med ngo-ledere, journalister og almindelige mennesker i togo.","he met leaders of ngos, journalists and ordinary people in togo.",Remove Token,"han talte med ngo-ledere, journalister almindelige mennesker i togo.","(0.99, 0.95)",0.7348889200874658,0.9216,1.0,0.9,0.947368416066482,0.875,0.7777777777777778,0.823529406782007,1.0,0.9,0.947368416066482,0.99,0.95,da
togo er på vej ud af en vanskelig politisk og økonomisk situation.,togo is emerging from a difficult political and economic situation.,Duplicate character,togo er på vej ud af en vanskelig politisk og økonomisk situaation.,"(1.00, 1.00)",0.842362674378975,0.9209,0.9166666666666666,0.9166666666666666,0.9166666616666668,0.9090909090909092,0.9090909090909092,0.9090909040909092,0.9166666666666666,0.9166666666666666,0.9166666616666668,1.00,1.00,da
"fru formand, den 20. marts i bruxelles præciserede jeg på vegne af upe-gruppen, at lomékonventionens særlige kendetegn var den partnerskabskontrakt, som den tilbyder, og som burde gives nye impulser i den politiske dialog, så vores bestræbelser kunne blive mere effektive.","madam president, on 20 march in brussels, i indicated on behalf of the group union for europe that the particular features of the lomé convention were to be found largely in the contractual framework which it offers to the partnership and that this must be revitalized within the domain of political dialogue to ensure that our action is more effective.",Duplicate Token,"fru formand, den 20. marts marts i bruxelles præciserede jeg på vegne af upe-gruppen, at lomékonventionens særlige kendetegn var den partnerskabskontrakt, som den tilbyder, og som burde gives nye impulser i den politiske dialog, så vores bestræbelser kunne blive mere effektive.","(0.99, 0.99)",0.9613723133131156,0.9978,1.0,1.0,0.999999995,0.975,1.0,0.9873417671526998,1.0,1.0,0.999999995,0.99,0.99,da
"upe-gruppen har altid ment, at bistandspolitikken måtte forholde sig til respekten for menneskerettighederne og demokratiet, men beklager, at bestemte politiske grupper opfordrer parlamentet til at sætte spørgsmålstegn ved en afstemning, som vi selv har deltaget i.","the group union for europe has always held that development aid is dependent on respect for human rights and democracy, but regrets that certain political groups demand that our parliament questions the result of a vote to which we contributed.",Replace Character,"upe-gruppen har altid ment, at bistandspblitikken måtte forholde sig til respekten for menneskerettighederne og demokratiet, men beklager, at bestemte politiske grupper opfordrer parlamentet til at sætte spørgsmålstegn ved en afstemning, som vi selv har deltaget i.","(1.00, 1.00)",0.935369573102062,0.9755,0.96875,0.96875,0.968749995,0.9428571428571428,0.9428571428571428,0.942857137857143,0.96875,0.96875,0.968749995,1.00,1.00,da
"at stemme en resolution igennem nu, som har omtrent samme indhold, ville sende signaler om miskreditering af avs-landene og avs-delegationen.",to now vote through a resolution that has virtually the same content would signal discredit of the acp states and the acp delegation.,Add random word,"at stemme en resolution stadig igennem nu, som har omtrent samme indhold, ville sende signaler om miskreditering af avs-landene og avs-delegationen.","(0.98, 0.95)",0.8862476419965991,0.9953,0.9523809523809524,1.0,0.9756097511005354,0.9,0.9473684210526316,0.9230769180802104,0.9523809523809524,1.0,0.9756097511005354,0.98,0.95,da
afstemningen finder sted kl. 17.30.,voting will take place at 5.30 p.m.,Remove Token,afstemningen finder sted . 17.30.,"(0.95, 0.95)",8.444843264428189e-78,0.8535,1.0,0.8333333333333334,0.9090909041322316,0.75,0.6,0.6666666617283951,1.0,0.8333333333333334,0.9090909041322316,0.95,0.95,da
næste punkt på dagsordenen er forhandling under ét om følgende beslutningsforslag:,the next item is the joint debate on the following resolutions:,Replace Token with Random Word,næste punkt på dagsordenen er forhandling under føre om følgende beslutningsforslag:,"(0.95, 0.95)",0.7348889200874658,0.9139,0.9090909090909092,0.9090909090909092,0.9090909040909092,0.8,0.8,0.7999999950000002,0.9090909090909092,0.9090909090909092,0.9090909040909092,0.95,0.95,da
kommissionen - og det beklager jeg at måtte sige - vil tydeligvis dæmpe denne affære ned.,"i am sorry to have to say it, but the commission obviously wants to stifle the whole affair.",Swap characters,kommissionen - og det beklager jge at måtte sige - vil tydeligvis dæmpe denne affære ned.,"(0.99, 0.99)",0.8282477531331041,0.9403,0.9333333333333332,0.9333333333333332,0.9333333283333336,0.8666666666666667,0.8666666666666667,0.8666666616666667,0.9333333333333332,0.9333333333333332,0.9333333283333336,0.99,0.99,da
"tohundredehalvtreds millioner børnearbejdere, tusindvis af udnyttede børn, børn, der terroriseres af krige eller tvangsindskrives, hvortil skal lægges alle de børn, der i den vestlige verden udsættes for de groveste mishandlinger.","two hundred and fifty million children are at work, thousands of children exploited, terrorized by war, if not dragooned, and we must also add the children in the western world who suffer terrible abuse.",Swap characters,"tohundredehalvtreds millioner børnearbejdeer, tusindvis af udnyttede børn, børn, der terroriseres af krige eller tvangsindskrives, hvortil skal lægges alle de børn, der i den vestlige verden udsættes for de groveste mishandlinger.","(0.99, 0.99)",0.9336312563108614,0.9721,0.96,0.96,0.959999995,0.9285714285714286,0.9285714285714286,0.9285714235714286,0.96,0.96,0.959999995,0.99,0.99,da
kravene om demokrati og udvikling burde have fået os til at insistere på mere uddannelse og længere skoletid.,democracy and development ought to have led to more education and a prolongation of the duration of schooling.,Replace Character,kravene om demokrati og udvikling burde have fået os til ct insistere på mere uddannelse og længere skoletid.,"(0.98, 0.99)",0.8492326635760689,0.9467,0.9411764705882352,0.9411764705882352,0.9411764655882354,0.8823529411764706,0.8823529411764706,0.8823529361764706,0.9411764705882352,0.9411764705882352,0.9411764655882354,0.98,0.99,da
"det skal naturligvis også gælde for børnene i vuggestuen clovis, hvor et barn af en af mine medarbejdere bliver passet.","that must also apply, of course, to children in the clovis nursery, to which a child of one of my assistants belongs.",Duplicate character,"det skal naturligvis også gælde for børnene i vuggestuen clovis, hvor et barn af en af mine meedarbejdere bliver passet.","(0.99, 0.99)",0.8725129388059689,0.9541,0.9473684210526316,0.9473684210526316,0.9473684160526316,0.8947368421052632,0.8947368421052632,0.8947368371052632,0.9473684210526316,0.9473684210526316,0.9473684160526316,0.99,0.99,da
"denne forbrydelses ophavsmænd er tre personer, der er kendetegnet ved at stå dyrenes instinktive natur nærmere end menneskene; tre mennesker, der skjulte deres foragtelige tilstand og perversioner under en facade af social respektabilitet.","three people were responsible for the crime, with instincts more bestial than human; three people who hid their baseness and perversion behind a facade of social respectability.",Remove Token,"denne forbrydelses ophavsmænd er tre personer, der er kendetegnet ved at stå dyrenes instinktive natur nærmere end menneskene; tre mennesker, der skjulte foragtelige tilstand og perversioner under en facade af social respektabilitet.","(0.99, 0.99)",0.9278982724420874,0.9755,1.0,0.9666666666666668,0.9830508424590636,0.967741935483871,0.9375,0.952380947382212,1.0,0.9666666666666668,0.9830508424590636,0.99,0.99,da
"det er et godt folk, som i historiens løb har lidt meget, og som alligevel står ved sin tro og sit fædreland.","they are good people who have suffered a great deal throughout their history, and yet still believe in their faith and their homeland.",Swap words,"det er et godt folk, som i historiens løb har lidt og meget, som alligevel står ved sin tro og sit fædreland. ","(0.95, 0.95)",0.8400642554861188,0.998,0.9523809523809524,1.0,0.9756097511005354,0.8181818181818182,0.8571428571428571,0.8372092973282856,0.9523809523809524,1.0,0.9756097511005354,0.95,0.95,da
journalisterne i landet er meget ængstelige.,journalists in the country are very anxious.,Replace Character,journalisterne i landeb er meget ængstelige.,"(0.95, 0.99)",0.488923022434901,0.8413,0.8333333333333334,0.8333333333333334,0.8333333283333335,0.6,0.6,0.5999999950000001,0.8333333333333334,0.8333333333333334,0.8333333283333335,0.95,0.99,da
"men for denne gang vil også jeg på min gruppes vegne sige, at vi trækker vores underskrift tilbage og tillige vil forholde os i overensstemmelse dermed i tilfælde af en afstemning.","on this occasion, however, i should like to say on behalf of my group that we shall withhold our signatures and also vote accordingly.",Duplicate Token,"men for denne gang vil også jeg på min gruppes vegne sige, at vi trækker vores underskrift tilbage og og tillige vil forholde os i overensstemmelse dermed i tilfælde af en afstemning.","(1.00, 1.00)",0.945776776063842,0.9969,1.0,1.0,0.999999995,0.967741935483871,1.0,0.983606552378393,1.0,1.0,0.999999995,1.00,1.00,da
samtidig er en bondeleder ved navn romeo cortes og en lokal leder ved navn gaudencio devaras blevet bortført af medlemmer af de væbnede styrker.,"simultaneously one of the farmers' leaders, one romeo cortez, and gaudencio devaras, chairman of a community, have been kidnapped by the military.",Remove Token,samtidig er en bondeleder ved navn romeo cortes og en lokal leder ved navn gaudencio devaras blevet bortført af medlemmer de væbnede styrker.,"(1.00, 1.00)",0.8895260356363631,0.9616,1.0,1.0,0.999999995,0.9523809523809524,0.9090909090909092,0.9302325531422392,1.0,1.0,0.999999995,1.00,1.00,da
forhandlingen under ét er afsluttet.,the debate is closed.,Replace Character,forhandliwgen under ét er afsluttet.,"(0.99, 0.99)",0.7598356856515925,0.83,0.8,0.8,0.7999999950000002,0.75,0.75,0.749999995,0.8,0.8,0.7999999950000002,0.99,0.99,da
"erfaringer fra algeriet og ægypten viser, at undertrykkelse ikke er løsningen på andre religiøse trosretninger.",experiences in algeria and egypt show that suppression is not the answer to differing religious beliefs.,Negation,"erfaringer fra algeriet og ægypten viser, at undertrykkelse er løsningen på andre religiøse trosretninger.","(0.95, 0.99)",0.8282477531331041,0.9458,1.0,0.9333333333333332,0.9655172363852556,0.9230769230769232,0.8571428571428571,0.8888888838957477,1.0,0.9333333333333332,0.9655172363852556,0.95,0.99,da
"i 1977 var der ca. 100.000, i dag er det allerede et syvcifret tal.","in 1977 there were about 100, 000, and today the number already runs into seven figures.",Swap characters,"i 1977 var der ca. 100.000, i dag er det alelrede et syvcifret tal.","(1.00, 1.00)",0.8282477531331041,0.9403,0.9285714285714286,0.9285714285714286,0.9285714235714286,0.8571428571428571,0.8571428571428571,0.8571428521428571,0.9285714285714286,0.9285714285714286,0.9285714235714286,1.00,1.00,da
"bemærk, at det ikke var »kendskab«, men »forudsigeligt kendskab «, et meget underligt skyldbegreb efter vores retsmålestok.","note, not 'knowledge' but 'foreseeable knowledge ' - a very peculiar notion indeed of guilt by our standards of justice.",Negation,"bemærk, at det var » kendskab «, men » forudsigeligt kendskab «, et meget underligt skyldbegreb efter vores retsmålestok.","(0.99, 0.95)",0.8843865924896842,0.962,0.875,0.8235294117647058,0.84848484348944,0.5882352941176471,0.625,0.6060606010651974,0.875,0.8235294117647058,0.84848484348944,0.99,0.95,da
"i den lange periode, hun har været i fængsel, er hun blevet opereret to gange for livmoderkræft.",during her long detention she has been operated on twice for cancer of the uterus.,Replace Character,"i den lange periodk, hun har været i fængsel, er hun blevet opereret to gange for livmoderkræft.","(0.99, 0.99)",0.8578928092681435,0.9494,0.9333333333333332,0.9333333333333332,0.9333333283333336,0.875,0.875,0.874999995,0.9333333333333332,0.9333333333333332,0.9333333283333336,0.99,0.99,da
