originalSentence,referenceSentence,tamperingType,tamperedSentence,"LLMScore (Sim, Con)",BLEU,METEOR,Rouge1 r,Rouge1 p,Rouge1 f,Rouge2 r,Rouge2 p,Rouge2 f,Rougel r,Rougel p,Rougel f,LLM-Sim,LLM-Con,originalLanguage
"thank you very much, mr commissioner.","mange tak, hr. kommissær.",Replace Token with Random Word,"thank halysites very much, mr commissioner.","(0.90, 0.95)",0.7071067811865475,0.8648,0.8333333333333334,0.8333333333333334,0.8333333283333335,0.6,0.6,0.5999999950000001,0.8333333333333334,0.8333333333333334,0.8333333283333335,0.90,0.95,en
fourth annual report of the sme observatory,4. årsberetning fra det europæiske observationscenter for smv,Remove Token,fourth report of the sme observatory,"(0.95, 0.98)",0.6434588841607617,0.8535,1.0,0.8571428571428571,0.9230769181065088,0.8,0.6666666666666666,0.7272727223140496,1.0,0.8571428571428571,0.9230769181065088,0.95,0.98,en
"the next item is the report (a4-0245/97) by mr torres couto, on behalf of the committee on economic and monetary affairs and industrial policy, on the fourth annual report of the european observatory for smes (1996) (c4-0292/97).","næste punkt på dagsordenen er forhandling om betænkning (a4-0245/97) af torres couto for udvalget om økonomi, valutaspørgsmål og industripolitik om den fjerde årsberetning fra det europæiske observationscenter for smv - 1996 (c4-0292/97).",Duplicate character,"the next item is the report (a4-0245/97) by mr torres couto, on behalf of the committee on economic and monetary affairs and industrial policy, on the fourth annual report off the european observatory for smes (1996) (c4-0292/97).","(0.99, 0.95)",0.9427781070492712,0.9779,0.9655172413793104,1.0,0.9824561353524162,0.9444444444444444,0.9714285714285714,0.9577464738742314,0.9655172413793104,1.0,0.9824561353524162,0.99,0.95,en
"mr president, the fourth report thus analyzes a large number of areas which are very important to the performance of smes.","den 4. årsberetning analyserer således, hr. formand, et stort antal områder, der er af væsentlig vigtighed for smv'ernes vilkår.",Swap words,"mr the president, fourth report thus analyzes a large number of areas which are very important to the performance of smes. ","(0.98, 0.95)",0.8647939316019191,0.9974,0.95,1.0,0.9743589693622616,0.8095238095238095,0.85,0.8292682876859013,0.95,1.0,0.9743589693622616,0.98,0.95,en
smes are all the more important after the amsterdam council and gordon brown's jobs initiative emphasizing the primacy of smes was included in the final text.,"der lægges endnu mere vægt på smv'erne, efter at amsterdamrådet og gordon browns jobskabelsesinitiativ til fordel for smv'erne er blevet medtaget i den endelige version.",Duplicate Token,smes are all the more important after the amsterdam council and gordon brown's jobs initiative emphasizing the primacy of smes smes was included in the final text.,"(0.99, 0.95)",0.9357893640502224,0.9958,1.0,1.0,0.999999995,0.9615384615384616,1.0,0.9803921518646674,1.0,1.0,0.999999995,0.99,0.95,en
"mr torres couto identifies certain problem areas such as the transfer of enterprises, where 1.5 million smes are at risk.","hr. torres couto påpeger visse problemområder, f.eks. overdragelse af virksomheder, hvor 1, 5 millioner smv'er er i farezonen.",Duplicate Token,"mr torres couto identifies certain problem areas such as the transfer of enterprises, where 1.5 million smes are at risk risk.","(0.99, 0.95)",0.9307219772708406,0.9951,1.0,1.0,0.999999995,0.9523809523809524,1.0,0.9756097511005354,1.0,1.0,0.999999995,0.99,0.95,en
"it is therefore disappointing, as is pointed out by the rapporteur, that the european cooperative statutes have not been established and has the multiannual programme, which was scheduled for 1994/1996.","det er derfor, som ordføreren påpeger, skuffende, at der ikke er indført europæisk samarbejdslovgivning, og at det flerårige arbejdsprogram for 1994/1996 aldrig er blevet vedtaget.",Negation,"it is therefore disappointing, as is pointed out by the rapporteur, that the european cooperative statutes have been established and has the multiannual programme, which was scheduled for 1994/1996.","(0.85, 0.95)",0.9210500207490828,0.9733,1.0,0.9629629629629628,0.9811320704734782,0.9642857142857144,0.9310344827586208,0.9473684160541708,1.0,0.9629629629629628,0.9811320704734782,0.85,0.95,en
this is more than the decayed tories did for small firms throughout the whole period of their sleazy tenancy.,"det er mere, end de forstokkede konservative har gjort for de små virksomheder i hele den periode, hvor de har misligholdt landet.",Swap words,this is more than the decayed did tories for small firms throughout the whole period of their sleazy tenancy. ,"(0.98, 0.95)",0.82459094086255,0.996,0.9473684210526316,1.0,0.9729729679766254,0.7894736842105263,0.8333333333333334,0.8108108058144633,0.8947368421052632,0.9444444444444444,0.9189189139225714,0.98,0.95,en
in the last four years it has managed to perform this task more than adequately.,i de sidste fire år har det mere end løst denne opgave.,Remove Character,in th last four years it has managed to perform this task more than adequately.,"(0.99, 0.99)",0.8761560783209453,0.9364,0.9333333333333332,0.9333333333333332,0.9333333283333336,0.8571428571428571,0.8571428571428571,0.8571428521428571,0.9333333333333332,0.9333333333333332,0.9333333283333336,0.99,0.99,en
"mr president, the approach of the observatory, with its dual structure, is greatly appreciated in our group.","hr. formand, i vores gruppe sætter vi meget stor pris på observationscenteret med dets todelte struktur.",Duplicate Token,"mr president president, the approach of the observatory, with its dual structure, is greatly appreciated in our group.","(0.99, 0.99)",0.9273488558828634,0.9948,0.9411764705882352,1.0,0.9696969647015612,0.8823529411764706,0.9375,0.9090909040955004,0.9411764705882352,1.0,0.9696969647015612,0.99,0.99,en
for me that is not really surprising as women always have responsibility and want to and dare to take it.,"det overrasker mig ikke, fordi kvinder altid har været villige til at tage et ansvar.",Negation,for me that is really surprising as women always have responsibility and want to and dare to take it.,"(0.95, 0.95)",0.8656030552541708,0.9565,1.0,0.9444444444444444,0.9714285664326532,0.9444444444444444,0.8947368421052632,0.9189189139225714,1.0,0.9444444444444444,0.9714285664326532,0.95,0.95,en
it seems a bit centralistic to me.,det virker lidt centralistisk.,Replace Token with Random Word,placoderm seems a bit centralistic to me.,"(0.85, 0.95)",0.8408964152537145,0.8737,0.8571428571428571,0.8571428571428571,0.8571428521428571,0.8333333333333334,0.8333333333333334,0.8333333283333335,0.8571428571428571,0.8571428571428571,0.8571428521428571,0.85,0.95,en
i am pleased that the fourth annual report devotes a full study to women and small and medium-sized enterprises.,"det glæder mig, at den 4. årsberetning indeholder en hel undersøgelse om kvinder og de små og mellemstore virksomheder.",Replace Token with Random Word,i am pleased that the fourth annual report divagated a full study to women and small and medium-sized enterprises.,"(0.85, 0.95)",0.8578928092681435,0.9494,0.9444444444444444,0.9444444444444444,0.9444444394444445,0.8888888888888888,0.8888888888888888,0.888888883888889,0.9444444444444444,0.9444444444444444,0.9444444394444445,0.85,0.95,en
"secondly, the financing of the smes.",for det andet finansieringen af smv.,Swap characters,"secnodly, the financing of the smes.","(0.99, 0.95)",0.8408964152537145,0.8737,0.8,0.8,0.7999999950000002,0.8,0.8,0.7999999950000002,0.8,0.8,0.7999999950000002,0.99,0.95,en
the elise programme was a good project in terms of providing great leverage.,elise-programmet var et godt projekt på grund af dets store løftestangseffekt.,Duplicate Token,the elise programme was a good project in terms of providing great leverage leverage.,"(0.95, 0.95)",0.8895772219579708,0.9915,1.0,1.0,0.999999995,0.9230769230769232,1.0,0.959999995008,1.0,1.0,0.999999995,0.95,0.95,en
here we have the potential for job creation.,her har vi jobskabelsespotentialet.,Add random word,here we have the potential for kakis job creation.,"(0.95, 0.90)",0.6690484408935986,0.9836,0.8888888888888888,1.0,0.9411764656055364,0.75,0.8571428571428571,0.7999999950222222,0.8888888888888888,1.0,0.9411764656055364,0.95,0.90,en
"at the informal environment council in amsterdam on 18 april last, it was concluded that the sme, apart from being a driving force behind jobs, is also an important cause of environmental pollution.","på den uformelle miljøkonference i amsterdam den 18. april i år konkluderedes det, at smv ud over at skabe job også i høj grad er med til at belaste miljøet.",Swap words,"the at informal environment council in amsterdam on 18 april last, it was concluded that the sme, apart from being a driving force behind jobs, is also an important cause of environmental pollution. ","(0.99, 1.00)",0.9568047953653488,0.9997,0.9696969696969696,1.0,0.984615379616568,0.9090909090909092,0.9375,0.9230769180781064,0.9696969696969696,1.0,0.984615379616568,0.99,1.00,en
the eu backs new enterprise in many ways.,eu støtter nye virksomhedsaktiviteter på mange måder.,Remove Character,the eu backs new enterprise in many was.,"(0.95, 0.99)",0.7506238537503395,0.8819,0.875,0.875,0.874999995,0.8571428571428571,0.8571428571428571,0.8571428521428571,0.875,0.875,0.874999995,0.95,0.99,en
legislators should have regard for their continuance and their important role in job security.,lovgiveren skal sørge for disse virksomheders fortsatte beståen med henblik på deres vigtige rolle for sikringen af arbejdspladser.,Swap words,legislators should have regard for their continuance and their important role job in security. ,"(0.95, 0.98)",0.7760114635728617,0.9905,0.9285714285714286,1.0,0.9629629579698218,0.7142857142857143,0.7692307692307693,0.7407407357475996,0.8571428571428571,0.9230769230769232,0.8888888838957477,0.95,0.98,en
"quite the contrary, i shall demand at the employment summit in luxembourg a marked increase in leonardo funding, because this is exactly what gives currently unemployed young people the means of getting jobs.","man bør gøre lige det modsatte, og med henblik på beskæftigelsestopmødet i luxembourg kræver jeg, at leonardo-midlerne øges væsentligt, fordi de netop giver de unge, som er arbejdsløse på nuværende tidspunkt, mulighed for at få et arbejde.",Duplicate character,"quite the contrary, i shall demand at the employment summit in luxembourg a marked increase in leonardo funding, because this is exactly what gives currently unemployed young people the means of gettting jobs.","(0.99, 1.00)",0.9336312563108614,0.9721,0.9666666666666668,0.9666666666666668,0.9666666616666668,0.9375,0.9375,0.937499995,0.9666666666666668,0.9666666666666668,0.9666666616666668,0.99,1.00,en
it is only now that their full role is beginning to be recognized.,"det er først nu, man begynder at indse deres fulde rolle.",Replace Character,it is only now that their full rqle is beginning to be recognized.,"(0.99, 0.99)",0.7825422900366437,0.9269,0.9166666666666666,0.9166666666666666,0.9166666616666668,0.8333333333333334,0.8333333333333334,0.8333333283333335,0.9166666666666666,0.9166666666666666,0.9166666616666668,0.99,0.99,en
"however, it is not support in the form of more measures and programmes which is needed, but rather the removal of obstacles.","men så er det ikke støtte i form af flere indgreb og programmer, der er brug for, men derimod primært fjernelse af hindringer.",Negation,"however, it is support in the form of more measures and programmes which is needed, but rather the removal of obstacles.","(0.95, 0.98)",0.8895260356363631,0.9636,1.0,0.9473684210526316,0.9729729679766254,0.95,0.9047619047619048,0.9268292632956572,1.0,0.9473684210526316,0.9729729679766254,0.95,0.98,en
"for the first time the observatory's network of small and medium-sized businesses has given this group priority consideration, because they contribute 5 % to employment and constitute 6 % of private businesses.","i første omgang har det europæiske observationscenter for smv hovedsagelig beskæftiget sig med disse kooperative selskaber, gensidige selskaber, foreninger og fonde, som immervæk bidrager med 5 % til beskæftigelsen og har en andel på 6 % i de private virksomheder.",Remove Token,"for the first time the observatory's network of small and medium-sized businesses has given this group priority consideration, they contribute 5% to employment and constitute 6% of private businesses.","(0.99, 0.95)",0.9234732618882052,0.9741,0.92,0.8518518518518519,0.8846153796227811,0.8214285714285714,0.7419354838709677,0.7796610119620799,0.92,0.8518518518518519,0.8846153796227811,0.99,0.95,en
"thank you very much, commissioner.","mange tak, hr. kommissær.",Replace Character,"thank ybu very much, commissioner.","(0.95, 0.99)",0.6434588841607617,0.8413,0.8,0.8,0.7999999950000002,0.5,0.5,0.4999999950000001,0.8,0.8,0.7999999950000002,0.95,0.99,en
this was widened in the committee on agriculture to include equivalent regional organizations also.,dette blev i landbrugsudvalget udvidet til at omfatte tilsvarende regionale organisationer.,Remove Token,this was widened in the committee on to include equivalent regional organizations also.,"(0.95, 0.95)",0.8003203203844999,0.9382,1.0,0.9285714285714286,0.9629629579698218,0.9166666666666666,0.8461538461538461,0.879999995008,1.0,0.9285714285714286,0.9629629579698218,0.95,0.95,en
"there was a well known sentence about the conditions concerning egg-laying hens, in 1988.",der er en kendt dom - fra 1988 - om betingelserne vedrørende læggehøner.,Remove Character,"there was a well known sentence about the conditions concerning eg-laying hens, in 1988.","(0.99, 0.95)",0.8153551038173115,0.9364,0.9285714285714286,0.9285714285714286,0.9285714235714286,0.8461538461538461,0.8461538461538461,0.8461538411538462,0.9285714285714286,0.9285714285714286,0.9285714235714286,0.99,0.95,en
"the reason is simply that since this crisis started, there has been a re-shuffle in the hierarchy of legal interests which require protection.","ganske enkelt fordi de juridiske interesser, som skal beskyttes, har ændret plads i hierarkiet efter denne krise.",Duplicate character,"the reason is simply that since this crisis started, there has been a re-shuffle in the hierarrchy of legal interests which require protection.","(1.00, 1.00)",0.8895260356363631,0.9597,0.9545454545454546,0.9545454545454546,0.9545454495454548,0.9090909090909092,0.9090909090909092,0.9090909040909092,0.9545454545454546,0.9545454545454546,0.9545454495454548,1.00,1.00,en
"thank you, mr graefe zu baringdorf.","tak, hr. graefe zu baringdorf.",Remove Character,"thank you, mr graefe zu baingdorf.","(0.95, 0.95)",0.7071067811865475,0.8648,0.8333333333333334,0.8333333333333334,0.8333333283333335,0.8,0.8,0.7999999950000002,0.8333333333333334,0.8333333333333334,0.8333333283333335,0.95,0.95,en
mr fischler now has the floor.,hr. fischler har ordet.,Swap characters,mr fischler onw has the floor.,"(0.95, 0.95)",0.488923022434901,0.8413,0.8333333333333334,0.8333333333333334,0.8333333283333335,0.6,0.6,0.5999999950000001,0.8333333333333334,0.8333333333333334,0.8333333283333335,0.95,0.95,en
"these amendments are, therefore, obsolete.",derfor bortfalder disse ændringsforslag.,Add random word,"colichemarde these amendments are, therefore, obsolete.","(0.99, 0.95)",0.8824969025845955,0.9867,0.8333333333333334,1.0,0.9090909041322316,0.8,1.0,0.8888888839506174,0.8333333333333334,1.0,0.9090909041322316,0.99,0.95,en
as a result i am able also to vote for amendments nos 4 and 12.,af den grund stemmer jeg for ændringsforslag 4 og 12.,Replace Character,as a redult i am able also to vote for amendments nos 4 and 12.,"(0.98, 0.95)",0.8371170098777919,0.9364,0.9333333333333332,0.9333333333333332,0.9333333283333336,0.8571428571428571,0.8571428571428571,0.8571428521428571,0.9333333333333332,0.9333333333333332,0.9333333283333336,0.98,0.95,en
for that reason the amendment you have so carefully worked out can be only partially taken into consideration if its wording is altered accordingly.,"derfor kan der kun delvist tages hensyn til ændringsforslaget, som blev formuleret i den retning af dem, hvis ordlyden modificeres tilsvarende.",Remove Token,for that reason the amendment you have so carefully worked out be only partially taken into consideration if its wording is altered accordingly.,"(0.98, 0.95)",0.8895260356363631,0.9636,1.0,0.9583333333333334,0.9787233992575828,0.9545454545454546,0.9130434782608696,0.9333333283358024,1.0,0.9583333333333334,0.9787233992575828,0.98,0.95,en
internal state authorities can also regulate this to whatever extent they think necessary.,"de kompetente nationale myndigheder kan også regulere dette, såfremt de finder det nødvendigt.",Swap characters,itnernal state authorities can also regulate this to whatever extent they think necessary.,"(0.99, 0.95)",0.9193227152249184,0.9284,0.9230769230769232,0.9230769230769232,0.9230769180769232,0.9166666666666666,0.9166666666666666,0.9166666616666668,0.9230769230769232,0.9230769230769232,0.9230769180769232,0.99,0.95,en
this initiative rests on the subsidiarity principle.,denne ansats er baseret på subsidiaritetsprincippet.,Remove Token,initiative rests on the subsidiarity principle.,"(1.00, 1.00)",0.8408964152537145,0.8848,1.0,0.8571428571428571,0.9230769181065088,1.0,0.8333333333333334,0.9090909041322316,1.0,0.8571428571428571,0.9230769181065088,1.00,1.00,en
that is the particular situation.,"det er den særlige situation, vi er i.",Duplicate Token,that that is the particular situation.,"(1.00, 1.00)",0.846481724890614,0.9813,1.0,1.0,0.999999995,0.8,1.0,0.8888888839506174,1.0,1.0,0.999999995,1.00,1.00,en
i can understand that causes you some disquiet and we will ensure it is corrected.,"for det første kan jeg godt forstå, at det generer dem, og vi vil sørge for, at det bliver rettet.",Swap words,can i understand that causes you some disquiet and we will ensure it is corrected. ,"(0.95, 0.95)",0.8904071917791836,0.9967,0.9375,1.0,0.967741930489074,0.8,0.8571428571428571,0.8275862019024971,0.875,0.9333333333333332,0.903225801456816,0.95,0.95,en
it has held meetings yesterday and today.,der er afholdt møder i dag og i går.,Replace Character,it has held meetings yesterbay and today.,"(0.98, 0.99)",0.5,0.8648,0.8571428571428571,0.8571428571428571,0.8571428521428571,0.6666666666666666,0.6666666666666666,0.6666666616666668,0.8571428571428571,0.8571428571428571,0.8571428521428571,0.98,0.99,en
i would like to add a few words to the final sentence of amendment no 13.,jeg vil gerne føje et par ord til det sidste sætningsled i ændringsforslag 13.,Duplicate Token,i would like to to add a few words to the final sentence of amendment no 13.,"(0.99, 0.99)",0.8917143641551922,0.9933,1.0,1.0,0.999999995,0.9375,1.0,0.967741930489074,1.0,1.0,0.999999995,0.99,0.99,en
' ...y asegure el mantenimiento de las producciones europeas y acp de plátanos y las producciones fair-trade de plátanos' .,...«y asegure el mantenimiento de las producciones europeas y acp de plátanos y las producciones fair-trade de plátanos«.,Remove Token,'...asegure el mantenimiento de las producciones europeas y acp de plátanos y las producciones fair-trade de plátanos'.,"(1.00, 1.00)",0.8867047947918724,0.9585,1.0,1.0,0.999999995,0.9375,0.8823529411764706,0.9090909040955004,1.0,1.0,0.999999995,1.00,1.00,en
we vote on the amendments as published.,vi stemmer om ændringsforslagene i den offentliggjorte form.,Replace Token with Random Word,prerelating vote on the amendments as published.,"(0.85, 0.90)",0.8408964152537145,0.8737,0.8571428571428571,0.8571428571428571,0.8571428521428571,0.8333333333333334,0.8333333333333334,0.8333333283333335,0.8571428571428571,0.8571428571428571,0.8571428521428571,0.85,0.90,en
it is too late to tell me when we are in the midst of a voting session.,det er for sent at gøre mig opmærksom på det midt i afstemningen.,Remove Character,it is too late to tel me when we are in the midst of a voting session.,"(1.00, 1.00)",0.8394327083733336,0.9437,0.9411764705882352,0.9411764705882352,0.9411764655882354,0.875,0.875,0.874999995,0.9411764705882352,0.9411764705882352,0.9411764655882354,1.00,1.00,en
(the president cut off the speaker),(formanden afbrød taleren),Add random word,(the president cut off liferenting the speaker),"(0.70, 0.85)",0.6101950432112578,0.9799,0.8571428571428571,1.0,0.9230769181065088,0.6666666666666666,0.8,0.7272727223140496,0.8571428571428571,1.0,0.9230769181065088,0.70,0.85,en
"i would just like to say that this is going a little too quickly, at least for me and those of us who speak swedish.","jeg vil bare sige, at dette her går lidt for hurtigt, i hvert fald for mig og os, som taler svensk.",Swap words,"i would just like to say that this going is a little too quickly, at least for me and those of us who speak swedish. ","(0.95, 0.95)",0.8757780041302399,0.9984,0.9615384615384616,1.0,0.9803921518646674,0.84,0.875,0.8571428521449397,0.9230769230769232,0.96,0.9411764655901576,0.95,0.95,en
these are technical matters which the linguistic lawyers themselves will be able to attend to.,"dette er tekniske spørgsmål, som sprogrevisorerne kan behandle.",Swap characters,these are technical matters which the linguistic lawyers tehmselves will be able to attend to.,"(0.99, 0.99)",0.8153551038173115,0.9364,0.9285714285714286,0.9285714285714286,0.9285714235714286,0.8571428571428571,0.8571428571428571,0.8571428521428571,0.9285714285714286,0.9285714285714286,0.9285714235714286,0.99,0.99,en
we will make sure it corresponds with the correct articles in the draft treaty.,vi skal sørge for overensstemmelse med de korrekte artikler i traktatudkastet.,Replace Character,we will make sure it corresponds wvth the correct articles in the draft treaty.,"(0.98, 0.99)",0.8003203203844999,0.932,0.9230769230769232,0.9230769230769232,0.9230769180769232,0.8461538461538461,0.8461538461538461,0.8461538411538462,0.9230769230769232,0.9230769230769232,0.9230769180769232,0.98,0.99,en
"i had two main reasons for voting against: firstly, it is up to the commission as the executive organ to adopt supplementary rules for the prioritising of applications.","jeg havde primært to grunde til at stemme imod: for det første er det op til kommissionen at, som det udøvende organ, vedtage tillægsregler for prioritering af ansøgninger.",Add random word,"i had two main reasons for voting against: firstly papelera, it is up to the commission as the executive organ to adopt supplementary rules for the prioritising of applications.","(0.98, 0.99)",0.9167409308877168,0.9967,0.92,0.9583333333333334,0.9387755052061642,0.8928571428571429,0.925925925925926,0.909090904092562,0.92,0.9583333333333334,0.9387755052061642,0.98,0.99,en
"that will require the member states to provide information each year about the cumulative emissions of each greenhouse gas, and will also guarantee comparability and transparency.",dette forpligter medlemsstaterne til hvert år at afgive rapport om den samlede emission af drivhusgasser for endvidere at garantere sammenligneligheden og gennemskueligheden.,Duplicate character,"that will require the member states to provide information each year about the cumulative emissions of each greenhouse gas, and will also guarantee comparability and transparrency.","(0.99, 0.99)",0.9331509974194672,0.9641,0.9545454545454546,0.9545454545454546,0.9545454495454548,0.96,0.96,0.959999995,0.9545454545454546,0.9545454545454546,0.9545454495454548,0.99,0.99,en
"all of this entails adequate monitoring of member states' national programmes, and submission of the findings to parliament and the commission.",alt dette kræver passende opfølgning af medlemsstaternes nationale programmer og forelæggelse heraf for parlamentet og kommissionen.,Add random word,"all of this entails adequate monitoring of member states' national programmes urethrorrhea, and submission of the findings to parliament and the commission.","(0.90, 0.95)",0.891237063632542,0.9956,0.8888888888888888,0.9411764705882352,0.914285709289796,0.8571428571428571,0.9,0.8780487754907793,0.8888888888888888,0.9411764705882352,0.914285709289796,0.90,0.95,en
"however this system, which gives preference to bananas from overseas, the less favoured african countries, the caribbean and the pacific which we intend to support, appears vital to the economic survival of these regions.","men denne ordning, der giver præference til bananer fra de oversøiske territorier og ugunstigt stillede lande i afrika, vestindien og stillehavet, som vi ønsker at støtte, synes uomgængeligt nødvendig for, at disse lande og territorier kan overleve økonomisk.",Duplicate character,"however this system, which gives preference to bananas from overseas, the less favoured african countries, the caribbean and the pacific which we intend to support, appears vital to the economic survival of these regiions.","(1.00, 1.00)",0.9529500947560268,0.9743,0.9642857142857144,0.9642857142857144,0.9642857092857144,0.9696969696969696,0.9696969696969696,0.96969696469697,0.9642857142857144,0.9642857142857144,0.9642857092857144,1.00,1.00,en
"there are other countries, apart from acp countries, which are dependent on exports of bananas.","der er andre lande, ud over avs-landene, der er afhængige af eksport af bananer.",Swap words,"there other are countries, apart from acp countries, which are dependent on exports of bananas. ","(0.99, 0.95)",0.8553583862778322,0.9945,0.9285714285714286,1.0,0.9629629579698218,0.7333333333333333,0.7857142857142857,0.7586206846611178,0.8571428571428571,0.9230769230769232,0.8888888838957477,0.99,0.95,en
