originalSentence,referenceSentence,tamperingType,tamperedSentence,"LLMScore (Sim, Con)",BLEU,METEOR,Rouge1 r,Rouge1 p,Rouge1 f,Rouge2 r,Rouge2 p,Rouge2 f,Rougel r,Rougel p,Rougel f,LLM-Sim,LLM-Con,originalLanguage
selvfølgelig skal europa-parlamentet stræbe efter et ypperligt lovgivningsarbejde.,"of course, the european parliament should strive for legislative excellence.",Replace Character,selvfølgelig skal europa-porlamentet stræbe efter et ypperligt lovgivningsarbejde.,"(1.00, 1.00)",0.6606328636027614,0.8819,0.875,0.875,0.874999995,0.7142857142857143,0.7142857142857143,0.7142857092857143,0.875,0.875,0.874999995,1.00,1.00,da
"rådet og europa-parlamentet bør og skal samarbejde mere, og dette samarbejde kræver en vilje til at agere som partnere.","the council and the european parliament are supposed to and must work together to a greater extent, and this cooperation requires a willingness to act as partners.",Duplicate character,"rådet og europa-parlamentet bbør og skal samarbejde mere, og dette samarbejde kræver en vilje til at agere som partnere.","(0.99, 0.99)",0.8656030552541708,0.9519,0.9375,0.9375,0.937499995,0.8888888888888888,0.8888888888888888,0.888888883888889,0.9375,0.9375,0.937499995,0.99,0.99,da
"på den anden side skal vi imidlertid give parlamentet mulighed for at udføre alle de pligter og opgaver, som de samme skatteydere har betroet det gennem lissabontraktaten.","on the other hand, however, we must give parliament the opportunity to fulfil all its duties and responsibilities which these same taxpayers have entrusted to it through the treaty of lisbon.",Remove Character,"på den anden side skal vi imidlertid give parlamentet mulighed for at udføre alle de pligter og opgaver, som de samme skatteydere har betroet det gennem lissabontaktaten.","(1.00, 1.00)",0.9356154226309104,0.9653,0.9615384615384616,0.9615384615384616,0.9615384565384616,0.9615384615384616,0.9615384615384616,0.9615384565384616,0.9615384615384616,0.9615384615384616,0.9615384565384616,1.00,1.00,da
vi har fortsat tilgængelige reserver.,"fellow members, we still have reserves available.",Duplicate Token,vi har fortsat tilgængelige reserver reserver.,"(0.95, 0.95)",0.7118034480382983,0.9654,1.0,1.0,0.999999995,0.8,1.0,0.8888888839506174,1.0,1.0,0.999999995,0.95,0.95,da
"i forhold til dette er det naturligt, at vælgerne og skatteyderne også forventer mere af os.","in relation to this, quite naturally, our voters' and taxpayers' expectations of us are greater, too.",Remove Token,"i forhold til dette er det naturligt, at vælgerne og skatteyderne også forventer mere os.","(0.95, 0.99)",0.8578928092681435,0.9489,1.0,0.9375,0.967741930489074,0.9285714285714286,0.8666666666666667,0.8965517191438764,1.0,0.9375,0.967741930489074,0.95,0.99,da
"jeg er helt overbevist om, at europa-parlamentets budget skal øges ganske betydeligt.",i am profoundly convinced that the budget of the european parliament should be significantly increased.,Add random word,"jeg er helt overbevist kalorius om, at europa-parlamentets budget skal øges ganske betydeligt.","(0.99, 0.95)",0.8052253761904355,0.9915,0.9230769230769232,1.0,0.959999995008,0.8333333333333334,0.9090909090909092,0.8695652124007562,0.9230769230769232,1.0,0.959999995008,0.99,0.95,da
"jeg hører fine ord om behovet for besparelser og effektivitet, men budgettet på over 1,7 mia. eur i 2011 er en stigning på næsten 6 %.","i hear fine words about the need for savings and efficiency, but the budget of over eur 1.7 billion in 2011 is an increase of nearly 6%.",Swap words,"jeg hører fine ord om behovet for og besparelser effektivitet, men budgettet på over 1,7 mia. eur i 2011 er en stigning på næsten 6 %. ","(0.98, 0.95)",0.8853153595969632,0.9987,0.9615384615384616,1.0,0.9803921518646674,0.8461538461538461,0.88,0.862745093041138,0.9230769230769232,0.96,0.9411764655901576,0.98,0.95,da
der kan spares yderligere 50 mio. eur årligt ved at lukke europa-parlamentets kontorer i hvert af vores lande.,a further eur 50 million would be saved every year by closing the european parliament offices in each of our countries.,Remove Token,kan spares yderligere 50 mio . eur årligt ved at lukke europa-parlamentets kontorer i hvert af vores lande.,"(0.98, 0.95)",0.9457416090031758,0.9547,1.0,0.9444444444444444,0.9714285664326532,1.0,0.9411764705882352,0.9696969647015612,1.0,0.9444444444444444,0.9714285664326532,0.98,0.95,da
overgang fra schengeninformationssystemet (sis 1+) til anden generation af schengeninformationssystemet (sis ii) (ændring af forordning (ef) nr. 1104/2008) - overgang fra schengen-informationssystemet (sis 1+) til anden generation af schengen-informationssystemet (sis ii) (ændring af afgørelse 2008/839/ria) - oprettelse af et fælles eu-genbosættelsesprogram (forhandling),migration from the schengen information system (sis 1+) to the second generation schengen information system (sis ii) (amendment of regulation (ec) no 1104/2008) - migration from the schengen information system (sis 1+) to the second generation schengen information system (sis ii) (amendment of decision 2008/839/jha) - the establishment of a joint eu resettlement programme (debate),Swap characters,overgang fra schengeninformationssystemet (sis 1+) til anden generation af schengeninformationsssytemet (sis ii) (ændring af forordning (ef) nr. 1104/2008) - overgang fra schengen-informationssystemet (sis 1+) til anden generation af schengen-informationssystemet (sis ii) (ændring af afgørelse 2008/839/ria) - oprettelse af et fælles eu-genbosættelsesprogram (forhandling),"(0.99, 0.95)",0.95591121971629,0.9829,0.96,1.0,0.9795918317367764,0.935483870967742,0.9666666666666668,0.9508196671324912,0.96,1.0,0.9795918317367764,0.99,0.95,da
"europa-parlamentet udtrykte endnu en gang stor bekymring over forsinkelserne i igangsættelsen og i leveringen af de ønskede oplysninger fra kommissionen og rådet om resultaterne af de tekniske test, og det krævede fuld gennemsigtighed vedrørende gennemførelsesprocessen for sis ii.","the european parliament once again expressed deep concern at the delays in commencing operations and requested information from the commission and the council on the results of the technical tests, demanding full transparency regarding the implementation process for the sis ii.",Replace Character,"europa-parlamentet udtrykte endnu en gang stor bekymring over forsinkelserne i igangsættelsen og i leveringen af de ønskede oplysninger fra kommissionen og rådet om resultaterne af de tekniske test, og det krævede fuld gennemsigtighed vedrørende nennemførelsesprocessen for sis ii.","(0.98, 0.95)",0.933651069586263,0.9749,0.9696969696969696,0.9696969696969696,0.96969696469697,0.9444444444444444,0.9444444444444444,0.9444444394444445,0.9696969696969696,0.9696969696969696,0.96969696469697,0.98,0.95,da
for det første: hvornår skal denne overgang finde sted?,"first, when is this migration to take place?",Replace Character,for det første: hvornår ikal denne overgang finde sted?,"(0.95, 0.99)",0.7016879391277372,0.9055,0.8888888888888888,0.8888888888888888,0.888888883888889,0.75,0.75,0.749999995,0.8888888888888888,0.8888888888888888,0.888888883888889,0.95,0.99,da
for det andet: er disse test blevet gennemført?,"second, have these tests been concluded?",Swap words,for det andet: er disse test gennemført? blevet ,"(0.95, 0.90)",0.7259795291154771,0.9865,1.0,1.0,0.999999995,0.7142857142857143,0.7142857142857143,0.7142857092857143,0.875,0.875,0.874999995,0.95,0.90,da
"denne test blev gennemført igen mellem den 2. og den 5. marts, og den endelige evaluering og validering af anden testrække fandt sted den 6. april.","this test was carried out again between 2 and 5 march, and the final assessment and validation of the second set of tests took place on 6 april.",Remove Token,"denne blev gennemført igen mellem den 2. og den 5. marts, og den endelige evaluering og validering af anden testrække fandt sted den 6. april.","(0.95, 0.98)",0.9331509974194672,0.9675,1.0,0.9523809523809524,0.9756097511005354,0.9565217391304348,0.9166666666666666,0.9361702077682208,1.0,0.9523809523809524,0.9756097511005354,0.95,0.98,da
"skønt de nødvendige betingelser for at fortsætte med overgangen ikke alle er blevet opfyldt eller kan forventes opfyldt inden for en overskuelig fremtid, vil kommissionens mandat til at udvikle sis ii udløbe igen den 30. juni 2010.","although the conditions necessary in order to go ahead with the migration have not all been met, nor is a time foreseeable when that will be the case, the mandate that was granted to the commission to develop the sis ii will expire again on 30 june 2010.",Negation,"skønt de nødvendige betingelser for at fortsætte med overgangen alle er blevet opfyldt eller kan forventes opfyldt inden for en overskuelig fremtid, vil kommissionens mandat til at udvikle sis ii udløbe igen den 30. juni 2010.","(0.95, 0.95)",0.931838481115484,0.9768,1.0,0.9705882352941176,0.9850746218667856,0.9714285714285714,0.9444444444444444,0.9577464738742314,1.0,0.9705882352941176,0.9850746218667856,0.95,0.95,da
"det globale programstyringsråd skal også oprettes, og dets forvaltning af sis ii skal formelt integreres.","the global programme management board must also be created, and its management of the sis ii formally integrated.",Swap words,"det globale skal programstyringsråd også oprettes, og dets forvaltning af sis ii skal formelt integreres. ","(0.98, 0.95)",0.8076983394577888,0.9935,0.9333333333333332,1.0,0.9655172363852556,0.7333333333333333,0.7857142857142857,0.7586206846611178,0.9333333333333332,1.0,0.9655172363852556,0.98,0.95,da
"fra et budgetmæssigt synspunkt kan jeg tilslutte mig alle hr. coelhos sætninger, ord og anstrengelser.","from a budgetary point of view, i can endorse mr coelho's every sentence, every word and every effort.",Replace Character,"føa et budgetmæssigt synspunkt kan jeg tilslutte mig alle hr. coelhos sætninger, ord og anstrengelser.","(1.00, 1.00)",0.9391044157537524,0.9443,0.9333333333333332,0.9333333333333332,0.9333333283333336,0.9285714285714286,0.9285714285714286,0.9285714235714286,0.9333333333333332,0.9333333333333332,0.9333333283333336,1.00,1.00,da
"vi vil fortsat arbejde videre med sis ii på en gennemsigtig måde sammen med parlamentet, men vi må klart sondre mellem det tekniske arbejde og politisk gennemsigtighed.","we will continue to move forward on sis ii in a transparent way with the european parliament, but we must keep a clear distinction between the technical work and political transparency.",Swap characters,"vi vil fortsat arbejde videre med sis ii på en gennemsigtig måde sammen med parlamentet, men vi må klart sondre mellem det tekniske arbejde og oplitisk gennemsigtighed.","(0.98, 0.95)",0.9163140145331566,0.9653,0.9583333333333334,0.9583333333333334,0.9583333283333336,0.9230769230769232,0.9230769230769232,0.9230769180769232,0.9583333333333334,0.9583333333333334,0.9583333283333336,0.98,0.95,da
"jeg vil gerne takke libe-udvalget, hr. coelho og budgetkontroludvalgets ordfører, hr. alvaro, for deres udmærkede samarbejde om denne sag.","i would like to thank the libe committee, mr coelho and the budgetary control committee rapporteur, mr alvaro, for their excellent cooperation on this file.",Remove Character,"jeg vil gerne takke libe-udvalget, hr. coelho og budgetkontroludvalgets ordfører, hr. alaro, for deres udmærkede samarbejde om denne sag.","(0.99, 0.99)",0.8895260356363631,0.9597,0.9444444444444444,0.9444444444444444,0.9444444394444445,0.8888888888888888,0.8888888888888888,0.888888883888889,0.9444444444444444,0.9444444444444444,0.9444444394444445,0.99,0.99,da
"mange af disse flygtninge befinder sig i en uløselig problemstilling, hvor de hverken kan vende tilbage til deres oprindelsesland eller blive integreret fuldt ud i det første asylland, da mange af disse lande selv er ofre for konflikter eller fattigdom.","many of these refugees find themselves in catch-22 situations: they cannot return to their country of origin, nor can they integrate locally in the country of first asylum, since many of these countries are themselves victims of conflict or poverty.",Replace Character,"mange af disse flygtninge befinder sig i en uløselig problemstilling, hvor de hverken kan vende tilbage til deres oprindelsesland xller blive integreret fuldt ud i det første asylland, da mange af disse lande selv er ofre for konflikter eller fattigdom.","(0.99, 0.99)",0.9385522307631308,0.9767,0.9722222222222222,1.0,0.9859154879587384,0.945945945945946,0.945945945945946,0.945945940945946,0.9722222222222222,1.0,0.9859154879587384,0.99,0.99,da
"gennem genbosættelse kan eu's medlemsstater udvise konkret solidaritet med disse ofte overbebyrdede første asyllande, samtidig med at de beskytter nogle af de mest sårbare flygtninge under bæredygtige og humane forhold.","through resettlement, the member states of the european union can demonstrate tangible solidarity with these often over-burdened countries of first asylum, at the same time protecting some of the most vulnerable refugees under sustainable and humane conditions.",Remove Character,"gennem genbosættelse kan eu's medlemsstater udvise konkret solidaritet med disse ofte overbebyrdede første asyllande, samtidig med at de beskytter nogle af de mest sårbare flygtninge under bæredygtige o humane forhold.","(0.99, 0.99)",0.9184678024441792,0.9696,0.9642857142857144,0.9642857142857144,0.9642857092857144,0.9310344827586208,0.9310344827586208,0.9310344777586208,0.9642857142857144,0.9642857142857144,0.9642857092857144,0.99,0.99,da
"jeg vil i særdeleshed takke hr. tavares for hans fremragende indsats hermed, og jeg glæder mig over den stærke politiske enighed blandt de forskellige grupper om denne sag.","i would particularly like to thank mr tavares for his sterling work on this, and i welcome the strong political consensus among the different groups on this matter.",Swap words,"jeg vil i takke særdeleshed hr. tavares for hans fremragende indsats hermed, og jeg glæder mig over den stærke politiske enighed blandt de forskellige grupper om denne sag. ","(0.99, 0.95)",0.8934877060849065,0.9989,0.9642857142857144,1.0,0.9818181768198349,0.8571428571428571,0.8888888888888888,0.8727272677289256,0.9285714285714286,0.9629629629629628,0.9454545404561984,0.99,0.95,da
"selvfølgelig er instrumentet til finansiering af denne indsats den europæiske flygtningefond, som vi ganske rigtigt ikke hidtil har udnyttet i tilstrækkelig grad, og der er plads til, at vi kan gøre større og bedre ting.","of course, the financing instrument to support this endeavour is the european refugee fund which, it is true, we have not sufficiently exhausted to date and there are margins for us to do bigger and better things.",Negation,"selvfølgelig er instrumentet til finansiering af denne indsats den europæiske flygtningefond, som vi ganske rigtigt hidtil har udnyttet i tilstrækkelig grad, og der er plads til, at vi kan gøre større og bedre ting.","(1.00, 1.00)",0.931838481115484,0.9768,1.0,0.96875,0.984126979128244,0.9696969696969696,0.9411764705882352,0.9552238755981288,1.0,0.96875,0.984126979128244,1.00,1.00,da
den europæiske reaktion på globale genbosættelsesbehov har været tilstrækkelig til dato.,the european response to global resettlement requirements has been adequate to date.,Swap words,den europæiske reaktion globale på genbosættelsesbehov har været tilstrækkelig til dato. ,"(1.00, 1.00)",0.6636154805687886,0.9815,0.9166666666666666,1.0,0.9565217341398866,0.6363636363636364,0.7,0.6666666616780046,0.8333333333333334,0.9090909090909092,0.8695652124007562,1.00,1.00,da
"i 2009 ankom der 6 896 flygtninge til europa under genbosættelsesprogrammet, hvilket kun svarer til 8,2 % af det samlede antal.","in 2009, 6 896 refugees arrived in europe under the resettlement programme, which accounts for just 8.2% of the total.",Add random word,"i 2009 ankom der 6 896 flygtninge til europa under genbosættelsesprogrammet, hvilket fjog kun svarer til 8,2% af det samlede antal.","(0.99, 0.95)",0.8862476419965991,0.9953,0.9,0.9,0.899999995,0.8,0.8,0.7999999950000002,0.9,0.9,0.899999995,0.99,0.95,da
for s&d-gruppen. - (es) fru formand!,"madam president, i would like to thank mrs malmström for being here.",Swap characters,for s&d-gruppen. - (es) fru foramnd!,"(0.95, 0.95)",0.8265168183793802,0.9139,0.8333333333333334,0.8333333333333334,0.8333333283333335,0.8,0.8,0.7999999950000002,0.8333333333333334,0.8333333333333334,0.8333333283333335,0.95,0.95,da
en kommission fra parlamentet har besøgt de irakiske palæstinensere.,a commission from parliament has visited the iraqi palestinians.,Swap characters,en kommission fra parlametnet har besøgt de irakiske palæstinensere.,"(0.99, 0.95)",0.6580370064762462,0.8951,0.8888888888888888,0.8888888888888888,0.888888883888889,0.75,0.75,0.749999995,0.8888888888888888,0.8888888888888888,0.888888883888889,0.99,0.95,da
"vi har brug for konsensus på tværs af samfundet om, at vi ønsker at deltage i et genbosættelsesprogram, at det er en god løsning, og at folk faktisk vil tilvejebringe integration lokalt.","we need a cross-society consensus that we want to take part in a resettlement programme, that it is a good solution, and that people will actually bring about integration on the ground.",Swap words,"vi har brug for konsensus på tværs af samfundet om, at vi ønsker at deltage i et at genbosættelsesprogram, det er en god løsning, og at folk faktisk vil tilvejebringe integration lokalt. ","(0.99, 0.99)",0.8937431161660789,0.9993,0.9655172413793104,1.0,0.9824561353524162,0.875,0.9032258064516128,0.8888888838901486,0.9655172413793104,1.0,0.9824561353524162,0.99,0.99,da
"i dag er vi nødt til at undersøge den juridiske ramme, inden for hvilken overgangen fra sis 1 til sis ii kan finde sted.","today, we have to examine the legal framework within which migration from sis i to sis ii can take place.",Replace Token with Random Word,"i dag er vi nødt til at undersøge den juridiske ramme, inden for hvilken overgangen fra sis 1 skaft sis ii kan finde sted.","(0.95, 0.95)",0.8942255541978509,0.9596,0.9565217391304348,1.0,0.977777772780247,0.9130434782608696,0.9130434782608696,0.9130434732608697,0.9565217391304348,1.0,0.977777772780247,0.95,0.95,da
"fru kommissær, gue/ngl-gruppen kan ikke under de nuværende omstændigheder støtte en sådan overgang.","commissioner, under the current circumstances, the gue/ngl group cannot support such a migration.",Negation,"fru kommissær, gue/ngl-gruppen kan under de nuværende omstændigheder støtte en sådan overgang.","(0.95, 0.95)",0.8003203203844999,0.9382,1.0,0.9230769230769232,0.959999995008,0.9090909090909092,0.8333333333333334,0.8695652124007562,1.0,0.9230769230769232,0.959999995008,0.95,0.95,da
"(mt) fru formand! dette genbosættelsesprogram, som bliver opstillet, fylder et betydeligt, mangeårigt tomrum.","(mt) madam president, this resettlement programme which is being set up is filling a significant, long-standing void.",Replace Character,"(mt) fru formand! dette genbosættelsesprogram, som bliver opstiælet, fylder et betydeligt, mangeårigt tomrum.","(0.98, 0.99)",0.8578928092681435,0.9494,0.9230769230769232,0.9230769230769232,0.9230769180769232,0.8333333333333334,0.8333333333333334,0.8333333283333335,0.9230769230769232,0.9230769230769232,0.9230769180769232,0.98,0.99,da
"deres andet vigtige mål er imidlertid at bremse indstrømningen af illegale indvandrere til eu, inklusive dem, der kræver beskyttelse.","however, their other important objective is to curb the influx of illegal immigrants towards the european union, including those who require protection.",Swap words,"deres andet vigtige mål er imidlertid at bremse indstrømningen af illegale til indvandrere eu, inklusive dem, der kræver beskyttelse. ","(0.98, 0.95)",0.8431006187347456,0.997,0.95,1.0,0.9743589693622616,0.7894736842105263,0.8333333333333334,0.8108108058144633,0.9,0.9473684210526316,0.9230769180802104,0.98,0.95,da
"indtil videre er dette stadig et pilotprojekt, et projekt, som er rettet mod malta.","thus far, this is still a pilot project, one that concerns malta.",Duplicate character,"indtil videre er dette sttadig et pilotprojekt, et projekt, som er rettet mod malta.","(1.00, 1.00)",0.8282477531331041,0.9403,0.9166666666666666,0.9166666666666666,0.9166666616666668,0.8461538461538461,0.8461538461538461,0.8461538411538462,0.9166666666666666,0.9166666666666666,0.9166666616666668,1.00,1.00,da
"først og fremmest vil jeg gerne lykønske hr. coelho med de kolossale bestræbelser, han har lagt i dette, og især med den konsekvens, han har udvist i færdiggørelsen af disse to betænkninger.","first of all, i would like to congratulate mr coelho for the huge effort he has invested in this and, in particular, for the consistency he has shown in finalising these two reports.",Swap words,"først og fremmest vil jeg gerne lykønske hr. coelho med de kolossale bestræbelser, han har lagt i dette, og især den med konsekvens, han har udvist i færdiggørelsen af disse to betænkninger. ","(0.99, 0.95)",0.9122335536579608,0.9994,0.9642857142857144,1.0,0.9818181768198349,0.8709677419354839,0.9,0.8852458966406881,0.9285714285714286,0.9629629629629628,0.9454545404561984,0.99,0.95,da
"det faktum, at vi selv nu ikke med sikkerhed ved, hvorvidt de gennemførte test har været succesfulde eller ej, bidrager bare til at rejse alvorlig tvivl om måden, hvorpå projektet bliver ledet.",the fact that we do not know for sure even now whether the tests carried out have been successful or not only serves to raise serious doubts about how the project is being managed.,Negation,"det faktum, at vi selv nu med sikkerhed ved, hvorvidt de gennemførte test har været succesfulde eller ej, bidrager bare til at rejse alvorlig tvivl om måden, hvorpå projektet bliver ledet.","(0.95, 0.95)",0.9278982724420874,0.9755,1.0,0.967741935483871,0.983606552378393,0.9666666666666668,0.935483870967742,0.9508196671324912,1.0,0.967741935483871,0.983606552378393,0.95,0.95,da
"nu virker det, som om den lange sis ii-saga langt fra er overstået.",now it seems that the long sis ii saga is far from being finished.,Swap characters,"nu virker det, som om dne lange sis ii-saga langt fra er overstået.","(0.98, 0.95)",0.8003203203844999,0.932,0.9230769230769232,0.9230769230769232,0.9230769180769232,0.8333333333333334,0.8333333333333334,0.8333333283333335,0.9230769230769232,0.9230769230769232,0.9230769180769232,0.98,0.95,da
"efter otte års lappearbejde ved vi, at målet med kommissionens foreslåede foranstaltning - overgangen fra sis 1+ til sis ii - er uopnåeligt for medlemsstaterne af såvel tekniske som juridiske årsager.","after eight years of tinkering, we know that the aim of the measure proposed by the commission - the migration from sis 1+ to sis ii - is unachievable by the member states, both on technical and legal grounds.",Swap characters,"efter otte års lappearbejde ved vi, at målet med kommissionens foreslåede foranstaltning - overgangen fra sis 1+ til sis ii - er uopnåeligt for medlemstsaterne af såvel tekniske som juridiske årsager.","(1.00, 1.00)",0.9184678024441792,0.9696,0.9655172413793104,0.9655172413793104,0.9655172363793104,0.9333333333333332,0.9333333333333332,0.9333333283333336,0.9655172413793104,0.9655172413793104,0.9655172363793104,1.00,1.00,da
"for det tredje bør der etableres en sikkerhedsperiode for migration, der om nødvendigt vil kunne udvides ved hjælp af komitologi.","thirdly, a precautionary period should be established for migration which, if necessary, could be extended through comitology.",Add random word,"for det tredje bør der etableres en sikkerhedsperiode for migration, der om trold nødvendigt vil kunne udvides ved hjælp af komitologi.","(0.99, 0.99)",0.880773500588743,0.9951,0.9473684210526316,1.0,0.9729729679766254,0.9,0.9473684210526316,0.9230769180802104,0.9473684210526316,1.0,0.9729729679766254,0.99,0.99,da
"hvad angår hr. tavares' betænkninger om den europæiske flygtningefond og genbosættelse, vil jeg også gerne lykønske hr. tavares.","regarding the reports by mr tavares on the european refugee fund and resettlement, i would also like to congratulate mr tavares.",Replace Character,"hvad awgår hr. tavares' betænkninger om den europæiske flygtningefond og genbosættelse, vil jeg også gerne lykønske hr. tavares.","(0.99, 0.95)",0.9173176373893104,0.9562,0.9411764705882352,0.9411764705882352,0.9411764655882354,0.8823529411764706,0.8823529411764706,0.8823529361764706,0.9411764705882352,0.9411764705882352,0.9411764655882354,0.99,0.95,da
hovedproblemet er mangel på solidaritet inden for unionen.,the main problem is a lack of solidarity within the union.,Swap characters,hovedprolbemet er mangel på solidaritet inden for unionen.,"(1.00, 1.00)",0.8633400213704505,0.888,0.875,0.875,0.874999995,0.8571428571428571,0.8571428571428571,0.8571428521428571,0.875,0.875,0.874999995,1.00,1.00,da
"særligt i disse økonomiske krisetider kan man ikke andet end ryste på hovedet, når det kommer til forslag som dette.","especially in such times of economic crisis, it is all you can do to shake your head when it comes to proposals like this.",Negation,"særligt i disse økonomiske krisetider kan man andet end ryste på hovedet, når det kommer til forslag som dette.","(0.95, 0.99)",0.8725129388059689,0.9585,1.0,0.95,0.9743589693622616,0.9444444444444444,0.8947368421052632,0.9189189139225714,1.0,0.95,0.9743589693622616,0.95,0.99,da
