originalSentence,referenceSentence,tamperingType,tamperedSentence,"LLMScore (Sim, Con)",BLEU,METEOR,Rouge1 r,Rouge1 p,Rouge1 f,Rouge2 r,Rouge2 p,Rouge2 f,Rougel r,Rougel p,Rougel f,LLM-Sim,LLM-Con,originalLanguage
stop being so bewitched and vote against mr nassauer and in favour of the alternative compromise.,"vågn op af trolddommen, og stem nej til hr. nassauer og ja til det alternative kompromis.",Swap words,stop being so bewitched and vote against mr nassauer and in favour the of alternative compromise. ,"(0.98, 0.95)",0.7867012086133773,0.9935,0.9375,1.0,0.967741930489074,0.75,0.8,0.7741935433922998,0.875,0.9333333333333332,0.903225801456816,0.98,0.95,en
i deeply regret the fact that socialists and liberals have run away from that compromise and chosen instead to reach a settlement with the right.,"jeg beklager dybt, at socialdemokraterne og de liberale er sprunget fra det kompromis og i stedet har valgt at gøre op med højrefløjen.",Swap characters,i deeply regret the fact that socialists and liberals have rnu away from that compromise and chosen instead to reach a settlement with the right.,"(0.99, 0.99)",0.8942255541978509,0.9613,0.9545454545454546,0.9545454545454546,0.9545454495454548,0.9166666666666666,0.9166666666666666,0.9166666616666668,0.9545454545454546,0.9545454545454546,0.9545454495454548,0.99,0.99,en
the nassauer/sacconi compromise drastically weakens what we aspired to achieve in terms of an efficient reach.,"nassauer/sacconi-kompromiset indebærer en dramatisk svækkelse af det, som vi ville iværksætte i forbindelse med et velfungerende reach.",Add random word,the nassauer/sacconi compromise drastically weakens flavors what we aspired to achieve in terms of an efficient reach.,"(0.95, 0.90)",0.8428014430784181,0.9933,0.9411764705882352,1.0,0.9696969647015612,0.875,0.9333333333333332,0.903225801456816,0.9411764705882352,1.0,0.9696969647015612,0.95,0.90,en
this is the most important proposal on environmental issues that we have dealt with for many years in the eu system.,"det er det vigtigste forslag i miljøspørgsmål, som vi har behandlet i mange år i eu-systemet.",Duplicate character,this is the most imporrtant proposal on environmental issues that we have dealt with for many years in the eu system.,"(0.98, 0.99)",0.8725129388059689,0.9541,0.95,0.95,0.949999995,0.9,0.9,0.899999995,0.95,0.95,0.949999995,0.98,0.99,en
you are not even standing up and defending what you yourselves proposed as recently as a few years ago.,"de rejser dem ikke engang op og forsvarer det, som de selv har foreslået så sent som for nogle år siden.",Negation,you are even standing up and defending what you yourselves proposed as recently as a few years ago.,"(0.95, 0.95)",0.8739351325046805,0.9542,1.0,0.9411764705882352,0.9696969647015612,0.9411764705882352,0.8888888888888888,0.914285709289796,1.0,0.9411764705882352,0.9696969647015612,0.95,0.95,en
"in my view, the ‘sacconi-nassauer compromise’ is inadequate.",det såkaldte sacconi-nassauer-kompromis er efter min mening ikke tilfredsstillende.,Duplicate character,"in my vieew, the ‘sacconi-nassauer compromise’ is inadequate.","(0.99, 0.95)",0.7691605673134586,0.9139,0.875,0.875,0.874999995,0.7142857142857143,0.7142857142857143,0.7142857092857143,0.875,0.875,0.874999995,0.99,0.95,en
"following the vote, another cost and benefit analysis must be carried out in order to map out the effects of the vote on the burden on smes.",efter afstemningen skal der på ny udarbejdes en cost-benefit-analyse for at kortlægge afstemningens følger for de små og mellemstore virksomheders byrder.,Replace Character,"following the vote, another cost and benefit analysis must be carried out in order to map out the effects of the vote on the burden oo smes.","(0.99, 0.99)",0.9163140145331566,0.9641,0.9565217391304348,1.0,0.977777772780247,0.9230769230769232,0.9230769230769232,0.9230769180769232,0.9565217391304348,1.0,0.977777772780247,0.99,0.99,en
"today there are more than 100 000 chemical products on the european market, a large majority of which have never been evaluated with regard to their long-term effects.","i dag er der over 100.000 kemiske produkter på det europæiske marked, hvoraf langt størstedelen aldrig er blevet vurderet med hensyn til deres langsigtede virkninger.",Swap characters,"today there are more than 100 000 chemical products on the european market, a large majority of hwich have never been evaluated with regard to their long-term effects.","(0.99, 0.99)",0.9095930632220222,0.9665,0.9642857142857144,0.9642857142857144,0.9642857092857144,0.925925925925926,0.925925925925926,0.925925920925926,0.9642857142857144,0.9642857142857144,0.9642857092857144,0.99,0.99,en
"more and more scientific research shows that modern-day illnesses such as asthma, allergies, certain types of cancer and work-related illnesses are often the result of chemical products in the environment.","mere og mere videnskabelig forskning viser, at nye sygdomme som astma, allergi, visse former for cancer og arbejdsrelaterede sygdomme ofte er en følge af kemiske produkter i miljøet.",Swap words,"more and more scientific research shows that modern-day illnesses as such asthma, allergies, certain types of cancer and work-related illnesses are often the result of chemical products in the environment. ","(0.98, 0.95)",0.9005694513489713,0.9991,0.9615384615384616,1.0,0.9803921518646674,0.8666666666666667,0.896551724137931,0.8813559272048264,0.9230769230769232,0.96,0.9411764655901576,0.98,0.95,en
"while there is unanimous approval for reach’s aims, there is far less agreement over the means of achieving them, especially regarding the obligations it imposes on the chemical and pharmaceutical industries.","selv om alle er enige om målene med reach, er der langt mindre enighed om, hvordan de skal nås, navnlig hvad angår de forpligtelser, som den pålægger den kemiske industri og lægemiddelindustrien.",Swap characters,"while there is unanimous approval for erach’s aims, there is far less agreement over the means of achieving them, especially regarding the obligations it imposes on the chemical and pharmaceutical industries.","(0.99, 0.99)",0.9257518071011758,0.9721,0.9629629629629628,0.9629629629629628,0.9629629579629628,0.9310344827586208,0.9310344827586208,0.9310344777586208,0.9629629629629628,0.9629629629629628,0.9629629579629628,0.99,0.99,en
"as a doctor, i am aware of the considerable rise in the incidence of serious diseases recorded over the last decade, much of which is due to the hazardous use of chemicals.","som læge er jeg bekendt med den betydelige stigning i antallet af alvorlige sygdomme, der er registeret i de sidste 10 år, hvoraf mange skyldes sundhedsfarlig brug af kemikalier.",Duplicate character,"as a doctor, i am aware of the considerable rise in the incidence of seriious diseases recorded over the last decade, much of which is due to the hazardous use of chemicals.","(0.99, 0.99)",0.9234732618882052,0.9713,0.9615384615384616,0.9615384615384616,0.9615384565384616,0.935483870967742,0.935483870967742,0.935483865967742,0.9615384615384616,0.9615384615384616,0.9615384565384616,0.99,0.99,en
"the line taken by the greens and others, again and again, exemplifies their hostility to small businesses.","det, som de grønne og andre igen og igen taler for her, det er fjendtligt over for de små virksomheder.",Duplicate character,"the line taken by the greens and others, again and again, exemplifies their hostility to small businessess.","(0.99, 0.95)",0.9036020036098448,0.9494,0.9333333333333332,0.9333333333333332,0.9333333283333336,0.9375,0.9375,0.937499995,0.9333333333333332,0.9333333333333332,0.9333333283333336,0.99,0.95,en
all of us here are keen to guarantee the competitiveness of the european chemical industry and thus to protect jobs.,vi ønsker alle at sikre den europæiske kemikaliesektors konkurrenceevne og således beskæftigelsen i denne sektor.,Replace Character,all of us hern are keen to guarantee the competitiveness of the european chemical industry and thus to protect jobs.,"(0.99, 0.99)",0.8656030552541708,0.9519,0.9411764705882352,0.9411764705882352,0.9411764655882354,0.8947368421052632,0.8947368421052632,0.8947368371052632,0.9411764705882352,0.9411764705882352,0.9411764655882354,0.99,0.99,en
"in order for reach to make it truly possible to eliminate harmful substances from the european market, there are two conditions.","hvis reach-systemet skal gøre det muligt at fjerne de skadelige stoffer fra det europæiske marked, skal to betingelser være opfyldt.",Remove Token,"in order for reach to make it possible to eliminate harmful substances from the european market, there are two conditions.","(0.95, 0.95)",0.8787419089273848,0.9603,1.0,0.95,0.9743589693622616,0.9473684210526316,0.9,0.9230769180802104,1.0,0.95,0.9743589693622616,0.95,0.95,en
"first, the determination of the nature and the potential risks of substances is directly dependent on the quality of the information supplied during registration.","for det første afhænger fastlæggelsen af stoffernes art og eventuelle skadelighed direkte af kvaliteten af de oplysninger, der forelægges i forbindelse med registreringen.",Add random word,"first, the determination of the nature and the potential risks of smalming substances is directly dependent on the quality of the information supplied during registration.","(0.95, 0.95)",0.9000001338525341,0.9959,0.9473684210526316,1.0,0.9729729679766254,0.9130434782608696,0.9545454545454546,0.9333333283358024,0.9473684210526316,1.0,0.9729729679766254,0.95,0.95,en
"too many in the chemicals industry, and particularly its german lobbying arm, seem to believe that if you are going to tell a lie, then lie big; the costs of reach have been grossly exaggerated from beginning to end.","alt for mange i den kemiske industri, og navnlig i dens tyske lobbyvirksomhed, synes at mene, at hvis man skal lyve, så skal man lyve stærkt, for omkostningerne ved reach er blevet overdrevet groft fra ende til anden.",Remove Character,"too many in the chemicals industry, and partiularly its german lobbying arm, seem to believe that if you are going to tell a lie, then lie big; the costs of reach have been grossly exaggerated from beginning to end.","(0.99, 0.99)",0.940028651976138,0.9772,0.9722222222222222,0.9722222222222222,0.9722222172222222,0.9473684210526316,0.9473684210526316,0.9473684160526316,0.9722222222222222,0.9722222222222222,0.9722222172222222,0.99,0.99,en
the second casualty has been the commission’s claim to be neutral in its support both for economic developments and for environmental protection at one and the same time.,det andet offer har været kommissionens påstand om at være neutral i sin støtte til både økonomisk udvikling og miljøbeskyttelse på en og samme tid.,Remove Character,the second casualty has been the commission’s claim to be neutral in its support both for economic dvelopments and for environmental protection at one and the same time.,"(0.99, 0.99)",0.9127592114472296,0.9676,0.9583333333333334,0.9583333333333334,0.9583333283333336,0.925925925925926,0.925925925925926,0.925925920925926,0.9583333333333334,0.9583333333333334,0.9583333283333336,0.99,0.99,en
i hope it secures a common position before the end of december and i hope that this parliament votes on thursday in a way that will bring it close to the presidency’s position.,"jeg håber, at det når frem til en fælles holdning inden udgangen af december, og jeg håber, at parlamentet på torsdag stemmer på en måde, der bringer det tæt på formandskabets holdning.",Replace Token with Random Word,i hope it secures a common position before the end of december and i hope that this parliament votes on thursday in a bunk that will bring it close to the presidency ’ s position.,"(0.95, 0.98)",0.9257518071011758,0.9721,0.8571428571428571,0.9230769230769232,0.8888888838957477,0.8181818181818182,0.8709677419354839,0.8437499950048829,0.8571428571428571,0.9230769230769232,0.8888888838957477,0.95,0.98,en
"however, i want to focus on the additional weaknesses of that compromise from an animal welfare perspective.",jeg vil imidlertid sætte fokus på de øvrige svagheder ved det kompromis set ud fra et perspektiv om dyrevelfærd.,Replace Token with Random Word,"however, i want to focus on the additional weaknesses of that compromise from an animal oilcamp perspective.","(0.85, 0.95)",0.866397551781362,0.9467,0.9411764705882352,0.9411764705882352,0.9411764655882354,0.875,0.875,0.874999995,0.9411764705882352,0.9411764705882352,0.9411764655882354,0.85,0.95,en
"many of these were adopted in the committee on the environment, public health and food safety, a move that has already helped to increase the pressure on the commission and industry to push for further work on non-animal tests.","mange af disse blev vedtaget i udvalget om miljø, folkesundhed og fødevaresikkerhed, hvilket allerede har bidraget til at presse kommissionen og industrien yderligere til at fremme forsøg uden dyr.",Duplicate character,"many of these were adopted in the committee on the environment, public health and food safety, a move that has already helped to increase the pressure on the commission and industry to push for further work on non-aanimal tests.","(0.99, 1.00)",0.9436234734029224,0.9761,0.96875,0.96875,0.968749995,0.945945945945946,0.945945945945946,0.945945940945946,0.96875,0.96875,0.968749995,0.99,1.00,en
"however, if we are to seek a better approach we must not let this opportunity to force greater scrutiny of animal tests to pass us by.","men hvis vi skal finde en bedre tilgang, må vi ikke lade denne mulighed for at gennemtvinge yderligere undersøgelser af dyreforsøg gå fra os.",Negation,"however, if we are to seek a better approach we must let this opportunity to force greater scrutiny of animal tests to pass us by.","(0.95, 0.95)",0.9025139799587886,0.9675,1.0,0.9565217391304348,0.977777772780247,0.9583333333333334,0.92,0.9387755052061642,1.0,0.9565217391304348,0.977777772780247,0.95,0.95,en
"if we ignore it, then reach and all future chemicals regulation will be tied to test methods that deserve only to be consigned to history.","hvis vi ignorerer den, vil reach og al fremtidig kemikalielovgivning være forbundet med forsøgsmetoder, som kun fortjener at blive gjort til fortid.",Replace Character,"if we ignore it, then reach and all future chemicals regulation will be tied to test methods that deserve gnly to be consigned to history.","(0.99, 0.99)",0.8985396083419646,0.9627,0.9545454545454546,0.9545454545454546,0.9545454495454548,0.9166666666666666,0.9166666666666666,0.9166666616666668,0.9545454545454546,0.9545454545454546,0.9545454495454548,0.99,0.99,en
"a month ago, the committee on the environment, public health and food safety voted by a very large majority for a strong reach, worthy of its name.","for en måned siden stemte udvalget om miljø, folkesundhed og fødevaresikkerhed med et meget stort flertal for et stærkt reach, som var sit navn værdigt.",Replace Character,"a month ago, the committee on the environment, public health and food gafety voted by a very large majority for a strong reach, worthy of its name.","(0.99, 0.99)",0.9127592114472296,0.9676,0.9583333333333334,0.9583333333333334,0.9583333283333336,0.9230769230769232,0.9230769230769232,0.9230769180769232,0.9583333333333334,0.9583333333333334,0.9583333283333336,0.99,0.99,en
"on top of that, establishing which amendments have gained the approval of the house during the course of the debate is physically and mentally impossible.","desuden er det fysisk og mentalt umuligt at fastslå, hvilke ændringsforslag parlamentet har godtaget under forhandlingen.",Swap characters,"on top of that, establishing which amendments have gained the approavl of the house during the course of the debate is physically and mentally impossible.","(0.99, 0.99)",0.8985396083419646,0.9627,0.95,0.95,0.949999995,0.9130434782608696,0.9130434782608696,0.9130434732608697,0.95,0.95,0.949999995,0.99,0.99,en
"in my view, however, mr sacconi has made some fundamental mistakes, especially in terms of relations with others.","jeg mener dog, at hr. sacconi har begået nogle grundlæggende fejl, ikke mindst når det gælder forbindelserne, eftersom han også burde have drøftet kompromiset med udvalget om miljø, folkesundhed og fødevaresikkerhed.",Swap words,"in my view, however, mr sacconi has made some fundamental mistakes, especially terms in of relations with others. ","(0.98, 0.95)",0.8431006187347456,0.997,0.9444444444444444,1.0,0.9714285664326532,0.7777777777777778,0.8235294117647058,0.7999999950040816,0.8888888888888888,0.9411764705882352,0.914285709289796,0.98,0.95,en
"thus to reach a compromise he should have shared his reflections with the committee on the environment, public health and food safety: otherwise his position is a purely personal one, not one shared by the committee.",ellers er der nemlig tale om hans rent personlige holdning og ikke om udvalgets holdning.,Negation,"thus to reach a compromise he should have shared his reflections with the committee on the environment, public health and food safety: otherwise his position is a purely personal one, one shared by the committee.","(0.95, 0.95)",0.933651069586263,0.9774,1.0,0.9666666666666668,0.9830508424590636,0.9696969696969696,0.9411764705882352,0.9552238755981288,1.0,0.9666666666666668,0.9830508424590636,0.95,0.95,en
"that is why, mr sacconi, i think you have taken the wrong route in deciding not to seek a solution of the most general application possible.","derfor mener jeg, hr. sacconi, at de ikke mindst er gået den forkerte vej ved at give afkald på at finde en løsning, der var så stor enighed om som muligt.",Negation,"that is why, mr sacconi, i think you have taken the wrong route in deciding to seek a solution of the most general application possible.","(0.95, 0.95)",0.9061874434879644,0.9687,1.0,0.96,0.9795918317367764,0.9583333333333334,0.92,0.9387755052061642,1.0,0.96,0.9795918317367764,0.95,0.95,en
"in this connection i should like to make some observations concerning the osor (one substance, one registration) system.",i den forbindelse vil jeg gerne fremsætte et par bemærkninger om osor-systemet.,Remove Token,"in this connection should like to make some observations concerning the osor (one substance, one registration) system.","(0.99, 0.95)",0.8725129388059689,0.9585,1.0,0.9444444444444444,0.9714285664326532,0.9375,0.8823529411764706,0.9090909040955004,1.0,0.9444444444444444,0.9714285664326532,0.99,0.95,en
"it is also our duty to legislate to promote the competitiveness of our industry, in accordance with the commitment we made in lisbon and as we repeated a few months ago.","det er også vores opgave at lovgive for at fremme vores industris konkurrenceevne, som vi forpligtede os til i lissabon, og som vi gentog for nogle få måneder siden.",Add random word,"it is also our duty to legislate to promote the competitiveness of our industry, antherozoidal in accordance with the commitment we made in lisbon and as we repeated a few months ago.","(0.95, 0.95)",0.9219602423775934,0.9969,0.9629629629629628,1.0,0.9811320704734782,0.935483870967742,0.9666666666666668,0.9508196671324912,0.9629629629629628,1.0,0.9811320704734782,0.95,0.95,en
that is another statistic of which we should take note.,"også det er et tal, som vi bør tage til efterretning.",Swap characters,that is another statistic of which we sholud take note.,"(0.99, 0.95)",0.7016879391277372,0.9055,0.9,0.9,0.899999995,0.7777777777777778,0.7777777777777778,0.7777777727777778,0.9,0.9,0.899999995,0.99,0.95,en
i believe that the requirements to provide information about chemical substances in lower volumes must be strengthened.,"jeg mener, at kravet om information om kemiske stoffer i lave volumener skal styrkes.",Replace Character,i believe that the requirements to provide rnformation about chemical substances in lower volumes must be strengthened.,"(0.98, 0.95)",0.8394327083733336,0.9437,0.9411764705882352,0.9411764705882352,0.9411764655882354,0.875,0.875,0.874999995,0.9411764705882352,0.9411764705882352,0.9411764655882354,0.98,0.95,en
that is a precondition of consumers being able to make active and informed choices.,"det er en forudsætning for, at de skal kunne foretage et aktivt og oplyst valg.",Duplicate character,that is a precondition of consumers being able to make active and informed choicess.,"(0.99, 0.95)",0.8666415730847504,0.932,0.9285714285714286,0.9285714285714286,0.9285714235714286,0.9230769230769232,0.9230769230769232,0.9230769180769232,0.9285714285714286,0.9285714285714286,0.9285714235714286,0.99,0.95,en
we must note with regret that there is no majority in favour of the original proposal by the committee on the environment.,"vi må med beklagelse konstatere, at der ikke er flertal for miljøudvalgets oprindelige forslag.",Remove Token,must note with regret that there is no majority in favour of the original proposal by the committee on the environment.,"(1.00, 1.00)",0.9533589351059684,0.9607,1.0,0.95,0.9743589693622616,1.0,0.9523809523809524,0.9756097511005354,1.0,0.95,0.9743589693622616,1.00,1.00,en
"they are the forces of the uncontrolled market, of deregulation and of profits that speculate with public health and the environment.","det er de ukontrollerede markedskræfter, dereguleringskræfterne og profitkræfterne, hvor der spekuleres i sundhed og miljø.",Duplicate Token,"they are the forces of the uncontrolled market, of deregulation and of profits that that speculate with public health and the environment.","(0.99, 1.00)",0.9212572821896308,0.9953,1.0,1.0,0.999999995,0.9523809523809524,1.0,0.9756097511005354,1.0,1.0,0.999999995,0.99,1.00,en
"curiously, this amount is spread very unevenly over the ten years in question with most of it, more than eur 50 million, concentrated in 2014 and 2015.","mærkeligt nok er dette beløb spredt meget ujævnt over de pågældende 10 år, og størstedelen af beløbet, over 50 millioner euro, er koncentreret i 2014 og 2015.",Add random word,"curiously, this amount is spread very unevenly over the ten years in question with most of it, noncapitalistically more than eur 50 million, concentrated in 2014 and 2015.","(0.97, 0.95)",0.9167409308877168,0.9967,0.9629629629629628,1.0,0.9811320704734782,0.925925925925926,0.9615384615384616,0.9433962214168744,0.9629629629629628,1.0,0.9811320704734782,0.97,0.95,en
that is why we will not allow ourselves to be influenced by purely political statements and why we will assess the various amendments put forward on a case-by-case basis.,"det er grunden til, at vi ikke udelukkende vil lade os lede af politiske overvejelser, og det er grunden til, at vi vil forholde os til de forskellige ændringsforslag enkeltvis.",Negation,that is why we will allow ourselves to be influenced by purely political statements and why we will assess the various amendments put forward on a case-by-case basis.,"(0.85, 0.95)",0.9095930632220222,0.9697,1.0,0.9615384615384616,0.9803921518646674,0.96,0.9230769230769232,0.9411764655901576,1.0,0.9615384615384616,0.9803921518646674,0.85,0.95,en
this is a sign that politics works and that this parliament works when it comes to a truly important task.,"det er tegn på, at politikken fungerer, og at parlamentet fungerer, når det drejer sig om en virkelig vigtig opgave.",Replace Token with Random Word,this is a sign that politics works and that this parliament works when dug comes to a truly important task.,"(0.98, 0.99)",0.8656030552541708,0.9519,0.9375,0.9375,0.937499995,0.8947368421052632,0.8947368421052632,0.8947368371052632,0.9375,0.9375,0.937499995,0.98,0.99,en
the statistical evidence confirms that one of the biggest dangers to human health and longevity is unemployment.,"statistikkerne bekræfter, at en af de største farer for menneskets sundhed og lange levetid er arbejdsløshed.",Add random word,the statistical evidence confirms that overgodly one of the biggest dangers to human health and longevity is unemployment.,"(0.99, 0.99)",0.8522456714074852,0.9938,0.9411764705882352,1.0,0.9696969647015612,0.8823529411764706,0.9375,0.9090909040955004,0.9411764705882352,1.0,0.9696969647015612,0.99,0.99,en
reach must also extend knowledge on chemicals by forming a european database and stimulate innovation by encouraging the substitution of substances of concern.,og reach bør også fremme kendskabet til kemikalierne ved at oprette en europæisk database og fremme nyskabelse ved at tilskynde til substitution af mistænkelige produkter.,Duplicate character,reach must also extend knowledge on chemicals by forming a european database and stimullate innovation by encouraging the substitution of substances of concern.,"(0.99, 0.99)",0.8843865924896842,1.0,0.9523809523809524,0.9523809523809524,0.9523809473809524,0.9090909090909092,0.9090909090909092,0.9090909040909092,0.9523809523809524,0.9523809523809524,0.9523809473809524,0.99,0.99,en
"at the same time, i should also like to thank mrs ek and mr nassauer for having drafted key opinions on behalf of other committees consulted.","men min tak gælder også de vigtige ordførere for udtalelserne fra de rådgivende udvalg, fru ek og hr. nassauer.",Duplicate character,"at the same time, i should also like to thank mrs ek and mr nassaueer for having drafted key opinions on behalf of other committees consulted.","(0.99, 0.95)",0.9025139799587886,0.9641,0.9615384615384616,0.9615384615384616,0.9615384565384616,0.92,0.92,0.919999995,0.9615384615384616,0.9615384615384616,0.9615384565384616,0.99,0.95,en
