originalSentence,referenceSentence,tamperingType,tamperedSentence,"LLMScore (Sim, Con)",BLEU,METEOR,Rouge1 r,Rouge1 p,Rouge1 f,Rouge2 r,Rouge2 p,Rouge2 f,Rougel r,Rougel p,Rougel f,LLM-Sim,LLM-Con,originalLanguage
all that we have heard so far confirms that.,"det bekræftes af alt, hvad vi har hørt indtil nu.",Add random word,all that we have hypostases heard so far confirms that.,"(0.85, 0.95)",0.710866788975034,0.9861,0.8888888888888888,1.0,0.9411764656055364,0.7777777777777778,0.875,0.823529406782007,0.8888888888888888,1.0,0.9411764656055364,0.85,0.95,en
we have to ask ourselves questions such as why it is that some of these murders have taken place close to security positions; why it is that the military have not been able to protect their population.,"vi må spørge os selv f.eks., hvorfor mordene er sket tæt ved sikkerhedsstillinger, og hvorfor militæret ikke har været i stand til at beskytte befolkningen.",Negation,we have to ask ourselves questions such as why it is that some of these murders have taken place close to security positions; why it is that the military have been able to protect their population.,"(0.95, 0.99)",0.931838481115484,0.9768,1.0,0.9655172413793104,0.9824561353524162,0.96875,0.9393939393939394,0.9538461488473374,1.0,0.9655172413793104,0.9824561353524162,0.95,0.99,en
"indeed, this is a factor of great concern which prompts me to ask for the european union to pay the greatest possible attention to all three of these countries.","dette er en kilde til alvorlig bekymring, som giver mig anledning til at kræve den størst mulige opmærksomhed fra den europæiske union på forholdene i alle disse tre lande.",Remove Character,"indeed, this is a factor of great concern which prompts me to ask for the european union to pay the greatest possible attention to ll three of these countries.","(0.99, 0.95)",0.9127592114472296,0.9676,0.96,0.96,0.959999995,0.9285714285714286,0.9285714285714286,0.9285714235714286,0.96,0.96,0.959999995,0.99,0.95,en
i welcome with great satisfaction the idea that a delegation from this parliament is going to make an urgent visit to algeria to begin as constructive a dialogue as possible with the new algerian parliament.,"jeg tilslutter mig varmt idéen om, at en delegation fra dette parlament hurtigst muligt rejser til algeriet for at starte en så konstruktiv dialog som mulig med det nye algeriske parlament.",Duplicate character,i welcome with great satisfaction the idea that a delegation from this parliament is going to make aan urgent visit to algeria to begin as constructive a dialogue as possible with the new algerian parliament.,"(0.99, 0.99)",0.9257518071011758,0.9721,0.9642857142857144,0.9642857142857144,0.9642857092857144,0.9411764705882352,0.9411764705882352,0.9411764655882354,0.9642857142857144,0.9642857142857144,0.9642857092857144,0.99,0.99,en
"firstly, as regards that reaction to interference, we should remind them that the euro-mediterranean agreements do not involve the european union alone.","for det første må vi i forbindelse med denne reaktion over for indblanding minde om, at den europæiske union ikke står alene i euro-middelhavsaftalerne.",Negation,"firstly, as regards that reaction to interference, we should remind them that the euro-mediterranean agreements do involve the european union alone.","(0.95, 0.95)",0.8895260356363631,0.9636,1.0,0.95,0.9743589693622616,0.95,0.9047619047619048,0.9268292632956572,1.0,0.95,0.9743589693622616,0.95,0.95,en
"well, there is now an algerian parliament whose president, as i have been informed, wishes to receive such a visit, and i believe that our parliament must send that delegation.","men nu er der altså et algerisk parlament, hvis formand - så vidt jeg har fået oplyst - ønsker at modtage dette besøg, og jeg tror, at det, parlamentet skal gøre, er at sende denne delegation af sted.",Swap characters,"well, there is now an lagerian parliament whose president, as i have been informed, wishes to receive such a visit, and i believe that our parliament must send that delegation.","(0.99, 0.95)",0.9234732618882052,0.9713,0.9629629629629628,0.9629629629629628,0.9629629579629628,0.9310344827586208,0.9310344827586208,0.9310344777586208,0.9629629629629628,0.9629629629629628,0.9629629579629628,0.99,0.95,en
"well, we have now arrived at an era when we can give a modest example of dialogue to others who are currently in a violent phase.","men nu er vi nået til et punkt, hvor vi kan foregå med et beskedent eksempel i dialogen med andre, som nu er voldelige.",Swap characters,"well, we have now arrived at an era when we can give a modest example of dialogue to others who aer currently in a violent phase.","(0.99, 0.99)",0.9025139799587886,0.9641,0.9583333333333334,0.9583333333333334,0.9583333283333336,0.92,0.92,0.919999995,0.9583333333333334,0.9583333333333334,0.9583333283333336,0.99,0.99,en
"and yet now, more than ever, is the time to cry out, and especially we members of european parliament.",alligevel er det mere end nogensinde vigtigt at der råbes op og især fra medlemmerne af europa-parlementet.,Add random word,"and yet now, arcosolia more than ever, is the time to cry out, and especially we members of european parliament.","(0.90, 0.95)",0.8862476419965991,0.9953,0.9473684210526316,1.0,0.9729729679766254,0.8947368421052632,0.9444444444444444,0.9189189139225714,0.9473684210526316,1.0,0.9729729679766254,0.90,0.95,en
let us never forget that the legitimacy of power wears out very quickly when you permanently betray the principles on which that power is based.,"vi må hele tiden huske på, at en magthavers legitimitet hurtigt forgår, når denne igen og igen forråder de principper, han er valgt på.",Duplicate Token,let us never forget that the legitimacy of power wears out very quickly when you permanently betray betray the principles on which that power is based.,"(0.99, 0.99)",0.9306757101384976,0.9959,1.0,1.0,0.999999995,0.96,1.0,0.9795918317367764,1.0,1.0,0.999999995,0.99,0.99,en
our common effort will therefore take a long time.,vores fælles anstrengelser er altså et langsommeligt arbejde.,Duplicate Token,our common effort will therefore take a long time time.,"(0.95, 0.95)",0.8420460979216616,0.9861,1.0,1.0,0.999999995,0.8888888888888888,1.0,0.9411764656055364,1.0,1.0,0.999999995,0.95,0.95,en
"mr president, ladies and gentlemen, i would also like to say a word about corruption within the palestinian authority itself.","hr. formand, mine damer og herrer, jeg vil samtidig gerne nævne korruptionen inden for de palæstinensiske myndigheders rækker.",Remove Character,"mr preident, ladies and gentlemen, i would also like to say a word about corruption within the palestinian authority itself.","(1.00, 1.00)",0.9173176373893104,0.9562,0.95,0.95,0.949999995,0.8947368421052632,0.8947368421052632,0.8947368371052632,0.95,0.95,0.949999995,1.00,1.00,en
"of course, mr president, the most difficult part is yet to come, that is, defining a basis on which discussions can be re-opened.","det vanskeligste, hr. formand, er selvfølgelig nu at finde et grundlag for disse forhandlinger.",Duplicate character,"of course, mr presideent, the most difficult part is yet to come, that is, defining a basis on which discussions can be re-opened.","(0.99, 0.99)",0.9025139799587886,1.0,0.9565217391304348,0.9565217391304348,0.9565217341304348,0.9090909090909092,0.9090909090909092,0.9090909040909092,0.9565217391304348,0.9565217391304348,0.9565217341304348,0.99,0.99,en
"there is no doubt, especially since the israeli government's decision to build a new settlement in east jerusalem, that we have entered a vicious circle which has placed the middle-east peace process in a frankly delicate situation.","kommissionen er helt enig, og vi har uden tvivl - især efter den israelske regerings beslutning om at bygge en ny bosættelse i østjerusalem - påbegyndt en spiral, der virkelig har sat fredsprocessen i mellemøsten i en ømtålelig situation.",Duplicate character,"there is no doubt, especially sinnce the israeli government's decision to build a new settlement in east jerusalem, that we have entered a vicious circle which has placed the middle-east peace process in a frankly delicate situation.","(0.99, 0.99)",0.935369573102062,0.9755,0.9696969696969696,0.9696969696969696,0.96969696469697,0.9444444444444444,0.9444444444444444,0.9444444394444445,0.9696969696969696,0.9696969696969696,0.96969696469697,0.99,0.99,en
"otherwise, i doubt whether the international community can sustain this enormous financial effort which, despite all attempts, has not been able to prevent the palestinians becoming even poorer this year, and having fewer investments than four years ago.","hvis ikke, tvivler jeg på, at det internationale samfund fortsat kan yde så stort et økonomisk bidrag, som alligevel ikke har kunnet forhindre, at palæstinenserne i år er fattigere og har færre investeringer end for fire år siden.",Negation,"otherwise, i doubt whether the international community can sustain this enormous financial effort which, despite all attempts, has been able to prevent the palestinians becoming even poorer this year, and having fewer investments than four years ago.","(0.99, 0.95)",0.9385522307631308,0.979,1.0,0.9722222222222222,0.9859154879587384,0.9722222222222222,0.945945945945946,0.9589041045899794,1.0,0.9722222222222222,0.9859154879587384,0.99,0.95,en
"it is totally unacceptable that people who sell land, from palestinians to israelis, should be ""punished' by death in a legal or illegal manner.","det er fuldstændigt uacceptabelt, at mennesker, som sælger land, at palæstinensere, som sælger til israelere, illegalt eller legalt - i anførselstegn - straffes med døden.",Duplicate Token,"it is totally unacceptable that people who sell land, from palestinians to israelis, should be ""punished' by death in a legal legal or illegal manner.","(0.99, 0.99)",0.9380720528370188,0.9964,1.0,1.0,0.999999995,0.9583333333333334,1.0,0.9787233992575828,1.0,1.0,0.999999995,0.99,0.99,en
"the fact remains, though, that freedom of movement is being massively restricted here, and also that the only peace partner there is, arafat and the plo, is being divorced from the support of its own population.","det er dog en kendsgerning, at bevægelsesfriheden er voldsomt begrænset, og at den eneste fredspartner, som der findes, arafat og plo, ikke længere har sin egen befolknings tillid.",Replace Token with Random Word,"the fact remains, though, that freedom of movement is being massively restricted here, and also that the only peace partner there is, arafat outparagon the plo, is being divorced from the support of its own population.","(0.95, 0.95)",0.9370011451812968,0.9757,0.9655172413793104,1.0,0.9824561353524162,0.9411764705882352,0.9411764705882352,0.9411764655882354,0.9655172413793104,1.0,0.9824561353524162,0.95,0.95,en
"this is something that must end, as must other, related, activities.","dette sammen med andre tendenser er noget, der må ophøre.",Add random word,"this is something that must end, as must other, related, nonleguminous activities.","(0.95, 0.90)",0.8415266720024042,0.9922,0.9090909090909092,1.0,0.9523809473922904,0.8181818181818182,0.9,0.8571428521541952,0.9090909090909092,1.0,0.9523809473922904,0.95,0.90,en
"thirdly, actions to implement the oslo agreements in full, since, because of their international nature, these agreements are the basis of any peace process in the middle east.","for det tredje må der tages skridt til fuldt ud at leve op til oslo-aftalerne, eftersom osloaftalerne, som internationale aftaler er af grundlæggende betydning for enhver fredsproces i mellemøsten.",Duplicate Token,"thirdly, actions to implement the oslo agreements in full, since, because of their international nature, these agreements are the basis of any peace process in the middle middle east.","(0.98, 0.95)",0.945776776063842,0.9969,1.0,1.0,0.999999995,0.9642857142857144,1.0,0.9818181768198349,1.0,1.0,0.999999995,0.98,0.95,en
"and fourthly, actions to ensure the success of the proposed new new york process - a process that will proceed in two phases: a bipartite phase, namely palestine and israel, and a tripartite phase, namely palestine, israel and the united states.","for det fjerde skal den i new york foreslåede nye procedure (procedure i to faser: en bilateral mellem palæstina og israel, og en trilateral mellem palæstina, israel og de forenede stater) kunne gennemføres med held.",Duplicate Token,"and fourthly, actions to ensure the success of the proposed new new york process - a process that will proceed in two phases: a bipartite bipartite phase, namely palestine and israel, and a tripartite phase, namely palestine, israel and the united states.","(0.95, 0.98)",0.9630079097791628,0.9979,1.0,1.0,0.999999995,0.975,1.0,0.9873417671526998,1.0,1.0,0.999999995,0.95,0.98,en
"mr president, the middle east is an area where colonial powers have created the background to the present situation by means of divide and rule tactics, for their own advantage.","hr. formand, mellemøsten er et område, hvor kolonimagter til egen fordel med del og hersk taktikker har lagt grunden til den nuværende situation.",Duplicate character,"mr president, the middle east is an area where colonial powers have created the background to the present ssituation by means of divide and rule tactics, for their own advantage.","(0.99, 0.99)",0.9184678024441792,0.9696,0.9642857142857144,0.9642857142857144,0.9642857092857144,0.9310344827586208,0.9310344827586208,0.9310344777586208,0.9642857142857144,0.9642857142857144,0.9642857092857144,0.99,0.99,en
people who trade with each other should also speak to each other.,"dem, der handler med hinanden, bør også tale sammen.",Remove Character,people ho trade with each other should also speak to each other.,"(0.99, 1.00)",0.842362674378975,0.9209,0.9,0.9,0.899999995,0.8,0.8,0.7999999950000002,0.9,0.9,0.899999995,0.99,1.00,en
"islamic leaders in the mosques of egypt, syria, lebanon and iran continue to praise the palestinian suicide squads literally as religious martyrs.","islamitiske ledere i mosker i ægypten, syrien, libanon og iran bliver bogstaveligt talt ved med prise de palæstinensiske selvmordskommandoer ind i himlen.",Swap characters,"islamic eladers in the mosques of egypt, syria, lebanon and iran continue to praise the palestinian suicide squads literally as religious martyrs.","(0.99, 0.99)",0.9244754047211334,0.9597,0.9523809523809524,0.9523809523809524,0.9523809473809524,0.9047619047619048,0.9047619047619048,0.9047618997619048,0.9523809523809524,0.9523809523809524,0.9523809473809524,0.99,0.99,en
the confidence of palestinians and israelis in their own leaders has decreased.,palæestinensernes og israelernes tillid til deres egne ledere er faldet.,Remove Token,the confidence of palestinians and israelis their own leaders has decreased.,"(0.95, 0.99)",0.7611606003349892,0.9281,1.0,0.9166666666666666,0.9565217341398866,0.9,0.8181818181818182,0.8571428521541952,1.0,0.9166666666666666,0.9565217341398866,0.95,0.99,en
"that is now exactly what the american secretary of state is trying to encourage by letting the parties for the moment stew in their own juice, because in the end they will have to get along with each other.","det er lige nøjagtigt det, som den amerikanske udenrigsminister forsøger at befordre ved i øjeblikket midlertidigt at lade parterne stege møre i deres eget fedt, for i den sidste ende bliver de nødt til at finde ud af det sammen.",Duplicate Token,"that is now exactly what the american secretary of state is trying to encourage by letting the parties for the moment stew in their own juice, because in the end they will have to get along with each each other.","(0.99, 1.00)",0.956570371605845,0.9975,1.0,1.0,0.999999995,0.9743589743589745,1.0,0.9870129820138304,1.0,1.0,0.999999995,0.99,1.00,en
"because without taking into account the rational economic and social development of israel's neighbours, the jealousy and fear of israel, a hard-working democracy, will remain.","for uden udsigt til en økonomisk og social udvikling af de israelske naboer vil jalousien og angsten for israel, et hårdtarbejdende demokrati, opretholdes.",Swap words,"because without taking into account the rational economic and social development israel's of neighbours, the jealousy and fear of israel, a hard-working democracy, will remain. ","(0.99, 0.99)",0.8699617762678626,0.9988,0.9565217391304348,1.0,0.977777772780247,0.84,0.875,0.8571428521449397,0.9130434782608696,0.9545454545454546,0.9333333283358024,0.99,0.99,en
"that is easy to say, but difficult to achieve.","det er nemt at sige, men svært at gennemføre.",Replace Character,"that is easy to say, buu difficult to achieve.","(0.99, 0.99)",0.7016879391277372,0.9055,0.875,0.875,0.874999995,0.75,0.75,0.749999995,0.875,0.875,0.874999995,0.99,0.99,en
"mr president, last saturday, the fourth anniversary of the signing of the oslo agreements in washington, should have been a day of rejoicing, both for israel and for palestine.","hr. formand, sidste lørdag var det fire år siden, at man i washington underskrev den såkaldte ""oslo-aftale«, og det var en dag, der burde have været en glædesdag både i israel og i palæstina.",Swap words,"mr president, saturday, last the fourth anniversary of the signing of the oslo agreements in washington, should have been a day of rejoicing, both for israel and for palestine. ","(0.95, 0.95)",0.8941491409902148,0.9992,0.96,1.0,0.9795918317367764,0.8571428571428571,0.8888888888888888,0.8727272677289256,0.92,0.9583333333333334,0.9387755052061642,0.95,0.95,en
we shall of course condemn all acts of violence.,naturligvis skal vi fordømme alle voldshandlinger.,Replace Token with Random Word,we shall of course camelopardel all acts of violence.,"(0.00, 1.00)",0.6580370064762462,0.8951,0.875,0.875,0.874999995,0.75,0.75,0.749999995,0.875,0.875,0.874999995,0.00,1.00,en
"we shall of course examine all those involved, including the palestinian authorities, and not least arafat's own authoritarian methods and the opportunities for corruption which the palestinians themselves have also now investigated.","naturligvis skal vi granske alle aktører, også den palæstinensiske myndighed, og ikke mindst arafats personlige autoritære metoder og mulighederne for korruption, som palæstinenserne nu også selv har undersøgt.",Negation,"we shall of course examine all those involved, including the palestinian authorities, and least arafat's own authoritarian methods and the opportunities for corruption which the palestinians themselves have also now investigated.","(0.98, 0.95)",0.9257518071011758,0.9748,1.0,0.9655172413793104,0.9824561353524162,0.9666666666666668,0.935483870967742,0.9508196671324912,1.0,0.9655172413793104,0.9824561353524162,0.98,0.95,en
"everyone who goes off to work in the morning has the right to return home alive in the evening, and every national authority has the right to protect its civil population.","enhver borger, der om morgenen tager afsted på arbejde, har ret til at komme levende hjem igen om aftenen, og enhver national myndighed har ret til at beskytte sin civile befolkning.",Swap words,"everyone who goes off to work in the morning has the right to return home alive in the evening, every and national authority has the right to protect its civil population. ","(0.99, 0.95)",0.9005694513489713,0.9991,0.9583333333333334,1.0,0.9787233992575828,0.8518518518518519,0.8846153846153846,0.8679245233036669,0.9166666666666666,0.9565217391304348,0.9361702077682208,0.99,0.95,en
"for this reason, we support the proposal from the president of the council to set up a permanent security committee between europe and the united states to exercise the maximum possible pressure on both sides.","derfor støtter vi rådsformandens forslag om at danne en permanent sikkerhedskomité mellem europa og de forenede stater, som kan gribe ind for at lægge det størst mulige pres på begge parter.",Remove Character,"for this reson, we support the proposal from the president of the council to set up a permanent security committee between europe and the united states to exercise the maximum possible pressure on both sides.","(0.99, 0.95)",0.9355359393782814,0.9729,0.9666666666666668,0.9666666666666668,0.9666666616666668,0.9411764705882352,0.9411764705882352,0.9411764655882354,0.9666666666666668,0.9666666666666668,0.9666666616666668,0.99,0.95,en
"without this fundamental clarification, no partial proposal will have any effect.",uden denne grundlæggende afklaring vil intet delforslag have nogen virkning.,Swap words,"without this fundamental clarification, no partial proposal will any have effect. ","(0.95, 0.99)",0.7315254958027825,0.9854,0.9166666666666666,1.0,0.9565217341398866,0.6363636363636364,0.7,0.6666666616780046,0.8333333333333334,0.9090909090909092,0.8695652124007562,0.95,0.99,en
"as regards commissioner marín's requests, i will be brief.","hvad angår kommissær maríns anmodning, vil jeg være ganske kort.",Remove Token,"as regards commissioner marín's, i will be brief.","(0.95, 0.95)",0.7348889200874658,0.9216,0.875,0.7777777777777778,0.823529406782007,0.7142857142857143,0.625,0.6666666616888889,0.875,0.7777777777777778,0.823529406782007,0.95,0.95,en
we have been for a long time hoping that the peace process in the middle east would come to some form of conclusion.,"vi har i lang tid håbet, at fredsprocessen i mellemøsten ville blive afsluttet med en eller anden løsning.",Swap characters,we have been for a long time hoping that the peace process in the middle east would come to some form fo conclusion.,"(0.99, 1.00)",0.8971148504974097,0.958,0.9545454545454546,0.9545454545454546,0.9545454495454548,0.9090909090909092,0.9090909090909092,0.9090909040909092,0.9545454545454546,0.9545454545454546,0.9545454495454548,0.99,1.00,en
these things have to be said at the present time and parliament will have to come to a conclusion because it has a role to play in this process.,"de ting må og skal siges på nuværende tidspunkt, og parlamentet, som jo har en rolle at spille i denne process, skal nå til en konklusion.",Remove Token,these things have to be said at the present time and parliament will have to come to a conclusion because it has role to play in this process.,"(0.99, 0.95)",0.9095930632220222,0.9686,1.0,1.0,0.999999995,0.9615384615384616,0.925925925925926,0.9433962214168744,1.0,1.0,0.999999995,0.99,0.95,en
"if we look at the situation we can see that, according to the famous saying, it is serious but not desperate.","når man undersøger situationen nærmere, kan man konstatere, at den er, som det populært siges, alvorlig men ikke håbløs.",Negation,"if we look at the situation we can see that, according to the famous saying, it is serious but desperate.","(0.95, 0.99)",0.8971148504974097,0.962,1.0,0.9473684210526316,0.9729729679766254,0.9473684210526316,0.9,0.9230769180802104,1.0,0.9473684210526316,0.9729729679766254,0.95,0.99,en
what is netanyahu achieving with this harmful policy?,hvad opnår netanyahu med denne ulovlige politik?,Add random word,what is netanyahu achieving with this harmful recreationist policy?,"(0.85, 0.95)",0.7189393375176814,0.9836,0.8888888888888888,1.0,0.9411764656055364,0.75,0.8571428571428571,0.7999999950222222,0.8888888888888888,1.0,0.9411764656055364,0.85,0.95,en
"and, unfortunately, we must emphasize again europe's failure to have a strong political presence in this sector in crisis, once again left almost entirely to american diplomacy.","desværre må vi også endnu en gang understrege, at europa ingen stærk, lokal tilstedeværelse har i dennne kriseregion, der endnu en gang er næsten fuldstændig overladt til det amerikanske diplomati.",Duplicate Token,"and, unfortunately, we must emphasize again europe's 's failure to have a strong political presence in this sector in crisis, once again left almost entirely to american diplomacy.","(1.00, 1.00)",0.9440368015398672,0.9968,0.96,1.0,0.9795918317367764,0.925925925925926,0.9615384615384616,0.9433962214168744,0.96,1.0,0.9795918317367764,1.00,1.00,en
it is the duty of europe and our parliament to remind everyone of that this morning!,det er europas og dette parlaments pligt at huske alle om dette!,Duplicate character,it is the duty of europe and our parliament to remind everyone of that thhis morning!,"(0.98, 0.95)",0.848219861937046,0.9403,0.9333333333333332,0.9333333333333332,0.9333333283333336,0.8666666666666667,0.8666666666666667,0.8666666616666667,0.9333333333333332,0.9333333333333332,0.9333333283333336,0.98,0.95,en
"we should be aware, as he asks us to be, that at the moment we are sustaining the situation with funds destined not for the development but for the security of palestinian society.","vi må, ganske som han beder os om, være bevidste om, at vi for øjeblikket støtter situationen med økonomisk bistand ikke til udvikling, men til social sikring af palæstinenserne.",Negation,"we should be aware, as he asks us to be, that at the moment we are sustaining the situation with funds destined for the development but for the security of palestinian society.","(0.95, 0.95)",0.9257518071011758,0.9748,1.0,0.9642857142857144,0.9818181768198349,0.9666666666666668,0.935483870967742,0.9508196671324912,1.0,0.9642857142857144,0.9818181768198349,0.95,0.95,en
we have no alternative but to keep on believing in oslo - putting our trust in oslo.,"vi kan ikke gøre andet end fortsat at tro på oslo, at sætte vores lid til oslo.",Replace Character,we have no alternative but to kebp on believing in oslo - putting our trust in oslo.,"(0.99, 0.99)",0.8394327083733336,0.9437,0.9333333333333332,0.9333333333333332,0.9333333283333336,0.8666666666666667,0.8666666666666667,0.8666666616666667,0.9333333333333332,0.9333333333333332,0.9333333283333336,0.99,0.99,en
