originalSentence,referenceSentence,tamperingType,tamperedSentence,"LLMScore (Sim, Con)",BLEU,METEOR,Rouge1 r,Rouge1 p,Rouge1 f,Rouge2 r,Rouge2 p,Rouge2 f,Rougel r,Rougel p,Rougel f,LLM-Sim,LLM-Con,originalLanguage
"udenrigsudvalget betoner desuden, at beskyttelsen af minoriteter er af afgørende betydning, og at kommissionen sammen med ansøgerlandene bør løse problemerne snarest muligt.","the committee on foreign affairs, security and defence policy also stresses that the protection of minorities is of crucial importance and that the commission should solve this problem as quickly as possible jointly with the applicant countries.",Remove Character,"udenrigsudvalget betoner desuden, at beskyttelsen af minoriteter er af afgørende betydning, og at kommissionen sammen med ansøgerlandene bør øse problemerne snarest muligt.","(0.98, 0.95)",0.8895260356363631,0.9597,0.95,0.95,0.949999995,0.9047619047619048,0.9047619047619048,0.9047618997619048,0.95,0.95,0.949999995,0.98,0.95,da
uden respekt for minoriteters rettigheder kan vi ikke skabe et stabilt europa.,we cannot create a stable europe without respect for the rights of minorities.,Negation,uden respekt for minoriteters rettigheder kan vi skabe et stabilt europa.,"(0.95, 0.95)",0.7611606003349892,0.9281,1.0,0.9166666666666666,0.9565217341398866,0.9,0.8181818181818182,0.8571428521541952,1.0,0.9166666666666666,0.9565217341398866,0.95,0.95,da
"på en god måde betyder imidlertid, at der i dette så afgørende spørgsmål for fremtiden ikke må føres politik hen over hovedet på de berørte.","making good use, however, means that in this extremely decisive question for the future, policy cannot be made over the heads of the people concerned.",Negation,"på en god måde betyder imidlertid, at der i dette så afgørende spørgsmål for fremtiden må føres politik hen over hovedet på de berørte.","(0.95, 0.99)",0.8985396083419646,0.9663,1.0,0.9583333333333334,0.9787233992575828,0.9565217391304348,0.9166666666666666,0.9361702077682208,1.0,0.9583333333333334,0.9787233992575828,0.95,0.99,da
"hvis den sociale dimension og udformningen af det sociale system i det nye europa ikke fremmes målrettet og med den nødvendige finfølelse, styrer vi ret hurtigt hen imod nye samfundskonflikter, især i den europæiske unions grænseregioner.","if the social dimensions, the social development of our new europe is not driven forward purposefully or with the necessary sensitivity we are heading ever more certainly for new social conflicts and that is particularly the case in the border regions of the european union.",Negation,"hvis den sociale dimension og udformningen af det sociale system i det nye europa fremmes målrettet og med den nødvendige finfølelse, styrer vi ret hurtigt hen imod nye samfundskonflikter, især i den europæiske unions grænseregioner.","(0.99, 0.95)",0.931838481115484,0.9768,1.0,0.9655172413793104,0.9824561353524162,0.9705882352941176,0.9428571428571428,0.9565217341314852,1.0,0.9655172413793104,0.9824561353524162,0.99,0.95,da
men netop dét gælder det om at undgå.,it is precisely that which we must avoid.,Replace Token with Random Word,men netop dét gælder det om at ridt.,"(0.85, 0.95)",0.7506238537503395,0.8819,0.875,0.875,0.874999995,0.8571428571428571,0.8571428571428571,0.8571428521428571,0.875,0.875,0.874999995,0.85,0.95,da
"hvorledes det kan ske, har udvalget om sociale anliggender og beskæftigelse redegjort for i sin udtalelse og stillet forslag.","the ""how' has been discussed by the committee for employment and social affairs in its opinion, and proposals have been made.",Replace Character,"hvorledes det kan ske, har udvalget om sociale anligiender og beskæftigelse redegjort for i sin udtalelse og stillet forslag.","(1.00, 1.00)",0.8656030552541708,0.9519,0.9444444444444444,0.9444444444444444,0.9444444394444445,0.8888888888888888,0.8888888888888888,0.888888883888889,0.9444444444444444,0.9444444444444444,0.9444444394444445,1.00,1.00,da
"men en af det sociale udvalgs konklusioner, som beskæftiger sig med overgangsfrister i den frie bevægelighed for arbejdstagere, blev forkastet med én stemmes flertal.","but one conclusion of the social committee, relating to the transition periods for freedom of movement of employees was rejected by a majority of one vote.",Remove Token,"men en af det sociale udvalgs konklusioner, som sig med overgangsfrister i den frie bevægelighed for arbejdstagere, blev forkastet med én stemmes flertal.","(0.95, 0.98)",0.8985396083419646,0.9663,1.0,0.9565217391304348,0.977777772780247,0.9545454545454546,0.9130434782608696,0.9333333283358024,1.0,0.9565217391304348,0.977777772780247,0.95,0.98,da
kun dermed vil vi være i stand til at indlede også en grænseoverskridende god dialog med henblik på også i ansøgerlandene strukturelt at fremme en bæredygtig udvikling.,only in this way will we be able to begin a good cross-border dialogue in order to promote the structure in the applicant states of a lasting development.,Remove Character,kun dermed vil vi være i stand til at indlede også en grænseovrskridende god dialog med henblik på også i ansøgerlandene strukturelt at fremme en bæredygtig udvikling.,"(1.00, 1.00)",0.9025139799587886,0.9641,0.9565217391304348,0.9565217391304348,0.9565217341304348,0.9230769230769232,0.9230769230769232,0.9230769180769232,0.9565217391304348,0.9565217391304348,0.9565217341304348,1.00,1.00,da
"alle tre ordførere har ikke kun vist stor sagkundskab, men navnlig megen indfølingsevne, og jeg mener, at det sidste i forbindelse med dette følsomme emne er mindst lige så vigtigt som det første!","all three rapporteurs have displayed not only great knowledge of the subject matter but also in particular a very high degree of sensitivity, and i believe that this sensitive topic demands both!",Negation,"alle tre ordførere har kun vist stor sagkundskab, men navnlig megen indfølingsevne, og jeg mener, at det sidste i forbindelse med dette følsomme emne er mindst lige så vigtigt som det første!","(1.00, 1.00)",0.9278982724420874,0.9755,1.0,0.96875,0.984126979128244,0.967741935483871,0.9375,0.952380947382212,1.0,0.96875,0.984126979128244,1.00,1.00,da
"hvis kommissionens og rådets forsikringer holder, så vil virkeligheden med hensyn til hvem der kommer først med være meget anderledes.","if the assurances of the commission and the council hold good, the reality of who will be included first will be very different.",Replace Character,"hvis kommissionens og rådets fgrsikringer holder, så vil virkeligheden med hensyn til hvem der kommer først med være meget anderledes.","(0.98, 0.99)",0.8725129388059689,0.9541,0.9473684210526316,0.9473684210526316,0.9473684160526316,0.8947368421052632,0.8947368421052632,0.8947368371052632,0.9473684210526316,0.9473684210526316,0.9473684160526316,0.98,0.99,da
"for at uskadeliggøre denne tidsbombe har miljøudvalget vedtaget en række ændringsforslag, der delvis er medtaget i betænkningerne.","to defuse this time bomb, the committee on environment adopted some amendments which have partly ended up in the plenary reports.",Duplicate Token,"for at uskadeliggøre denne tidsbombe har miljøudvalget vedtaget en række ændringsforslag ændringsforslag, der delvis er medtaget i betænkningerne.","(0.99, 0.99)",0.903778850827967,0.9942,0.9444444444444444,1.0,0.9714285664326532,0.8823529411764706,0.9375,0.9090909040955004,0.9444444444444444,1.0,0.9714285664326532,0.99,0.99,da
"det er naturligvis evident, at man for at blive medlem skal opfylde den miljølovgivning, der hænger sammen med hvidbogen om det indre marked, men med hensyn til den øvrige lovgivning anmoder vi kommissionen om at foretage en prioritering.","it is of course evident that in order to be able to join, environmental legislation related to the internal market white paper has to be complied with, but as far as the other environmental legislation is concerned, we must ask the european commission to set priorities.",Duplicate Token,"det er naturligvis evident, at man for at blive medlem skal opfylde den miljølovgivning, der hænger sammen med hvidbogen om det indre indre marked, men med hensyn til den øvrige lovgivning anmoder vi kommissionen om at foretage en prioritering.","(1.00, 1.00)",0.9576241467260528,0.9976,1.0,1.0,0.999999995,0.9736842105263158,1.0,0.9866666616675556,1.0,1.0,0.999999995,1.00,1.00,da
"det ville være godt, om vi kunne støtte dette initiativ.",it would be helpful if we could support this initiative.,Replace Token with Random Word,"det ville være godt, om sjæl kunne støtte dette initiativ.","(0.85, 0.95)",0.7348889200874658,0.9139,0.9,0.9,0.899999995,0.7777777777777778,0.7777777777777778,0.7777777727777778,0.9,0.9,0.899999995,0.85,0.95,da
europas kulturelle mangfoldighed vil blive en kilde til kreativitet og velstand.,the cultural diversity of europe will be a source of creativity and prosperity.,Swap words,kulturelle europas mangfoldighed vil blive en kilde til kreativitet og velstand. ,"(0.95, 0.95)",0.8446928838416219,0.9922,0.9166666666666666,1.0,0.9565217341398866,0.7272727272727273,0.8,0.7619047569160999,0.8333333333333334,0.9090909090909092,0.8695652124007562,0.95,0.95,da
derfor er efter kultur- og uddannelsesudvalgets mening en forhøjelse af de finansielle midler til disse programmer absolut nødvendig.,"therefore, in the view of the committee on youth, culture, education and the media, it is absolutely essential to increase the financial resources for these programmes.",Remove Character,derfor er efter kultur- og uddannelsesudvagets mening en forhøjelse af de finansielle midler til disse programmer absolut nødvendig.,"(1.00, 1.00)",0.8492326635760689,0.9467,0.9444444444444444,0.9444444444444444,0.9444444394444445,0.8823529411764706,0.8823529411764706,0.8823529361764706,0.9444444444444444,0.9444444444444444,0.9444444394444445,1.00,1.00,da
der er behov for oprettelse af en effektiv grænsekontrol i overensstemmelse med schengen-aftalen langs unionens fremtidige nye ydre grænser.,it requires the setting up of efficient border controls which conform to the schengen agreement on the future new external borders of the union.,Swap characters,der er behov ofr oprettelse af en effektiv grænsekontrol i overensstemmelse med schengen-aftalen langs unionens fremtidige nye ydre grænser.,"(1.00, 1.00)",0.8578928092681435,0.9494,0.9473684210526316,0.9473684210526316,0.9473684160526316,0.8888888888888888,0.8888888888888888,0.888888883888889,0.9473684210526316,0.9473684210526316,0.9473684160526316,1.00,1.00,da
"kandidatlandene bør prioritere, og vi bør gennem samarbejde og økonomisk hjælp bidrage til, at disse lande kan opnå velfungerende retssystemer, og at de kan forebygge og bekæmpe korruption og kriminalitet.","the applicant countries should give priority to acquiring well-functioning legal systems and preventing and fighting corruption and criminality, and we should contribute to this through our cooperation and economic help.",Replace Character,"kandidatlandene bør prioritere, og vi bør gennem samarbejde og økonomisk hjælp bidrage til, at disse lande kan opnå velfungerende retssystemer, og at de kan forebygge og bekæmpe korruption og kriminalitee.","(0.99, 0.95)",0.9456329342976758,0.9705,0.9565217391304348,0.9565217391304348,0.9565217341304348,0.9655172413793104,0.9655172413793104,0.9655172363793104,0.9565217391304348,0.9565217391304348,0.9565217341304348,0.99,0.95,da
"hr. formand, dette var et resumé af indholdet i udtalelsen fra udvalget om institutionelle spørgsmål.","in summary, mr president, this is the opinion of the committee on institutional affairs.",Duplicate Token,"hr . formand, dette var et resumé af indholdet i i udtalelsen fra udvalget om institutionelle spørgsmål.","(1.00, 1.00)",0.8981075993548011,0.9938,1.0,1.0,0.999999995,0.9333333333333332,1.0,0.9655172363852556,1.0,1.0,0.999999995,1.00,1.00,da
"fra den tekniske synsvinkel har det været vanskeligt at få adgang til mange oplysninger.vi lod afholde en høring, hvori deltog repræsentanter fra ansøgerlandenes delegationer og ambassadører.","from the technical point of view, it has been difficult to get a lot of information. we held a hearing when we had representatives from the delegations and ambassadors of the applicant countries.",Remove Token,"fra den tekniske synsvinkel har det været vanskeligt at få adgang til mange lod afholde en høring, hvori deltog repræsentanter fra ansøgerlandenes delegationer og ambassadører.","(0.95, 0.95)",0.9025139799587886,0.9675,1.0,0.9230769230769232,0.959999995008,0.9583333333333334,0.8846153846153846,0.919999995008,1.0,0.9230769230769232,0.959999995008,0.95,0.95,da
"ansøgerlandene skal specielt hvad angår arbejderbeskyttelsen og produktsikkerheden hjælpes til at opnå det niveau for lovgivningen og især for kontrollen af disse områder, som kræves af eu.","for example, they must be helped to bring in legislation on job protection and product safety, which must meet eu monitoring requirements.",Swap characters,"ansøgerlandene skal specielt hvad angår arbejderbeskyttelsen og produktsikkerheden hjælpes til at opnå det niveau for lovgivningen og især for kontrollen fa disse områder, som kræves af eu.","(0.99, 1.00)",0.9061874434879644,0.9653,0.96,1.0,0.9795918317367764,0.9230769230769232,0.9230769230769232,0.9230769180769232,0.96,1.0,0.9795918317367764,0.99,1.00,da
"et regnestykke, hvor ingen kommer til at betale noget, er alligevel umuligt.","the equation will not be met, though, if money is not going to be spent.",Replace Token with Random Word,"et regnestykke, hvor ingen swing til at betale noget, er alligevel umuligt.","(0.95, 0.99)",0.8003203203844999,0.932,0.9166666666666666,0.9166666666666666,0.9166666616666668,0.8181818181818182,0.8181818181818182,0.8181818131818183,0.9166666666666666,0.9166666666666666,0.9166666616666668,0.95,0.99,da
"hr. formand, kære kolleger, budgetkontroludvalget vil gerne hilse den indsats velkommen, som kommissionen har gjort ved at foreslå os dokumentet agenda 2000.","mr president, ladies and gentlemen, the committee on budgetary control would like to applaud the efforts made by the commission in putting forward the agenda 2000 proposal.",Duplicate Token,"hr . formand, kære kære kolleger, budgetkontroludvalget vil gerne hilse den indsats velkommen, som kommissionen har gjort ved at foreslå os dokumentet agenda 2000.","(0.99, 0.99)",0.9333309921372168,0.9961,1.0,1.0,0.999999995,0.9545454545454546,1.0,0.976744181049216,1.0,1.0,0.999999995,0.99,0.99,da
det må man hilse velkommen.,it is to be applauded.,Replace Character,det må maj hilse velkommen.,"(0.95, 0.95)",7.262123179505913e-78,0.8067,0.8,0.8,0.7999999950000002,0.5,0.5,0.4999999950000001,0.8,0.8,0.7999999950000002,0.95,0.95,da
"jeg er, og vi er, således helt bevidste om, at de handler under pres.","so i am, we are, well aware that you are constrained in your actions.",Replace Token with Random Word,"jeg er, og vi er, således svigte bevidste om, at de handler under pres.","(0.90, 0.95)",0.8394327083733336,0.9437,0.9230769230769232,0.9230769230769232,0.9230769180769232,0.8461538461538461,0.8461538461538461,0.8461538411538462,0.9230769230769232,0.9230769230769232,0.9230769180769232,0.90,0.95,da
vi var i foregående regnskabsår vidne til en forøgelse af antallet af strukturfondenes kategorier.,"we witnessed, during the previous budgetary exercise, a growth in the number of categories of structural funds.",Duplicate Token,vi vi var i foregående regnskabsår vidne til en forøgelse af antallet af strukturfondenes kategorier.,"(1.00, 1.00)",0.9355069850316178,0.9932,1.0,1.0,0.999999995,0.9285714285714286,1.0,0.9629629579698218,1.0,1.0,0.999999995,1.00,1.00,da
vi er i dag vidne til disses indskrænkning.,today we are witnessing their contraction.,Add random word,vi er i tralle dag vidne til disses indskrænkning.,"(0.95, 0.95)",0.6690484408935986,0.9836,0.8888888888888888,1.0,0.9411764656055364,0.75,0.8571428571428571,0.7999999950222222,0.8888888888888888,1.0,0.9411764656055364,0.95,0.95,da
"det er, hvad vi bebrejder dem, selvom vi godt ved, at de kun delvist er ansvarlige for dette.","that is what we reproach you with, even if we know very well that you are only partially to blame.",Replace Character,"det er, hvad vi bebrerder dem, selvom vi godt ved, at de kun delvist er ansvarlige for dette.","(1.00, 1.00)",0.8725129388059689,0.9541,0.9411764705882352,0.9411764705882352,0.9411764655882354,0.8823529411764706,0.8823529411764706,0.8823529361764706,0.9411764705882352,0.9411764705882352,0.9411764655882354,1.00,1.00,da
"der er et problem med hensyn til ressourcerne, for der er jo blevet varslet et fald i strukturmidlerne for de 15 medlemslande på 13 %.",there is a problem with regard to resources because a 13 % reduction in structural funds for the 15 member states has been announced.,Duplicate Token,"der er et problem med hensyn til ressourcerne, for der er jo blevet varslet et fald i strukturmidlerne for for de 15 medlemslande på 13%.","(1.00, 1.00)",0.9333309921372168,0.9947,0.95,0.9047619047619048,0.9268292632956572,0.9130434782608696,0.9130434782608696,0.9130434732608697,0.95,0.9047619047619048,0.9268292632956572,1.00,1.00,da
"de vil ligeledes fremlægge et forslag, der tillader medlemsstaterne at gøre udbetalingen af direkte støtte afhængig af overholdelsen af miljøbestemmelserne.",you are also going to present a proposal authorizing member states to make direct aid payments conditional on respect for environmental measures.,Duplicate character,"de vil ligeledes fremlægge et forslag, der tillader medlemssstaterne at gøre udbetalingen af direkte støtte afhængig af overholdelsen af miljøbestemmelserne.","(0.99, 0.99)",0.8725129388059689,0.9541,0.9444444444444444,0.9444444444444444,0.9444444394444445,0.8947368421052632,0.8947368421052632,0.8947368371052632,0.9444444444444444,0.9444444444444444,0.9444444394444445,0.99,0.99,da
"den vil blive et stabilitets- og velstandsområde, der vil forbedre livskvaliteten for alle dens borgere, og den vil for stedse blive en vigtig magt i verden uden for dens grænser.",it will become a zone of stability and prosperity which will improve the quality of life of all its citizens and it will become a major force for good in the world beyond its borders.,Add random word,"den vil blive et stabilitets- og velstandsområde, der vil forbedre livskvaliteten for alle dens borgere, og den vil for stedse blive en vigtig magt liguster i verden uden for dens grænser.","(0.95, 0.99)",0.9219602423775934,0.9969,0.9565217391304348,1.0,0.977777772780247,0.9310344827586208,0.9642857142857144,0.9473684160541708,0.9565217391304348,1.0,0.977777772780247,0.95,0.99,da
"udfordringen for unionen er nu at tilbyde medlemskab til disse lande, som hører til den europæiske kreds.",the challenge for the union now is to offer membership to these countries which belong to the european circle.,Replace Character,"udpordringen for unionen er nu at tilbyde medlemskab til disse lande, som hører til den europæiske kreds.","(1.00, 1.00)",0.942615147681512,0.9473,0.9375,0.9375,0.937499995,0.9375,0.9375,0.937499995,0.9375,0.9375,0.937499995,1.00,1.00,da
"efter de institutionelle ændringer af unionens beslutningsmekanismer, som er en forudsætning for at optage flere medlemmer, kan unionen i et videre europa bidrage til stabilitet.","after the institutional changes in the union's decision-making mechanisms which are a condition for admitting more members, the union can contribute to stability in a wider europe.",Duplicate character,"efter de institutionelle ændringer af unionens beslutningsmekanismer, som er en forudsætning for at optage flere medlemmer, kan unnionen i et videre europa bidrage til stabilitet.","(0.99, 0.95)",0.9025139799587886,0.9641,0.96,0.96,0.959999995,0.9166666666666666,0.9166666666666666,0.9166666616666668,0.96,0.96,0.959999995,0.99,0.95,da
"betydningsfulde økonomiske omstillinger har lagt grunden til markedsøkonomi, reformer har forstærket det demokratiske system, retsvæsenet og respekten for menneskerettighederne.","important economic adjustments have laid the basis for market economics. reforms have strengthened the democratic system, the judiciary and respect for human rights.",Remove Character,"betydningsfulde økonomiske omstillinger har lagt grunden til markedsøkonomi, reformer har forstærket det demokraiske system, retsvæsenet og respekten for menneskerettighederne.","(0.99, 0.99)",0.8725129388059689,0.9541,0.9444444444444444,0.9444444444444444,0.9444444394444445,0.8888888888888888,0.8888888888888888,0.888888883888889,0.9444444444444444,0.9444444444444444,0.9444444394444445,0.99,0.99,da
"de tragiske erfaringer fra det forhenværende jugoslavien lærer os imidlertid, hvor let nationalistiske politikker i turbulensen efter sovjetvældets fald har kunnet udnytte latente modsætninger.","however, the tragic experiences in the former yugoslavia teach us how easily nationalist politicians have been able to exploit latent conflicts in the turbulence following the fall of the soviet empire.",Duplicate Token,"de tragiske erfaringer fra det forhenværende jugoslavien lærer os imidlertid, hvor let nationalistiske politikker i turbulensen efter sovjetvældets fald har kunnet udnytte latente modsætninger modsætninger.","(0.99, 1.00)",0.9415626571925269,0.9959,1.0,1.0,0.999999995,0.9583333333333334,1.0,0.9787233992575828,1.0,1.0,0.999999995,0.99,1.00,da
det er svært at gennemføre reformer - man skal kunne se målene.,it is difficult to carry out reforms - you have to be able to see the goal.,Replace Character,det er svært at gennemføre reformer - man skah kunne se målene.,"(0.99, 0.99)",0.7611606003349892,0.9209,0.9166666666666666,0.9166666666666666,0.9166666616666668,0.8181818181818182,0.8181818181818182,0.8181818131818183,0.9166666666666666,0.9166666666666666,0.9166666616666668,0.99,0.99,da
"samtidig understreger udvalget dog - dette er af afgørende betydning - at intensive forhandlinger snarest skal optages med de lande, som er kommet længst i deres reformer.","at the same time, however, and this is of crucial importance, the committee stresses that intensive negotiations should quickly be taken up with those countries which have progressed furthest with their reforms.",Replace Token with Random Word,"samtidig understreger udvalget dog - dette er af men betydning - at intensive forhandlinger snarest skal optages med de lande, som er kommet længst i deres reformer.","(0.95, 0.95)",0.9061874434879644,0.9653,0.96,0.96,0.959999995,0.9230769230769232,0.9230769230769232,0.9230769180769232,0.96,0.96,0.959999995,0.95,0.95,da
"på ministerrådets opfordring har kommissionen nøje klarlagt, hvilke lande der nu forekommer at have de bedste forudsætninger for at opfylde de krav, der stilles til medlemskab.","on the instruction of the council of ministers, the commission has carefully analyzed which countries now appear to have the best chances of fulfilling the requirements for membership.",Duplicate character,"på ministerrådets opfordring har kommissionen nøje klarlagt, hvilke lande der nu forekommer at have de bedste forudsætningger for at opfylde de krav, der stilles til medlemskab.","(0.99, 0.99)",0.9061874434879644,0.9653,0.9565217391304348,0.9565217391304348,0.9565217341304348,0.92,0.92,0.919999995,0.9565217391304348,0.9565217391304348,0.9565217341304348,0.99,0.99,da
"specielt for de nordiske og de baltiske lande er det meget glædeligt, at estland er med i den første forhandlingsgruppe.",for the nordic and baltic countries it is very gratifying that estonia is in the first negotiating group.,Swap words,"specielt for de nordiske de og baltiske lande er det meget glædeligt, at estland er med i den første forhandlingsgruppe. ","(0.99, 0.99)",0.8431006187347456,0.997,0.9473684210526316,1.0,0.9729729679766254,0.8,0.8421052631578947,0.8205128155161079,0.9473684210526316,1.0,0.9729729679766254,0.99,0.99,da
"fru formand, alle er klar over den store betydning af den europæiske unions udvidelse med de øst- og centraleuropæiske lande.","madam president, everyone understands the considerable impact of the process of enlargement of the european union on the countries of east and central europe.",Replace Character,"fru formand, alle er klar over den store betydning af den europæisve unions udvidelse med de øst- og centraleuropæiske lande.","(1.00, 1.00)",0.8725129388059689,0.9541,0.9473684210526316,0.9473684210526316,0.9473684160526316,0.8947368421052632,0.8947368421052632,0.8947368371052632,0.9473684210526316,0.9473684210526316,0.9473684160526316,1.00,1.00,da
"""sig mig, hvordan du betragter udvidelsen, og jeg skal sige dig, hvilken ambition du tillægger den europæiske konstruktion«.","""tell me how you envisage enlargement and i will tell you how ambitious you are about european construction.'",Duplicate Token,"""sig mig, hvordan du betragter udvidelsen, og jeg skal sige dig, hvilken hvilken ambition du tillægger den europæiske konstruktion «.","(0.99, 0.99)",0.9246707643923312,0.9956,0.8888888888888888,0.9411764705882352,0.914285709289796,0.8421052631578947,0.9411764705882352,0.888888883904321,0.8888888888888888,0.9411764705882352,0.914285709289796,0.99,0.99,da
den lære kan vi drage af den tyske enhedsproces.,we can learn this lesson from the german unification process.,Replace Token with Random Word,den lære kan vi drage cirkel den tyske enhedsproces.,"(0.90, 0.95)",0.6580370064762462,0.8951,0.875,0.875,0.874999995,0.75,0.75,0.749999995,0.875,0.875,0.874999995,0.90,0.95,da
