originalSentence,referenceSentence,tamperingType,tamperedSentence,"LLMScore (Sim, Con)",BLEU,METEOR,Rouge1 r,Rouge1 p,Rouge1 f,Rouge2 r,Rouge2 p,Rouge2 f,Rougel r,Rougel p,Rougel f,LLM-Sim,LLM-Con,originalLanguage
"begrebet åbenhed og gennemskuelighed blev indsat i eu-traktaten ved amsterdam-traktaten, således at alle unionsborgere og alle fysiske og juridiske personer, der har bopæl eller hjemsted i en medlemsstat, har ret til aktindsigt i dokumenter fra europa-parlamentet, rådet og kommissionen.","the treaty of amsterdam introduced the concept of openness and transparency into the treaties, in such a way as to give any citizen of the union, and any natural or legal person residing or having its registered office in a member state, a right of access to parliament, council and commission documents.",Replace Token with Random Word,"begrebet åbenhed og gennemskuelighed blev indsat i eu-traktaten ved amsterdam-traktaten, således at alle unionsborgere og alle fysiske og juridiske personer, tremme har bopæl eller hjemsted i en medlemsstat, har ret til aktindsigt i dokumenter fra europa-parlamentet, rådet og kommissionen.","(0.95, 0.99)",0.940028651976138,0.9772,0.96875,0.96875,0.968749995,0.9473684210526316,0.9473684210526316,0.9473684160526316,0.96875,0.96875,0.968749995,0.95,0.99,da
"det er efter min mening uforsvarligt at gøre ""arbejdsdokumenter"" offentligt tilgængelige.",i consider it irresponsible for us to make 'working documents' accessible to the public.,Add random word,"det er efter min mening uforsvarligt at mose gøre ""arbejdsdokumenter"" offentligt tilgængelige.","(0.95, 0.95)",0.8052253761904355,0.9915,0.9166666666666666,1.0,0.9565217341398866,0.8181818181818182,0.9,0.8571428521541952,0.9166666666666666,1.0,0.9565217341398866,0.95,0.95,da
officielle dokumenter og arbejdsdokumenter er to forskellige par sko!,official documents and working documents are quite different things.,Swap words,officielle dokumenter arbejdsdokumenter og er to forskellige par sko! ,"(0.95, 0.95)",0.6147881529512643,0.968,1.0,1.0,0.999999995,0.625,0.625,0.624999995,0.8888888888888888,0.8888888888888888,0.888888883888889,0.95,0.95,da
takket være den manglende afgift på flybrændstoffer har de en fordel i forhold til transport på landjorden.,"thanks to the absence of tax on kerosene, they already have the edge on transport on the ground.",Remove Character,takket være den mangende afgift på flybrændstoffer har de en fordel i forhold til transport på landjorden.,"(1.00, 1.00)",0.8394327083733336,0.9437,0.9375,0.9375,0.937499995,0.875,0.875,0.874999995,0.9375,0.9375,0.937499995,1.00,1.00,da
jeg bifalder også forslaget om at udsætte ikrafttrædelsen af lovgivningen til den 31. december 2003. luftfartsselskaberne har brug for tid til at gennemføre den nødvendige træning og det nødvendige indkøb af ekstra udstyr.,i also welcome the move to delay the entry into force of this legislation until 31 december 2003: airlines need time to carry out the necessary retraining and to purchase additional equipment.,Duplicate character,jeg bifalder også forslaget om at udsætte ikrafttrædelsen af lovgivningen til den 31. december 2003. luftfartsselskaberne har brug for tid til at genneemføre den nødvendige træning og det nødvendige indkøb af ekstra udstyr.,"(0.99, 0.95)",0.9210500207490828,0.9705,0.9642857142857144,0.9642857142857144,0.9642857092857144,0.9375,0.9375,0.937499995,0.9642857142857144,0.9642857142857144,0.9642857092857144,0.99,0.95,da
"dette betyder med andre ord, at hvis der er bestemt en overordnet forpligtelse, kan medlemsstaterne gøre, hvad de vil, og særligt sætte et loft for de erstatninger, der skal gives til arbejdstagerne.","in other words, if a general obligation is defined, the states can do what they want, and essentially place a ceiling on compensation payments paid to workers.",Duplicate character,"dette betyder med andre ord, at hvis der er bestemt en overordnet forpligtelse, kan medlemsstaterne gøre, hvad de vil, og særligt sætte et loft for de erstatninger, derr skal gives til arbejdstagerne.","(1.00, 1.00)",0.9299238452109287,0.9731,0.967741935483871,1.0,0.983606552378393,0.935483870967742,0.935483870967742,0.935483865967742,0.967741935483871,1.0,0.983606552378393,1.00,1.00,da
"betænkningen lader dog dette betinge af, at der er hjemmel for det i national ret.",the council position remained set on cases provided for in national legislation.,Replace Character,"betænkningen lader dog dette betinfe af, at der er hjemmel for det i national ret.","(0.99, 0.99)",0.8282477531331041,0.9403,0.9333333333333332,0.9333333333333332,0.9333333283333336,0.8571428571428571,0.8571428571428571,0.8571428521428571,0.9333333333333332,0.9333333333333332,0.9333333283333336,0.99,0.99,da
der afholdes em i fodbold og olympiske og paraolympiske lege i athen.,the european football championships will be held as well as the olympic and paralympic games in athens.,Replace Token with Random Word,der sved em i fodbold og olympiske og paraolympiske lege i athen.,"(0.95, 0.9)",0.842362674378975,0.9209,0.9,0.9,0.899999995,0.8181818181818182,0.8181818181818182,0.8181818131818183,0.9,0.9,0.899999995,0.95,0.9,da
"når først medlemsstaterne begynder at udvide samarbejdet på området og indarbejde idræt i uddannelsessystemet, vil vi endelig indse idrættens store samfundsmæssige værdi.","lastly, once member states begin to co-operate more in this domain and demonstrate how they have mainstreamed sport into their education systems, we will finally come to realise the full potential that sport has to offer.",Replace Token with Random Word,"når først medlemsstaterne begynder at udvide samarbejdet på området og indarbejde idræt i haspe, vil vi endelig indse idrættens store samfundsmæssige værdi.","(0.90, 0.95)",0.8843865924896842,0.958,0.9545454545454546,0.9545454545454546,0.9545454495454548,0.9047619047619048,0.9047619047619048,0.9047618997619048,0.9545454545454546,0.9545454545454546,0.9545454495454548,0.90,0.95,da
"men hvad har ""tempus fugit"" med det at gøre?",what has 'tempus fugit' got to do with anything?,Duplicate character,"men hvad har ""tempus fugit"" med dett at gøre?","(0.98, 0.99)",0.7348889200874658,0.9139,0.8888888888888888,0.8888888888888888,0.888888883888889,0.75,0.75,0.749999995,0.8888888888888888,0.8888888888888888,0.888888883888889,0.98,0.99,da
"2. et særligt punkt for socialpolitikken bør være støtte til de små og mellemstore virksomheder i turistområder, der er i fare for at blive kvalt af de snærende politikker, som eu's ledende tour operators anvender mod dem.",secondly: one specific aspect of community policy should be support for small and medium-sized enterprises in tourist areas which risk being bled to death by the major tour operators in the european union.,Replace Character,"2. et særligt punkt for socialpolitikken bør være støtte til de små og mellemstore virksomheder i turistområder, der er i fare for ah blive kvalt af de snærende politikker, som eu's ledende tour operators anvender mod dem.","(0.99, 0.99)",0.935369573102062,0.9755,0.9705882352941176,0.9705882352941176,0.9705882302941176,0.9444444444444444,0.9444444444444444,0.9444444394444445,0.9705882352941176,0.9705882352941176,0.9705882302941176,0.99,0.99,da
"kommissionen og europa-parlamentet har dog i flere år uden ophør med ""meddelelser"", ""hvidbøger"", ""uformelle møder"" og ""initiativbetænkninger"" arbejdet på at få gjort denne kompetence til deres.","yet the commission and the european parliament have been working relentlessly for years, firstly with a 'communication', then a 'white paper', at an 'informal meeting', then an 'own-initiative report', to take over this responsibility.",Swap characters,"kommissionen og europa-parlamentet har dog i flere år uden ophør med ""meddelelser"", ""hvidbøger"", ""uformelle møder"" og ""initiativbetænkninger"" arbejdet på at få gjort denne okmpetence til deres.","(0.99, 0.99)",0.9278982724420874,0.9729,0.96,0.96,0.959999995,0.92,0.92,0.919999995,0.96,0.96,0.959999995,0.99,0.99,da
"jeg nævner det kun for at sige, at jeg er meget bevidst om fordelene for regionerne ved en nøje planlagt turisme.",i mention this simply to indicate that i am fully aware of the benefits that carefully-developed tourism can bring to a region.,Replace Character,"jeg nævner det kun for at sige, at jeg er meget bevidst om fordelene for regionerne ved en nøje plaxlagt turisme.","(0.98, 0.99)",0.8921616972156079,0.9562,0.9444444444444444,0.9444444444444444,0.9444444394444445,0.9,0.9,0.899999995,0.9444444444444444,0.9444444444444444,0.9444444394444445,0.98,0.99,da
"enhver form for støtte, som eu kan tilbyde for at sætte gang i sektoren, er meget velkommen.",any assistance that europe can offer to kick-start the industry is very positive.,Swap words,"enhver form for støtte, som eu kan for tilbyde at sætte gang i sektoren, er meget velkommen. ","(1.00, 1.00)",0.82459094086255,0.996,0.9411764705882352,1.0,0.9696969647015612,0.7647058823529411,0.8125,0.7878787828833793,0.9411764705882352,1.0,0.9696969647015612,1.00,1.00,da
turismen er en vigtig motor for udviklingen af de økonomiske aktiviteter i mange dele af europa.,. (sv) tourism is an important engine for the development of economic activity in many parts of europe.,Add random word,turismen er en vigtig motor for udviklingen af de økonomiske aktiviteter i bak mange dele af europa.,"(0.95, 0.95)",0.8428014430784181,0.9933,0.9375,1.0,0.967741930489074,0.875,0.9333333333333332,0.903225801456816,0.9375,1.0,0.967741930489074,0.95,0.95,da
"for så vidt som der findes meninger om dem, er disse fuldstændig i modstrid med hinanden, eller også går de tværs igennem grupperne.","if there are opinions on certain topics, they will be completely contradictory or they will be the same right across the groups.",Swap characters,"for så vidt som der findes meninger om dem, er disse fuldstændig i modstrid med hinanden, eller også går de tværs igennem grupprene.","(0.99, 0.99)",0.9276077030810346,0.9613,0.9565217391304348,0.9565217391304348,0.9565217341304348,0.9545454545454546,0.9545454545454546,0.9545454495454548,0.9565217391304348,0.9565217391304348,0.9565217341304348,0.99,0.99,da
"beskyttelsen og bevarelsen af naturlandskaber og udsatte områder har vist sig at være progressiv og er betegnende for den såkaldte bløde turisme, som vi praktiserer i vores land.",protection and maintenance of the countryside and of sensitive regions have demonstrated their potential for the future and are characteristic of our country's practice of what is termed 'soft tourism'.,Duplicate character,"beskyttelsen og bevarelsen af naturlandskaber og udsatte områder har vist sig at være progressiv og er betegnende for den sååkaldte bløde turisme, som vi praktiserer i vores land.","(1.00, 1.00)",0.9095930632220222,0.9665,0.9615384615384616,0.9615384615384616,0.9615384565384616,0.925925925925926,0.925925925925926,0.925925920925926,0.9615384615384616,0.9615384615384616,0.9615384565384616,1.00,1.00,da
"indførelsen af et europæisk rammeprogram for turisme betyder en yderligere belastning af eu's budget, der allerede er anstrengt.","setting up a european framework programme for tourism would place a further burden on the eu budget, which is already overstretched.",Remove Character,"indførelsen af et europæisk rammeprogram for turisme betyder en yderligere belastning af eu's budget, der allerede er anstrent.","(0.99, 1.00)",0.9086549610666288,0.9519,0.9411764705882352,0.9411764705882352,0.9411764655882354,0.9411764705882352,0.9411764705882352,0.9411764655882354,0.9411764705882352,0.9411764705882352,0.9411764655882354,0.99,1.00,da
"det er rigtigt, men jeg har et problem, hr. formand, for hvordan skal jeg få de unge til at stille op for pensionistpartiet?","i agree with this, mr president, but there is one problem: how am i going to get young people to stand for the pensioners' party?",Add random word,"det lager er rigtigt, men jeg har et problem, hr . formand, for hvordan skal jeg få de unge til at stille op for pensionistpartiet?","(0.99, 0.95)",0.936917502763974,0.9963,0.9545454545454546,1.0,0.976744181049216,0.9130434782608696,0.9545454545454546,0.9333333283358024,0.9545454545454546,1.0,0.976744181049216,0.99,0.95,da
"selv om unge mennesker ikke er helt tilsidesat i projektet om europæisk integration, har der ikke været tilstrækkelig fokus på denne gruppes betydning for europas fremtid.","whilst young people have not been entirely marginalised in the project of european integration, there has not been enough sustained emphasis on their importance for the future of europe.",Negation,"selv om unge mennesker er helt tilsidesat i projektet om europæisk integration, har der været tilstrækkelig fokus på denne gruppes betydning for europas fremtid.","(0.75, 0.95)",0.8020219183488043,0.9345,1.0,0.9583333333333334,0.9787233992575828,0.9130434782608696,0.84,0.8749999950086805,1.0,0.9583333333333334,0.9787233992575828,0.75,0.95,da
"jeg drømte, at jeg var inviteret til frokost hjemme hos lucas papademos - selvfølgelig i athen - og at jeg sammen med ham badede i en swimmingpool, der ikke var fuld af vand, men af euromønter.","i dreamt that i was invited to lunch at lucas papademos' house - in athens, of course - and that he let me take a bathe with him in his swimming pool, but the pool contained euro coins, not water.",Negation,"jeg drømte, at jeg var inviteret til frokost hjemme hos lucas papademos - selvfølgelig i athen - og at jeg sammen med ham badede i en swimmingpool, der var fuld af vand, men af euromønter.","(0.95, 0.9)",0.933651069586263,0.9774,1.0,0.9655172413793104,0.9824561353524162,0.9696969696969696,0.9411764705882352,0.9552238755981288,1.0,0.9655172413793104,0.9824561353524162,0.95,0.9,da
"hr. formand, som de kan se, begynder man at efterligne hr. fatuzzos stemmeforklaringer, og jeg er glad for, at man begynder at følge mine angivelser.","mr president, as you see, people are starting to copy mr fatuzzo's explanations of vote.",Replace Token with Random Word,"hr . formand, som de kan se, begynder man at efterligne hr . fatuzzos stemmeforklaringer, og jeg fart glad for, at man begynder at følge mine angivelser.","(0.99, 0.95)",0.9157103753711766,0.9686,0.95,0.95,0.949999995,0.9166666666666666,0.9166666666666666,0.9166666616666668,0.95,0.95,0.949999995,0.99,0.95,da
"hr. formand, jeg mener ikke, vi er her for at have det sjovt, men for at drøfte alvorlige emner.","mr president, i believe we are here to discuss serious matters, not to make jokes.",Negation,"hr . formand, jeg mener, vi er her for at have det sjovt, men for at drøfte alvorlige emner.","(0.95, 0.95)",0.8843865924896842,0.962,0.9375,0.8823529411764706,0.9090909040955004,0.875,0.8235294117647058,0.84848484348944,0.9375,0.8823529411764706,0.9090909040955004,0.95,0.95,da
"hr. formand, jeg har også stemt for stenmarck-betænkningen til trods for, at en stor del af udgifterne også til næste år går til bygninger i luxembourg, bruxelles og strasbourg.","mr president, i too have voted in favour of the stenmarck report, despite the fact that next year, a large proportion of the costs will once again be spent on buildings in luxembourg, brussels and strasbourg.",Swap characters,"hr. formand, jeg har også stemt fro stenmarck-betænkningen til trods for, at en stor del af udgifterne også til næste år går til bygninger i luxembourg, bruxelles og strasbourg.","(1.00, 1.00)",0.9210500207490828,0.9705,0.9615384615384616,0.9615384615384616,0.9615384565384616,0.9285714285714286,0.9285714285714286,0.9285714235714286,0.9615384615384616,0.9615384615384616,0.9615384565384616,1.00,1.00,da
"europa-parlamentet kan tilrettelægge sit arbejde billigere og bedre, hvis det holder møder på ét sted.",the european parliament can organise its work more cheaply and more effectively by meeting in one place.,Replace Token with Random Word,"europa-parlamentet kan tilrettelægge sit arbejde slendrian og bedre, hvis det holder møder på ét sted.","(0.85, 0.95)",0.8282477531331041,0.9403,0.9333333333333332,0.9333333333333332,0.9333333283333336,0.8571428571428571,0.8571428571428571,0.8571428521428571,0.9333333333333332,0.9333333333333332,0.9333333283333336,0.85,0.95,da
vi skal diskutere dette spørgsmål både i konventet og her i salen.,we must highlight this issue and discuss it in the convention and in this house.,Remove Character,vi skal diskutere dette spørgsmål både i konvente og her i salen.,"(0.99, 0.99)",0.7611606003349892,0.9209,0.9090909090909092,0.9090909090909092,0.9090909040909092,0.8181818181818182,0.8181818181818182,0.8181818131818183,0.9090909090909092,0.9090909090909092,0.9090909040909092,0.99,0.99,da
vi er som en omrejsende teatertrup.,we are like a travelling theatre company.,Remove Token,vi som en omrejsende teatertrup.,"(0.95, 0.95)",0.6434588841607617,0.8535,1.0,0.8333333333333334,0.9090909041322316,0.75,0.6,0.6666666617283951,1.0,0.8333333333333334,0.9090909041322316,0.95,0.95,da
mødeperioderne i bruxelles skal have en reel værdighed.,the brussels part-sessions must be given real dignity.,Swap words,mødeperioderne i bruxelles have skal en reel værdighed. ,"(0.95, 0.9)",0.4596613576124592,0.9561,0.8888888888888888,1.0,0.9411764656055364,0.5,0.5714285714285714,0.5333333283555556,0.7777777777777778,0.875,0.823529406782007,0.95,0.9,da
"jeg tror, det vil få langt større betydning at gøre vores vilje og de beslutninger, vi træffer her for fremtiden, forståelige for folk.",i believe it will be far more meaningful to make clear to people our desires for the future and the decisions we take about it here.,Duplicate Token,"jeg tror, det vil få langt større betydning at gøre vores vilje vilje og de beslutninger, vi træffer her for fremtiden, forståelige for folk.","(0.99, 0.99)",0.9333309921372168,0.9961,1.0,1.0,0.999999995,0.9565217391304348,1.0,0.977777772780247,1.0,1.0,0.999999995,0.99,0.99,da
jeg kan umuligt støtte det stillede budget for den meningsløse faren frem og tilbage mellem bruxelles og strasbourg.,i find the budget laid aside for the nonsensical tracking backwards and forwards from brussels to strasbourg almost impossible to support.,Replace Token with Random Word,jeg kan umuligt støtte det stillede budget for den meningsløse faren frem og tilbage mellem bruxelles gæk strasbourg.,"(0.95, 0.95)",0.866397551781362,0.9422,0.9444444444444444,1.0,0.9714285664326532,0.8823529411764706,0.8823529411764706,0.8823529361764706,0.9444444444444444,1.0,0.9714285664326532,0.95,0.95,da
"det er mig en fornøjelse at byde velkommen til hr. rajoy brey, som vil indlede debatten på rådets vegne.",i am pleased to welcome mr rajoy brey to introduce the debate on behalf of the council.,Swap characters,"det er mig en fornøjelse at byde velkommen til hr. rajoy brey, som vil nidlede debatten på rådets vegne.","(0.95, 0.95)",0.8725129388059689,0.9541,0.9473684210526316,0.9473684210526316,0.9473684160526316,0.8888888888888888,0.8888888888888888,0.888888883888889,0.9473684210526316,0.9473684210526316,0.9473684160526316,0.95,0.95,da
"endelig vil jeg gerne inden for dette afsnit om de fremskridt, der er gjort, henvise til drivkraften i eu's handlingsplaner med tredjelande.","finally, within this section on progress made, i would like to refer to the promotion of european union action plans with third countries.",Remove Token,"endelig vil jeg inden for dette afsnit om de fremskridt, der er gjort, henvise til drivkraften i eu's handlingsplaner med tredjelande.","(1.00, 1.00)",0.8942255541978509,0.965,1.0,0.9545454545454546,0.976744181049216,0.95,0.9047619047619048,0.9268292632956572,1.0,0.9545454545454546,0.976744181049216,1.00,1.00,da
"i slutningen af denne måned er det planlagt at præsentere resultaterne af gennemførlighedsundersøgelsen om et europæisk grænsepoliti, som en arbejdsgruppe under italiensk ledelse er i gang med, og hvor der i øvrigt deltager repræsentanter fra tyskland, belgien, frankrig og spanien.","at the end of this month we expect the results to be presented of a viability study on european border policy which, under the auspices of italy, is being developed by a working group which also includes representatives from germany, belgium, france and spain.",Remove Token,"i slutningen af denne måned er det planlagt at præsentere resultaterne af gennemførlighedsundersøgelsen om et europæisk grænsepoliti, som en arbejdsgruppe italiensk ledelse er i gang med, og hvor der i øvrigt deltager repræsentanter fra tyskland, belgien, frankrig og spanien.","(0.99, 0.95)",0.9414356817218076,0.9799,1.0,0.9714285714285714,0.9855072413778618,0.9736842105263158,0.9487179487179488,0.9610389560398044,1.0,0.9714285714285714,0.9855072413778618,0.99,0.95,da
med hensyn til de andre emner til drøftelse vil kommissionen fortsat bidrage til opfølgningen på og udfaldet af disse drøftelser.,"as for the other subjects under discussion, the commission will continue to contribute to the follow-up and the outcome of all these debates.",Duplicate character,med hensyn til de andre emner til drøftelse vil kommissionen fortssat bidrage til opfølgningen på og udfaldet af disse drøftelser.,"(1.00, 1.00)",0.8656030552541708,0.9519,0.9444444444444444,0.9444444444444444,0.9444444394444445,0.8947368421052632,0.8947368421052632,0.8947368371052632,0.9444444444444444,0.9444444444444444,0.9444444394444445,1.00,1.00,da
der er ganske givet en tæt forbindelse mellem f.eks. fremme af bæredygtig udvikling og befolkningspresset.,"there is plainly an intimate connection between our success, for example, in promoting sustainable development and demographic pressures.",Remove Token,der er ganske en tæt forbindelse mellem f.eks . fremme af bæredygtig udvikling og befolkningspresset.,"(0.95, 0.98)",0.8282477531331041,0.9458,1.0,0.9375,0.967741930489074,0.9285714285714286,0.8666666666666667,0.8965517191438764,1.0,0.9375,0.967741930489074,0.95,0.98,da
"dette er naturligvis en model, som vi ønsker at anvende andre steder også.","this is, of course, a model for what we want to do in other places.",Replace Token with Random Word,"dette er naturligvis en model, bimle vi ønsker at anvende andre steder også.","(0.98, 0.99)",0.8003203203844999,0.932,0.9230769230769232,0.9230769230769232,0.9230769180769232,0.8333333333333334,0.8333333333333334,0.8333333283333335,0.9230769230769232,0.9230769230769232,0.9230769180769232,0.98,0.99,da
"det er et usædvanlig vigtigt område for os, og den seneste manifestation i forbindelse med et valg burde ikke have været nødvendig for at overbevise os om dette områdes betydning.",this is an exceptionally important area for us and we should not have needed recent electoral manifestations in order to convince us of the importance of this subject.,Negation,"det er et usædvanlig vigtigt område for os, og den seneste manifestation i forbindelse med et valg burde have været nødvendig for at overbevise os om dette områdes betydning.","(0.95, 0.99)",0.9157103753711766,0.9717,1.0,0.9642857142857144,0.9818181768198349,0.9642857142857144,0.9310344827586208,0.9473684160541708,1.0,0.9642857142857144,0.9818181768198349,0.95,0.99,da
"det er blevet påvist, at den ulovlige situation er roden til udstødelse.",it is proven that illegality leads to marginalisation.,Duplicate Token,"det er blevet påvist, at den ulovlige situation er roden roden til udstødelse.","(0.99, 0.95)",0.8664515469216714,0.9915,1.0,1.0,0.999999995,0.9166666666666666,1.0,0.9565217341398866,1.0,1.0,0.999999995,0.99,0.95,da
"jeg synes kort sagt, hr. formand, at det er på tide at lægge de demagogiske og uansvarlige erklæringer på hylden.","finally, mr president, i believe it is time to leave behind demagoguery and irresponsible statements.",Swap words,"jeg synes kort sagt, formand, hr. at det er på tide at lægge de demagogiske og uansvarlige erklæringer på hylden. ","(0.99, 0.99)",0.8281454308440269,0.9977,0.9473684210526316,1.0,0.9729729679766254,0.8,0.8421052631578947,0.8205128155161079,0.9473684210526316,1.0,0.9729729679766254,0.99,0.99,da
"det glæder mig, og derfor vil jeg begrænse mit indlæg til dette område.",i am delighted about this and i am therefore only going to speak about this field.,Replace Token with Random Word,"det glæder mig, og derfor vil jeg begrænse mit indlæg filter dette område.","(0.95, 0.95)",0.8003203203844999,0.932,0.9230769230769232,0.9230769230769232,0.9230769180769232,0.8333333333333334,0.8333333333333334,0.8333333283333335,0.9230769230769232,0.9230769230769232,0.9230769180769232,0.95,0.95,da
to og et halvt år efter dette råd er der kun gjort små fremskridt.,two and a half years after that council there has been little progress.,Swap characters,to og et halvt år efter dette råd er der kun gjort mså fremskridt.,"(0.95, 0.95)",0.8242367502646054,0.932,0.9285714285714286,0.9285714285714286,0.9285714235714286,0.8461538461538461,0.8461538461538461,0.8461538411538462,0.9285714285714286,0.9285714285714286,0.9285714235714286,0.95,0.95,da
"vi mener det samme om de fælles regler for adgangen til boligen, samlingen af rettigheder for borgere fra tredjelande.","we have the same problem with the common rules on entry for residence, the body of rights for third-country citizens.",Add random word,"vi mener det kjole samme om de fælles regler for adgangen til boligen, samlingen af rettigheder for borgere fra tredjelande.","(0.95, 0.99)",0.8747394842931362,0.9948,0.9473684210526316,1.0,0.9729729679766254,0.8947368421052632,0.9444444444444444,0.9189189139225714,0.9473684210526316,1.0,0.9729729679766254,0.95,0.99,da
