originalSentence,referenceSentence,tamperingType,tamperedSentence,"LLMScore (Sim, Con)",BLEU,METEOR,Rouge1 r,Rouge1 p,Rouge1 f,Rouge2 r,Rouge2 p,Rouge2 f,Rougel r,Rougel p,Rougel f,LLM-Sim,LLM-Con,originalLanguage
"for det tredje støtter vi, og der er tale om stor støtte, at farlige skibe ikke blot tilbageholdes og derefter får tilladelse til fortsat sejlads.","thirdly, we support, and there is a great amount of support, that a dangerous ship should not simply be detained and then allowed to return to sea.",Negation,"for det tredje støtter vi, og der er tale om stor støtte, at farlige skibe blot tilbageholdes og derefter får tilladelse til fortsat sejlads.","(0.95, 0.95)",0.9025139799587886,0.9675,1.0,0.9583333333333334,0.9787233992575828,0.9565217391304348,0.9166666666666666,0.9361702077682208,1.0,0.9583333333333334,0.9787233992575828,0.95,0.95,da
"jeg vil gerne gøre opmærksom på, at parlamentet lige med det samme, faktisk fra den dag erika forliste, rejste krav om foranstaltninger og anmodede kommissionen om at sætte forslag til afstemning.","allow me to remind you that parliament demanded action right from the start, on the very day the erika was shipwrecked, calling on the commission to put forward proposals for adoption.",Swap words,"jeg vil gerne gøre opmærksom på, at parlamentet lige med det samme, faktisk fra dag den erika forliste, rejste krav om foranstaltninger og anmodede kommissionen om at sætte forslag til afstemning. ","(0.99, 0.95)",0.9067658489656212,0.9993,0.9666666666666668,1.0,0.9830508424590636,0.8709677419354839,0.9,0.8852458966406881,0.9333333333333332,0.9655172413793104,0.949152537374318,0.99,0.95,da
hvilken grundlæggende retning følger min betænkning?,so what is the basic approach in my report?,Add random word,hvilken grundlæggende nu retning følger min betænkning?,"(0.95, 0.90)",0.6129752413741056,0.9744,0.8571428571428571,1.0,0.9230769181065088,0.6666666666666666,0.8,0.7272727223140496,0.8571428571428571,1.0,0.9230769181065088,0.95,0.90,da
"vi beskytter miljøet, skaber sikkerhed inden for skibsfarten, samtidig med at vi ikke berører skibsfartens konkurrencedygtighed og den regelmæssige forsyning af markedet.","we are protecting the environment, we are providing safety at sea but, at the same time, we have not touched competition in the shipping sector or the normal supply to the market.",Negation,"vi beskytter miljøet, skaber sikkerhed inden for skibsfarten, samtidig med at vi berører skibsfartens konkurrencedygtighed og den regelmæssige forsyning af markedet.","(0.95, 0.99)",0.8895260356363631,0.9636,1.0,0.9523809523809524,0.9756097511005354,0.95,0.9047619047619048,0.9268292632956572,1.0,0.9523809523809524,0.9756097511005354,0.95,0.99,da
på dette område drejede kommissionens første forslag og parlamentets ændringsforslag sig om at konkretisere en ordning med finansielt ansvar for klassifikations- og inspektionsselskaberne.,"in this area, the initial proposals from the commission and parliament' s amendments aimed to define the system of financial responsibility for the classification and inspection societies.",Duplicate character,på dette område drejede kommissionens første forslag og parlamentets ændringsforslag sig om at konkretisere en ordning med finansielt ansvar for klassifikattions- og inspektionsselskaberne.,"(1.00, 1.00)",0.8843865924896842,0.958,0.9545454545454546,0.9545454545454546,0.9545454495454548,0.9090909090909092,0.9090909090909092,0.9090909040909092,0.9545454545454546,0.9545454545454546,0.9545454495454548,1.00,1.00,da
"vi skulle gerne lære, at når vi smider væk, går det ikke bare væk, for ""væk"" findes ikke.","it is a lesson which tells us that, when we attempt to throw things away, they do not actually go away because there is no such place as 'away'.",Negation,"vi skulle gerne lære, at når vi smider væk, går det bare væk, for ""væk"" findes.","(0.95, 0.95)",0.8040514736345937,0.9232,1.0,0.9333333333333332,0.9655172363852556,0.9333333333333332,0.8235294117647058,0.8749999950195313,1.0,0.9333333333333332,0.9655172363852556,0.95,0.95,da
"offentligheden har også ret til at vide, hvilke forberedelser der er iværksæt, hvilke materialer der udgør truslen, og hvilke virkninger der kan forventes.","furthermore, the public have a right to know what preparations have been made, what types of material are threatening and what impacts are to be expected.",Replace Character,"offentligheden har også het til at vide, hvilke forberedelser der er iværksæt, hvilke materialer der udgør truslen, og hvilke virkninger der kan forventes.","(0.99, 0.99)",0.8985396083419646,0.9627,0.9473684210526316,0.9473684210526316,0.9473684160526316,0.9090909090909092,0.9090909090909092,0.9090909040909092,0.9473684210526316,0.9473684210526316,0.9473684160526316,0.99,0.99,da
"der blev tilføjet en definition af skadelige stoffer, som er på linje med rammedirektivet om vandpolitik, for at dække radioaktive stoffer, som dog uheldigvis ikke nævnes udtrykkeligt.","a definition of harmful substances in line with the water framework directive was added in order to cover but not, unfortunately, explicitly mention radioactive substances.",Negation,"der blev tilføjet en definition af skadelige stoffer, som er på linje med rammedirektivet om vandpolitik, for at dække radioaktive stoffer, som dog uheldigvis nævnes udtrykkeligt.","(0.95, 0.99)",0.9127592114472296,0.9707,1.0,0.96,0.9795918317367764,0.9583333333333334,0.92,0.9387755052061642,1.0,0.96,0.9795918317367764,0.95,0.99,da
"samarbejdet omfatter udveksling af oplysninger og kortlægning af steder, hvor der dumpes ammunition.",the cooperation includes exchange of information and mapping of munitions dump sites.,Duplicate Token,"samarbejdet omfatter udveksling af oplysninger og kortlægning af steder, hvor hvor der dumpes ammunition.","(1.00, 1.00)",0.8761151623788772,0.9922,1.0,1.0,0.999999995,0.9230769230769232,1.0,0.959999995008,1.0,1.0,0.999999995,1.00,1.00,da
"jeg ved, i hvor høj grad hr. gayssot har rettet sin opmærksomhed mod equasis-programmet og nu også galileo-programmet, som vi skal til at iværksætte.","i know how much attention mr gayssot pays to the action of equasis and now to galileo, which we must implement.",Swap characters,"jeg ved, i hvor høj gard hr. gayssot har rettet sin opmærksomhed mod equasis-programmet og nu også galileo-programmet, som vi skal til at iværksætte.","(1.00, 1.00)",0.9025139799587886,0.9641,0.9583333333333334,0.9583333333333334,0.9583333283333336,0.9130434782608696,0.9130434782608696,0.9130434732608697,0.9583333333333334,0.9583333333333334,0.9583333283333336,1.00,1.00,da
"dette betyder helt konkret, at de skal ansætte ekstra inspektører, udvide kontrolkompetencerne og -området, særligt inden for overholdelse af sociale standarder, besætningernes leve- og arbejdsvilkår og offentliggørelsen af dem.","in concrete terms, this means employing additional inspectors, broadening the competences and the scope of inspection, notably concerning respect for social standards and for shipboard living and working conditions, and their publication.",Add random word,"hofte dette betyder helt konkret, at de skal ansætte ekstra inspektører, udvide kontrolkompetencerne og -området, særligt inden for overholdelse af sociale standarder, besætningernes leve- og arbejdsvilkår og offentliggørelsen af dem.","(0.99, 0.99)",0.9710165517924372,0.9971,0.9629629629629628,1.0,0.9811320704734782,0.9655172413793104,1.0,0.9824561353524162,0.9629629629629628,1.0,0.9811320704734782,0.99,0.99,da
men det handler også om at gå et skridt videre og forbyde dem at sejle i ef-farvande.,we must also go further and ban them from sailing in community waters.,Replace Token with Random Word,men det handler kolloid om at gå et skridt videre og forbyde dem at sejle i ef-farvande.,"(0.95, 0.95)",0.8394327083733336,0.9437,0.9375,0.9375,0.937499995,0.875,0.875,0.874999995,0.9375,0.9375,0.937499995,0.95,0.95,da
"det vil med andre ord sige, at vi har haft saglige drøftelser og er nået frem til et fælles resultat.","in other words, we discussed the issues objectively and arrived at a common position.",Add random word,"det vil med andre ord sige, at holdt vi har haft saglige drøftelser og er nået frem til et fælles resultat.","(0.95, 0.99)",0.880773500588743,0.9951,0.9523809523809524,1.0,0.9756097511005354,0.9,0.9473684210526316,0.9230769180802104,0.9523809523809524,1.0,0.9756097511005354,0.95,0.99,da
"men hr. rådsformand, det er alt sammen en smule tvetydigt.",but i put it to you that this is a somewhat ambivalent move.,Swap characters,"men hr. rådsformand, det er lat sammen en smule tvetydigt.","(0.99, 0.99)",0.7611606003349892,0.9209,0.9,0.9,0.899999995,0.7777777777777778,0.7777777777777778,0.7777777727777778,0.9,0.9,0.899999995,0.99,0.99,da
derfor kan jeg kun opfordre dem til efter afstemningen i dag middag at godkende henholdsvis direktivet og forordningen i europa-parlamentets udformning.,i can therefore only ask you to accept the directive and the regulation in the form in which parliament adopts them at noon today.,Swap words,derfor kan jeg kun opfordre dem til efter afstemningen i dag middag at godkende henholdsvis og direktivet forordningen i europa-parlamentets udformning. ,"(0.99, 0.95)",0.8431006187347456,0.997,0.9523809523809524,1.0,0.9756097511005354,0.8095238095238095,0.85,0.8292682876859013,0.9047619047619048,0.95,0.9268292632956572,0.99,0.95,da
"til disse dobbeltskrogede tankskibe har vi brug for mange nye, sikre og gode skibe.",for these double-hull tankers we shall need many good and safe new vessels.,Add random word,"til disse dobbeltskrogede tankskibe spilde har vi brug for mange nye, sikre og gode skibe.","(0.95, 0.95)",0.8320381765431424,0.9928,0.9333333333333332,1.0,0.9655172363852556,0.8571428571428571,0.9230769230769232,0.8888888838957477,0.9333333333333332,1.0,0.9655172363852556,0.95,0.95,da
derfor støtter vi nogle af hr. vachettas ændringsforslag.,hence we will support a number of amendments tabled by mr vachetta.,Remove Character,derfor støtter vi nole af hr. vachettas ændringsforslag.,"(0.99, 0.95)",0.6580370064762462,0.8951,0.875,0.875,0.874999995,0.7142857142857143,0.7142857142857143,0.7142857092857143,0.875,0.875,0.874999995,0.99,0.95,da
det har flere kolleger allerede været inde på.,a number of speakers have already made the same point.,Add random word,det har flere kolleger allerede været inde på bejdse.,"(0.6, 0.8)",0.795637166192145,0.9836,0.8888888888888888,1.0,0.9411764656055364,0.875,1.0,0.9333333283555556,0.8888888888888888,1.0,0.9411764656055364,0.6,0.8,da
"den, der ikke vil påtage sig dette ansvar, skal holde sig væk fra vores farvande og havne.",those who are not prepared to take on this responsibility must stay out of our waters and our ports.,Negation,"den, der vil påtage sig dette ansvar, skal holde sig væk fra vores farvande og havne.","(0.85, 0.95)",0.8578928092681435,0.9542,1.0,0.9375,0.967741930489074,0.9333333333333332,0.875,0.903225801456816,1.0,0.9375,0.967741930489074,0.85,0.95,da
"men vi venter ligeledes utålmodigt på den anden pakke, erika ii, der omhandler oprettelsen af et søagentur og skitsen til en europæisk kystvagt.","but we are also waiting impatiently for the second package, 'erika ii' , with the establishment of a maritime agency and outline plans for a european coastguard.",Swap words,"men vi venter ligeledes utålmodigt på den pakke, anden erika ii, der omhandler oprettelsen af et søagentur og skitsen til en europæisk kystvagt. ","(0.95, 0.95)",0.8471036034893624,0.9982,0.9583333333333334,1.0,0.9787233992575828,0.8260869565217391,0.8636363636363636,0.8444444394469136,0.9166666666666666,0.9565217391304348,0.9361702077682208,0.95,0.95,da
"min gruppe støtter watts- og larrea-betænkningerne, som vi stemmer for.",my group supports the watts and larrea reports. we will vote in favour of them.,Remove Character,"mi gruppe støtter watts- og larrea-betænkningerne, som vi stemmer for.","(1.00, 1.00)",0.9036020036098448,0.9163,0.9,0.9,0.899999995,0.8888888888888888,0.8888888888888888,0.888888883888889,0.9,0.9,0.899999995,1.00,1.00,da
der skal træffes langt strengere foranstaltninger for at gøre klassifikationsselskaberne effektive.,much more stringent measures must be imposed to make classification societies effective.,Remove Character,der skal træffes langt strengere foranstaltninger for at gøre klassifikationsselskabene effektive.,"(1.00, 1.00)",0.7691605673134586,0.9139,0.9090909090909092,0.9090909090909092,0.9090909040909092,0.8,0.8,0.7999999950000002,0.9090909090909092,0.9090909090909092,0.9090909040909092,1.00,1.00,da
beboerne i disse regioner ville have sat pris på en hurtigere behandling af sagen i ef-institutionerne.,"workers in the fishing industry, in fish farming and aquaculture, and salt makers have been very badly hit. the inhabitants of this region would have appreciated greater speed on the part of the community institutions.",Remove Token,beboerne i disse regioner ville have sat pris på en behandling af sagen i ef-institutionerne.,"(0.95, 0.95)",0.8282477531331041,0.9458,1.0,0.9333333333333332,0.9655172363852556,0.9285714285714286,0.8666666666666667,0.8965517191438764,1.0,0.9333333333333332,0.9655172363852556,0.95,0.95,da
"til gengæld er det utilgiveligt, at parlamentet svækker kommissionens oprindelige forslag om forbud mod olietankskibe med enkeltskrog.","on the other hand, it is unacceptable that the european parliament should be moderating the initial commission proposal concerning the ban on single-hull oil tankers.",Remove Token,"til gengæld er det utilgiveligt, at parlamentet svækker kommissionens oprindelige forslag om forbud mod olietankskibe enkeltskrog.","(0.95, 0.99)",0.866397551781362,0.9517,1.0,0.9411764705882352,0.9696969647015612,0.9333333333333332,0.875,0.903225801456816,1.0,0.9411764705882352,0.9696969647015612,0.95,0.99,da
europa-parlamentets rolle burde være at støtte kommissionens strengeste og mest effektive bestemmelser i deres helhed hurtigst muligt i stedet for at udvande dem.,"parliament' s role should be to speedily and fully support the most stringent and most effective provisions proposed by the commission, not to dilute them.",Swap characters,europa-parlamentets rolle burde være at støtte kommissionens strengeste og mset effektive bestemmelser i deres helhed hurtigst muligt i stedet for at udvande dem.,"(0.99, 0.99)",0.8843865924896842,0.958,0.9523809523809524,0.9523809523809524,0.9523809473809524,0.9090909090909092,0.9090909090909092,0.9090909040909092,0.9523809523809524,0.9523809523809524,0.9523809473809524,0.99,0.99,da
jeg støtter endvidere hans krav om voyage data recorders (vdr).,i also support his demand for compulsory voyage data recorders.,Duplicate Token,jeg støtter støtter endvidere hans krav om voyage data recorders (vdr).,"(1.00, 1.00)",0.8806537489484312,0.9906,1.0,1.0,0.999999995,0.9,1.0,0.947368416066482,1.0,1.0,0.999999995,1.00,1.00,da
med hensyn til havnestatens ansvar må havnemyndighedernes opgaver ikke undervurderes.,"speaking of the responsibilities of the port state, we must take care not to underplay the importance of the tasks to be fulfilled by the port authorities.",Negation,med hensyn til havnestatens ansvar må havnemyndighedernes opgaver undervurderes.,"(0.95, 0.99)",0.7419446627365011,0.9138,1.0,0.9,0.947368416066482,0.875,0.7777777777777778,0.823529406782007,1.0,0.9,0.947368416066482,0.95,0.99,da
"her tænker jeg bl.a. på vandrammedirektivet. det er nødvendigt at rationalisere alt dette og overveje en rammelov, der vil lette tingene på internationalt plan.",all this needs to be rationalised and we must turn our mind to producing a framework text which would simplify things at international level.,Remove Character,"her tænker jeg bl.a. på vandrammedirektivet. det er nødvendigt at rationalisere alt dette og overveje en rammelov, der vil lette tingene på internaionalt plan.","(0.99, 0.99)",0.9130714940405412,0.9641,0.9583333333333334,0.9583333333333334,0.9583333283333336,0.9166666666666666,0.9166666666666666,0.9166666616666668,0.9583333333333334,0.9583333333333334,0.9583333283333336,0.99,0.99,da
"den offentlige mening kræver, at vi, som rådsformanden nævnte, handler hurtigt i den aktuelle situation, men denne hurtighed skal være forenelig med en i det mindste nogenlunde acceptabel tekst.","public opinion is demanding that we act swiftly in this situation, as the president-in-office of the council has said, but that speed needs to be compatible with an acceptable minimum text.",Swap characters,"den offentlige mening kræver, at vi, som rådsformanden nævnte, handler hurtigt i den aktuelle situation, men denne hurtighed skal være forenelig med en i det mnidste nogenlunde acceptabel tekst.","(0.99, 0.99)",0.9210500207490828,0.9705,0.9629629629629628,0.9629629629629628,0.9629629579629628,0.9285714285714286,0.9285714285714286,0.9285714235714286,0.9629629629629628,0.9629629629629628,0.9629629579629628,0.99,0.99,da
"det store spørgsmål er selvfølgelig fortsat, om foranstaltningerne i praksis fører til, at skibe i dårlig stand tages ud af drift.","of course, the key question is will these measures actually lead to sub-standard ships being taken out of service?",Replace Token with Random Word,"det store spørgsmål er selvfølgelig fortsat, om foranstaltningerne i praksis fører til, at skibe i dårlig stand tages ud af titte.","(0.95, 0.95)",0.9210589320522864,0.958,0.95,0.95,0.949999995,0.95,0.95,0.949999995,0.95,0.95,0.949999995,0.95,0.95,da
endvidere skal der gribes ind over for bekvemmelighedsflag.,then there is the matter of how to deal with flags of convenience.,Duplicate character,endvidere skal der gribes ind over for bekvemmelighedsflagg.,"(0.98, 0.99)",0.7506238537503395,0.8819,0.875,0.875,0.874999995,0.8571428571428571,0.8571428571428571,0.8571428521428571,0.875,0.875,0.874999995,0.98,0.99,da
"det er dårligt for menneskene. det er dårligt for havet, miljøet og sektorens image.","that is bad for the people, the sea, the environment and for the sector' s image.",Remove Token,"det er dårligt for menneskene . det er dårligt for havet, miljøet og image.","(0.95, 0.90)",0.848219861937046,0.9458,1.0,0.9,0.947368416066482,0.8888888888888888,0.8,0.8421052581717452,1.0,0.9,0.947368416066482,0.95,0.90,da
"hr. formand, indledningsvis vil jeg gerne takke ordførerne for det gode arbejde, de har udført.","mr president, first of all i would like to thank the rapporteurs for their sterling work.",Duplicate character,"hr. formand, indledningsvis vil jeg gerne takke ordførerne for det gode arbejde, de haar udført.","(0.99, 0.99)",0.866397551781362,0.9467,0.9333333333333332,0.9333333333333332,0.9333333283333336,0.8571428571428571,0.8571428571428571,0.8571428521428571,0.9333333333333332,0.9333333333333332,0.9333333283333336,0.99,0.99,da
det og bemandingen drøfter vi nu.,"that is what we are discussing now, along with manpower.",Add random word,det og bemandingen skolde drøfter vi nu.,"(0.95, 0.9)",0.5154486831107657,0.9744,0.8571428571428571,1.0,0.9230769181065088,0.6666666666666666,0.8,0.7272727223140496,0.8571428571428571,1.0,0.9230769181065088,0.95,0.9,da
"og hverken de internationale organisationer som imo eller de ting, teknologien har at byde på, sorte bokse osv., er i stand til at give en sådan regulering.","and there is nothing which international organisations such as the imo or technology, black boxes and so on can do to provide this sort of regulation.",Swap characters,"og hverken de internationale organisationer som imo eller de ting, teknologien har at byde på, sorte bokse osv., er i tsand til at give en sådan regulering.","(0.99, 0.99)",0.9127592114472296,0.9676,0.9615384615384616,0.9615384615384616,0.9615384565384616,0.925925925925926,0.925925925925926,0.925925920925926,0.9615384615384616,0.9615384615384616,0.9615384565384616,0.99,0.99,da
"de betænkninger, der bliver drøftet i dag, skal åbne op for en egentlig sikkerhedspolitik til søs og skal under ingen omstændigheder begrænse sig til ef-niveau.","the reports currently under debate must be the draft for a genuine maritime safety policy, but they must in no way be limited to the community context.",Remove Token,"de betænkninger, der bliver drøftet i dag, skal åbne op for egentlig sikkerhedspolitik til søs og skal under ingen omstændigheder begrænse sig til ef-niveau.","(0.99, 0.95)",0.9025139799587886,0.9675,1.0,0.9565217391304348,0.977777772780247,0.9565217391304348,0.9166666666666666,0.9361702077682208,1.0,0.9565217391304348,0.977777772780247,0.99,0.95,da
vi har de politiske og økonomiske midler til at implementere og skabe respekt om vores beslutninger.,we have the political and economic resources to impose our choices and to ensure that they are respected.,Replace Token with Random Word,vi har sauna politiske og økonomiske midler til at implementere og skabe respekt om vores beslutninger.,"(0.95, 0.95)",0.848219861937046,0.9403,0.9333333333333332,0.9333333333333332,0.9333333283333336,0.8666666666666667,0.8666666666666667,0.8666666616666667,0.9333333333333332,0.9333333333333332,0.9333333283333336,0.95,0.95,da
lad os dog for en gangs skyld have det politiske mod til at gennemføre vores miljømæssige ambitioner.,let us have the political courage of our ecological ambitions.,Duplicate Token,lad os dog for en gangs skyld have det det politiske mod til at gennemføre vores miljømæssige ambitioner.,"(1.00, 1.00)",0.8981075993548011,0.9938,1.0,1.0,0.999999995,0.9411764705882352,1.0,0.9696969647015612,1.0,1.0,0.999999995,1.00,1.00,da
"den personlige skæbne og mange virksomheders eksistens står på spil, rent bortset fra miljøskaderne.","people's futures and the survival of many businesses are on the line here, not to mention the environmental implications.",Duplicate Token,"den personlige skæbne og mange virksomheders virksomheders eksistens står på spil, rent bortset fra miljøskaderne.","(0.99, 0.95)",0.8844489226418503,0.9928,1.0,1.0,0.999999995,0.9285714285714286,1.0,0.9629629579698218,1.0,1.0,0.999999995,0.99,0.95,da
"det er i hvert fald det indtryk, man får.","this, at least, is the impression that has been conveyed.",Swap words,"det i er hvert fald det indtryk, man får. ","(1.00, 1.00)",0.7348889200874658,0.976,0.8888888888888888,1.0,0.9411764656055364,0.5555555555555556,0.625,0.5882352891349482,0.7777777777777778,0.875,0.823529406782007,1.00,1.00,da
vi har brug for et fuldstændigt billede af ansvaret og dermed af alle aktørers erstatningsansvar.,we must have a full picture of all parties' responsibilities and hence of their liability.,Add random word,vi har brug for et fuldstændigt billede af ansvaret og sø dermed af alle aktørers erstatningsansvar.,"(0.99, 0.95)",0.8320381765431424,0.9928,0.9333333333333332,1.0,0.9655172363852556,0.8666666666666667,0.9285714285714286,0.8965517191438764,0.9333333333333332,1.0,0.9655172363852556,0.99,0.95,da
"en territorial lovgivning er heller ikke her tilstrækkelig, man har behov for globale aftaler truffet i imo-regi.",rules applied regionally are not enough here either: we need global imo agreements.,Negation,"en territorial lovgivning er heller her tilstrækkelig, man har behov for globale aftaler truffet i imo-regi.","(0.99, 0.99)",0.8492326635760689,0.9517,1.0,0.9411764705882352,0.9696969647015612,0.9333333333333332,0.875,0.903225801456816,1.0,0.9411764705882352,0.9696969647015612,0.99,0.99,da
for kort tid siden dumpede et skib med maltetisk bekvemmelighedsflag olie i svensk farvand uden for gotska sandön.,a short time ago a vessel with a maltese flag of convenience discharged oil in swedish waters just off gotska sandön.,Duplicate character,for kort tid siden dumpede et skib med maltetisk bekvemmeelighedsflag olie i svensk farvand uden for gotska sandön.,"(0.99, 0.99)",0.8492326635760689,0.9467,0.9411764705882352,0.9411764705882352,0.9411764655882354,0.8823529411764706,0.8823529411764706,0.8823529361764706,0.9411764705882352,0.9411764705882352,0.9411764655882354,0.99,0.99,da
derefter sejlede skibet ind i tallinns havn i estland.,the vessel then sailed into the port of tallinn in estonia.,Remove Character,derefter sejlede skibet ind i tallinns havn i estlnd.,"(0.98, 0.95)",0.7825422900366437,0.8951,0.875,0.875,0.874999995,0.875,0.875,0.874999995,0.875,0.875,0.874999995,0.98,0.95,da
"hr. formand, mine damer og herrer, der er ingen tvivl om, at et spørgsmål, der drejer sig om skibes sikkerhed og som følge heraf også menneskers sikkerhed og beskyttelse af miljøet, er et særdeles alvorligt spørgsmål.","mr president, ladies and gentlemen, clearly the issue of safety at sea, in other words, the safety of human life and environmental protection, is a very serious issue.",Duplicate character,"hr. formand, mine damer og herrer, der er ingen tvivl om, at et spørgsmål, der drejer sig om skibes sikkerhed og som følge heraf også menneskers sikkerhed og beskyttelse af miljøet, er et særdelees alvorligt spørgsmål.","(1.00, 1.00)",0.9385522307631308,1.0,0.9666666666666668,0.9666666666666668,0.9666666616666668,0.9411764705882352,0.9411764705882352,0.9411764655882354,0.9666666666666668,0.9666666666666668,0.9666666616666668,1.00,1.00,da
"i dag behandler vi sikkerheden for skibe og flagstater, havnestatskontrollen og klassifikationsselskaberne.","today we are discussing the safety of ships and flag states, port state control and the classification societies.",Add random word,"i dag behandler se vi sikkerheden for skibe og flagstater, havnestatskontrollen og klassifikationsselskaberne.","(0.99, 0.95)",0.8052253761904355,0.9915,0.9166666666666666,1.0,0.9565217341398866,0.8333333333333334,0.9090909090909092,0.8695652124007562,0.9166666666666666,1.0,0.9565217341398866,0.99,0.95,da
