originalSentence,referenceSentence,tamperingType,tamperedSentence,"LLMScore (Sim, Con)",BLEU,METEOR,Rouge1 r,Rouge1 p,Rouge1 f,Rouge2 r,Rouge2 p,Rouge2 f,Rougel r,Rougel p,Rougel f,LLM-Sim,LLM-Con,originalLanguage
"desuden er der stadig brug for en afklaring af visse spørgsmål, bl.a. vedrørende offentlig-private partnerskaber, byplanlægning og koncessioner på tjenesteydelser.","furthermore, clarification is still required for questions including public-private partnerships, town planning and service concessions.",Swap characters,"desuden er der stadig brug fro en afklaring af visse spørgsmål, bl.a. vedrørende offentlig-private partnerskaber, byplanlægning og koncessioner på tjenesteydelser.","(1.00, 1.00)",0.8843865924896842,0.958,0.9523809523809524,0.9523809523809524,0.9523809473809524,0.9,0.9,0.899999995,0.9523809523809524,0.9523809523809524,0.9523809473809524,1.00,1.00,da
"det vil sætte os i stand til at slippe af med de nuværende uoverensstemmelser, der er mellem de bestemmelser, som gælder i de respektive medlemsstater, og undgå fejl samt udnytte de offentlige midler mere effektivt.","this will enable us to eliminate current discrepancies between the regulations applied by member states, along with errors, as well as to make more efficient use of public money.",Duplicate Token,"det vil sætte os i stand til at slippe af med de nuværende uoverensstemmelser, der er mellem de bestemmelser, som gælder i de respektive medlemsstater, og undgå fejl samt udnytte de offentlige midler mere effektivt effektivt.","(0.99, 0.95)",0.9612377631083082,0.9974,1.0,1.0,0.999999995,0.9714285714285714,1.0,0.9855072413778618,1.0,1.0,0.999999995,0.99,0.95,da
"som vi kan se med vanskelighederne med at omsætte direktivet om tjenesteydelser vedrørende sociale tjenesteydelser, er det kun nogle specifikke rammebestemmelser, der kan tilvejebringe juridisk sikkerhed og kvalitetsprægede tjenesteydelser.","as we can see with the difficulties in transposing the services directive in relation to social services, only a specific framework can provide legal certainty and quality of service.",Swap characters,"som vi kan se med vanskelighederne med at omsætte direktivet om tjenesteydelser vedrørende sociale tjenesteydelser, er det kun nogle specifikke rammebestemmelser, der kan tilvejebringe juridisk sikkerhed og kvalitetsprægede jtenesteydelser.","(0.99, 0.95)",0.9420254600938036,0.9652,0.9629629629629628,1.0,0.9811320704734782,0.9642857142857144,0.9642857142857144,0.9642857092857144,0.9629629629629628,1.0,0.9811320704734782,0.99,0.95,da
"vi er derfor nødt til at håndtere et uønsket resultat som følge heraf, nemlig at eu opbygger noget på makroniveau og har en negativ indvirkning på mikroniveau.",we therefore have to deal with an undesirable upshot from this: the eu builds at macro level and has an adverse influence at micro level.,Replace Character,"vi er derfor nødt til at håndtere et uønsket resultat som følge heraf, nemlig at eu opbygger noget på makroniveau og har en negativ indvirkning på mikroniveah.","(0.99, 1.00)",0.9356154226309104,0.9653,0.96,0.96,0.959999995,0.9615384615384616,0.9615384615384616,0.9615384565384616,0.96,0.96,0.959999995,0.99,1.00,da
vi skal se på offentlig udviklingsbistand ud fra en langsigtet synsvinkel ved at sammenbringe synergier mellem alle medlemsstaterne og sammenhæng mellem politikkerne.,we must look at official development assistance from a long-term point of view of bringing together synergies between all the member states and consistency between policies.,Add random word,vi skal se på offentlig udviklingsbistand ud fra en langsigtet synsvinkel ved at sammenbringe synergier mellem potentil alle medlemsstaterne og sammenhæng mellem politikkerne.,"(0.98, 0.95)",0.8862476419965991,0.9953,0.9545454545454546,1.0,0.976744181049216,0.9090909090909092,0.9523809523809524,0.9302325531422392,0.9545454545454546,1.0,0.976744181049216,0.98,0.95,da
"1,4 mia. mennesker i verden overlever for under 1 eur om dagen.",one billion four hundred million people in the world survive on less than eur 1 per day.,Remove Token,"1,4 mia . mennesker i verden overlever for under 1 om dagen.","(0.98, 0.95)",0.7825422900366437,0.9335,1.0,0.9166666666666666,0.9565217341398866,0.9,0.8181818181818182,0.8571428521541952,1.0,0.9166666666666666,0.9565217341398866,0.98,0.95,da
"alligevel står der i fru kellers betænkning f.eks., at liberalisering af tjenesteydelser og klare konkurrenceregler er hindringer for at opnå millenniumudviklingsmålene.","yet mrs keller's report talks, for example, of a developed services market and clear competition rules as obstacles to meeting the millennium development goals.",Duplicate Token,"alligevel står der i fru kellers betænkning f.eks., at liberalisering af tjenesteydelser og klare konkurrenceregler er hindringer for at opnå millenniumudviklingsmålene millenniumudviklingsmålene.","(0.99, 0.95)",0.9337942766980332,0.9953,1.0,1.0,0.999999995,0.9565217391304348,1.0,0.977777772780247,1.0,1.0,0.999999995,0.99,0.95,da
"det glæder mig rigtig meget, at betænkningen om sammenhængen i eu's udviklingspolitik og ""offentlig udviklingsbistand plus-konceptet"" er blevet vedlaget, idet det er en fremragende betænkning med det formål at sikre større respekt for udviklingslandene.","i am particularly pleased about the adoption of the report on eu policy coherence for development and the 'official development assistance plus' concept, which is an excellent report aimed at ensuring greater respect for developing countries.",Swap characters,"det glæder mig rigtig meget, at betænkningen om sammenhængen i eu's udviklingspolitik og ""offentlig udviklingsbitsand plus-konceptet"" er blevet vedlaget, idet det er en fremragende betænkning med det formål at sikre større respekt for udviklingslandene.","(1.00, 1.00)",0.933651069586263,0.9749,0.9666666666666668,0.9666666666666668,0.9666666616666668,0.9393939393939394,0.9393939393939394,0.9393939343939396,0.9666666666666668,0.9666666666666668,0.9666666616666668,1.00,1.00,da
udviklingsbistand og fattigdomsudryddelse er af største betydning og fortjener min fulde støtte.,development aid and poverty eradication are a requirement of the greatest importance that deserve my full support.,Remove Token,udviklingsbistand fattigdomsudryddelse er af største betydning og fortjener min fulde støtte.,"(0.99, 0.95)",0.842362674378975,0.9281,1.0,1.0,0.999999995,0.9,0.8181818181818182,0.8571428521541952,1.0,1.0,0.999999995,0.99,0.95,da
"da jeg fuldt ud støtter disse forslag, stemte jeg for den foreliggende betænkning.","as i fully support these proposals, i voted in favour of this report.",Remove Character,"da jeg fuldt ud støtter disse forslag, stemte jeg for den foreliggende betnkning.","(0.99, 1.00)",0.8666415730847504,0.932,0.9166666666666666,0.9166666666666666,0.9166666616666668,0.9166666666666666,0.9166666666666666,0.9166666616666668,0.9166666666666666,0.9166666666666666,0.9166666616666668,0.99,1.00,da
"i en række medlemsstater kan der ved alvorlige overtrædelser idømmes en fængselsstraf, mens man i andre lande simpelthen inddrager kørekortet.","in some member states, a prison sentence may be applied for serious infringements, while in others, the driving licence is simply withdrawn.",Swap characters,"i en række medlemsstater kan der ved alvorlige overtræedlser idømmes en fængselsstraf, mens man i andre lande simpelthen inddrager kørekortet.","(1.00, 1.00)",0.8725129388059689,0.9541,0.9444444444444444,0.9444444444444444,0.9444444394444445,0.8947368421052632,0.8947368421052632,0.8947368371052632,0.9444444444444444,0.9444444444444444,0.9444444394444445,1.00,1.00,da
"det er derfor så meget desto vigtigere, at køretøjet ikke er behæftet med fejl.",it is therefore that much more important the vehicle be in faultless condition.,Negation,"det er derfor så meget desto vigtigere, at køretøjet er behæftet med fejl.","(0.00, 1.00)",0.8153551038173115,0.9423,1.0,0.9230769230769232,0.959999995008,0.9166666666666666,0.8461538461538461,0.879999995008,1.0,0.9230769230769232,0.959999995008,0.00,1.00,da
"da der ikke er planlagt nogen udvidelse af disse færdselssikkerhedsforanstaltninger, stemte jeg nej.","as no expansion of these road safety measures is planned, i voted 'no'.",Negation,"da der er planlagt nogen udvidelse af disse færdselssikkerhedsforanstaltninger, stemte jeg nej.","(0.85, 0.95)",0.8242367502646054,0.9382,1.0,0.9230769230769232,0.959999995008,0.9090909090909092,0.8333333333333334,0.8695652124007562,1.0,0.9230769230769232,0.959999995008,0.85,0.95,da
næste punkt på dagsordenen er forhandling under ét om:,the next item is the joint debate on:,Replace Character,næste punkt på dagsærdenen er forhandling under ét om:,"(1.00, 1.00)",0.6580370064762462,0.8951,0.8888888888888888,0.8888888888888888,0.888888883888889,0.75,0.75,0.749999995,0.8888888888888888,0.8888888888888888,0.888888883888889,1.00,1.00,da
"betænkning af hr. mikolášik for udvalget om miljø, folkesundhed og fødevaresikkerhed om forslaget til parlamentets og rådets direktiv om kvalitets- og sikkerhedsstandarder for menneskelige organer til transplantation - c6-0480/2008 - og","the report by mr mikolášik, on behalf of the committee on the environment, public health and food safety, on the proposal for a directive of the european parliament and of the council on standards of quality and safety of human organs intended for transplantation - c6-0480/2008 -, and",Remove Character,"betænkning af hr. mikolášik for udvalget om milj, folkesundhed og fødevaresikkerhed om forslaget til parlamentets og rådets direktiv om kvalitets- og sikkerhedsstandarder for menneskelige organer til transplantation - c6-0480/2008 - og","(0.99, 0.95)",0.9184678024441792,0.9696,0.9565217391304348,0.9565217391304348,0.9565217341304348,0.9333333333333332,0.9333333333333332,0.9333333283333336,0.9565217391304348,0.9565217391304348,0.9565217341304348,0.99,0.95,da
samtidig skal man sikre levende donorer den størst mulige beskyttelse.,"at the same time, the greatest possible protection must be ensured for living donors.",Duplicate Token,samtidig skal man sikre levende levende donorer den størst mulige beskyttelse.,"(0.99, 0.99)",0.8250796367302369,0.988,1.0,1.0,0.999999995,0.9,1.0,0.947368416066482,1.0,1.0,0.999999995,0.99,0.99,da
"vi har forfægtet disse synspunkter i den indledende del i bestemmelsen, dvs. i betragtningerne.",we defended these in the introductory parts of the provision known as the recitals.,Add random word,"vi har sigte forfægtet disse synspunkter i den indledende del i bestemmelsen, dvs . i betragtningerne.","(0.95, 0.9)",0.8613356263647329,0.9933,0.9230769230769232,1.0,0.959999995008,0.8571428571428571,0.9230769230769232,0.8888888838957477,0.9230769230769232,1.0,0.959999995008,0.95,0.9,da
personoplysninger skal fortsat være fortrolige.,personal data must remain confidential.,Duplicate Token,personoplysninger skal skal fortsat være fortrolige.,"(0.99, 0.95)",0.7118034480382983,0.9654,1.0,1.0,0.999999995,0.8,1.0,0.8888888839506174,1.0,1.0,0.999999995,0.99,0.95,da
"deri ligger udfordringen for parlamentet, der på dette plenarmøde skal vedtage direktivet, som så glimrende blev gennemgået af hr. mikolášik, såvel som handlingsplanen.","therein lies the challenge for parliament which, in this plenary sitting, has to adopt both the directive, which was explained so well by dr mikolášik, and also the action plan.",Swap characters,"deri ligger udfordringen for parlmaentet, der på dette plenarmøde skal vedtage direktivet, som så glimrende blev gennemgået af hr. mikolášik, såvel som handlingsplanen.","(0.99, 0.99)",0.9025139799587886,0.9641,0.9545454545454546,0.9545454545454546,0.9545454495454548,0.9090909090909092,0.9090909090909092,0.9090909040909092,0.9545454545454546,0.9545454545454546,0.9545454495454548,0.99,0.99,da
"forhandlingen her i eftermiddag betyder, at vi kan sætte godt gang i iværksættelsen af en fælles eu-strategi med henblik på at opnå den bedste struktur i verden for organdonation og -transplantation.",the debate this afternoon is going to enable us to give a definitive boost to the launch of a common union strategy for achieving the best structure in the world for organ donation and transplantation.,Duplicate Token,"forhandlingen her i eftermiddag betyder, at vi kan sætte godt gang i iværksættelsen af en en fælles eu-strategi med henblik på at opnå den bedste struktur i verden for organdonation og -transplantation.","(0.99, 0.95)",0.945776776063842,0.9969,1.0,1.0,0.999999995,0.967741935483871,1.0,0.983606552378393,1.0,1.0,0.999999995,0.99,0.95,da
"vi gør dette ved at etablere en europæisk model for organdonation og -transplantation omkring værdier og principper, som vi alle er fælles om, dvs. solidaritet, fairness og samhørighed, der er symboler på eu's identitet.","we are doing so by establishing a european model for donation and transplantation around values and principles that we all share: solidarity, fairness and cohesion, which are the symbols of the union's identity.",Duplicate Token,"vi gør dette ved at etablere en europæisk model for organdonation og -transplantation omkring værdier værdier og principper, som vi alle er fælles om, dvs . solidaritet, fairness og samhørighed, der er symboler på eu's identitet.","(1.00, 1.00)",0.956570371605845,0.9975,1.0,1.0,0.999999995,0.9705882352941176,1.0,0.9850746218667856,1.0,1.0,0.999999995,1.00,1.00,da
for det første etablerer vi nogle eu-rammer for at give eu's borgere lige adgang til sundhed i al almindelighed og til transplantationsbehandling i særdeleshed.,"firstly, we are establishing an eu framework to give europeans equal access to health in general and to transplant treatment in particular.",Swap words,for det første etablerer vi nogle eu-rammer for at give eu's borgere lige adgang sundhed til i al almindelighed og til transplantationsbehandling i særdeleshed. ,"(0.98, 0.95)",0.8703852523251989,0.9982,0.9545454545454546,1.0,0.976744181049216,0.8333333333333334,0.8695652173913043,0.8510638247894976,0.9090909090909092,0.9523809523809524,0.9302325531422392,0.98,0.95,da
jeg vil også gerne takke hr. perelló rodriguez for hans nyttige initiativbetænkning om handlingsplanen for organdonation og -transplantation.,i would also like to thank mr perello rodriguez for his supportive own-initiative report on the action plan on organ donation and transplantation.,Swap characters,jeg vil også gerne takke hr. perelló rodriguez for hans nyttige initiativbetænkning om handlingpslanen for organdonation og -transplantation.,"(0.99, 0.99)",0.8578928092681435,0.9494,0.9411764705882352,0.9411764705882352,0.9411764655882354,0.8823529411764706,0.8823529411764706,0.8823529361764706,0.9411764705882352,0.9411764705882352,0.9411764655882354,0.99,0.99,da
i den seksårige handlingsplan er der 10 prioriterede tiltag med henblik på at styrke samarbejdet mellem medlemsstaterne via fælles aktiviteter og udveksling af god praksis.,the six-year action plan sets out 10 priority actions to reinforce cooperation between member states through joint actions and the sharing of best practices.,Remove Character,i den seksrige handlingsplan er der 10 prioriterede tiltag med henblik på at styrke samarbejdet mellem medlemsstaterne via fælles aktiviteter og udveksling af god praksis.,"(0.99, 1.00)",0.905766335288725,0.9613,0.96,0.96,0.959999995,0.9166666666666666,0.9166666666666666,0.9166666616666668,0.96,0.96,0.959999995,0.99,1.00,da
"parlamentets opgave indebærer også, at der skal føres en stålsat kamp mod den afskyvækkende handel med menneskelige organer.",the tasks of the european parliament also include conducting a determined battle against the despicable trade in human organs.,Replace Token with Random Word,"springe opgave indebærer også, at der skal føres en stålsat kamp mod den afskyvækkende handel med menneskelige organer.","(0.95, 0.95)",0.9457416090031758,0.9499,0.9444444444444444,0.9444444444444444,0.9444444394444445,0.9411764705882352,0.9411764705882352,0.9411764655882354,0.9444444444444444,0.9444444444444444,0.9444444394444445,0.95,0.95,da
"vi kan ved hjælp af tydelige etiske og sikkerhedsmæssige regler bedre sikre menneskers selvindlysende ret til deres krop, deres integritet og deres selvbestemmelse.","by laying down clear ethical and safety rules, we can better ensure people's self-evident right to their body, their integrity and their self-determination.",Remove Character,"vi ka ved hjælp af tydelige etiske og sikkerhedsmæssige regler bedre sikre menneskers selvindlysende ret til deres krop, deres integritet og deres selvbestemmelse.","(0.98, 0.99)",0.9244754047211334,0.9597,0.95,0.95,0.949999995,0.9090909090909092,0.9090909090909092,0.9090909040909092,0.95,0.95,0.949999995,0.98,0.99,da
"ifølge den foreliggende betænkning bør de lande, der har meget restriktive systemer, fremover kigge nærmere på eksemplerne i andre lande for også at se de positive virkninger.","in future, under this report, those countries with very restrictive systems ought to take a very close look at the examples of other countries in order also to observe the positive effects.",Add random word,"ifølge den foreliggende betænkning bør de lande, der har meget restriktive systemer, fremover kigge skulke nærmere på eksemplerne i andre lande for også at se de positive virkninger.","(0.99, 0.99)",0.9138590650193388,0.9965,0.9629629629629628,1.0,0.9811320704734782,0.925925925925926,0.9615384615384616,0.9433962214168744,0.9629629629629628,1.0,0.9811320704734782,0.99,0.99,da
vi skal derfor virkelig lægge os i selen for at få medlemsstaterne til at forstå dette punkt i perelló rodriguez-betænkningen.,that is why we should really press home this point in the perello report to the member states.,Swap characters,vi skal derfor virkelig lægge os i selen for at få medlemsstaterne til at forstå dette punkt i perelló rodriguez-betænnkingen.,"(1.00, 1.00)",0.9086549610666288,0.9519,0.9444444444444444,0.9444444444444444,0.9444444394444445,0.9473684210526316,0.9473684210526316,0.9473684160526316,0.9444444444444444,0.9444444444444444,0.9444444394444445,1.00,1.00,da
"et andet særdeles vigtigt element i direktivet er, at vi skal bekæmpe handelen med organer.",another very important element in the directive is that we must combat the trade in organs.,Remove Character,"et andet særdeles vigtigt element i direktivet r, at vi skal bekæmpe handelen med organer.","(0.99, 0.99)",0.8282477531331041,0.9403,0.9333333333333332,0.9333333333333332,0.9333333283333336,0.8571428571428571,0.8571428571428571,0.8571428521428571,0.9333333333333332,0.9333333333333332,0.9333333283333336,0.99,0.99,da
"der er fastlagt juridisk bindende bestemmelser om frivillig og vederlagsfri donation, og jeg vil gerne takke alle, som har været med til at nå frem til disse mål.",voluntary and unpaid donation is laid down in a legally binding way and i would like to thank everyone who has helped us to achieve these goals.,Replace Character,"der er fastlagt juridisk bindende bestemmelser om frivillig og vederlagsfri donation, og jeg vil gerne takke alle, som har været med qil at nå frem til disse mål.","(0.99, 1.00)",0.9127592114472296,0.9676,0.9629629629629628,1.0,0.9811320704734782,0.925925925925926,0.925925925925926,0.925925920925926,0.9629629629629628,1.0,0.9811320704734782,0.99,1.00,da
"jeg taler her hovedsagelig om nyre- eller leverdonationer, dvs. donationer, som er nødvendige, som er i kraftig vækst, som praktiserende læger og speciallæger opfordrer til, og som i øjeblikket stadig kun står for gennemsnitlig 5 % af donationerne.","here i am essentially talking about kidney or liver donations, donations which are necessary, which are fast expanding, which are encouraged by practitioners and specialists, and which, at the moment, still only account, on average, for 5% of donations.",Replace Character,"jeg taler her hovedsagelig om nyre- eller leverdonationer, dvs. donationer, som er nødvendige, som er i kraftig vækst, som praktiserende læger og speciallæger opfordrer til, og sqm i øjeblikket stadig kun står for gennemsnitlig 5 % af donationerne.","(0.99, 0.99)",0.9414356817218076,0.9748,0.9696969696969696,1.0,0.984615379616568,0.9444444444444444,0.9444444444444444,0.9444444394444445,0.9696969696969696,1.0,0.984615379616568,0.99,0.99,da
"ifølge europarådet stammer 5-10 % af de transplanterede nyrer fra den illegale handel med organer, og det betyder, at der hvert år er tusindvis af ofre.","according to the council of europe, 5-10% of transplanted kidneys come from the illegal trade in organs, and that means thousands of victims a year.",Duplicate character,"ifølge europarådet stammer 5-10 % af de transplanterede nyrer fra den iillegale handel med organer, og det betyder, at der hvert år er tusindvis af ofre.","(1.00, 1.00)",0.9061874434879644,0.9653,0.96,0.96,0.959999995,0.92,0.92,0.919999995,0.96,0.96,0.959999995,1.00,1.00,da
f.eks. har australske organtransplantationskirurger fordømt praksis i kina med at slå fængselsindsatte ihjel for at udnytte deres organer.,"for example, australian organ transplant surgeons have condemned the practice in china of killing prisoners for their organs.",Swap words,f.eks. har australske organtransplantationskirurger fordømt praksis i med kina at slå fængselsindsatte ihjel for at udnytte deres organer. ,"(0.99, 0.95)",0.82459094086255,0.996,0.9473684210526316,1.0,0.9729729679766254,0.7894736842105263,0.8333333333333334,0.8108108058144633,0.8947368421052632,0.9444444444444444,0.9189189139225714,0.99,0.95,da
"vi må fra europæisk side gøre vores yderste for at undgå, at vi skaber et marked for denne form for kriminalitet.",we in europe must do all we can to avoid creating a market for this kind of criminality.,Swap words,"vi må fra europæisk side gøre vores yderste for undgå, at at vi skaber et marked for denne form for kriminalitet. ","(0.99, 0.95)",0.8471957049969466,0.9974,0.9444444444444444,1.0,0.9714285664326532,0.8571428571428571,0.9,0.8780487754907793,0.8888888888888888,0.9411764705882352,0.914285709289796,0.99,0.95,da
"desværre har vi i de seneste år set en række eksempler på fusk, som er gået ud over såvel patient som donor.","unfortunately, in recent years, we have seen a number of examples of botched work that has affected both patients and donors.",Duplicate character,"desværre har vi i de seneste år set en rækkee eksempler på fusk, som er gået ud over såvel patient som donor.","(0.99, 0.99)",0.8843865924896842,0.958,0.9523809523809524,0.9523809523809524,0.9523809473809524,0.9047619047619048,0.9047619047619048,0.9047618997619048,0.9523809523809524,0.9523809523809524,0.9523809473809524,0.99,0.99,da
"derfor har vi brug for en koordinering og samordning på eu-plan, og selvfølgelig skal både modtager og donor sikres bedst muligt.","we therefore need coordination at eu level and, of course, we must ensure that both recipient and donor receive the best possible treatment.",Duplicate character,"derfor har vi brug for en koordinering og samordning på eu-plan, og selvfølgelig skal både modtager og donnor sikres bedst muligt.","(0.99, 0.99)",0.8787419089273848,0.9562,0.9473684210526316,0.9473684210526316,0.9473684160526316,0.9,0.9,0.899999995,0.9473684210526316,0.9473684210526316,0.9473684160526316,0.99,0.99,da
handlingsplanen kan være med til at afhjælpe denne organmangel og forbedre borgernes adgang til transplantater.,the action plan can contribute to this by helping to solve the shortage of organs and improving public access to transplants.,Add random word,handlingsplanen kan være med til at afhjælpe denne organmangel og forbedre borgernes adgang til vånde transplantater.,"(0.95, 0.9)",0.8521016864386923,0.9928,0.9333333333333332,1.0,0.9655172363852556,0.8666666666666667,0.9285714285714286,0.8965517191438764,0.9333333333333332,1.0,0.9655172363852556,0.95,0.9,da
"i frankrig vil en person, der venter på en lever, således f.eks. kunne få et forligeligt organ fra tyskland eller italien - velvidende at der anvendes fælles minimumsstandarder overalt i eu.","for example, in france, a person waiting for a liver transplant could thus receive a compatible organ from germany or italy, knowing that minimum common standards are applied throughout europe.",Remove Character,"i frankrig vil en person, der venter på en lever, således f.eks. kunne få et orligeligt organ fra tyskland eller italien - velvidende at der anvendes fælles minimumsstandarder overalt i eu.","(0.99, 0.95)",0.9234732618882052,0.9713,0.9655172413793104,0.9655172413793104,0.9655172363793104,0.935483870967742,0.935483870967742,0.935483865967742,0.9655172413793104,0.9655172413793104,0.9655172363793104,0.99,0.95,da
der var tydeligvis blot tale om en fejl af en eller anden slags.,it was clearly just an error of some kind.,Add random word,der var tydeligvis blot tale om en fejl af en eller logge anden slags.,"(0.95, 0.9)",0.8052253761904355,0.9915,0.9230769230769232,1.0,0.959999995008,0.8461538461538461,0.9166666666666666,0.879999995008,0.9230769230769232,1.0,0.959999995008,0.95,0.9,da
"jeg vil i mit indlæg gerne rose det arbejde, som begge ordførere har udført, og som efter min mening er meget værdifuldt.","in my speech, i would like to praise the work of both rapporteurs, which i consider to be very valuable.",Remove Token,"jeg vil i mit indlæg gerne rose det arbejde, som ordførere har udført, og som efter min mening er meget værdifuldt.","(0.95, 0.95)",0.8895260356363631,0.9636,1.0,0.9523809523809524,0.9756097511005354,0.95,0.9047619047619048,0.9268292632956572,1.0,0.9523809523809524,0.9756097511005354,0.95,0.95,da
