originalSentence,referenceSentence,tamperingType,tamperedSentence,"LLMScore (Sim, Con)",BLEU,METEOR,Rouge1 r,Rouge1 p,Rouge1 f,Rouge2 r,Rouge2 p,Rouge2 f,Rougel r,Rougel p,Rougel f,LLM-Sim,LLM-Con,originalLanguage
"aftalen vedrørende sikkerhed i mellemøsten om principperne for voldens ophør, anerkendelsen af staterne, anerkendelse af den palæstinensiske myndighed som en legitim forhandlingspartner og støtte til mitchell- og tenet-planen er tydelige eksempler på denne samordning.","examples of these are the agreement on security in the middle east on the principles of the end to violence, recognition of states and recognition of the palestinian authority as a legitimate participant along with support for the mitchell and tenet plans. the improvement in the situation in the balkans was also noted.",Add random word,"aftalen vedrørende sikkerhed i mellemøsten pelikan om principperne for voldens ophør, anerkendelsen af staterne, anerkendelse af den palæstinensiske myndighed som en legitim forhandlingspartner og støtte til mitchell- og tenet-planen er tydelige eksempler på denne samordning.","(0.95, 0.95)",0.930648893393227,0.9972,0.9696969696969696,1.0,0.984615379616568,0.9411764705882352,0.9696969696969696,0.9552238755981288,0.9696969696969696,1.0,0.984615379616568,0.95,0.95,da
"for det femte og i tråd med det nævnte blev der givet udtryk for vilje til at samarbejde i andre fora og i internationale processer, f.eks.","fifthly, and still in the same vein, the wish to cooperate in other fora and international processes was declared.",Swap characters,"for det femte og i tråd med det nævnte blev der givet udtryk for vilje til at samarbejde i andre fora og i internationale procseser, f.eks.","(0.99, 1.00)",0.9025139799587886,0.9641,0.9545454545454546,0.9545454545454546,0.9545454495454548,0.92,0.92,0.919999995,0.9545454545454546,0.9545454545454546,0.9545454495454548,0.99,1.00,da
"inden for rammerne af forhandlingsmandatet om den aftale om handel og samarbejde, som unionen agter at indgå med nævnte land, forpligtede eu sig til at inddrage ikkespredning som et af de emner, der skal behandles i den politiske dialog.",the european union undertook to include non-proliferation as one of the issues to be dealt with in the political dialogue within the framework of the negotiating mandate for the free trade and cooperation agreement the union hopes to adopt with iran.,Replace Token with Random Word,"inden for rammerne af forhandlingsmandatet om den aftale om handel og samarbejde, som unionen agter at indgå med nævnte land, forpligtede eu sig til at inddrage ikkespredning som et af de emner, visum skal behandles i den politiske dialog.","(0.90, 0.95)",0.9385522307631308,0.9767,0.9705882352941176,0.9705882352941176,0.9705882302941176,0.9473684210526316,0.9473684210526316,0.9473684160526316,0.9705882352941176,0.9705882352941176,0.9705882302941176,0.90,0.95,da
"hvad angår balkanlandene, lagde eu særlig vægt på betydningen af strategien om partnerskab og stabilisering og den fælles interesse i udsendelse af aptf-politimissionen i bosnien-hercegovina fra januar 2003.","concerning the balkans, the european union placed particular emphasis on the importance of the association and stabilisation strategy, and also on the common interest in the deployment of the aptf police mission in bosnia-herzegovina from january 2003. the union reiterated its willingness to take charge of operation amber fox in the republic of macedonia.",Add random word,"hvad angår balkanlandene, lagde eu særlig vægt på betydningen merkantil af strategien om partnerskab og stabilisering og den fælles interesse i udsendelse af aptf-politimissionen i bosnien-hercegovina fra januar 2003.","(0.95, 0.99)",0.9138590650193388,0.9965,0.9615384615384616,1.0,0.9803921518646674,0.9285714285714286,0.9629629629629628,0.9454545404561984,0.9615384615384616,1.0,0.9803921518646674,0.95,0.99,da
"det er klart, at på det tidspunkt var den nye lov, som lige er blevet vedtaget, ikke kommet frem.","clearly, this all dates back to before the advent of the new law adopted recently.",Negation,"det er klart, at på det tidspunkt var den nye lov, som lige er blevet vedtaget, kommet frem.","(0.95, 0.95)",0.8787419089273848,0.9603,1.0,0.9411764705882352,0.9696969647015612,0.9411764705882352,0.8888888888888888,0.914285709289796,1.0,0.9411764705882352,0.9696969647015612,0.95,0.95,da
"hr. formand, siden den 11. september har vi alle sagt, at europa og usa må stå skulder ved skulder, fordi vi deler fælles værdier.","mr president, since 11 september, we have all said that europe and the usa must stand shoulder to shoulder because we share common values.",Remove Character,"hr. formand, siden den 11. september har vi alle sagt, at europa og sa må stå skulder ved skulder, fordi vi deler fælles værdier.","(0.98, 0.95)",0.9061874434879644,0.9653,0.9565217391304348,0.9565217391304348,0.9565217341304348,0.9130434782608696,0.9130434782608696,0.9130434732608697,0.9565217391304348,0.9565217391304348,0.9565217341304348,0.98,0.95,da
"vi må støtte vores allierede i nødens stund på samme måde, som usa kom europa til hjælp to gange i forbindelse med de mørkeste stunder i det sidste århundrede.",we must support our ally in its time of need in the same way as america came to europe's aid twice in the darkest hours of the last century.,Remove Character,"vi må støtte vores allierede i nødens stund på samme måde, som usa kom europa til hjælp to gange i forbindelse med de mørkeste stunder i det sidte århundrede.","(0.99, 0.99)",0.922122069382768,0.9676,0.9629629629629628,0.9629629629629628,0.9629629579629628,0.9285714285714286,0.9285714285714286,0.9285714235714286,0.9629629629629628,0.9629629629629628,0.9629629579629628,0.99,0.99,da
"hr. formand, forholdet mellem usa og eu er ikke et forhold mellem ligeværdige.","mr president, the relationship between the united states and the eu is not one of equals.",Negation,"hr . formand, forholdet mellem usa og eu er et forhold mellem ligeværdige.","(0.95, 0.95)",0.8153551038173115,0.9423,1.0,0.9166666666666666,0.9565217341398866,0.9090909090909092,0.8333333333333334,0.8695652124007562,1.0,0.9166666666666666,0.9565217341398866,0.95,0.95,da
"alligevel skal eu stille det svar, den forskel, til diskussion med selvsikkerhed og kraft i forhold til usa.","despite this, the eu would do well to highlight this response, this difference, with confidence and force in a discussion, a debate with the united states.",Duplicate character,"alligevel sskal eu stille det svar, den forskel, til diskussion med selvsikkerhed og kraft i forhold til usa.","(1.00, 1.00)",0.9086549610666288,0.9519,0.9411764705882352,0.9411764705882352,0.9411764655882354,0.8823529411764706,0.8823529411764706,0.8823529361764706,0.9411764705882352,0.9411764705882352,0.9411764655882354,1.00,1.00,da
"det er noget andet end multilateralisme a la carte, sådan som usa til tider udstiller det, bl.a. med hensyn til deres optræden og holdning i nato.","this is different from multilateralism à la carte, as is sometimes displayed by the united states, for example their behaviour in nato.",Replace Token with Random Word,"det er konsilium andet end multilateralisme a la carte, sådan som usa til tider udstiller det, bl.a . med hensyn til deres optræden og holdning i nato.","(0.95, 0.98)",0.9193227152249184,0.9665,0.96,0.96,0.959999995,0.9230769230769232,0.9230769230769232,0.9230769180769232,0.96,0.96,0.959999995,0.95,0.98,da
"jeg krummer imidlertid også tæer, når jeg ser, at eu ikke er i stand til at komme med alternativer.","i also get impatient, however, when i notice that the eu is unable to come up with alternatives.",Negation,"jeg krummer imidlertid også tæer, når jeg ser, at eu er i stand til at komme med alternativer.","(0.85, 0.95)",0.8725129388059689,0.9585,1.0,0.9411764705882352,0.9696969647015612,0.9411764705882352,0.8888888888888888,0.914285709289796,1.0,0.9411764705882352,0.9696969647015612,0.85,0.95,da
"så, hr. formand, skal det nok blive til noget med verden.","if this could be done, i am hopeful of a better future for the world.",Duplicate character,"så, hr. fformand, skal det nok blive til noget med verden.","(0.99, 0.95)",0.8003203203844999,0.932,0.9090909090909092,0.9090909090909092,0.9090909040909092,0.8,0.8,0.7999999950000002,0.9090909090909092,0.9090909090909092,0.9090909040909092,0.99,0.95,da
konflikterne mellem usa og eu-medlemsstaterne tager til.,disagreements between the us and eu are on the increase.,Swap words,konflikterne mellem usa og eu-medlemsstaterne til. tager ,"(0.95, 0.99)",0.6147881529512644,0.9736,1.0,1.0,0.999999995,0.6666666666666666,0.6666666666666666,0.6666666616666668,1.0,1.0,0.999999995,0.95,0.99,da
og hvorfor skulle det alternativ være tillokkende for usa?,and why should this alternative be attractive to the united states?,Duplicate character,og hvorfor skulle det alternativ være tillokkende for usaa?,"(0.99, 0.95)",0.7825422900366437,0.8951,0.8888888888888888,0.8888888888888888,0.888888883888889,0.875,0.875,0.874999995,0.8888888888888888,0.8888888888888888,0.888888883888889,0.99,0.95,da
"derudover er spørgsmålet, om eu-medlemsstaterne altid er på rette kurs.","additionally, it is questionable whether the european member states always sail the right course.",Remove Character,"derudoer er spørgsmålet, om eu-medlemsstaterne altid er på rette kurs.","(1.00, 1.00)",0.9036020036098448,0.9163,0.8888888888888888,0.8888888888888888,0.888888883888889,0.8888888888888888,0.8888888888888888,0.888888883888889,0.8888888888888888,0.8888888888888888,0.888888883888889,1.00,1.00,da
i forbindelse med de transatlantiske forbindelser ville det være meget ugunstigt.,this would be very detrimental to transatlantic relations.,Replace Token with Random Word,i forbindelse med de transatlantiske forbindelser ville hævn være meget ugunstigt.,"(0.85, 0.95)",0.7348889200874658,0.9139,0.9090909090909092,0.9090909090909092,0.9090909040909092,0.8,0.8,0.7999999950000002,0.9090909090909092,0.9090909090909092,0.9090909040909092,0.85,0.95,da
"ordføreren siger med rette, at de transatlantiske forbindelser har været vores sikkerheds hjørnesten, så længe den blev truet af øst/vest-modsætningerne.","the rapporteur is right to note that the transatlantic relationship was, in fact, the keystone of our security as long as it was under threat from the east-west divide.",Add random word,"ordføreren siger blod med rette, at de transatlantiske forbindelser har været vores sikkerheds hjørnesten, så længe den blev truet af øst/vest-modsætningerne.","(0.95, 0.95)",0.8990026845785033,0.9953,0.9523809523809524,1.0,0.9756097511005354,0.9,0.9473684210526316,0.9230769180802104,0.9523809523809524,1.0,0.9756097511005354,0.95,0.95,da
det skyldes den fælles holdnings styrke.,this is thanks to the power of the community approach.,Duplicate Token,det skyldes den fælles holdnings styrke styrke.,"(0.95, 0.95)",0.7629494139369416,0.9744,1.0,1.0,0.999999995,0.8333333333333334,1.0,0.9090909041322316,1.0,1.0,0.999999995,0.95,0.95,da
"så længe afkastet af vores forsvarsudgifter kun er 15% af amerikanernes, kan der opnås langt større fremskridt med en fuldstændig fælles politik.","after all, as long as the return on our defence expenditure is only 15% of that of the americans, far more progress can be made by a full-on community policy.",Swap words,"så længe afkastet af vores forsvarsudgifter kun 15% er af amerikanernes, kan der opnås langt større fremskridt med en fuldstændig fælles politik. ","(0.98, 0.95)",0.8400642554861188,0.998,0.9545454545454546,1.0,0.976744181049216,0.8181818181818182,0.8571428571428571,0.8372092973282856,0.9090909090909092,0.9523809523809524,0.9302325531422392,0.98,0.95,da
"vanskeligheden består aktuelt også i, at usa har vanskeligt ved at acceptere, at eu ønsker at opnå anerkendelse som ligeværdig partner og etablere forbindelser, som afgjort beror på venskab, men også på lighed og gensidighed.","a further reason for our current difficulty is the fact that the united states is finding it hard to accept that the european union naturally aspires to be an equal partner and on friendly terms, but also to be treated as equal in return.",Duplicate Token,"vanskeligheden består aktuelt også i, at usa har vanskeligt ved at acceptere, at at eu ønsker at opnå anerkendelse som ligeværdig partner og etablere forbindelser, som afgjort beror på venskab, men også på lighed og gensidighed.","(0.99, 1.00)",0.9554627273815156,0.9958,1.0,1.0,0.999999995,0.9714285714285714,1.0,0.9855072413778618,1.0,1.0,0.999999995,0.99,1.00,da
"det er yderst betænkeligt, at produktionen af tritium til fremstilling af brintbomber, der blev indstillet i 1988, nu skal genoptages, og at der skal opføres en ny fabrik til produktion af små plutoniumdele, der bruges til fremstilling af atombomber.","it is highly ominous that the production of tritium for hydrogen bombs, which stopped in 1988, is to start up again and that a new factory manufacturing plutonium parts for atom bombs is to be built.",Swap words,"det er yderst betænkeligt, at produktionen af til tritium fremstilling af brintbomber, der blev indstillet i 1988, nu skal genoptages, og at der skal opføres en ny fabrik til produktion af små plutoniumdele, der bruges til fremstilling af atombomber. ","(1.00, 1.00)",0.9289020927995748,0.9996,0.9666666666666668,1.0,0.9830508424590636,0.8947368421052632,0.9444444444444444,0.9189189139225714,0.9666666666666668,1.0,0.9830508424590636,1.00,1.00,da
"nej, det, vi har brug for, er frem for alt et større effektivitetsniveau for vores udgifter.","no, what we need most of all is more efficient spending.",Replace Character,"nej, det, vi hay brug for, er frem for alt et større effektivitetsniveau for vores udgifter.","(1.00, 1.00)",0.8578928092681435,0.9494,0.9333333333333332,0.9333333333333332,0.9333333283333336,0.8666666666666667,0.8666666666666667,0.8666666616666667,0.9333333333333332,0.9333333333333332,0.9333333283333336,1.00,1.00,da
"det er muligt på grund af det arbejde, som medlemmerne af udvalget om industripolitik, eksterne økonomiske forbindelser, forskning og energi, kommissionen og rådet har udført.","this is the result of the work undertaken with the council, the rapporteurs from the committee on industry, external trade, research and energy, and also with the commission and the council.",Duplicate character,"det er muligt på gruund af det arbejde, som medlemmerne af udvalget om industripolitik, eksterne økonomiske forbindelser, forskning og energi, kommissionen og rådet har udført.","(0.99, 1.00)",0.9095930632220222,0.9665,0.9545454545454546,0.9545454545454546,0.9545454495454548,0.9166666666666666,0.9166666666666666,0.9166666616666668,0.9545454545454546,0.9545454545454546,0.9545454495454548,0.99,1.00,da
"jeg mener, at det vil være vigtigt at sende hele det videnskabelige og teknologiske miljø i europa dette budskab om, at parlamentet støtter initiativet til dette sjette rammeprogram, som vil udvikle det europæiske forskningsrum.",i think it is important to send a signal out to all those involved in science and technology in europe that parliament supports the sixth framework programme. this aims to create the european research area.,Add random word,"jeg mener, at det vil være vigtigt at sende hele det videnskabelige og teknologiske miljø i europa dette reprise budskab om, at parlamentet støtter initiativet til dette sjette rammeprogram, som vil udvikle det europæiske forskningsrum.","(0.99, 0.95)",0.9325260649618224,0.9973,0.9655172413793104,1.0,0.9824561353524162,0.9411764705882352,0.9696969696969696,0.9552238755981288,0.9655172413793104,1.0,0.9824561353524162,0.99,0.95,da
"hr. formand, kære kolleger, jeg vil også gerne takke de mange kolleger, der har bistået mig under det forløbne halvandet års arbejde med det sjette rammeprogram for forskning.","mr president, ladies and gentlemen, i would also like to thank all the members who have helped me over the last year and a half with the work on the sixth framework programme on research.",Duplicate character,"hrr. formand, kære kolleger, jeg vil også gerne takke de mange kolleger, der har bistået mig under det forløbne halvandet års arbejde med det sjette rammeprogram for forskning.","(1.00, 1.00)",0.9682132340352988,0.9697,0.9615384615384616,0.9615384615384616,0.9615384565384616,0.9629629629629628,0.9629629629629628,0.9629629579629628,0.9615384615384616,0.9615384615384616,0.9615384565384616,1.00,1.00,da
"båndene mellem mexico og eu er stærke. deres land var det første på det amerikanske kontinent, der undertegnede en associerings- og frihandelsaftale med eu.",the links between mexico and the european union are strong: your country was the first from all the americas to sign an association and free trade agreement with the european union.,Remove Token,"båndene mellem mexico og eu er stærke . deres land var det første på det amerikanske kontinent, der undertegnede en og frihandelsaftale med eu.","(0.98, 0.95)",0.8985396083419646,0.9663,1.0,0.9523809523809524,0.9756097511005354,0.9545454545454546,0.9130434782608696,0.9333333283358024,1.0,0.9523809523809524,0.9756097511005354,0.98,0.95,da
"der er tale om et politisk engagement af meget stor betydning, der omfatter økonomi og også politisk dialog med en parlamentarisk dimension, og centralt for det hele er de fælles værdier.","it is a political commitment of profound significance, covering economics and also political dialogue with a parliamentary dimension, and shared values at the core.",Duplicate Token,"der er tale om et politisk engagement af meget stor betydning, der omfatter økonomi og også politisk dialog med en parlamentarisk dimension, og centralt for det hele hele er de fælles værdier.","(0.99, 0.99)",0.9474114688990278,0.997,1.0,1.0,0.999999995,0.967741935483871,1.0,0.983606552378393,1.0,1.0,0.999999995,0.99,0.99,da
"jeg giver dem ordet, hr. præsident.","i give you the floor, mr president.",Duplicate Token,"jeg giver dem dem ordet, hr . præsident.","(0.95, 0.95)",0.7780106561124064,0.9836,1.0,1.0,0.999999995,0.8333333333333334,1.0,0.9090909041322316,1.0,1.0,0.999999995,0.95,0.95,da
"vi skal også være os bevidste, at mange syge venter på, at der udvikles nye behandlingsformer, som kan sikre mange af dem mulighed for helbredelse.",we must not hide the fact that many people who are ill are waiting for new therapies to be developed that will offer many of them the possibility of recovery.,Remove Token,"vi også være os bevidste, at mange syge venter på, at der udvikles nye behandlingsformer, som kan sikre mange af dem mulighed for helbredelse.","(1.00, 1.00)",0.9356154226309104,0.9687,1.0,0.9565217391304348,0.977777772780247,0.9565217391304348,0.9166666666666666,0.9361702077682208,1.0,0.9565217391304348,0.977777772780247,1.00,1.00,da
"de grundlæggende etiske principper, som forskningen ifølge rådets fælles holdning skal overholde, er imidlertid ikke klart defineret, og rækkevidden af disse er ikke præcist angivet.","however, the definition and scope of the fundamental ethical principles, which the council common position states must be observed when carrying out research, are not clearly explained.",Negation,"de grundlæggende etiske principper, som forskningen ifølge rådets fælles holdning skal overholde, er imidlertid klart defineret, og rækkevidden af disse er præcist angivet.","(0.85, 0.95)",0.8096427216101598,0.9369,1.0,0.9565217391304348,0.977777772780247,0.9090909090909092,0.8333333333333334,0.8695652124007562,1.0,0.9565217391304348,0.977777772780247,0.85,0.95,da
"jeg går derfor ind for et retligt forbud, på europæisk niveau, mod at skabe menneskelige fostre ved kloning (såvel i behandlingsøjemed som til reproduktion).","for this reason, i am calling for a legal ban at european level on creating human embryos by cloning, be it for therapeutic purposes or for reproductive purposes.",Replace Token with Random Word,"jeg går derfor ind for et retligt forbud, på europæisk niveau, mod at skabe menneskelige fostre ved kloning (såvel i behandlingsøjemed som til stund).","(0.95, 0.9)",0.9163140145331566,0.9653,0.9583333333333334,0.9583333333333334,0.9583333283333336,0.9565217391304348,0.9565217391304348,0.9565217341304348,0.9583333333333334,0.9583333333333334,0.9583333283333336,0.95,0.9,da
"hvad angår forskningens finansiering, og særlig i relation til det sjette rammeprogram (som caudron-teænkningen vedrører), mener jeg imidlertid, at eu-finansieringen i første række bør rettes mod forskningsprojekter, der i behandlingsøjemed anvender voksne stamceller.","however, with regard to financing research, and in particular as regards the sixth framework programme, which is the subject of the caudron report, i believe that priority should be given to community financing of research projects on the use of adult stem cells for therapeutic purposes.",Swap characters,"hvad angår forskningens finansiering, og særlig i relation til det sjette rammeprogram (som caudron-teænkningen vedrører), mener jeg imidlertid, at eu-finansieringen i første række bør rettes mod forskningsprojekter, der i behandlingsøjemed anvedner voksne stamceller.","(0.99, 0.95)",0.933651069586263,0.9749,0.967741935483871,0.967741935483871,0.9677419304838712,0.9375,0.9375,0.937499995,0.967741935483871,0.967741935483871,0.9677419304838712,0.99,0.95,da
"dette forhold er selvfølgelig ikke blot en hån mod demokratiet i dets egentlige forstand og over for de enkelte landes retsorden, men det er også fuldstændig absurd ud fra et juridisk synspunkt, da det krænker de retlige bestemmelsers substantielle hierarki.","it goes without saying that this would be not only an offence to democracy in the true sense of the word and to national legal systems, but it would also be completely absurd from a legal point of view and would be at odds with the normal legislative hierarchy.",Negation,"dette forhold er selvfølgelig blot en hån mod demokratiet i dets egentlige forstand og over for de enkelte landes retsorden, men det er også fuldstændig absurd ud fra et juridisk synspunkt, da det krænker de retlige bestemmelsers substantielle hierarki.","(1.00, 1.00)",0.9385522307631308,0.979,1.0,0.972972972972973,0.986301364863952,0.9736842105263158,0.9487179487179488,0.9610389560398044,1.0,0.972972972972973,0.986301364863952,1.00,1.00,da
jeg har stemt imod betænkningen.,i have voted against the report.,Duplicate character,jeg har stemt imod betænkningeen.,"(0.98, 0.95)",0.537284965911771,0.8067,0.8,0.8,0.7999999950000002,0.75,0.75,0.749999995,0.8,0.8,0.7999999950000002,0.98,0.95,da
"medlemsstater skal ikke, som det nu sker, tvinges til at finansiere forskning, som er ulovlig og imod deres eget lands forfatning.","member states must not be obliged, as is currently the case, to fund research that is illegal and unconstitutional in their own countries.",Negation,"medlemsstater skal, som det nu sker, tvinges til at finansiere forskning, som er ulovlig og imod deres eget lands forfatning.","(1.00, 1.00)",0.9016312132446728,0.9636,0.9473684210526316,0.9,0.9230769180802104,0.8947368421052632,0.85,0.8717948667981592,0.9473684210526316,0.9,0.9230769180802104,1.00,1.00,da
"efter en række forskrækkelser i de senere år, er der taget enorme skridt for at finjustere hele fødevareproduktionsprocessen, således at intet bliver overladt til tilfældigheder, og vores forbrugere kan have fred i sindet.","following on from a number of scares in recent years, tremendous steps have been taken to fine-tune the whole food production process so that nothing can be left to chance and so that our consumers can have peace of mind.",Swap words,"efter en række forskrækkelser i de senere år, er der taget enorme for skridt at finjustere hele fødevareproduktionsprocessen, således at intet bliver overladt til tilfældigheder, og vores forbrugere kan have fred i sindet. ","(0.99, 0.99)",0.9122335536579608,0.9994,0.96875,1.0,0.984126979128244,0.8787878787878788,0.90625,0.8923076873088758,0.9375,0.967741935483871,0.952380947382212,0.99,0.99,da
"ja, hvis en europæisk borger har problemer med fødevaresikkerheden for blot at finde ud af, at der er en undtagelse for netop denne type kød, kunne det gøre hele denne pakke af foranstaltninger meningsløs.","indeed, if a european citizen has problems with food safety only to find that there is an exemption for the particular meat in question, it could render this whole package of measures meaningless.",Replace Token with Random Word,"ja, hvis en europæisk borger har problemer med fødevaresikkerheden for blot at finde ud af, at der akut en undtagelse for netop denne type kød, kunne det gøre hele denne pakke af foranstaltninger meningsløs.","(0.95, 0.98)",0.9299238452109287,0.9736,0.9666666666666668,0.9666666666666668,0.9666666616666668,0.9393939393939394,0.9393939393939394,0.9393939343939396,0.9666666666666668,0.9666666666666668,0.9666666616666668,0.95,0.98,da
"det kapitalistiske markeds nådesløse lov, der ændrer planteædende dyr til kødædende, er det første, der skal påvises og bekæmpes.","and that means pointing the finger first and coming down hard on the merciless laws of the capitalist market, which turn herbivores into carnivores.",Duplicate Token,"det kapitalistiske markeds nådesløse lov, der ændrer planteædende dyr til kødædende, er det første, der der skal påvises og bekæmpes.","(1.00, 1.00)",0.9212572821896308,0.9931,1.0,1.0,0.999999995,0.9473684210526316,1.0,0.9729729679766254,1.0,1.0,0.999999995,1.00,1.00,da
