originalSentence,referenceSentence,tamperingType,tamperedSentence,"LLMScore (Sim, Con)",BLEU,METEOR,Rouge1 r,Rouge1 p,Rouge1 f,Rouge2 r,Rouge2 p,Rouge2 f,Rougel r,Rougel p,Rougel f,LLM-Sim,LLM-Con,originalLanguage
"rådet accepterede flere af europa-parlamentets ændringsforslag under udgiftsområde iii, indre anliggender, primært for at tage højde for udviklingen på det lovgivningsmæssige område.","it also accepted several european parliament amendments in heading 3 on internal policy, particularly in order to take account of developments in legislation.",Swap words,"rådet accepterede flere af europa-parlamentets ændringsforslag under udgiftsområde iii, indre primært anliggender, for at tage højde for udviklingen på det lovgivningsmæssige område. ","(0.99, 0.95)",0.8400642554861188,0.998,0.9545454545454546,1.0,0.976744181049216,0.8181818181818182,0.8571428571428571,0.8372092973282856,0.9090909090909092,0.9523809523809524,0.9302325531422392,0.99,0.95,da
de supplerende bevillinger gør det muligt at fremskynde den europæiske unions bistand til det vestlige balkan i 2001.,these additional appropriations will enable us to speed up the european union' s aid programme for the western balkans in 2001.,Add random word,de supplerende bevillinger gør det drone muligt at fremskynde den europæiske unions bistand til det vestlige balkan i 2001.,"(0.95, 0.98)",0.8606031405392816,0.9942,0.9444444444444444,1.0,0.9714285664326532,0.8888888888888888,0.9411764705882352,0.914285709289796,0.9444444444444444,1.0,0.9714285664326532,0.95,0.98,da
"inden europa-parlamentet vedtager budgettet, vil jeg gerne understrege, at rådet lægger vægt på, at en række grundlæggende budgetregler overholdes, i særdeleshed når det gælder henlæggelse af bevillinger, retsgrundlag og klassificering af udgifter.","lastly, before you proceed to the final adoption of this budget, i wish to stress the importance the council attaches to some of the fundamental budgetary rules, in the field of entering appropriations in the reserve, the legal basis and the classification of expenditure.",Remove Token,"inden europa-parlamentet vedtager budgettet, vil jeg gerne understrege, at rådet lægger vægt på, at en grundlæggende budgetregler overholdes, i særdeleshed når det gælder henlæggelse af bevillinger, retsgrundlag og klassificering af udgifter.","(0.95, 0.95)",0.9299238452109287,0.9762,1.0,0.9666666666666668,0.9830508424590636,0.9666666666666668,0.935483870967742,0.9508196671324912,1.0,0.9666666666666668,0.9830508424590636,0.95,0.95,da
"inden jeg slutter denne gennemgang, vil jeg gerne fremhæve det positive klima, der har kendetegnet budgetproceduren.","to conclude this overview, i wish to join those who have highlighted the excellent climate in which this budgetary procedure has taken place.",Duplicate character,"inden jeg sslutter denne gennemgang, vil jeg gerne fremhæve det positive klima, der har kendetegnet budgetproceduren.","(0.99, 1.00)",0.866397551781362,0.9467,0.9333333333333332,0.9333333333333332,0.9333333283333336,0.8666666666666667,0.8666666666666667,0.8666666616666667,0.9333333333333332,0.9333333333333332,0.9333333283333336,0.99,1.00,da
"jeg vil også takke ordførerne hr. ferber og hr. colom i naval, formanden for budgetudvalget hr. wynn og medlemmerne af budgetudvalget for alle medlemmernes store engagement, som under forhandlingerne førte til de gode resultater.","i should also like to thank the rapporteurs, mr ferber and mr colom i naval, the chairman of the committee on budgets, mr wynn, and the members of the committee on budgets for being so committed.",Swap characters,"jeg vil også takke ordfrøerne hr. ferber og hr. colom i naval, formanden for budgetudvalget hr. wynn og medlemmerne af budgetudvalget for alle medlemmernes store engagement, som under forhandlingerne førte til de gode resultater.","(1.00, 1.00)",0.933651069586263,0.9749,0.9655172413793104,0.9655172413793104,0.9655172363793104,0.9393939393939394,0.9393939393939394,0.9393939343939396,0.9655172413793104,0.9655172413793104,0.9655172363793104,1.00,1.00,da
"imidlertid må man også sige, at tallene, som de ser ud i dag, ikke omfatter det forestående tillægsbudget, som bliver nødvendigt som konsekvens af bse-krisen.","however, we must also note that the figures before us today do not include the supplementary budget which still needs to be addressed in the wake of the bse crisis.",Negation,"imidlertid må man også sige, at tallene, som de ser ud i dag, omfatter det forestående tillægsbudget, som bliver nødvendigt som konsekvens af bse-krisen.","(0.85, 0.95)",0.9095930632220222,0.9697,1.0,0.9565217391304348,0.977777772780247,0.9565217391304348,0.9166666666666666,0.9361702077682208,1.0,0.9565217391304348,0.977777772780247,0.85,0.95,da
"det er vigtigt, at intet land i balkanregionen får mindre hjælp til rådighed som følge af demokratiseringen i serbien, end der var planlagt før udviklingen i serbien.",what is important is that no country in the balkans will now be offered less aid than originally planned before developments in serbia due to the democratisation of serbia.,Remove Character,"det er vigtigt, at intet land i balkanregionen får mindre hjælp til rådighed som følge af demokratseringen i serbien, end der var planlagt før udviklingen i serbien.","(1.00, 1.00)",0.9095930632220222,0.9665,0.96,0.96,0.959999995,0.9230769230769232,0.9230769230769232,0.9230769180769232,0.96,0.96,0.959999995,1.00,1.00,da
"i det budget, som vi vedtager i dag, er der afsat seks milliarder euro til subsidiering af oksekødsproduktionen, og der er allerede anvendt 60 millioner i budgettet til medfinansieringen af bse-test.","the budget being voted on today includes eur 6 billion to subsidise beef production, in addition to the eur 60 million budgeted in order to cofinance bse tests.",Duplicate character,"i det buudget, som vi vedtager i dag, er der afsat seks milliarder euro til subsidiering af oksekødsproduktionen, og der er allerede anvendt 60 millioner i budgettet til medfinansieringen af bse-test.","(1.00, 1.00)",0.9316103763537944,0.9713,0.96,0.96,0.959999995,0.9333333333333332,0.9333333333333332,0.9333333283333336,0.96,0.96,0.959999995,1.00,1.00,da
"her gælder i øvrigt også det, som blev understreget endnu en gang i nice, nemlig at der skal tages højde for de økonomiske ordninger og grænser for landbrugsbudgettet.",plus - and this was again stressed in nice - we have to comply with the financial regulations and ceilings for the agricultural budget.,Remove Character,"her gælder i øvrigt også det, som blev understreget ndnu en gang i nice, nemlig at der skal tages højde for de økonomiske ordninger og grænser for landbrugsbudgettet.","(0.99, 0.99)",0.9127592114472296,0.9676,0.9615384615384616,0.9615384615384616,0.9615384565384616,0.925925925925926,0.925925925925926,0.925925920925926,0.9615384615384616,0.9615384615384616,0.9615384565384616,0.99,0.99,da
"mange af de beslutninger, der blev truffet i nice, er særdeles relevante for budgetprocessen.",several decisions taken at nice are highly relevant to the budget and the budgetary process.,Replace Character,"mange af de beslutninger, der blev truffet i nice, er særdeles relevante for buugetprocessen.","(0.99, 0.95)",0.8843946454355334,0.9403,0.9285714285714286,0.9285714285714286,0.9285714235714286,0.9230769230769232,0.9230769230769232,0.9230769180769232,0.9285714285714286,0.9285714285714286,0.9285714235714286,0.99,0.95,da
"i modsat fald må jeg fortolke det således, at tavsheden er svaret.","if not, i will have to interpret that silence is the response.",Replace Token with Random Word,"i modsat fald vanke jeg fortolke det således, at tavsheden er svaret.","(0.95, 0.99)",0.7825422900366437,0.9269,0.9166666666666666,0.9166666666666666,0.9166666616666668,0.8181818181818182,0.8181818181818182,0.8181818131818183,0.9166666666666666,0.9166666666666666,0.9166666616666668,0.95,0.99,da
"vi roste kommissær busquin, som overgik vores forventninger på dette område.","we praised commissioner busquin, who has exceeded our expectations in that area.",Add random word,"vi lange roste kommissær busquin, som overgik vores forventninger på dette område.","(0.95, 0.95)",0.8617038791239606,0.9906,0.9166666666666666,1.0,0.9565217341398866,0.8181818181818182,0.9,0.8571428521541952,0.9166666666666666,1.0,0.9565217341398866,0.95,0.95,da
output i stedet for input.,output instead of input.,Duplicate character,output i stedet ffor input.,"(0.95, 0.99)",7.262123179505913e-78,0.8067,0.8,0.8,0.7999999950000002,0.5,0.5,0.4999999950000001,0.8,0.8,0.7999999950000002,0.95,0.99,da
"hr. formand, jeg vil også gerne takke ordføreren, fru haug, for den fantastiske indsats, som hun har ydet som ordfører for budgettet, og hendes bestræbelser for at tage højde for de anmodninger, vi har fremsat fra de forskellige udvalgs side.","mr president, i would also like to thank the rapporteur, mrs haug, for the magnificent work that she has done as the rapporteur responsible for the budget and for her efforts in dealing with the requests that the various committees have made.",Swap words,"hr. formand, jeg vil også gerne takke ordføreren, fru haug, for den fantastiske indsats, som hun har ydet som ordfører for og budgettet, hendes bestræbelser for at tage højde for de anmodninger, vi har fremsat fra de forskellige udvalgs side. ","(0.98, 0.95)",0.9221641491622664,0.9997,0.9714285714285714,1.0,0.9855072413778618,0.9,0.9230769230769232,0.9113924000640924,0.9428571428571428,0.9705882352941176,0.9565217341314852,0.98,0.95,da
det ligger inden for de finansielle overslag.,it operates within the financial perspective.,Duplicate Token,det det ligger inden for de finansielle overslag.,"(0.99, 0.99)",0.8824969025845955,0.9867,1.0,1.0,0.999999995,0.8571428571428571,1.0,0.9230769181065088,1.0,1.0,0.999999995,0.99,0.99,da
det håber vi at opnå.,we hope that will be achieved.,Remove Token,det håber at opnå.,"(0.95, 0.9)",7.262123179505913e-78,0.8203,1.0,0.8,0.8888888839506174,0.6666666666666666,0.5,0.5714285665306124,1.0,0.8,0.8888888839506174,0.95,0.9,da
"vi må sikre os, at vi kan beholde vores informationsprogrammer.",we must see that we keep our information programmes.,Replace Character,"vi må sikre os, at vi kan beholde vores informationsprsgrammer.","(0.99, 0.95)",0.8265168183793802,0.9139,0.8888888888888888,0.8888888888888888,0.888888883888889,0.8888888888888888,0.8888888888888888,0.888888883888889,0.8888888888888888,0.8888888888888888,0.888888883888889,0.99,0.95,da
"(fi) hr. formand, der blev ikke udspillet det store drama ved budgetbehandlingen i år.","that does not mean, however, that things have been easy.",Negation,"(fi) hr . formand, der blev udspillet det store drama ved budgetbehandlingen i år.","(0.95, 0.95)",0.8492326635760689,0.9517,1.0,0.9285714285714286,0.9629629579698218,0.9166666666666666,0.8461538461538461,0.879999995008,1.0,0.9285714285714286,0.9629629579698218,0.95,0.95,da
"det betyder dog ikke, at det var nemt. ordfører haugs saglige arbejdsmetode viste imidlertid sin styrke.","the matter-of-fact approach of the rapporteur, mrs haug, has nevertheless shown its strength.",Negation,"det betyder dog, at det var nemt . ordfører haugs saglige arbejdsmetode viste imidlertid sin styrke.","(0.98, 0.95)",0.8492326635760689,0.9517,0.9285714285714286,0.8666666666666667,0.8965517191438764,0.8571428571428571,0.8,0.8275862019024971,0.9285714285714286,0.8666666666666667,0.8965517191438764,0.98,0.95,da
"jeg vil gerne takke fru schreyer, som også har hjulpet os med en meget konstruktiv tilgang, og naturligvis min veninde jutta haug, som har ydet en fremragende indsats, og joan colom i naval og markus ferber.","i should also like to thank mrs schreyer, who has continued to help us with her highly constructive approach and, of course, my friend jutta haug, who has done an excellent job, not forgetting joan colom i naval and markus ferber.",Replace Token with Random Word,"jeg vil gerne takke fru schreyer, som også har hjulpet os med en meget konstruktiv tilgang, og naturligvis min veninde jutta haug, som har ydet en fremragende indsats, og joan colom i naval og difteri ferber.","(0.95, 0.95)",0.9421727090955796,0.9755,0.967741935483871,0.967741935483871,0.9677419304838712,0.9428571428571428,0.9428571428571428,0.942857137857143,0.967741935483871,0.967741935483871,0.9677419304838712,0.95,0.95,da
det er også en forpligtelse over for rådet.,it is also a commitment vis-à-vis the council.,Remove Character,det er oså en forpligtelse over for rådet.,"(0.99, 0.99)",0.6606328636027614,0.8819,0.875,0.875,0.874999995,0.7142857142857143,0.7142857142857143,0.7142857092857143,0.875,0.875,0.874999995,0.99,0.99,da
"det har aldrig været meningen, at vi hvert år skulle agere brandvæsen med dem på de områder, som vi under alle omstændigheder skal finansiere.",it was never meant to be used for firefighting every year in areas which we have to fund in any case.,Remove Character,"det har aldrig været meningen, at vi hvert år skulle agere brandvæsen med dem på de områder, som vi under alle mstændigheder skal finansiere.","(0.99, 1.00)",0.8985396083419646,0.9627,0.9565217391304348,0.9565217391304348,0.9565217341304348,0.9130434782608696,0.9130434782608696,0.9130434732608697,0.9565217391304348,0.9565217391304348,0.9565217341304348,0.99,1.00,da
"dette betyder, at der for de andre budgetposter har været en meget stram anvendelse af midlerne.",this means that great restraint has been shown in the use of funds in the other categories.,Add random word,"dette skur betyder, at der for de andre budgetposter har været en meget stram anvendelse af midlerne.","(0.95, 0.99)",0.9011400823378845,0.9938,0.9411764705882352,1.0,0.9696969647015612,0.875,0.9333333333333332,0.903225801456816,0.9411764705882352,1.0,0.9696969647015612,0.95,0.99,da
dette indebærer dog en risiko.,"this, however, conceals a danger.",Duplicate Token,dette indebærer indebærer dog en risiko.,"(0.99, 0.99)",0.7118034480382983,0.9654,1.0,1.0,0.999999995,0.8,1.0,0.8888888839506174,1.0,1.0,0.999999995,0.99,0.99,da
"det er et bevis for, at begge budgetmyndighederne handler ansvarligt med hensyn til eu's forvaltning.",it shows that both budgetary authorities are taking responsibility for the administration of the eu in an appropriate manner.,Duplicate character,"det er et bevis forr, at begge budgetmyndighederne handler ansvarligt med hensyn til eu's forvaltning.","(0.99, 0.99)",0.8394327083733336,0.9437,0.9333333333333332,0.9333333333333332,0.9333333283333336,0.8571428571428571,0.8571428571428571,0.8571428521428571,0.9333333333333332,0.9333333333333332,0.9333333283333336,0.99,0.99,da
"det er derimod beklageligt, at parlamentet igen måtte kæmpe for midler til vestbalkan.","however, it is unfortunate that parliament once again had to fight with regard to funds for the west balkans.",Add random word,"det er derimod beklageligt, at parlamentet igen måtte kæmpe for midler til vestbalkan mangle.","(0.95, 0.95)",0.880771385653411,0.9922,0.9285714285714286,1.0,0.9629629579698218,0.9230769230769232,1.0,0.959999995008,0.9285714285714286,1.0,0.9629629579698218,0.95,0.95,da
"også vores gruppe vil stemme for dette budget, fordi det viser, at vi trods et voksende pres af problemer på eksemplarisk vis atter har fundet et kompromis.","our group will also vote in favour of this budget because it shows that, once again, we have reached an exemplary compromise, despite being under increasing pressure.",Remove Character,"også vores gruppe vil stemme for dette buget, fordi det viser, at vi trods et voksende pres af problemer på eksemplarisk vis atter har fundet et kompromis.","(1.00, 1.00)",0.9095930632220222,0.9665,0.9615384615384616,0.9615384615384616,0.9615384565384616,0.9230769230769232,0.9230769230769232,0.9230769180769232,0.9615384615384616,0.9615384615384616,0.9615384565384616,1.00,1.00,da
"det voksende pres af problemer vedrører især arbejdsløsheden, bse-krisen og stabilitetspagten for balkan.","the main sources of this pressure are unemployment, the bse crisis and the balkan stability pact.",Duplicate character,"det voksende pres af problemer vedrører især arbejdsløsheden, bse-krissen og stabilitetspagten for balkan.","(0.98, 0.95)",0.8003203203844999,0.932,0.9230769230769232,0.9230769230769232,0.9230769180769232,0.8333333333333334,0.8333333333333334,0.8333333283333335,0.9230769230769232,0.9230769230769232,0.9230769180769232,0.98,0.95,da
parlamentet vil i hvert fald blive en langt hårdere modpart til næste år.,"in all events, parliament will be a much tougher negotiating partner next year.",Swap words,parlamentet i vil hvert fald blive en langt hårdere modpart til næste år. ,"(1.00, 1.00)",0.8048293456573857,0.9883,0.9285714285714286,1.0,0.9629629579698218,0.6923076923076923,0.75,0.7199999950079999,0.8571428571428571,0.9230769230769232,0.8888888838957477,1.00,1.00,da
næste punkt på dagsordenen er forhandling under ét om beretning fra det europæiske råd og redegørelse fra kommissionen om det europæiske råds møde i nice samt redegørelse fra rådets formandskab om det franske formandskab.,and the next item is the joint discussion on the report by the european council and the commission statement on the european council meeting in nice and the statement by the presidency-in-office of the council on the french presidency' s term of office.,Duplicate character,næste punkt på dagsordenenn er forhandling under ét om beretning fra det europæiske råd og redegørelse fra kommissionen om det europæiske råds møde i nice samt redegørelse fra rådets formandskab om det franske formandskab.,"(1.00, 1.00)",0.9234732618882052,0.9713,0.96,0.96,0.959999995,0.9333333333333332,0.9333333333333332,0.9333333283333336,0.96,0.96,0.959999995,1.00,1.00,da
"hr. formand, ordet er deres.","mr president, i give you the floor.",Swap words,"hr. formand, er ordet deres. ","(0.95, 0.95)",0.4417918226831577,0.9375,0.8333333333333334,1.0,0.9090909041322316,0.2,0.25,0.2222222172839507,0.6666666666666666,0.8,0.7272727223140496,0.95,0.95,da
"fru formand for parlamentet, hr. formand for rådet, mine damer og herrer, det europæiske råd i december 2000 vil blive husket som et særligt langt og vanskeligt råd.",". (it) madam president, mr president-in-office of the council, ladies and gentlemen, the december 2000 european council will be remembered as particularly lengthy and particularly complex.",Add random word,"fru formand for parlamentet, hr . formand for rådet, mine damer og herrer, hæk det europæiske råd i december 2000 vil blive husket som et særligt langt og vanskeligt råd.","(0.99, 0.95)",0.9219602423775934,0.9969,0.96,1.0,0.9795918317367764,0.925925925925926,0.9615384615384616,0.9433962214168744,0.96,1.0,0.9795918317367764,0.99,0.95,da
"der blev truffet nogle gode beslutninger i nice, og nogle af dem havde vi ventet på længe.","positive decisions were taken at nice, some of them long-awaited.",Replace Token with Random Word,"der blev truffet nogle gode beslutninger i nice, og nogle af dem havde vi ventet på dement.","(0.85, 0.95)",0.8979542144404234,0.9467,0.9375,0.9375,0.937499995,0.9375,0.9375,0.937499995,0.9375,0.9375,0.937499995,0.85,0.95,da
"det europæiske råd traf derfor den fornuftige beslutning, at de hen ad vejen skal finde sted i bruxelles alle sammen.",the european council took the wise decision to move gradually towards holding them all in brussels.,Duplicate Token,"det europæiske råd traf derfor den fornuftige beslutning, at de de hen ad vejen skal finde sted i bruxelles alle sammen.","(0.99, 1.00)",0.9175169016290816,0.9951,1.0,1.0,0.999999995,0.95,1.0,0.9743589693622616,1.0,1.0,0.999999995,0.99,1.00,da
"endelig var deres klare indlæg i rådet virkelig eksemplariske, fru formand.","finally, madam president, i would like to praise the truly exemplary clarity of your own speeches to the meetings of the council.",Replace Character,"endelig var deres klare indlæg i rådet virkelig ekszmplariske, fru formand.","(0.99, 0.99)",0.7611606003349892,0.9209,0.9090909090909092,0.9090909090909092,0.9090909040909092,0.8,0.8,0.7999999950000002,0.9090909090909092,0.9090909090909092,0.9090909040909092,0.99,0.99,da
"det vil et tage et stykke tid at foretage en nøjagtig og grundig vurdering af de fremskridt, man har gjort i nice, men vi kan allerede fremsætte et par betragtninger på nuværende tidspunkt.","it will be a little while before we can make a full, accurate assessment of the progress made at nice, but we can at this stage hazard a few observations.",Add random word,"det vil et tage et stykke tid at foretage en nøjagtig og grundig vurdering af de fremskridt, man har gjort i nice, men vi grat kan allerede fremsætte et par betragtninger på nuværende tidspunkt.","(0.99, 0.95)",0.928663927948396,0.9971,0.96875,1.0,0.984126979128244,0.9393939393939394,0.96875,0.9538461488473374,0.96875,1.0,0.984126979128244,0.99,0.95,da
"på de vanskelige områder som samhørighed, skatteregler og sociallovgivning blev der kun gjort ringe eller slet ingen fremskridt.","little or no progress was made on the sensitive issues of cohesion, tax regulation and social legislation.",Swap characters,"på de vanskelige områder som samhørighed, skattergeler og sociallovgivning blev der kun gjort ringe eller slet ingen fremskridt.","(1.00, 1.00)",0.8578928092681435,0.9494,0.9444444444444444,0.9444444444444444,0.9444444394444445,0.8823529411764706,0.8823529411764706,0.8823529361764706,0.9444444444444444,0.9444444444444444,0.9444444394444445,1.00,1.00,da
"endelig vil jeg gerne rette en tak til præsident chirac og premierminister jospin, fordi de har givet os mulighed for at komme af med de værste uklarheder i forvaltningen af vores handelspolitik.","lastly, i would like to take this opportunity to thank president chirac and the french prime minister, mr jospin, for making it possible to put paid to the main ambiguities of our commercial policy.",Replace Token with Random Word,"endelig vil jeg gerne rette en tak til præsident chirac og premierminister jospin, fordi de har givet os mulighed for at komme af med libertiner værste uklarheder i forvaltningen af vores handelspolitik.","(0.95, 0.95)",0.9210500207490828,0.9697,0.967741935483871,1.0,0.983606552378393,0.935483870967742,0.935483870967742,0.935483865967742,0.967741935483871,1.0,0.983606552378393,0.95,0.95,da
"en anden grund til tilfredshed er det resultat, man har opnået med hensyn til det tættere samarbejde. mine damer og herrer, jeg tror, at vi nu står med et vigtigt instrument for den udvidede union.",another source of satisfaction lies in the result in the field of closer cooperation.,Replace Token with Random Word,"en anden grund til tilfredshed er det resultat, man har opnået med hensyn til det tættere samarbejde . mine damer og herrer, jeg tror, at vi nu står med et lange instrument for den udvidede union.","(0.95, 0.95)",0.933651069586263,0.9749,0.96875,0.96875,0.968749995,0.9411764705882352,0.9411764705882352,0.9411764655882354,0.96875,0.96875,0.968749995,0.95,0.95,da
der er ikke nogle resterende spørgsmål - ikke nogen leftovers - tilbage på forhandlingsbordet i nice.,there are no leftovers from nice.,Negation,der er nogle resterende spørgsmål - nogen leftovers - tilbage på forhandlingsbordet i nice.,"(0.85, 0.95)",0.6675075987129311,0.8893,1.0,0.9285714285714286,0.9629629579698218,0.8461538461538461,0.7333333333333333,0.7857142807397959,1.0,0.9285714285714286,0.9629629579698218,0.85,0.95,da
"hr. formand, jeg nævner dette, fordi den slags forslag opstår i den hektiske stemning under et topmøde i nice, og dette må aldrig gentage sig i den europæiske unions historie.","mr president, i mention this because proposals such as this arise in the maelstrom of a summit such as nice but should never be repeated in the history of the european union.",Remove Character,"hr. formand, jeg nævner dette, fordi de slags forslag opstår i den hektiske stemning under et topmøde i nice, og dette må aldrig gentage sig i den europæiske unions historie.","(1.00, 1.00)",0.9234732618882052,0.9713,0.9629629629629628,1.0,0.9811320704734782,0.9285714285714286,0.9285714285714286,0.9285714235714286,0.9629629629629628,1.0,0.9811320704734782,1.00,1.00,da
"vi sætter vores lid til fremtiden, selv om vi også kan se de gode ting, f.eks. deres engagement i udenrigs-, sikkerheds- og forsvarspolitikken, styrkelsen af kommissionen.","we have hope for the future and we do also see the good side, such as your commitment to the foreign, security and defence policy and the increase in commission posts.",Swap characters,"vi sætter vores lid til fremtiden, selv om vi også kan se de gode ting, f.eks. deres engagement i udenrigs-, sikkerheds- og forsvarspolitikken, styrkelsne af kommissionen.","(0.98, 0.99)",0.9157103753711766,0.9686,0.9615384615384616,0.9615384615384616,0.9615384565384616,0.9230769230769232,0.9230769230769232,0.9230769180769232,0.9615384615384616,0.9615384615384616,0.9615384565384616,0.98,0.99,da
"vi kommer til at følge rådet meget kritisk i de kommende uger og måneder for at se, om det selv er i stand til at sikre denne gennemsigtighed, som de talte om.",we shall have to keep a very critical eye on the council over coming weeks and months in order to ascertain if it too is in a position to safeguard the transparency of which you spoke.,Remove Token,"vi kommer til at følge rådet meget kritisk i de kommende uger og for at se, om det selv er i stand til at sikre denne gennemsigtighed, som de talte om.","(0.95, 0.99)",0.9234732618882052,0.9741,1.0,0.9615384615384616,0.9803921518646674,0.9655172413793104,0.9333333333333332,0.949152537374318,1.0,0.9615384615384616,0.9803921518646674,0.95,0.99,da
