originalSentence,referenceSentence,tamperingType,tamperedSentence,"LLMScore (Sim, Con)",BLEU,METEOR,Rouge1 r,Rouge1 p,Rouge1 f,Rouge2 r,Rouge2 p,Rouge2 f,Rougel r,Rougel p,Rougel f,LLM-Sim,LLM-Con,originalLanguage
"– madam president, commissioner, ladies and gentlemen, mr brejc’s approach to a topic with extremely sensitive ramifications – the social implications of globalisation – is a particularly effective one.","- fru formand, hr. kommissær, mine damer og herrer, hr. brejcs tilgang til et emne med så følsomme forgreninger - globaliseringens sociale implikationer - er særdeles effektiv.",Remove Character,"– madam president, commissioner, ladie and gentlemen, mr brejc’s approach to a topic with extremely sensitive ramifications – the social implications of globalisation – is a particularly effective one.","(0.99, 0.95)",0.9234732618882052,1.0,0.9615384615384616,0.9615384615384616,0.9615384565384616,0.9285714285714286,0.9285714285714286,0.9285714235714286,0.9615384615384616,0.9615384615384616,0.9615384565384616,0.99,0.95,en
"– madam president, the process of so-called globalisation highlights the barbarity of capitalist development and the imperialist imposition of the choices of big business, with painful consequences on the working classes, grass-roots society and the environment.","- fru formand, den såkaldte globaliseringsproces belyser den kapitalistiske udviklings barbari og den imperialistiske gennemtrumfning af storkapitalens valg med smertefulde konsekvenser for arbejderklassen, græsrodsbevægelserne og miljøet.",Duplicate character,"– madam president, the process of so-called globalisation highlights the barbarity of capitalist development and the imperialist imposition of the choices of big business, withh painful consequences on the working classes, grass-roots society and the environment.","(0.99, 1.00)",0.933651069586263,0.9749,0.9629629629629628,0.9629629629629628,0.9629629579629628,0.9411764705882352,0.9411764705882352,0.9411764655882354,0.9629629629629628,0.9629629629629628,0.9629629579629628,0.99,1.00,en
the communication by the european commission on the social dimension of globalisation analyses the phenomena from the point of view of the interests of big business and tries to obscure the real reasons for modern problems.,"i kommissionens meddelelse om globaliseringens sociale dimension analyseres fænomenet ud fra storkapitalens interesser, og man forsøger at skjule den virkelige årsag til nutidens problemer.",Add random word,the communication by the european commission on the social dimension of globalisation analyses the phenomena from the point of view of the interests of big business and tries to obscure the real reasons for ulama modern problems.,"(0.95, 0.98)",0.930648893393227,0.9972,0.9642857142857144,1.0,0.9818181768198349,0.9444444444444444,0.9714285714285714,0.9577464738742314,0.9642857142857144,1.0,0.9818181768198349,0.95,0.98,en
"capitalist restructurings are the answer of the european union, with the promotion of competitiveness as their main feature.",kapitalistiske omstruktureringer er eu's svar med forbedret konkurrencedygtighed som hovedtema.,Swap words,"capitalist restructurings are the answer of the european with union, the promotion of competitiveness as their main feature. ","(0.98, 0.95)",0.7920365952156737,0.996,0.9375,1.0,0.967741930489074,0.7777777777777778,0.8235294117647058,0.7999999950040816,0.875,0.9333333333333332,0.903225801456816,0.98,0.95,en
an evaluation of all the data shows that the term 'globalisation' is a misnomer.,"en evaluering af alle data viser, at termen ""globalisering"" er misvisende.",Add random word,an evaluation of all the ascocarpous data shows that the term 'globalisation' is a misnomer.,"(0.85, 0.95)",0.8320381765431424,0.9928,0.9285714285714286,1.0,0.9629629579698218,0.8571428571428571,0.9230769230769232,0.8888888838957477,0.9285714285714286,1.0,0.9629629579698218,0.85,0.95,en
"madam president, this report has been prepared at a time when the residents of the european union member states are harbouring ever-increasing concerns about the processes caused by or imputed to globalisation.","- fru formand, denne betænkning er udarbejdet på et tidspunkt, hvor borgerne i eu's medlemsstater føler en stadig stigende bekymring over de processer, der forårsages af eller tilskrives globaliseringen.",Remove Character,"madam presidet, this report has been prepared at a time when the residents of the european union member states are harbouring ever-increasing concerns about the processes caused by or imputed to globalisation.","(0.99, 0.99)",0.9456329342976758,0.9705,0.9666666666666668,0.9666666666666668,0.9666666616666668,0.935483870967742,0.935483870967742,0.935483865967742,0.9666666666666668,0.9666666666666668,0.9666666616666668,0.99,0.99,en
"madam president, globalisation is irreversible.","- fru formand, globaliseringen er uafvendelig.",Swap characters,"mada mpresident, globalisation is irreversible.","(0.99, 0.95)",0.6147881529512643,0.7114,0.6,0.6,0.5999999950000001,0.5,0.5,0.4999999950000001,0.6,0.6,0.5999999950000001,0.99,0.95,en
one need only look at the booming chinese economy to see proof of this.,det er den blomstrende kinesiske økonomi et levende bevis på.,Remove Character,one need only look at te booming chinese economy to see proof of this.,"(0.99, 1.00)",0.8003203203844999,0.932,0.9285714285714286,0.9285714285714286,0.9285714235714286,0.8461538461538461,0.8461538461538461,0.8461538411538462,0.9285714285714286,0.9285714285714286,0.9285714235714286,0.99,1.00,en
"workers have no freedom of movement within the eu, unlike capital, and the common agricultural policy is unjust.","arbejdstagerne har ikke fri bevægelighed inden for eu i modsætning til kapitalen, og den fælles landbrugspolitik er uretfærdig.",Add random word,"workers have no freedom of movement within the eu, unlike pinworms capital, and the common agricultural policy is unjust.","(0.95, 0.95)",0.8747394842931362,0.9948,0.9444444444444444,1.0,0.9714285664326532,0.8888888888888888,0.9411764705882352,0.914285709289796,0.9444444444444444,1.0,0.9714285664326532,0.95,0.95,en
"madam president, i first want to thank my colleague, mr brejc, for his work on this report and for his efforts to direct it towards the really important issues.","- fru formand, først vil jeg takke min kollega hr. brejc for arbejdet med denne betænkning og for hans bestræbelser på at koncentrere det om de virkelig vigtige spørgsmål.",Duplicate character,"madam president, i first want to thank my colleague, mr brejc, for his work on this report and for his efforts to direct it towards thee really important issues.","(0.99, 0.95)",0.9184678024441792,0.9696,0.9615384615384616,0.9615384615384616,0.9615384565384616,0.925925925925926,0.925925925925926,0.925925920925926,0.9615384615384616,0.9615384615384616,0.9615384565384616,0.99,0.95,en
"i must say, however, that, if there are no changes to it, it will be difficult to support the report in the form it has been drawn up following the committee’s reading of it.","jeg må dog sige, at det bliver svært at støtte betænkningen, således som den er blevet udformet efter udvalgets behandling, hvis der ikke kommer ændringer hertil.",Replace Token with Random Word,"i pansciolism say, however, that, if there are no changes to it, it will be difficult to support the report in the form it has been drawn up following the committee ’ s reading of it.","(0.98, 0.99)",0.9553531508099192,0.9755,0.8709677419354839,0.9310344827586208,0.8999999950055556,0.8285714285714286,0.8787878787878788,0.8529411714749136,0.8709677419354839,0.9310344827586208,0.8999999950055556,0.98,0.99,en
"we see how people in taiwan, china, india and ever more other countries are slowly obtaining progressively more dignity and increased prosperity.","vi ser, hvordan mennesker i taiwan, kina, indien og mange flere lande langsomt får en gradvis øget værdighed og øget velstand.",Swap words,"we see how people in taiwan, china, india and ever more other countries are slowly obtaining progressively more dignity and prosperity. increased ","(0.95, 0.90)",0.910879922930628,0.9991,1.0,1.0,0.999999995,0.9047619047619048,0.9047619047619048,0.9047618997619048,1.0,1.0,0.999999995,0.95,0.90,en
"europe is a continent that, to the very highest degree, thrives on globalisation.","europa er et kontinent, som i allerhøjeste grad lever på globaliseringen.",Swap words,"europe a is continent that, to the very highest degree, thrives on globalisation. ","(0.99, 0.99)",0.833878585505777,0.9922,0.9285714285714286,1.0,0.9629629579698218,0.6923076923076923,0.75,0.7199999950079999,0.8571428571428571,0.9230769230769232,0.8888888838957477,0.99,0.99,en
"if we try to impose our rules on other countries, they, for their part, are then hit.","hvis vi forsøger at påtvinge andre lande vores regler, rammes de.",Swap words,"if we try to impose our rules on other countries, they, their for part, are then hit. ","(0.98, 0.95)",0.8343664980911134,0.9965,0.9444444444444444,1.0,0.9714285664326532,0.7647058823529411,0.8125,0.7878787828833793,0.8888888888888888,0.9411764705882352,0.914285709289796,0.98,0.95,en
"it certainly has its winners but - to plagiarise the former prime minister of france - globalisation is a new aristocracy of money and power, which today accumulates profits and relegates a majority of losers to the sidelines.","den har ganske afgjort sine vindere, men med et lån fra den tidligere franske premierminister kunne man sige, at der er tale om et nyt aristokrati, pengenes og magtens aristokrati, som nu høster udbytte og efterlader et flertal som tabere.",Remove Character,"it certainly as its winners but - to plagiarise the former prime minister of france - globalisation is a new aristocracy of money and power, which today accumulates profits and relegates a majority of losers to the sidelines.","(1.00, 1.00)",0.9406451993027368,0.9749,0.967741935483871,0.967741935483871,0.9677419304838712,0.945945945945946,0.945945945945946,0.945945940945946,0.967741935483871,0.967741935483871,0.9677419304838712,1.00,1.00,en
europe also has to act as an example internally.,europa bør også foregå med det gode eksempel på det interne plan.,Swap characters,europe also has to act as an example internalyl.,"(0.95, 0.99)",0.7825422900366437,0.8951,0.8888888888888888,0.8888888888888888,0.888888883888889,0.875,0.875,0.874999995,0.8888888888888888,0.8888888888888888,0.888888883888889,0.95,0.99,en
"madam president, commissioner, while i do agree with many of the views expressed in the report by our slovene member mr brejc, i am not with him every step of the way.","- fru formand, hr. kommissær, på mange områder deler jeg synspunkterne i det slovenske parlamentsmedlem hr. brejcs betænkning, men er dog ikke enig med ham på alle punkter.",Negation,"madam president, commissioner, while i do agree with many of the views expressed in the report by our slovene member mr brejc, i am with him every step of the way.","(0.95, 0.95)",0.9257518071011758,0.9748,1.0,0.9629629629629628,0.9811320704734782,0.9655172413793104,0.9333333333333332,0.949152537374318,1.0,0.9629629629629628,0.9811320704734782,0.95,0.95,en
"you say that the lisbon agenda will, in bringing together the social components, enable us to meet the challenges of globalisation.","de siger, at lissabon-strategien ved at samle de sociale komponenter vil sætte os i stand til at tage udfordringerne forbundet med globalisering op.",Swap words,"you say that the lisbon agenda will, in bringing together the social enable components, us to meet the challenges of globalisation. ","(0.95, 0.98)",0.8323387063085926,0.9977,0.95,1.0,0.9743589693622616,0.8095238095238095,0.85,0.8292682876859013,0.9,0.9473684210526316,0.9230769180802104,0.95,0.98,en
"that is a world away from your approach, and it is for that reason that hong kong will, unfortunately, be a repeat of what we have seen before.","det ligger langt fra deres tilgang, og det er også grunden til, at konferencen i hongkong desværre vil blive en gentagelse af det, som vi har set før.",Remove Token,"that is a world away from your approach, and it is for that reason that hong kong will, unfortunately, be a repeat of what have seen before.","(0.98, 0.95)",0.9157103753711766,0.9717,1.0,0.9583333333333334,0.9787233992575828,0.9615384615384616,0.925925925925926,0.9433962214168744,1.0,0.9583333333333334,0.9787233992575828,0.98,0.95,en
the european union is the largest contributor of development aid in the world and therefore must continue to show real leadership when it comes to addressing humanitarian and development aid problems in the world.,"eu er den største yder af udviklingsbistand i verden og må derfor fortsat udvise ægte lederskab, når det drejer sig om at løse problemer i forbindelse med humanitær bistand og udviklingsbistand.",Replace Token with Random Word,the european semibarbaric is the largest contributor of development aid in the world and therefore must continue to show real leadership when it comes to addressing humanitarian and development aid problems in the world.,"(0.95, 0.99)",0.9316103763537944,0.9713,0.96,0.96,0.959999995,0.9333333333333332,0.9333333333333332,0.9333333283333336,0.96,0.96,0.959999995,0.95,0.99,en
"i am indebted to mr brejc for this report, which i think will galvanise us into action.","jeg takker hr. brejc for denne betænkning, som efter min mening giver anledning til at iværksætte yderligere foranstaltninger.",Duplicate character,"i am indebted too mr brejc for this report, which i think will galvanise us into action.","(0.99, 0.99)",0.8492326635760689,0.9467,0.9375,0.9375,0.937499995,0.875,0.875,0.874999995,0.9375,0.9375,0.937499995,0.99,0.99,en
i very much hope that the house will support those revisions.,"jeg håber meget, at parlamentet vil støtte disse revisioner.",Swap characters,i very much hope that the house will uspport those revisions.,"(0.95, 0.95)",0.7348889200874658,0.9139,0.9090909090909092,0.9090909090909092,0.9090909040909092,0.8,0.8,0.7999999950000002,0.9090909090909092,0.9090909090909092,0.9090909040909092,0.95,0.95,en
"it was with great interest that i listened to this debate, and i will also be very interested to follow developments regarding the report that has been drafted and the structure of the amendments that will be adopted.","jeg lyttede med stor interesse til forhandlingen, og jeg ser også frem til at følge udviklingen vedrørende betænkningen og strukturen af de ændringsforslag, der bliver vedtaget.",Remove Token,"it was with great interest that i listened to this debate, and i will also be very interested to follow developments regarding the report that has been and the structure of the amendments that will be adopted.","(0.95, 0.95)",0.933651069586263,0.9774,1.0,0.9655172413793104,0.9824561353524162,0.9722222222222222,0.945945945945946,0.9589041045899794,1.0,0.9655172413793104,0.9824561353524162,0.95,0.95,en
all indications suggest that isolation from globalisation brings greater risks in terms of poverty effects than if a country participates in globalisation.,"alt tyder på, at isolering fra globaliseringen giver større fattigdomsmæssige risici, end hvis et land deltager i globaliseringen.",Duplicate Token,all indications suggest that isolation from from globalisation brings greater risks in terms of poverty effects than if a country participates in globalisation.,"(1.00, 1.00)",0.9212572821896308,0.9953,1.0,1.0,0.999999995,0.9545454545454546,1.0,0.976744181049216,1.0,1.0,0.999999995,1.00,1.00,en
"in this context i am also referring to the potential it offers for new pan-european services, as in the case of the transport sector, to mention only one of many examples.","i den forbindelse henviser jeg også til dets potentiale for de nye paneuropæiske tjenester - eksempelvis inden for transportsektoren, hvis jeg blot skal nævne et enkelt af mange eksempler.",Swap words,"in this context i am also referring to the potential offers it for new pan-european services, as in the case of the transport sector, to mention only one of many examples. ","(0.99, 0.95)",0.9037675743000012,0.9992,0.9629629629629628,1.0,0.9811320704734782,0.8709677419354839,0.9,0.8852458966406881,0.925925925925926,0.9615384615384616,0.9433962214168744,0.99,0.95,en
"in order to ensure that the switchover has the desired results, it is impossible to overstate the need for technological neutrality and interoperability, which is one of the pillars of european innovation in this field.","for at sikre, at overgangen får de ønskede resultater, er det umuligt at overdrive behovet for teknologisk neutralitet og interoperabilitet, der er en af søjlerne for europæisk innovation på dette område.",Duplicate character,"in order to ensure that the switchover has the desired results, it is impossible to overstate the need for technological neutrality and interoperability, which is one off the pillars of european innovation in this field.","(0.98, 0.95)",0.9299238452109287,0.9736,0.9655172413793104,1.0,0.9824561353524162,0.9411764705882352,0.9411764705882352,0.9411764655882354,0.9655172413793104,1.0,0.9824561353524162,0.98,0.95,en
"the aim is to switch off analogue signals by the beginning of 2012 at the latest, and to ensure that the spectrum released by this switch-off is used in such a way that society will derive the maximum possible benefits.","målet er at ophøre med den analoge radio-/tv-spredning senest i starten af 2012 og sikre, at det frigivne spektrum fra dette ophør bruges på en måde, så samfundet høster størst mulig fordel heraf.",Remove Token,"aim is to switch off analogue signals by the beginning of 2012 at the latest, and to ensure that the spectrum released by this switch-off is used in such a way that society will derive the maximum possible benefits.","(0.99, 0.95)",0.9752895627511564,0.9785,1.0,1.0,0.999999995,1.0,0.9743589743589745,0.9870129820138304,1.0,1.0,0.999999995,0.99,0.95,en
the international community’s future approach to planning should ensure that new broadcasting and non-broadcasting services can operate in the same bands.,"det internationale samfunds fremtidige tilgang til planlægning bør sikre, at nye radio-/tv-transmissionstjenester og ikke-radio-/tv-transmissionstjenester kan køre på samme frekvensbånd.",Replace Character,the international community’s future approach to planning should ensure that new broadcasting and non-broadcasting services can lperate in the same bands.,"(0.99, 0.99)",0.8843865924896842,0.958,0.95,0.95,0.949999995,0.9,0.9,0.899999995,0.95,0.95,0.949999995,0.99,0.99,en
"if i may, i should like to comment briefly on the motion for a resolution.",jeg vil gerne kort kommentere beslutningsforslaget.,Add random word,"if i may, i should like to comment briefly whaly on the motion for a resolution.","(0.95, 0.95)",0.8428014430784181,0.9933,0.9333333333333332,1.0,0.9655172363852556,0.8666666666666667,0.9285714285714286,0.8965517191438764,0.9333333333333332,1.0,0.9655172363852556,0.95,0.95,en
"within the framework of its decisions on state subsidies, the commission also issues guidelines on certain aspects of the funding of the transition to digital broadcasting.",inden for rammerne af sine beslutninger om statsstøtte udsteder kommissionen også retningslinjer om visse aspekter af finansieringen af overgangen til digital transmission.,Replace Character,"within the framework of its decisions on atate subsidies, the commission also issues guidelines on certain aspects of the funding of the transition to digital broadcasting.","(0.99, 1.00)",0.9025139799587886,0.9641,0.95,0.95,0.949999995,0.9166666666666666,0.9166666666666666,0.9166666616666668,0.95,0.95,0.949999995,0.99,1.00,en
"i take it that you share our view that providers must, in future, be required to offer their customers the basic channels of the national stations.","jeg formoder, at de er enig med os i, at udbyderne i fremtiden skal forpligtes til at tilbyde deres kunder især de offentlige radio- og tv-selskabers grundkanaler.",Remove Token,"i take it that you share our view that providers must, in, be required to offer their customers the basic channels of the national stations.","(0.99, 0.99)",0.9061874434879644,0.9687,0.9565217391304348,0.9166666666666666,0.9361702077682208,0.9166666666666666,0.88,0.8979591786755519,0.9565217391304348,0.9166666666666666,0.9361702077682208,0.99,0.99,en
"the customers have a look at them; they watch a digital-format dvd and enthuse about the picture quality, and then they see an analog tv programme on the same screen and are astonished at how great the difference is.","kunderne ser på dem og ser en dvd i digitalform og bliver begejstret over billedkvaliteten, og så ser de et analogt tv-program på samme billedskærm og bliver overrasket over, hvor stor forskellen er.",Add random word,"the customers have a look at them; they watch a digital-format dvd and enthuse about the picture quality, and then they see an analog colophonite tv programme on the same screen and are astonished at how great the difference is.","(0.95, 0.95)",0.9391156189585852,0.9976,0.96875,1.0,0.984126979128244,0.9487179487179488,0.9736842105263158,0.9610389560398044,0.96875,1.0,0.984126979128244,0.95,0.95,en
"what i do see as important, though, is that we make sure that we do not miss the boat when taking our people into the digital era.","men jeg betragter det som vigtigt at sørge for, at vi tager borgerne med ind i den digitale tv-tidsalder i tide.",Negation,"what i do see as important, though, is that we make sure that we do miss the boat when taking our people into the digital era.","(0.05, 0.95)",0.9095930632220222,0.9697,1.0,0.9565217391304348,0.977777772780247,0.9583333333333334,0.92,0.9387755052061642,1.0,0.9565217391304348,0.977777772780247,0.05,0.95,en
that is a considerable advantage.,det er en stor fordel.,Duplicate character,thatt is a considerable advantage.,"(0.95, 0.99)",0.7598356856515925,0.83,0.8,0.8,0.7999999950000002,0.75,0.75,0.749999995,0.8,0.8,0.7999999950000002,0.95,0.99,en
"– mr president, commissioner, digital television offers a series of benefits to viewers: improved picture quality, better sound, better reception of the picture through mobile and portable devices and interactive services.","- hr. formand, hr. kommissær digitalt fjernsyn giver en række fordele for seerne: bedre billedkvalitet, lyd og billedmodtagelse gennem mobile og bærbare enheder og interaktive tjenester.",Replace Character,"– mr president, commissioner, digital television offers a series of benefits to viewers: improved picture quality, better sound, better reception of the picture through mobile and portable devices ank interactive services.","(0.99, 0.99)",0.9278982724420874,0.9723,0.9642857142857144,1.0,0.9818181768198349,0.9333333333333332,0.9333333333333332,0.9333333283333336,0.9642857142857144,1.0,0.9818181768198349,0.99,0.99,en
"at the same time, digital television improves access for people with special needs, such as people with impaired hearing or vision, by providing auxiliary services such as better subtitling, sound commentary and sign commentary.","samtidig betyder digitalt fjernsyn bedre adgang for folk med særlige behov som f.eks. mennesker med nedsat hørelse eller syn i form af hjælpetjenester som f.eks. bedre undertekster, speakerkommentarer og tegnsprogskommentarer.",Remove Character,"at the same time, digital television improves access for people with special needs, such as people with impaired hearig or vision, by providing auxiliary services such as better subtitling, sound commentary and sign commentary.","(0.99, 0.99)",0.931838481115484,0.9743,0.9655172413793104,0.9655172413793104,0.9655172363793104,0.935483870967742,0.935483870967742,0.935483865967742,0.9655172413793104,0.9655172413793104,0.9655172363793104,0.99,0.99,en
"parliament needs to pay far more attention to the issue of how radio spectrum will be allocated and managed across the european union, because it is clearly important that we have some alignment of goals there.","parlamentet er nødt til at sætte langt større fokus på spørgsmålet om, hvordan radiofrekvenserne fordeles og forvaltes i eu, for det er helt tydeligt vigtigt med en vis afstemning af mål på dette område.",Replace Token with Random Word,"parliament needs eloquentness pay far more attention to the issue of how radio spectrum will be allocated and managed across the european union, because it is clearly important that we have some alignment of goals there.","(0.95, 0.98)",0.9373341827832584,0.9736,0.9705882352941176,1.0,0.9850746218667856,0.9428571428571428,0.9428571428571428,0.942857137857143,0.9705882352941176,1.0,0.9850746218667856,0.95,0.98,en
the commission will continue to monitor these allegations closely.,kommissionen vil fortsat nøje overvåge disse påstande.,Add random word,the commission will continue to monitor these hydrocaulus allegations closely.,"(0.95, 0.90)",0.710866788975034,0.9861,0.9,1.0,0.947368416066482,0.7777777777777778,0.875,0.823529406782007,0.9,1.0,0.947368416066482,0.95,0.90,en
