originalSentence,referenceSentence,tamperingType,tamperedSentence,"LLMScore (Sim, Con)",BLEU,METEOR,Rouge1 r,Rouge1 p,Rouge1 f,Rouge2 r,Rouge2 p,Rouge2 f,Rougel r,Rougel p,Rougel f,LLM-Sim,LLM-Con,originalLanguage
"som jeg sagde tidligere, omfatter det alt fra lægemidler, reservedele til biler og designerprodukter til ulovlige downloads.","as i mentioned earlier, it encompasses everything from medicines, car parts and designer products to illegal downloads.",Duplicate character,"som jeg sagde tidligere, omfatter det alt fra lægemidler, reservedele til biler og designerprodukkter til ulovlige downloads.","(0.99, 0.95)",0.8578928092681435,0.9494,0.9375,0.9375,0.937499995,0.875,0.875,0.874999995,0.9375,0.9375,0.937499995,0.99,0.95,da
"på dette område er det helt klart, at forfalskninger er et enormt problem, og at forfalskede produkter er en trussel mod varer til enorme værdier og endog for sikkerheden.",in this area it is absolutely clear that counterfeiting is a huge problem and that counterfeit products are a threat to goods worth large sums of money and even to safety.,Replace Character,"på dette område er det helt klart, at forfalskninger er et enormt problem, og at forfalskede produkteo er en trussel mod varer til enorme værdier og endog for sikkerheden.","(0.99, 0.99)",0.9157103753711766,0.9686,0.96,0.96,0.959999995,0.9285714285714286,0.9285714285714286,0.9285714235714286,0.96,0.96,0.959999995,0.99,0.99,da
"jeg påpeger i ændringsforslaget, at vi ikke skal have foranstaltninger, der begrænser privatlivets fred, og vi skal ikke gå længere end den eksisterende lovgivning på dette område og sidst, men ikke mindst, at det ikke skal hæmme innovation og konkurrence.","in the amendment, i pointed out, in particular, that we must not have measures that restrict privacy, nor should we go beyond the existing legislation in this area and, last but not least, that it must not inhibit innovation and competition.",Negation,"jeg påpeger i ændringsforslaget, at vi skal have foranstaltninger, der begrænser privatlivets fred, og vi skal gå længere end den eksisterende lovgivning på dette område og sidst, men mindst, at det skal hæmme innovation og konkurrence.","(0.10, 0.95)",0.7651882981775256,0.9203,1.0,0.967741935483871,0.983606552378393,0.9117647058823528,0.8157894736842105,0.8611111061265432,1.0,0.967741935483871,0.983606552378393,0.10,0.95,da
"jeg sidder i udvalget om det indre marked og har været med til at formulere det spørgsmål, vi har stillet til kommissionen, om hvad der skal gøres ved forfalskninger set fra et forbrugerbeskyttelsessynspunkt.",i am on the committee on the internal market and consumer protection and was involved in wording the question that we posed to the commission on what is to be done about counterfeiting from the point of view of consumer protection.,Replace Token with Random Word,"jeg sidder i udvalget om det indre marked og har været med til at formulere det spørgsmål, vi har stillet til kommissionen, om kløgt der skal gøres ved forfalskninger set fra et forbrugerbeskyttelsessynspunkt.","(0.95, 0.98)",0.9257518071011758,0.9721,0.9655172413793104,0.9655172413793104,0.9655172363793104,0.9375,0.9375,0.937499995,0.9655172413793104,0.9655172413793104,0.9655172363793104,0.95,0.98,da
kommissionen spiller en suveræn rolle i den fælles udenrigshandelspolitik.,the european commission has a sovereign role in common foreign trade policy.,Replace Token with Random Word,kommissionen spiller en suveræn rolle dolke den fælles udenrigshandelspolitik.,"(0.95, 0.99)",0.6580370064762462,0.8951,0.8888888888888888,0.8888888888888888,0.888888883888889,0.75,0.75,0.749999995,0.8888888888888888,0.8888888888888888,0.888888883888889,0.95,0.99,da
"vi gør det helt forkerte, hvis vi ikke handler resolut.","ladies and gentlemen, we are completely mistaken if we do not take more resolute action.",Negation,"vi gør det helt forkerte, hvis vi handler resolut.","(0.95, 0.95)",0.7348889200874658,0.9216,1.0,0.8888888888888888,0.9411764656055364,0.875,0.7777777777777778,0.823529406782007,1.0,0.8888888888888888,0.9411764656055364,0.95,0.95,da
"der er mange eksempler på, at forfalskede produkter udgør en risiko for forbrugernes sundhed, ja, endog for deres liv, og det er ikke nødvendig at sige mere om det.","there are many cases where counterfeit products pose a danger to the health, or even the lives, of consumers, and it is not necessary to elaborate any further on this point.",Negation,"der er mange eksempler på, at forfalskede produkter udgør en risiko for forbrugernes sundhed, ja, endog for deres liv, og det er nødvendig at sige mere om det.","(0.95, 1.00)",0.9210500207490828,0.9733,1.0,0.96,0.9795918317367764,0.9629629629629628,0.9285714285714286,0.9454545404561984,1.0,0.96,0.9795918317367764,0.95,1.00,da
"en række originale produkter kopieres, så de bliver til efterligninger.",a large number of original products are copied by look-alike products.,Replace Character,"en række originale produbter kopieres, så de bliver til efterligninger.","(1.00, 1.00)",0.7348889200874658,0.9139,0.9,0.9,0.899999995,0.7777777777777778,0.7777777777777778,0.7777777727777778,0.9,0.9,0.899999995,1.00,1.00,da
"disse produkter fremstilles på fabrikker eller værksteder, som ikke følger reglerne for forsvarlig produktion, og i mange tilfælde indeholder de ikke nogen spor af farmaceutisk aktive stoffer.","these products are manufactured in factories or workshops which do not follow the rules of good manufacture and, in many cases, they contain no trace of the pharmaceutically active ingredient.",Negation,"disse produkter fremstilles på fabrikker eller værksteder, som følger reglerne for forsvarlig produktion, og i mange tilfælde indeholder de nogen spor af farmaceutisk aktive stoffer.","(0.85, 0.95)",0.8166920319485289,0.939,1.0,0.9615384615384616,0.9803921518646674,0.9166666666666666,0.8461538461538461,0.879999995008,1.0,0.9615384615384616,0.9803921518646674,0.85,0.95,da
"observatoriet skal identificere sårbare geografiske områder og websteder, der ulovligt sælger forfalskede varer.",the observatory should identify vulnerable geographical areas and the illegal trafficking of websites selling counterfeit goods.,Replace Token with Random Word,"observatoriet skal identificere sårbare geografiske områder og websteder, lumske ulovligt sælger forfalskede varer.","(0.85, 0.90)",0.8003203203844999,0.932,0.9230769230769232,0.9230769230769232,0.9230769180769232,0.8333333333333334,0.8333333333333334,0.8333333283333335,0.9230769230769232,0.9230769230769232,0.9230769180769232,0.85,0.90,da
"det skal også tilrettelægge det administrative samarbejde mellem medlemsstaterne, informationsudvekslingen og, som hr. martin sagde, øge forbrugernes bevidsthed.","it ought also to organise administrative cooperation between the member states, organise the exchange of information and, as mr martin said, raise consumer awareness.",Swap words,"det skal også tilrettelægge det administrative mellem samarbejde medlemsstaterne, informationsudvekslingen og, som hr. martin sagde, øge forbrugernes bevidsthed. ","(0.95, 0.95)",0.8509527625828,0.9974,0.9444444444444444,1.0,0.9714285664326532,0.7777777777777778,0.8235294117647058,0.7999999950040816,0.8888888888888888,0.9411764705882352,0.914285709289796,0.95,0.95,da
forhandlingen under ét er afsluttet.,the joint debate is closed.,Replace Character,forhandlingen under ét eø afsluttet.,"(0.95, 0.9)",7.262123179505913e-78,0.8067,0.8,0.8,0.7999999950000002,0.5,0.5,0.4999999950000001,0.8,0.8,0.7999999950000002,0.95,0.9,da
den europæiske handlingsplan for jobmobilitet (2007-2010) (,the european job mobility action plan (2007-2010) (,Swap characters,edn europæiske handlingsplan for jobmobilitet (2007-2010) (,"(0.99, 0.95)",0.8633400213704505,0.888,0.8571428571428571,0.8571428571428571,0.8571428521428571,0.8333333333333334,0.8333333333333334,0.8333333283333335,0.8571428571428571,0.8571428571428571,0.8571428521428571,0.99,0.95,da
oplysningskrav til mellemstore selskaber om udarbejdelse af konsoliderede regnskaber (,disclosure requirements for medium-sized companies and obligation to draw up consolidated accounts (,Add random word,oplysningskrav til mellemstore selskaber om udarbejdelse af konsoliderede regnskaber manna (,"(0.95, 0.98)",0.8176129038784518,0.9861,0.9090909090909092,1.0,0.9523809473922904,0.8,0.8888888888888888,0.8421052581717452,0.9090909090909092,1.0,0.9523809473922904,0.95,0.98,da
meddelelse af rådets fælles holdninger: se protokollen,communication of council common positions: see minutes,Replace Character,meddelelse af rådets fælles holdninger: sq protokollen,"(0.95, 0.98)",0.7071067811865475,0.8648,0.8571428571428571,0.8571428571428571,0.8571428521428571,0.6666666666666666,0.6666666666666666,0.6666666616666668,0.8571428571428571,0.8571428571428571,0.8571428521428571,0.95,0.98,da
fremsendelse af tekster vedtaget under dette møde: se protokollen,forwarding of texts adopted during the sitting: see minutes,Duplicate Token,fremsendelse af tekster vedtaget under dette møde: se se protokollen,"(0.99, 0.95)",0.8420460979216616,0.9861,1.0,1.0,0.999999995,0.8888888888888888,1.0,0.9411764656055364,1.0,1.0,0.999999995,0.99,0.95,da
"jeg vil gerne ønske dem alle godt nytår og et lykkebringende 2009, som forhåbentlig bringer os nærmere den europæiske samhørighed.","i would like to wish you all, ladies and gentlemen, a happy new year and a successful 2009 which will hopefully bring us nearer to european unity.",Swap words,"jeg vil gerne ønske dem alle godt nytår og et lykkebringende 2009, som forhåbentlig bringer os nærmere europæiske den samhørighed. ","(0.98, 0.95)",0.8577687377037934,0.997,0.9523809523809524,1.0,0.9756097511005354,0.8,0.8421052631578947,0.8205128155161079,0.9047619047619048,0.95,0.9268292632956572,0.98,0.95,da
"det er forståeligt, at vi i krisetider ofte tænker kortsigtet.","it is understandable that, in times of crisis management, we tend to think in the short term.",Swap characters,"det er forståeligt, at vi i kristeider ofte tænker kortsigtet.","(0.99, 0.95)",0.7348889200874658,0.9139,0.9,0.9,0.899999995,0.7777777777777778,0.7777777777777778,0.7777777727777778,0.9,0.9,0.899999995,0.99,0.95,da
vi skal forfølge et klart politisk mål med at skabe den nødvendige tillid til gennemførelsen af fredsforhandlinger ved at garantere både israelernes og palæstinensernes sikkerhed.,it must pursue a clear political objective of creating the required trust for the conclusion of peace talks by guaranteeing security for israelis and palestinians alike.,Swap characters,vi skal forfølge et klart politisk mål med at skabe den nødvendige tillid til genenmførelsen af fredsforhandlinger ved at garantere både israelernes og palæstinensernes sikkerhed.,"(0.99, 0.99)",0.8942255541978509,0.9613,0.9583333333333334,0.9583333333333334,0.9583333283333336,0.9166666666666666,0.9166666666666666,0.9166666616666668,0.9583333333333334,0.9583333333333334,0.9583333283333336,0.99,0.99,da
"til sidst vil jeg gerne minde om, at 2008 var det europæiske år for interkulturel dialog.","in closing, i would like to remind you that 2008 was the european year of intercultural dialogue.",Replace Character,"til sidst vil jeg gzrne minde om, at 2008 var det europæiske år for interkulturel dialog.","(0.99, 0.99)",0.8394327083733336,0.9437,0.9375,0.9375,0.937499995,0.8666666666666667,0.8666666666666667,0.8666666616666667,0.9375,0.9375,0.937499995,0.99,0.99,da
tekster til aftaler sendt af rådet: se protokollen,texts of agreements forwarded by the council: see minutes,Remove Token,tekster til aftaler sendt af rådet: se,"(0.95, 0.99)",0.8633400213704505,0.898,1.0,0.875,0.9333333283555556,1.0,0.8571428571428571,0.9230769181065088,1.0,0.875,0.9333333283555556,0.95,0.99,da
"da laima andrikienikke kan være til stede i eftermiddag for at fremlægge sin betænkning om udvikling af fn's menneskerettighedsråd, herunder eu's rolle, vil der som planlagt blive stemt om denne betænkning uden en generel forhandling.","as mrs andrikiencannot be present this evening to present her report on the development of the un human rights council and the role of the eu, there will be a vote on this report on wednesday, as scheduled, without a general discussion.",Swap characters,"da laima andrikienikke kan være til stede i eftermiddag for at fremlægge sin betænkning om udvikling af fn's menneskerettighedsråd, herunder eu's rolle, vil der som planlagt blive stemt om denne betænkning uden en generel fohrandling.","(0.99, 0.99)",0.9541831417502228,0.9749,0.9696969696969696,0.9696969696969696,0.96969696469697,0.9705882352941176,0.9705882352941176,0.9705882302941176,0.9696969696969696,0.9696969696969696,0.96969696469697,0.99,0.99,da
dette er et vigtigt grundlæggende princip og en vigtig erklæring fra parlamentet.,this is an important basic principle and an important statement by parliament.,Duplicate character,dette er et vigtigt grundlæggende princip og en vigtig erklæring fra parllamentet.,"(0.99, 0.95)",0.842362674378975,0.9209,0.9166666666666666,0.9166666666666666,0.9166666616666668,0.9090909090909092,0.9090909090909092,0.9090909040909092,0.9166666666666666,0.9166666666666666,0.9166666616666668,0.99,0.95,da
"vi må ikke ødelægge dette gennem en beslutning, der måske er formet af følelser.",we should not destroy this by a resolution perhaps shaped by emotions.,Negation,"vi må ødelægge dette gennem en beslutning, der måske er formet af følelser.","(0.95, 0.99)",0.8371170098777919,0.9423,1.0,0.9285714285714286,0.9629629579698218,0.9166666666666666,0.8461538461538461,0.879999995008,1.0,0.9285714285714286,0.9629629579698218,0.95,0.99,da
indlæg af et minuts varighed om politisk vigtige sager,one-minute speeches on matters of political importance,Replace Character,indlæg af et minuts varifhed om politisk vigtige sager,"(0.98, 0.99)",0.5969491792019646,0.8819,0.8888888888888888,0.8888888888888888,0.888888883888889,0.75,0.75,0.749999995,0.8888888888888888,0.8888888888888888,0.888888883888889,0.98,0.99,da
"det er rystende, at man ud af de to kvalificerede kandidater, en ungarer og en brite, valgte den britiske kandidat.","mr president, it is appalling that of two eligible candidates, one hungarian and one british, the british candidate was selected.",Swap characters,"det er rystende, at man ud af de to kvalificerede kandidater, en ungarer og en brite, valgte den britiske kanddiat.","(1.00, 1.00)",0.9210589320522864,0.958,0.9473684210526316,0.9473684210526316,0.9473684160526316,0.9473684210526316,0.9473684210526316,0.9473684160526316,0.9473684210526316,0.9473684210526316,0.9473684160526316,1.00,1.00,da
- (en) hr. formand! vi har i eftermiddag hørt dem og andre fremsætte erklæringer om den forfærdelige situation i gaza og om behovet for omgående våbenhvile og tilbagetrækning af israelske væbnede styrker fra gaza.,"mr president, this afternoon we have listened to yourself and others make statements on the terrible situation in gaza and on the need for an immediate ceasefire and the withdrawal of israeli armed forces from gaza.",Duplicate Token,- (en) hr . formand! vi har i eftermiddag hørt dem og andre fremsætte erklæringer om den forfærdelige situation i gaza og om behovet for omgående våbenhvile og tilbagetrækning af israelske væbnede styrker styrker fra gaza.,"(0.99, 0.95)",0.9542969642914884,0.9974,1.0,1.0,0.999999995,0.9705882352941176,1.0,0.9850746218667856,1.0,1.0,0.999999995,0.99,0.95,da
"jeg må sige, at jeg i denne sammenhæng er enig med daniel cohn-bendit i, at parlamentet bør tage stilling - vi kan ikke blot indtage en afventende holdning.","i must say that, in this context, i agree with mr cohn-bendit that parliament should take a position - we cannot sit on the fence.",Negation,"jeg må sige, at jeg i denne sammenhæng er enig med daniel cohn-bendit i, at parlamentet bør tage stilling - vi kan blot indtage en afventende holdning.","(0.95, 0.98)",0.9127592114472296,0.9707,1.0,0.9615384615384616,0.9803921518646674,0.9615384615384616,0.925925925925926,0.9433962214168744,1.0,0.9615384615384616,0.9803921518646674,0.95,0.98,da
"det er måske lidt overfladisk at tale om forhold, som angår det daglige brød, efter at have hørt alt dette, men disse almindelige spørgsmål angår alle vores borgere.","however, in a way it is a bit mundane to speak about bread-and-butter issues, having listened to all that has been said, but of course bread-and-butter issues concern all our citizens.",Swap characters,"det er måske lidt overfladisk at tale om forhold, som angår det daglgie brød, efter at have hørt alt dette, men disse almindelige spørgsmål angår alle vores borgere.","(0.99, 0.99)",0.9157103753711766,0.9686,0.96,0.96,0.959999995,0.925925925925926,0.925925925925926,0.925925920925926,0.96,0.96,0.959999995,0.99,0.99,da
vi gjorde dog heldigvis en indsats for at vise fælles front til sidst.,"fortunately, however, we made an effort to present a united front at the end.",Swap words,vi dog gjorde heldigvis en indsats for at vise fælles front til sidst. ,"(0.95, 0.95)",0.8048293456573857,0.9883,0.9285714285714286,1.0,0.9629629579698218,0.6923076923076923,0.75,0.7199999950079999,0.8571428571428571,0.9230769230769232,0.8888888838957477,0.95,0.95,da
"(hu) hr. formand, mine damer og herrer! i en global tidsalder, der på usund vis domineres af coca cola og chips, vil jeg gerne forsvare den ungarske drue og vin, der dyrkes i karpaterbækkenet, som er af international betydning.","(hu) mr president, ladies and gentlemen, in a global era of the unhealthy dominance of coke and crisps, i wish to raise my voice in defence of hungarian grape and wine growing in the carpathian basin, which is of international significance.",Duplicate character,"(hu) hr. formand, mine damer og herrer! i en global tidsalder, der på usund vis domineres af coca cola og chips, vil jeg gerne forsvare den unggarske drue og vin, der dyrkes i karpaterbækkenet, som er af international betydning.","(1.00, 1.00)",0.9464594399631752,0.9796,0.9705882352941176,0.9705882352941176,0.9705882302941176,0.9473684210526316,0.9473684210526316,0.9473684160526316,0.9705882352941176,0.9705882352941176,0.9705882302941176,1.00,1.00,da
"retorikken om menneskerettigheder, der så ofte genlyder i parlamentet, skal nu udmøntes i ord og gerning.","the rhetoric of human rights, which so often echoed this chamber, must now be honoured in word and deed.",Remove Token,"retorikken om, der så ofte genlyder i parlamentet, skal nu udmøntes i ord og gerning.","(0.95, 0.99)",0.866397551781362,0.9517,0.9285714285714286,0.8666666666666667,0.8965517191438764,0.8571428571428571,0.8,0.8275862019024971,0.9285714285714286,0.8666666666666667,0.8965517191438764,0.95,0.99,da
"det betyder også tabet af sandsynligvis yderligere 2 000 arbejdspladser, der er afhængige af dells produktion i irland.",this also means the loss of probably 2 000 more jobs that depend on dell production in ireland.,Duplicate character,"det betyder også tabet af sandsynligvis yderligere 2 000 arbejdspladser, der er afhængige af dells produuktion i irland.","(0.98, 0.95)",0.8578928092681435,0.9494,0.9411764705882352,0.9411764705882352,0.9411764655882354,0.8823529411764706,0.8823529411764706,0.8823529361764706,0.9411764705882352,0.9411764705882352,0.9411764655882354,0.98,0.95,da
"""giaourer"" er det ord, som den tidligere landbrugsminister nihat kabil og de tyrkiske embedsmænd i landbrugsministeriet brugte for de bulgarere, der var blevet ansat i ministeriet, hvorefter de gav tyrkerne særbehandling.","'giaours' is the same word used by the former minister of agriculture nihat kabil and the turkish administrators in the ministry of agriculture to refer to the bulgarians who had joined the department, following which they gave preferential treatment to the turks.",Remove Character,"""giaouer"" er det ord, som den tidligere landbrugsminister nihat kabil og de tyrkiske embedsmænd i landbrugsministeriet brugte for de bulgarere, der var blevet ansat i ministeriet, hvorefter de gav tyrkerne særbehandling.","(0.99, 0.99)",0.9502733228857496,0.9729,0.9642857142857144,0.9642857142857144,0.9642857092857144,0.9666666666666668,0.9666666666666668,0.9666666616666668,0.9642857142857144,0.9642857142857144,0.9642857092857144,0.99,0.99,da
"jeg opfordrer dem som medlemmer af parlamentet til at vise det igen og støtte vores skriftlige erklæring, som fordømmer den tyrkiske racisme mod bulgarere.","i appeal to you, as members of this house, to do it once again and support our written declaration condemning turkish racism against bulgarians.",Duplicate Token,"jeg opfordrer dem som medlemmer af parlamentet til at vise det igen igen og støtte vores skriftlige erklæring, som fordømmer den tyrkiske racisme mod bulgarere.","(0.95, 0.95)",0.9306757101384976,0.9959,1.0,1.0,0.999999995,0.9583333333333334,1.0,0.9787233992575828,1.0,1.0,0.999999995,0.95,0.95,da
det er det typiske resultat af politisk statsstyring af produktionen.,this is the typical result of political state control over production.,Swap characters,det er det ytpiske resultat af politisk statsstyring af produktionen.,"(0.99, 0.95)",0.7016879391277372,0.9055,0.875,0.875,0.874999995,0.7777777777777778,0.7777777777777778,0.7777777727777778,0.875,0.875,0.874999995,0.99,0.95,da
"det gør det så meget vigtigere for os, at vi koncentrerer os om at finde nye energikilder.",this makes it all the more important for us to concentrate upon finding new energy sources.,Duplicate Token,"det gør det så meget meget vigtigere for os, at vi koncentrerer os om at finde nye energikilder.","(0.99, 0.95)",0.903778850827967,0.9942,1.0,1.0,0.999999995,0.9411764705882352,1.0,0.9696969647015612,1.0,1.0,0.999999995,0.99,0.95,da
jeg opfordrer derfor kommissionen til at etablere en retlig ramme for frivillig mærkning af gmo-frie fødevarer på europæisk plan.,therefore i call on the commission to provide the legal framework for voluntary gm-free labelling at european level.,Duplicate character,jeg opfordrer derfor kommissionen til at etablere en retlig ramme for frivillig mærkning af gmo-frie fødevarer ppå europæisk plan.,"(0.99, 1.00)",0.8578928092681435,0.9494,0.9473684210526316,0.9473684210526316,0.9473684160526316,0.8888888888888888,0.8888888888888888,0.888888883888889,0.9473684210526316,0.9473684210526316,0.9473684160526316,0.99,1.00,da
de litauiske myndigheder forsøgte efterfølgende at fratage dem deres pladser i parlamentet.,the lithuanian authorities subsequently tried to deprive them of their parliamentary seats.,Add random word,smult de litauiske myndigheder forsøgte efterfølgende at fratage dem deres pladser i parlamentet.,"(0.99, 0.95)",0.925961078642316,0.9921,0.9230769230769232,1.0,0.959999995008,0.9166666666666666,1.0,0.9565217341398866,0.9230769230769232,1.0,0.959999995008,0.99,0.95,da
"som begrundelse blev det anført, at disse personer har et ""karta polaka"".",the reason given is that these persons hold the karta polaka.,Replace Character,"srm begrundelse blev det anført, at disse personer har et ""karta polaka"".","(0.99, 0.99)",0.9306048591020996,0.9374,0.9166666666666666,0.9166666666666666,0.9166666616666668,0.9090909090909092,0.9090909090909092,0.9090909040909092,0.9166666666666666,0.9166666666666666,0.9166666616666668,0.99,0.99,da
det er direkte latterligt og skandaløst.,this is obviously ridiculous and outrageous.,Replace Character,det er direkte lmtterligt og skandaløst.,"(0.95, 0.99)",8.444843264428189e-78,0.8413,0.8333333333333334,0.8333333333333334,0.8333333283333335,0.6,0.6,0.5999999950000001,0.8333333333333334,0.8333333333333334,0.8333333283333335,0.95,0.99,da
"- (cs) hr. formand, mine damer og herrer! bernd posselt, som repræsenterer det bayriske csu-parti her i parlamentet, og som også er leder af det sudetertyske samfund, har foreslået, at tjekkiet afskaffer de såkaldte benes-dekreter under dets formandskab.","- (cs) mr president, ladies and gentlemen, bernd posselt, who represents the bavarian csu party here in parliament and who also leads the sudeten german society has proposed that the czech republic abolish the so-called benes decrees during the course of its presidency.",Swap words,"- (cs) hr. formand, mine damer og herrer! bernd posselt, som repræsenterer det bayriske csu-parti her i parlamentet, og som også er leder af det sudetertyske samfund, har foreslået, at tjekkiet afskaffer såkaldte de benes-dekreter under dets formandskab. ","(0.98, 0.95)",0.9336270772165716,0.9997,0.9722222222222222,1.0,0.9859154879587384,0.8947368421052632,0.918918918918919,0.9066666616675556,0.9444444444444444,0.9714285714285714,0.9577464738742314,0.98,0.95,da
"det er derfor ikke tale om en form for kræftknude i den europæiske parlamentariske orden, som han har hævdet.","it is therefore not a question of some sort of cancerous growth on european parliamentary order, as he has claimed.",Negation,"det er derfor tale om en form for kræftknude i den europæiske parlamentariske orden, som han har hævdet.","(0.95, 0.95)",0.8656030552541708,0.9565,1.0,0.9473684210526316,0.9729729679766254,0.9411764705882352,0.8888888888888888,0.914285709289796,1.0,0.9473684210526316,0.9729729679766254,0.95,0.95,da
