originalSentence,referenceSentence,tamperingType,tamperedSentence,"LLMScore (Sim, Con)",BLEU,METEOR,Rouge1 r,Rouge1 p,Rouge1 f,Rouge2 r,Rouge2 p,Rouge2 f,Rougel r,Rougel p,Rougel f,LLM-Sim,LLM-Con,originalLanguage
"vi ønsker dem held og lykke, gud velsigne dem alle, og måtte gud beskytte alle vores tropper.","we wish you god-speed, and may god bless you all and may god protect all of our troops.",Replace Character,"vi ønsker dem held og lykke, gud velsigne dem alla, og måtte gud beskytte alle vores tropper.","(0.99, 0.95)",0.8578928092681435,0.9494,0.9285714285714286,0.9285714285714286,0.9285714235714286,0.875,0.875,0.874999995,0.9285714285714286,0.9285714285714286,0.9285714235714286,0.99,0.95,da
det er et godt udgangspunkt for vores partnerskab og samarbejde.,it is a good beginning to our partnership and cooperation.,Add random word,det er et godt udgangspunkt for lind vores partnerskab og samarbejde.,"(0.95, 0.98)",0.7426141117870939,0.988,0.9090909090909092,1.0,0.9523809473922904,0.8,0.8888888888888888,0.8421052581717452,0.9090909090909092,1.0,0.9523809473922904,0.95,0.98,da
"hr. vicepræsident, endnu en gang mange tak.","mr vice president, once again, thank you very much.",Replace Token with Random Word,"hr . naiv, endnu en gang mange tak.","(0.95, 0.95)",0.7071067811865475,0.8951,0.8571428571428571,0.8571428571428571,0.8571428521428571,0.6666666666666666,0.6666666666666666,0.6666666616666668,0.8571428571428571,0.8571428571428571,0.8571428521428571,0.95,0.95,da
vi mangler stadig tre stemmeforklaringer.,we still have three explanations of votes remaining.,Duplicate Token,vi vi mangler stadig tre stemmeforklaringer.,"(0.99, 0.99)",0.846481724890614,0.9813,1.0,1.0,0.999999995,0.8,1.0,0.8888888839506174,1.0,1.0,0.999999995,0.99,0.99,da
"(en) hr. formand! jeg glæder mig over, at den samlede mængde af uregelmæssigheder ved brugen af europæiske fonde er faldende.","- mr president, i welcome the fact that the total amount of irregularities in the way european funds are being used is declining.",Remove Token,"(en) hr . formand! jeg glæder mig, at den samlede mængde af uregelmæssigheder ved brugen af europæiske fonde er faldende.","(0.99, 0.95)",0.8942255541978509,0.965,0.9444444444444444,0.8947368421052632,0.9189189139225714,0.8888888888888888,0.8421052631578947,0.8648648598685172,0.9444444444444444,0.8947368421052632,0.9189189139225714,0.99,0.95,da
"dagens omfattende diskussion og vores beslutningsforslag, som jeg stemte for, udgør et fremragende udgangspunkt for den europæiske investeringsbanks fremtidige aktiviteter, især under hensyntagen til europa 2020-strategien.","today's substantive discussion and our resolution, which i supported, is an excellent starting point for the future activities of the european investment bank, especially taking into account the eu 2020 strategy.",Replace Character,"dagens omfattende diskussion og vores beslutningsforslag, som jeg stemte for, udgør et fremragende udgangspunkt for ded europæiske investeringsbanks fremtidige aktiviteter, især under hensyntagen til europa 2020-strategien.","(0.99, 0.95)",0.9095930632220222,0.9665,0.9615384615384616,0.9615384615384616,0.9615384565384616,0.92,0.92,0.919999995,0.9615384615384616,0.9615384615384616,0.9615384565384616,0.99,0.95,da
nordirland anvender også systemet med proportionalvalg ved valg til europa-parlamentet.,northern ireland also uses the system of proportional representation for european elections.,Swap characters,nordilrand anvender også systemet med proportionalvalg ved valg til europa-parlamentet.,"(1.00, 1.00)",0.8931539818068694,0.9086,0.9,0.9,0.899999995,0.8888888888888888,0.8888888888888888,0.888888883888889,0.9,0.9,0.899999995,1.00,1.00,da
jeg stemte for beslutningen om ikke at indkalde et konvent til en revision af traktaterne i forbindelse med overgangsbestemmelserne vedrørende europa-parlamentets sammensætning.,i voted for the decision not to convene a convention for the revision of the treaties with regard to the transitional measures concerning the composition of the european parliament.,Negation,jeg stemte for beslutningen om at indkalde et konvent til en revision af traktaterne i forbindelse med overgangsbestemmelserne vedrørende europa-parlamentets sammensætning.,"(0.95, 0.99)",0.8787419089273848,0.9603,1.0,0.9545454545454546,0.976744181049216,0.95,0.9047619047619048,0.9268292632956572,1.0,0.9545454545454546,0.976744181049216,0.95,0.99,da
den må ikke skabe præcedens.,it is not a precedent for the future.,Negation,den må skabe præcedens.,"(0.05, 0.95)",7.262123179505913e-78,0.8203,1.0,0.8,0.8888888839506174,0.6666666666666666,0.5,0.5714285665306124,1.0,0.8,0.8888888839506174,0.05,0.95,da
"skriftlig. - vi glæder os over foranstaltningerne, der betyder, at de 18 ekstra medlemmer kan indtage deres plads i parlamentet.",in writing. - we welcome measures to allow the 18 additional members to take up their seats in the european parliament.,Duplicate Token,"skriftlig . - vi glæder os over foranstaltningerne, der betyder, at de 18 ekstra medlemmer kan indtage deres plads i i parlamentet.","(0.99, 0.95)",0.9246707643923312,0.9956,1.0,1.0,0.999999995,0.95,1.0,0.9743589693622616,1.0,1.0,0.999999995,0.99,0.95,da
"det er forkert, og derfor har vores delegation stemt imod betænkningen.","that is wrong, and it is why our delegation has voted against this report.",Remove Character,"det er forkert, og derfor har vores delegation stemt imod betænknigen.","(1.00, 1.00)",0.842362674378975,0.9209,0.9090909090909092,0.9090909090909092,0.9090909040909092,0.9,0.9,0.899999995,0.9090909090909092,0.9090909090909092,0.9090909040909092,1.00,1.00,da
"derfor skal vi fastsætte regler for, hvordan de 18 ekstra medlemmer (fordelt på 12 medlemsstater) skal vælges.","it will, therefore, be necessary to regulate how the 18 new members (shared between 12 member states) will be elected.",Replace Character,"derfor skal vi fastsætte regler for, hvordan he 18 ekstra medlemmer (fordelt på 12 medlemsstater) skal vælges.","(0.99, 0.99)",0.8656030552541708,0.9519,0.9375,0.9375,0.937499995,0.875,0.875,0.874999995,0.9375,0.9375,0.937499995,0.99,0.99,da
dette er skumle planer udtænkt mellem venner og med støtte fra parlamentet.,"this is scheming between friends, with the support of this parliament.",Replace Token with Random Word,ål er skumle planer udtænkt mellem venner og med støtte fra parlamentet.,"(0.95, 0.95)",0.912167909070388,0.9228,0.9166666666666666,0.9166666666666666,0.9166666616666668,0.9090909090909092,0.9090909090909092,0.9090909040909092,0.9166666666666666,0.9166666666666666,0.9166666616666668,0.95,0.95,da
"de nye franske medlemmer skal sidde i fire år, hvilket svarer til mere end 80 % af parlamentets valgperiode.","the new french meps will sit for four years, which is more than 80% of the parliamentary term.",Swap words,"de nye franske medlemmer skal sidde i fire år, hvilket svarer til mere end 80 % parlamentets af valgperiode. ","(0.95, 0.95)",0.8499688867759349,0.9965,0.95,1.0,0.9743589693622616,0.7894736842105263,0.8333333333333334,0.8108108058144633,0.9,0.9473684210526316,0.9230769180802104,0.95,0.95,da
"jeg glæder mig over, at eu står fast på at gøre spørgsmål om frihed, demokrati og menneskerettigheder til det centrale i vores dagsorden for kirgisistan.","i welcome the european union's firmness in making the issues of freedom, democracy and human rights central to its agenda for kyrgyzstan.",Add random word,"jeg glæder mig over stramme, at eu står fast på at gøre spørgsmål om frihed, demokrati og menneskerettigheder til det centrale i vores dagsorden for kirgisistan.","(0.98, 0.95)",0.9074485692010054,0.9963,0.92,0.9583333333333334,0.9387755052061642,0.88,0.9166666666666666,0.8979591786755519,0.92,0.9583333333333334,0.9387755052061642,0.98,0.95,da
"eu og centralasien står over for fælles udfordringer med hensyn til energi, kampen mod klimaændringer, bekæmpelse af narkotikasmugling og kampen mod terror.","the eu and central asia have common challenges in terms of energy, the fight against climate change, drug trafficking control and the fight against terrorism.",Replace Character,"eu og centralasien står over fir fælles udfordringer med hensyn til energi, kampen mod klimaændringer, bekæmpelse af narkotikasmugling og kampen mod terror.","(0.99, 0.99)",0.8895260356363631,0.9597,0.9473684210526316,0.9473684210526316,0.9473684160526316,0.9,0.9,0.899999995,0.9473684210526316,0.9473684210526316,0.9473684160526316,0.99,0.99,da
"der er behov for en fn-ledet international undersøgelse af begivenhederne for at finde frem til, hvor ansvaret ligger.","a united nations-led international investigation into the events is needed, in order to identify responsibilities.",Add random word,"maori der er behov for en fn-ledet international undersøgelse af begivenhederne for at finde frem til, hvor ansvaret ligger.","(0.99, 0.99)",0.951229424500714,0.995,0.9444444444444444,1.0,0.9714285664326532,0.9444444444444444,1.0,0.9714285664326532,0.9444444444444444,1.0,0.9714285664326532,0.99,0.99,da
parlamentets forslag til beslutning af 6. maj 2010 om situationen i kirgisistan er et vigtigt signal fra eu og hele europa.,european parliament motion for a resolution no of 6 may 2010 on the situation in kyrgyzstan is the common voice of europe directed to kyrgyzstan and its authorities.,Remove Token,parlamentets forslag til beslutning 6. maj 2010 om situationen i kirgisistan er et vigtigt signal fra eu og hele europa.,"(1.00, 1.00)",0.8725129388059689,0.9585,1.0,0.9523809523809524,0.9756097511005354,0.9473684210526316,0.9,0.9230769180802104,1.0,0.9523809523809524,0.9756097511005354,1.00,1.00,da
"vi skal vise de kirgisiske borgerne og de kirgisiske myndigheder - og ikke kun ved at vedtage beslutningsforslag, at vi støtter styrkelsen af demokratiet og udviklingen af samfundet, befolkningens sikkerhed og en bæredygtig vækst.","the motion for a resolution on kyrgyzstan is an important signal from the european union and the whole of europe. we should show both the citizens and the kyrgyzstani authorities, and not just by resolutions like this one, that we support the strengthening of democracy and the development of society, the security of the population and sustainable growth.",Negation,"vi skal vise de kirgisiske borgerne og de kirgisiske myndigheder - og kun ved at vedtage beslutningsforslag, at vi støtter styrkelsen af demokratiet og udviklingen af samfundet, befolkningens sikkerhed og en bæredygtig vækst.","(0.98, 0.95)",0.9278982724420874,0.9755,1.0,0.9615384615384616,0.9803921518646674,0.967741935483871,0.9375,0.952380947382212,1.0,0.9615384615384616,0.9803921518646674,0.98,0.95,da
"ændringerne i kirgisistan er et resultat af det, der er sket i de seneste par år, og af de kortvarige forhåbninger, tulipanrevolutionen vakte.",the changes in kyrgyzstan are a consequence of the last few years and the transitory nature of the hopes associated with the tulip revolution.,Swap words,"ændringerne i kirgisistan er et resultat af det, der er sket i de seneste par år, og af de forhåbninger, kortvarige tulipanrevolutionen vakte. ","(0.95, 0.9)",0.8535450235540848,0.9984,0.95,1.0,0.9743589693622616,0.8260869565217391,0.8636363636363636,0.8444444394469136,0.9,0.9473684210526316,0.9230769180802104,0.95,0.9,da
"jeg håber, at beslutningsforslaget om kirgisistan kun er et af mange skridt, vi vil tage.",i hope the resolution on kyrgyzstan is one of many steps we will take.,Duplicate Token,"jeg håber, at beslutningsforslaget om kirgisistan kun kun er et af mange skridt, vi vil tage.","(0.99, 0.99)",0.8981075993548011,0.9938,1.0,1.0,0.999999995,0.9333333333333332,1.0,0.9655172363852556,1.0,1.0,0.999999995,0.99,0.99,da
"elektriske køretøjer bidrager til at nå europa 2020-prioriteterne om fremme af innovation og viden (intelligent vækst), fremme af en mere ressourceeffektiv og grønnere økonomi (bæredygtig vækst), og de medvirker ligeledes til økonomisk vækst ved at skabe arbejdspladser (inklusiv vækst).","electric vehicles contribute to achieving the 'europe 2020' priorities of fostering innovation and knowledge (smart growth), promoting a more resource-efficient and greener economy (sustainable growth), and allowing the economy to grow by creating jobs (inclusive growth).",Remove Token,"elektriske køretøjer bidrager til at nå europa 2020-prioriteterne om fremme af innovation og viden (intelligent vækst), fremme af mere ressourceeffektiv og grønnere økonomi (bæredygtig vækst), og de medvirker ligeledes til økonomisk vækst ved at skabe arbejdspladser (inklusiv vækst).","(1.00, 1.00)",0.9452861848260063,0.9812,1.0,0.96875,0.984126979128244,0.9722222222222222,0.945945945945946,0.9589041045899794,1.0,0.96875,0.984126979128244,1.00,1.00,da
"så hvis vi skal gå i den ønskede retning, er det nødvendigt at sætte fokus på standardiseringsprocedurerne.","this is why, if we want to move in the desired direction, i believe that we must focus on standardisation procedures.",Duplicate character,"så hvis vi skal gå i den ønskede retning, er det nødvendigt at sætte fokus på standardiseeringsprocedurerne.","(1.00, 1.00)",0.8979542144404234,0.9467,0.9411764705882352,0.9411764705882352,0.9411764655882354,0.9375,0.9375,0.937499995,0.9411764705882352,0.9411764705882352,0.9411764655882354,1.00,1.00,da
"vi skal undersøge, hvordan vi kan tilskynde de europæiske forbrugere til at køre i elbiler.",we must find ways of encouraging european consumers towards using electric cars.,Duplicate Token,"vi skal undersøge, hvordan vi kan tilskynde de europæiske forbrugere til at køre i i elbiler.","(0.98, 0.99)",0.8917143641551922,0.9933,1.0,1.0,0.999999995,0.9333333333333332,1.0,0.9655172363852556,1.0,1.0,0.999999995,0.98,0.99,da
"en større brug af denne form for transport bidrager positivt til, at man kan nå målsætningerne i europa 2020-strategien.",increased use of this mode of transport makes a very positive contribution to achieving the objectives set out in the 'europe 2020' strategy.,Swap characters,"en større brug af denne form for transport bidrager positivt til, at man kan nå målsæntingerne i europa 2020-strategien.","(1.00, 1.00)",0.8656030552541708,0.9519,0.9473684210526316,0.9473684210526316,0.9473684160526316,0.8888888888888888,0.8888888888888888,0.888888883888889,0.9473684210526316,0.9473684210526316,0.9473684160526316,1.00,1.00,da
"i beslutningsforslaget opfordres kommissionen til at tage højde for flere elementer, som ville kunne destabilisere magtbalancen mellem motorkøretøjsproducenterne og forhandlerne til skade for forbrugerne.","it calls on the commission to take into account several elements that are likely to destabilise the balance of power between motor vehicle manufacturers and distributors, to the detriment of consumers.",Replace Token with Random Word,"i beslutningsforslaget opfordres takke til at tage højde for flere elementer, som ville kunne destabilisere magtbalancen mellem motorkøretøjsproducenterne og forhandlerne til skade for forbrugerne.","(0.99, 0.95)",0.8942255541978509,0.9613,0.9545454545454546,0.9545454545454546,0.9545454495454548,0.9130434782608696,0.9130434782608696,0.9130434732608697,0.9545454545454546,0.9545454545454546,0.9545454495454548,0.99,0.95,da
"jeg besluttede at stemme for dette beslutningsforslag, da det fremhæver de iboende problemer i kommissionens forslag til en gruppefritagelsesforordning for motorkøretøjer.",i decided to vote for this motion for a resolution as it highlights the problems inherent in the european commission's proposal on the motor vehicle block exemption regulation.,Replace Token with Random Word,"jeg besluttede at stemme for dette beslutningsforslag, da det fremhæver de iboende problemer i kommissionens forslag til en himle for motorkøretøjer.","(0.95, 0.95)",0.8787419089273848,0.9562,0.95,0.95,0.949999995,0.9,0.9,0.899999995,0.95,0.95,0.949999995,0.95,0.95,da
de modvirker individuelle initiativer til fordel for konkurrencen mellem forhandlere og reparationsvirksomheder og fremmer branchens udvikling.,they discourage individual initiatives in favour of competition among dealers and repairers and encourage the development of the sector.,Replace Character,de modvirker individuelle initiativer til fordel for konkurrencen mellem forhandlere og reparationsvirksomheder og fremger branchens udvikling.,"(0.99, 0.99)",0.8282477531331041,0.9403,0.9333333333333332,0.9333333333333332,0.9333333283333336,0.8666666666666667,0.8666666666666667,0.8666666616666667,0.9333333333333332,0.9333333333333332,0.9333333283333336,0.99,0.99,da
"det er grunden til, at vi benytter os af dette beslutningsforslag, som jeg støttede, til at udtrykke vores klare forbehold, hvad angår visse af de forslag, der ligger på bordet.","this is why we are using this motion for a resolution, which i supported, to clearly state our reservations about some of the proposals on the table.",Remove Token,"det er grunden til, at vi benytter os af dette beslutningsforslag, som jeg støttede, til at udtrykke vores klare, hvad angår visse af de forslag, der ligger på bordet.","(0.95, 0.95)",0.9257518071011758,0.9748,0.9629629629629628,0.9285714285714286,0.9454545404561984,0.9285714285714286,0.896551724137931,0.912280696755925,0.9629629629629628,0.9285714285714286,0.9454545404561984,0.95,0.95,da
"kræft er en af de største sundhedsudfordringer i europa, og det er den næststørste dødsårsag i eu med 3 mio. nye tilfælde og 1,7 mio. dødsfald hvert år.","cancer is one of the biggest health challenges faced by europe: it is the second most important cause of death in the eu, with 3 million new cases and 1.7 million deaths every year.",Remove Token,"kræft er en af de største sundhedsudfordringer i europa, og det er den næststørste dødsårsag i eu med 3 mio . nye og 1,7 mio . dødsfald hvert år.","(0.99, 0.95)",0.9157103753711766,0.9717,1.0,0.9583333333333334,0.9787233992575828,0.9615384615384616,0.925925925925926,0.9433962214168744,1.0,0.9583333333333334,0.9787233992575828,0.99,0.95,da
"jeg er glad for målsætningen om at reducere kræftbyrden ved at indføre screening for 100 % af befolkningen i 2013, når det gælder brystkræft, livmoderhalskræft og endetarms- og tyktarmskræft, og at medlemsstaterne opfordres til at gennemføre de tidligere nævnte retningslinjer.","i welcome the objective of reducing the cancer burden by introducing 100% population screening for breast, cervical and colorectal cancers by 2013, urging the member states implement the aforementioned guidelines.",Duplicate Token,"jeg er glad for målsætningen om at reducere kræftbyrden ved at indføre indføre screening for 100% af befolkningen i 2013, når det gælder brystkræft, livmoderhalskræft og endetarms- og tyktarmskræft, og at medlemsstaterne opfordres til at gennemføre de tidligere nævnte retningslinjer.","(1.00, 1.00)",0.9595851092834936,0.9977,0.9696969696969696,0.9411764705882352,0.9552238755981288,0.9230769230769232,0.9230769230769232,0.9230769180769232,0.9696969696969696,0.9411764705882352,0.9552238755981288,1.00,1.00,da
"kræft er et af de vigtigste områder for en indsats inden for folkesundheden, da 3,2 mio. europæere hvert år får konstateret kræft, som er den næsthyppigste dødsårsag efter hjertesygdomme.","cancer is one of the main areas of community action in the field of public health, since every year 3.2 million europeans are diagnosed with cancer, which represents the second most frequent cause of death after heart disease.",Add random word,"kræft er et af de vigtigste områder for en indsats inden ørred for folkesundheden, da 3,2 mio . europæere hvert år får konstateret kræft, som er den næsthyppigste dødsårsag efter hjertesygdomme.","(0.95, 0.95)",0.9219602423775934,0.9969,0.9642857142857144,1.0,0.9818181768198349,0.9310344827586208,0.9642857142857144,0.9473684160541708,0.9642857142857144,1.0,0.9818181768198349,0.95,0.95,da
"formålet med det af kommissionen foreslåede partnerskab er at støtte medlemsstaterne i deres bestræbelser på at tackle kræften ved at fastlægge en ramme for kortlægning og deling af viden, kapacitet og ekspertise inden for kræftforebyggelse og -kontrol.","the partnership proposed by the commission aims to support the member states in their efforts to tackle cancer by providing a framework for identifying and sharing information, capacity and expertise in cancer prevention and control.",Duplicate Token,"formålet formålet med det af kommissionen foreslåede partnerskab er at støtte medlemsstaterne i deres bestræbelser på at tackle kræften ved at fastlægge en ramme for kortlægning og deling af viden, kapacitet og ekspertise inden for kræftforebyggelse og -kontrol.","(1.00, 1.00)",0.9746849137081522,0.9974,1.0,1.0,0.999999995,0.972972972972973,1.0,0.986301364863952,1.0,1.0,0.999999995,1.00,1.00,da
"det er for øjeblikket den næststørste dødsårsag i europa med 3 mio. nye tilfælde og 1,7 mio. dødsfald om året.","it is currently the second most important cause of death in europe, with 3 million new cases and 1.7 million deaths every year.",Duplicate Token,"det er for øjeblikket den næststørste dødsårsag i europa med 3 mio . nye tilfælde og 1,7 mio . dødsfald dødsfald om året.","(0.99, 0.99)",0.9212572821896308,0.9953,1.0,1.0,0.999999995,0.95,1.0,0.9743589693622616,1.0,1.0,0.999999995,0.99,0.99,da
jeg er derfor glad for beslutningsforslagets henstilling om at tilskynde den offentlige sektor til generelt at investere i solid og konsekvent kræftforebyggelse.,i therefore welcome this motion for a resolution's recommendation to mobilise the public sector in general to invest in a robust and consistent effort for cancer prevention.,Duplicate character,jeg er derfor glad for beslutningsforslagets henstilling om at tilskynde den offenttlige sektor til generelt at investere i solid og konsekvent kræftforebyggelse.,"(1.00, 1.00)",0.8787419089273848,0.9562,0.9523809523809524,0.9523809523809524,0.9523809473809524,0.9047619047619048,0.9047619047619048,0.9047618997619048,0.9523809523809524,0.9523809523809524,0.9523809473809524,1.00,1.00,da
som forfatter til den skriftlige erklæring nr. 71/2009 om bekæmpelse af brystkræft i europa er jeg overordentlig glad for kommissionens meddelelse om et europæisk partnerskab om en indsats mod kræft.,"as the author of written declaration no 71/2009 on the fight against breast cancer in the european union, which has been adopted by parliament, i am exceedingly pleased by the commission communication on action against cancer: european partnership.",Replace Token with Random Word,som hjul til den skriftlige erklæring nr . 71/2009 om bekæmpelse af brystkræft i europa er jeg overordentlig glad for kommissionens meddelelse om et europæisk partnerskab om en indsats mod kræft.,"(0.95, 0.95)",0.9420254600938036,0.9686,0.9642857142857144,0.9642857142857144,0.9642857092857144,0.9310344827586208,0.9310344827586208,0.9310344777586208,0.9642857142857144,0.9642857142857144,0.9642857092857144,0.95,0.95,da
brystkræft er fortsat den største dødsårsag for kvinder mellem 35 og 59 år.,breast cancer remains the main cause of death among women aged 35 to 59.,Remove Token,brystkræft er fortsat den største dødsårsag kvinder mellem 35 og 59 år.,"(0.98, 0.99)",0.7825422900366437,0.9335,1.0,0.9230769230769232,0.959999995008,0.9090909090909092,0.8333333333333334,0.8695652124007562,1.0,0.9230769230769232,0.959999995008,0.98,0.99,da
"tværnationalt samarbejde skal gøres til en prioritet, således at vi kan få standset kræftens udbredelse permanent.","we must make transnational cooperation our priority, so that we can permanently stop the spread of cancer.",Swap words,"tværnationalt samarbejde skal gøres til en prioritet, således at vi kan få standset kræftens permanent. udbredelse ","(0.95, 0.9)",0.8702397637697912,0.9977,1.0,1.0,0.999999995,0.8666666666666667,0.8666666666666667,0.8666666616666667,1.0,1.0,0.999999995,0.95,0.9,da
"lægevidenskaben kan stadig ikke standse kræft, som er ved at blive en af menneskehedens største svøber.","medical science is still unable to stop cancer, which is becoming one of the greatest plagues of humanity.",Negation,"lægevidenskaben kan stadig standse kræft, som er ved at blive en af menneskehedens største svøber.","(0.95, 0.99)",0.8394327083733336,0.9489,1.0,0.9375,0.967741930489074,0.9285714285714286,0.8666666666666667,0.8965517191438764,1.0,0.9375,0.967741930489074,0.95,0.99,da
"det er forfærdeligt at konstatere, at kræft i 2006 var den anden mest almindelige dødsårsag.","the knowledge that, in 2006, cancer was the second most common cause of death is horrifying.",Replace Token with Random Word,"det er forfærdeligt at konstatere, at kræft i 2006 var den canasta mest almindelige dødsårsag.","(0.90, 0.95)",0.8282477531331041,0.9403,0.9285714285714286,0.9285714285714286,0.9285714235714286,0.8571428571428571,0.8571428571428571,0.8571428521428571,0.9285714285714286,0.9285714285714286,0.9285714235714286,0.90,0.95,da
"der bør gennemføres lignende foranstaltninger i hele eu, men de skal være stærkere og mere effektive.","similar measures should be put in place throughout the union, but with greater intensity and effectiveness.",Add random word,"der benzol bør gennemføres lignende foranstaltninger i hele eu, men de skal være stærkere og mere effektive.","(0.95, 0.99)",0.9011400823378845,0.9938,0.9411764705882352,1.0,0.9696969647015612,0.875,0.9333333333333332,0.903225801456816,0.9411764705882352,1.0,0.9696969647015612,0.95,0.99,da
