originalSentence,referenceSentence,tamperingType,tamperedSentence,"LLMScore (Sim, Con)",BLEU,METEOR,Rouge1 r,Rouge1 p,Rouge1 f,Rouge2 r,Rouge2 p,Rouge2 f,Rougel r,Rougel p,Rougel f,LLM-Sim,LLM-Con,originalLanguage
"det vil uden tvivl styrke økonomien og også bidrage til at forbedre luftkvaliteten, livskvaliteten og den almene sundhedstilstand.","this will undoubtedly invigorate the economy and also help to improve air quality, quality of life and everybody's health.",Add random word,"det vil uden tvivl styrke hybrid økonomien og også bidrage til at forbedre luftkvaliteten, livskvaliteten og den almene sundhedstilstand.","(0.95, 0.95)",0.8680538146126793,0.9945,0.9444444444444444,1.0,0.9714285664326532,0.8888888888888888,0.9411764705882352,0.914285709289796,0.9444444444444444,1.0,0.9714285664326532,0.95,0.95,da
"jeg vil gerne endnu engang takke alle de involverede, og jeg ser frem til en forhandling, der helt sikkert bliver interessant.","i would once again like to thank all those involved, and i am looking forward to what is sure to be an interesting debate.",Remove Token,"jeg vil gerne endnu engang takke alle de involverede, og jeg frem til en forhandling, der helt sikkert bliver interessant.","(0.99, 0.95)",0.8843865924896842,0.962,1.0,0.95,0.9743589693622616,0.9473684210526316,0.9,0.9230769180802104,1.0,0.95,0.9743589693622616,0.99,0.95,da
"dette faktum er mindre kendt af offentligheden, da de fleste mennesker ikke køber tunge erhvervskøretøjer.",this fact is less noticed by the public as most people do not buy heavy-duty vehicles.,Negation,"dette faktum er mindre kendt af offentligheden, da de fleste mennesker køber tunge erhvervskøretøjer.","(0.95, 0.99)",0.8282477531331041,0.9458,1.0,0.9333333333333332,0.9655172363852556,0.9230769230769232,0.8571428571428571,0.8888888838957477,1.0,0.9333333333333332,0.9655172363852556,0.95,0.99,da
dette euro vi-forslag blev udarbejdet sammen med programmet ren luft i europa (clean air for europe - cafe) og temastrategien for luftforurening.,"this euro vi proposal was drawn up in conjunction with the clean air for europe, or cafe, programme and the thematic strategy on air pollution.",Remove Token,dette euro vi-forslag blev udarbejdet sammen med programmet ren i europa (clean air for europe - cafe) og temastrategien for luftforurening.,"(0.95, 0.95)",0.8895260356363631,0.9636,1.0,0.9523809523809524,0.9756097511005354,0.95,0.9047619047619048,0.9268292632956572,1.0,0.9523809523809524,0.9756097511005354,0.95,0.95,da
"for det første er der ""bedre lovgivning""'. forslaget tager højde for de berørte parters holdninger, som blev fastslået i en offentlig internethøring.","first of all, there is 'better lawmaking': the proposal takes account of the positions of those affected, as ascertained through a public internet consultation.",Replace Character,"for det første er der ""bedre lovgivning""'. forslaget tager højde for de berørte parters holdninger, som blev fastslået i en olfentlig internethøring.","(0.98, 0.95)",0.9130714940405412,0.9641,0.9523809523809524,0.9523809523809524,0.9523809473809524,0.9047619047619048,0.9047619047619048,0.9047618997619048,0.9523809523809524,0.9523809523809524,0.9523809473809524,0.98,0.95,da
"jeg er også glad for at kunne afgive den erklæring, som ordføreren har udbedt sig, og faktisk vil jeg endda gå en smule længere, end han har bedt om.","i am also happy to issue the declaration requested by the rapporteur, and, in fact, i will even make it a little bit better than he had asked for.",Swap words,"jeg er også glad for at kunne den afgive erklæring, som ordføreren har udbedt sig, og faktisk vil jeg endda gå en smule længere, end han har bedt om. ","(0.99, 0.95)",0.9005694513489713,0.9991,0.9642857142857144,1.0,0.9818181768198349,0.8620689655172413,0.8928571428571429,0.8771929774576792,0.9285714285714286,0.9629629629629628,0.9454545404561984,0.99,0.95,da
deres hjælp gjorde det muligt at nå frem til en aftale om en meget teknisk sag allerede ved førstebehandlingen.,their help made it possible for an agreement to be reached about a very technical dossier as early as the first reading stage.,Remove Token,deres gjorde det muligt at nå frem til en aftale om en meget teknisk sag allerede ved førstebehandlingen.,"(1.00, 1.00)",0.9036020036098448,0.9542,1.0,0.9444444444444444,0.9714285664326532,0.9411764705882352,0.8888888888888888,0.914285709289796,1.0,0.9444444444444444,0.9714285664326532,1.00,1.00,da
som skyggeordfører for gruppen for det europæiske folkeparti (kristelige demokrater) og de europæiske demokrater husker jeg stadig meget tydeligt vores afstemning om revisionen af direktivet om fine partikler.,"as shadow rapporteur for the group of the european people's party (christian democrats) and european democrats, i still recall very well our vote on the revision of the fine particulates directive.",Duplicate character,som skyggeordfører for gruppen for det europæiske folkeparti (kristelige demokrater) og de europæiske demokrater husker jeg stadig meget tydeligt voores afstemning om revisionen af direktivet om fine partikler.,"(0.99, 0.95)",0.9127592114472296,0.9676,0.96,0.96,0.959999995,0.925925925925926,0.925925925925926,0.925925920925926,0.96,0.96,0.959999995,0.99,0.95,da
"den nye euro vi-norm vil således nedbringe emissionerne af fine partikler fra tunge dieseldrevne erhvervskøretøjer og busser med 66 % sammenlignet med euro v-normen, mens nitrogenemissionerne (nox-emissionerne) fra benzindrevne køretøjer bliver nedbragt med yderligere 80 %.","the new euro vi standard will thus reduce emissions of fine particulates from diesel heavy-duty vehicles and buses by 66% as compared with the euro v standard, while in petrol-driven vehicles nitrogen (nox) emissions will be reduced by a further 80%.",Remove Character,"den nye euro vi-norm vil således nedbringe emissionerne af fine partikler fra tunge dieseldrevne erhvervskøretøjer og busser med 6 % sammenlignet med euro v-normen, mens nitrogenemissionerne (nox-emissionerne) fra benzindrevne køretøjer bliver nedbragt med yderligere 80 %.","(0.95, 0.99)",0.933651069586263,0.9749,0.967741935483871,0.967741935483871,0.9677419304838712,0.9428571428571428,0.9428571428571428,0.942857137857143,0.967741935483871,0.967741935483871,0.9677419304838712,0.95,0.99,da
"derfor glæder jeg mig naturligvis også meget over den erklæring, som kommissær verheugen netop har afgivet, hvori kommissionen forpligter sig til at fremlægge gennemførelsesforanstaltningerne for parlamentet og rådet meget hurtigt - hurtigere end det oprindeligt var planlagt.","for that reason i am also, of course, very pleased about the declaration that commissioner verheugen has just made, in which the commission undertakes to put the implementing measures forward to parliament and the council very quickly - more quickly than was originally planned.",Remove Token,"derfor glæder jeg mig naturligvis også meget over den erklæring, som kommissær netop har afgivet, hvori kommissionen forpligter sig til at fremlægge gennemførelsesforanstaltningerne for parlamentet og rådet meget hurtigt - hurtigere end det oprindeligt var planlagt.","(0.98, 0.95)",0.933651069586263,0.9774,1.0,0.9722222222222222,0.9859154879587384,0.9714285714285714,0.9444444444444444,0.9577464738742314,1.0,0.9722222222222222,0.9859154879587384,0.98,0.95,da
ordfører for udtalelsen fra transport- og turismeudvalget. - (nl) hr. formand! tidligere i år udarbejdede jeg en udtalelse om euro 6 for transport- og turismeudvalget.,"draftsman of the opinion of the committee on transport and tourism. - (nl) mr president, earlier this year, i wrote an opinion on euro 6 on behalf of the committee on transport and tourism.",Swap words,ordfører for udtalelsen fra transport- og turismeudvalget. - (nl) hr. tidligere formand! i år udarbejdede jeg en udtalelse om euro 6 for transport- og turismeudvalget. ,"(1.00, 1.00)",0.8746415418408885,0.9989,0.9545454545454546,1.0,0.976744181049216,0.8260869565217391,0.8636363636363636,0.8444444394469136,0.9090909090909092,0.9523809523809524,0.9302325531422392,1.00,1.00,da
han var meget samarbejdsvillig under udarbejdelsen.,his approach to its production was a very collaborative one.,Replace Character,han var meget samarbejdsvillrg under udarbejdelsen.,"(0.99, 0.99)",8.444843264428189e-78,0.8413,0.8333333333333334,0.8333333333333334,0.8333333283333335,0.6,0.6,0.5999999950000001,0.8333333333333334,0.8333333333333334,0.8333333283333335,0.99,0.99,da
"vi har i tyrol opdaget, at de eksisterende målemetoder faktisk er en fiasko, og at forskellen mellem et tungt euro 0- og et euro iii- eller euro iv-erhvervskøretøj i praksis er meget lille.","we in the tyrol have discovered that the existing measurement methods are actually a failure and that, in practice, the difference between a euro 0 and a euro iii or euro iv heavy-duty vehicle was really small.",Remove Character,"vi har i tyrol opdaget, at de eksisterende målemetoder faktisk er en fiasko, og at forskellen melem et tungt euro 0- og et euro iii- eller euro iv-erhvervskøretøj i praksis er meget lille.","(0.99, 0.95)",0.9257518071011758,0.9721,0.9615384615384616,0.9615384615384616,0.9615384565384616,0.9375,0.9375,0.937499995,0.9615384615384616,0.9615384615384616,0.9615384565384616,0.99,0.95,da
"disse systemer er vigtige for at kontrollere emissioner, mens køretøjerne anvendes.",these systems are important for controlling emissions while vehicles are being used.,Duplicate Token,"disse systemer er vigtige for at kontrollere emissioner, mens køretøjerne køretøjerne anvendes.","(0.99, 0.95)",0.8551002976753405,0.9906,1.0,1.0,0.999999995,0.9090909090909092,1.0,0.9523809473922904,1.0,1.0,0.999999995,0.99,0.95,da
det vil forbedre emissionsregnskabet hurtigere og lettere end dyr motortuning.,this would improve the emissions balance sheet more rapidly and more easily than expensive engine-tuning.,Add random word,det vil forbedre emissionsregnskabet hurtigere og lettere end dyr difteri motortuning.,"(0.95, 0.9)",0.7772460244048297,0.988,0.9090909090909092,1.0,0.9523809473922904,0.8,0.8888888888888888,0.8421052581717452,0.9090909090909092,1.0,0.9523809473922904,0.95,0.9,da
kun store transportører og store selskaber vil kunne håndtere forskning og organisatoriske krav i denne størrelsesorden.,only large transporters and corporations will be able to cope with research and organisational requirements of this magnitude.,Replace Token with Random Word,kun store skur og store selskaber vil kunne håndtere forskning og organisatoriske krav i denne størrelsesorden.,"(0.95, 0.95)",0.848219861937046,0.9403,0.9285714285714286,0.9285714285714286,0.9285714235714286,0.8666666666666667,0.8666666666666667,0.8666666616666667,0.9285714285714286,0.9285714285714286,0.9285714235714286,0.95,0.95,da
"hvad angår polen, vil mange transport- og motorfremstillingsvirksomheder såsom ""andoria"" højst sandsynligt lukke.","as far as poland is concerned, it is highly likely that many transport undertakings and engine manufacturing firms such as andoria will simply cease to exist.",Duplicate character,"hvad angår polen, vil mange transport- og motorfremstillingsvirksomheder såsom ""andoria"" højst sandsynligt lukkke.","(0.99, 0.99)",0.8843946454355334,0.9403,0.9230769230769232,0.9230769230769232,0.9230769180769232,0.9166666666666666,0.9166666666666666,0.9166666616666668,0.9230769230769232,0.9230769230769232,0.9230769180769232,0.99,0.99,da
"ejere af køretøjer bliver i hvert fald pålagt at yde en stor økonomisk indsats netop på et tidspunkt, hvor transportsektoren er ramt af en meget alvorlig finanskrise.","vehicle owners are certainly being required to make a great economic effort at present, just as the transport sector is experiencing such a dramatic financial crisis.",Swap words,"ejere af køretøjer bliver i hvert pålagt fald at yde en stor økonomisk indsats netop på et tidspunkt, hvor transportsektoren er ramt af en meget alvorlig finanskrise. ","(0.99, 0.95)",0.8853153595969632,0.9987,0.9615384615384616,1.0,0.9803921518646674,0.8518518518518519,0.8846153846153846,0.8679245233036669,0.9230769230769232,0.96,0.9411764655901576,0.99,0.95,da
"det fremgår af kommissionens uformelle høring af medlemsstaterne, at bestemmelserne i artikel 55 helt klart er uegnede til projekter, der medfinansieres af den europæiske socialfond, som primært støtter immaterielle operationer i stedet for infrastrukturprojekter.","according to the outcome of the informal consultation of member states by the european commission, the provisions of article 55 are clearly unsuitable for projects cofinanced by the european social fund, which mainly finances intangible operations rather than infrastructure projects.",Duplicate Token,"det fremgår af kommissionens uformelle høring af medlemsstaterne, at bestemmelserne i artikel 55 helt klart er uegnede til projekter, der medfinansieres af af den europæiske socialfond, som primært støtter immaterielle operationer i stedet for infrastrukturprojekter.","(0.99, 0.99)",0.953068372203858,0.9954,1.0,1.0,0.999999995,0.9705882352941176,1.0,0.9850746218667856,1.0,1.0,0.999999995,0.99,0.99,da
beslutningen om at indføre et loft på 1 mio. eur opstod på baggrund af indledende undersøgelser og havde til formål at bevare den generelle karakter i artikel 55.,the decision to impose a ceiling of eur 1 million arose from preliminary studies and was aimed at retaining the general nature of article 55.,Remove Character,beslutningen om at indføre et loft på 1 mio. eur opstod på baggrund af indledende undersøgelser og havde il formål at bevare den generelle karakter i artikel 55.,"(0.99, 0.99)",0.9095930632220222,0.9665,0.9615384615384616,0.9615384615384616,0.9615384565384616,0.925925925925926,0.925925925925926,0.925925920925926,0.9615384615384616,0.9615384615384616,0.9615384565384616,0.99,0.99,da
"dette ville gøre det muligt for forvaltningsmyndighederne at fortsætte deres arbejde, hvilket er et presserende aspekt i forbindelse med forenklingen.","this would allow the managing authorities to continue with their work, which is a compelling aspect of the simplification.",Add random word,"dette ville tarif gøre det muligt for forvaltningsmyndighederne at fortsætte deres arbejde, hvilket er et presserende aspekt i forbindelse med forenklingen.","(0.99, 0.99)",0.8942243145168116,0.9951,0.9523809523809524,1.0,0.9756097511005354,0.9,0.9473684210526316,0.9230769180802104,0.9523809523809524,1.0,0.9756097511005354,0.99,0.99,da
"beviset på dette er, at vi inden for rammerne af planen om at bidrage til europæisk økonomisk genopretning er gået sammen med kommissær hübner om en forslag om tre nye grundlæggende ændringer af forordningerne om strukturfondene.",the proof of this is that within the framework of the plan to assist european economic regeneration we have combined forces with commissioner hübner on a proposal for three new fundamental amendments to structural fund regulations.,Add random word,"beviset på dette er, at vi inden for rammerne af planen om at bidrage til europæisk økonomisk genopretning er gået sammen med kommissær hübner om en musik forslag om tre nye grundlæggende ændringer af forordningerne om strukturfondene.","(0.95, 0.99)",0.9325260649618224,0.9973,0.96875,1.0,0.984126979128244,0.9444444444444444,0.9714285714285714,0.9577464738742314,0.96875,1.0,0.984126979128244,0.95,0.99,da
"for det første viser de europæiske institutioner gennem denne ændring, at de er i stand til at reagere fleksibelt på de vanskeligheder, som opstår i gennemførelsen af en bestemt politik.","firstly, through this change, the european institutions are demonstrating that they are able to respond flexibly to the difficulties arising during implementation of a certain policy.",Replace Character,"for det første viser de europæiske institutioner gennem denne ændring, at de er i stand til at reagere fleksibslt på de vanskeligheder, som opstår i gennemførelsen af en bestemt politik.","(1.00, 1.00)",0.9184678024441792,0.9696,0.9615384615384616,0.9615384615384616,0.9615384565384616,0.9310344827586208,0.9310344827586208,0.9310344777586208,0.9615384615384616,0.9615384615384616,0.9615384565384616,1.00,1.00,da
"i de forslag, som vi skal stemme om i marts, er vi overbevist om, at kommissionen vil foreslå os nye forenklingsværktøjer, særligt i forhold til vores ""mindre spillere"", i forhold til vores smv'er.","within these drafts that we shall have to vote on in march, we are convinced that the commission will propose new simplification tools to us, particularly regarding our 'small-scale players', regarding our smes.",Swap words,"i de forslag, som vi skal stemme om i marts, er vi overbevist om, at kommissionen vil foreslå os nye forenklingsværktøjer, særligt forhold i til vores ""mindre spillere"", i forhold til vores smv'er. ","(0.99, 0.95)",0.9214438554340222,0.9995,0.9629629629629628,1.0,0.9811320704734782,0.875,0.9655172413793104,0.9180327818973394,0.9629629629629628,1.0,0.9811320704734782,0.99,0.95,da
ikke desto mindre angår det vigtige emner i forhold til anvendelsen af eu-støtte.,"nonetheless, it relates to important issues concerning use of union aid.",Negation,desto mindre angår det vigtige emner i forhold til anvendelsen af eu-støtte.,"(0.99, 0.95)",0.9193227152249184,0.935,1.0,0.9230769230769232,0.959999995008,1.0,0.9166666666666666,0.9565217341398866,1.0,0.9230769230769232,0.959999995008,0.99,0.95,da
"jeg kan eksempelvis nævne, at vi i polen har over hundrede forskellige typer institutioner, der forvalter anvendelsen af eu-midler.",by way of example i could mention that in poland we have over one hundred different types of institutions managing the implementation of union funds.,Swap characters,"jeg kan eksempelvis nævne, at vi i polen har over hundrede forskellige typer institutioner, der forvalter anvendelsen af eu-milder.","(0.99, 1.00)",0.9132027013286008,0.9541,0.9473684210526316,0.9473684210526316,0.9473684160526316,0.9444444444444444,0.9444444444444444,0.9444444394444445,0.9473684210526316,0.9473684210526316,0.9473684160526316,0.99,1.00,da
"endvidere har kommissionen fremlagt hele pakken, herunder den økonomiske genopretningsplan, og i den forbindelse kan midlerne bl.a. bruges hurtigere.","moreover, the commission has presented the entire package, including the economic recovery plan, in which context funds can be spent more quickly, amongst other things.",Duplicate character,"endvidere har kommissionen fremlagt hele pakken, herunder den økonomiske genopretningsplan, ogg i den forbindelse kan midlerne bl.a. bruges hurtigere.","(0.99, 0.99)",0.8787419089273848,0.9562,0.9473684210526316,0.9473684210526316,0.9473684160526316,0.8947368421052632,0.8947368421052632,0.8947368371052632,0.9473684210526316,0.9473684210526316,0.9473684160526316,0.99,0.99,da
"- (cs) hr. formand! den lov, vi drøfter, behandler problemet med indtægtsskabende projekter.",- (cs) the bill under discussion deals with the problem of revenue-generating projects.,Swap words,"- (cs) hr. den formand! lov, vi drøfter, behandler problemet med indtægtsskabende projekter. ","(0.98, 0.95)",0.7920365952156737,0.996,0.9285714285714286,1.0,0.9629629579698218,0.6923076923076923,0.75,0.7199999950079999,0.8571428571428571,0.9230769230769232,0.8888888838957477,0.98,0.95,da
"særligt hvad angår den anden projektkategori, er der ingen indtægter af kommerciel karakter, kun de lokale myndigheders og ngo'ers indtægter i form af administrative gebyrer eller lignende.","concerning the second category of projects in particular, there are no revenues of a commercial nature, only revenues of local authorities and non-profit making organisations that are raised in the form of administrative and other fees.",Duplicate Token,"særligt hvad angår den anden projektkategori, er der ingen indtægter af kommerciel karakter, kun de lokale lokale myndigheders og ngo'ers indtægter i form af administrative gebyrer eller lignende.","(0.99, 0.99)",0.9401973258230508,0.9965,1.0,1.0,0.999999995,0.9629629629629628,1.0,0.9811320704734782,1.0,1.0,0.999999995,0.99,0.99,da
dette skridt vil uden tvivl forenkle administrationen og sikre en mere effektiv gennemførelse af disse projekter.,this step will undoubtedly simplify administration and increase efficiency in the implementation of these projects.,Remove Token,dette skridt vil uden tvivl forenkle administrationen og sikre mere effektiv gennemførelse af disse projekter.,"(0.98, 0.99)",0.8282477531331041,0.9458,1.0,0.9375,0.967741930489074,0.9285714285714286,0.8666666666666667,0.8965517191438764,1.0,0.9375,0.967741930489074,0.98,0.99,da
"målet er at sikre, at midlerne kan tildeles så hurtigt som muligt.",the aim is to enable funds to be allocated as soon as possible.,Remove Token,"målet er at sikre, at midlerne kan tildeles så hurtigt muligt.","(0.99, 1.00)",0.8091067115702212,0.9335,1.0,0.9090909090909092,0.9523809473922904,0.9,0.8181818181818182,0.8571428521541952,1.0,0.9090909090909092,0.9523809473922904,0.99,1.00,da
særligt for de nye medlemsstater er det én potentiel måde at imødegå den økonomiske krise på.,"for the new member states in particular, this is one potential way of countering the economic crisis.",Swap characters,sræligt for de nye medlemsstater er det én potentiel måde at imødegå den økonomiske krise på.,"(0.99, 1.00)",0.9351334836242398,0.9411,0.9375,0.9375,0.937499995,0.9333333333333332,0.9333333333333332,0.9333333283333336,0.9375,0.9375,0.937499995,0.99,1.00,da
"derfor vil jeg gerne rette en særlig tak til kommissær hübner og formanden for parlamentet for at godkende forslaget, så det kan stemmes igennem inden udgangen af året.",that is why i should like specifically to thank commissioner hübner and the president of the european parliament for adopting the proposal so that it can be voted through by the end of the year.,Replace Character,"derfor vil jeg gerne rette en særlig tak til kommissær hübner og formanden for parlamentet for at godkende forslaget, så det kan stemmes igennim inden udgangen af året.","(0.99, 1.00)",0.9095930632220222,0.9665,0.9629629629629628,0.9629629629629628,0.9629629579629628,0.925925925925926,0.925925925925926,0.925925920925926,0.9629629629629628,0.9629629629629628,0.9629629579629628,0.99,1.00,da
"jeg er sikker på, at de nye bestemmelser vil bidrage til at forbedre håndhævelsen af prioriteterne i samhørighedspolitikken.",i am certain that the new provisions will help to improve the application of the priorities of cohesion policy.,Add random word,"jeg er sikker svige på, at de nye bestemmelser vil bidrage til at forbedre håndhævelsen af prioriteterne i samhørighedspolitikken.","(0.99, 0.99)",0.8680538146126793,0.9945,0.9444444444444444,1.0,0.9714285664326532,0.8888888888888888,0.9411764705882352,0.914285709289796,0.9444444444444444,1.0,0.9714285664326532,0.99,0.99,da
"det er her, en hel befolkning synker ned i jagten på muligheder og økonomiske synergier og i mange tilfælde med den ene forventning, at disse vil have turisme som omdrejningspunkt.","it is here where a whole population descends, in search of opportunities and economic synergies and, in many cases, with the sole expectation that these will revolve around tourism.",Replace Character,"det er her, en hel befolkning synker ned i jagten på muligheder og økonomiske synergier og i mange tilfælde med den ene fornentning, at disse vil have turisme som omdrejningspunkt.","(0.99, 1.00)",0.9184678024441792,0.9696,0.9642857142857144,0.9642857142857144,0.9642857092857144,0.9310344827586208,0.9310344827586208,0.9310344777586208,0.9642857142857144,0.9642857142857144,0.9642857092857144,0.99,1.00,da
"derfor blev vi optaget af det klare behov for en pragmatisk integreret tilgang til turismens indvirkning på kystområder, og det fik os til at påbegynde arbejdet.",that is why the clear need for a pragmatic and integrated view of the impact of tourism on coastal regions took hold in our minds and led us to start work.,Remove Character,"derfor blev vi optaget af det klare behov for en pagmatisk integreret tilgang til turismens indvirkning på kystområder, og det fik os til at påbegynde arbejdet.","(0.99, 1.00)",0.9025139799587886,0.9641,0.9583333333333334,0.9583333333333334,0.9583333283333336,0.92,0.92,0.919999995,0.9583333333333334,0.9583333333333334,0.9583333283333336,0.99,1.00,da
"denne betænkning, som vi nu fremlægger for dem, var allerede meget relevant og presserende, da regionaludviklingsudvalget besluttede sig for at udarbejde den.","this report, which we are now putting before you here, was already very opportune and urgent when the committee on regional development decided to prepare it.",Remove Character,"denne betænkning, som vi nu fremlægger for dem, var allerede meget relevant og presserende, da regionaludviklingsudvalet besluttede sig for at udarbejde den.","(1.00, 1.00)",0.8942255541978509,0.9613,0.9523809523809524,0.9523809523809524,0.9523809473809524,0.9047619047619048,0.9047619047619048,0.9047618997619048,0.9523809523809524,0.9523809523809524,0.9523809473809524,1.00,1.00,da
