originalSentence,referenceSentence,tamperingType,tamperedSentence,"LLMScore (Sim, Con)",BLEU,METEOR,Rouge1 r,Rouge1 p,Rouge1 f,Rouge2 r,Rouge2 p,Rouge2 f,Rougel r,Rougel p,Rougel f,LLM-Sim,LLM-Con,originalLanguage
også de nyvalgte kroatiske myndigheders ændrede holdning til den internationale straffedomstol for det tidligere jugoslavien tæller på den positive side i kroatiens regnskab.,another point in croatia's favour is the changed attitude of the newly elected croatian authorities to the international criminal tribunal for the former yugoslavia.,Replace Token with Random Word,også de titte kroatiske myndigheders ændrede holdning til den internationale straffedomstol for det tidligere jugoslavien tæller på den positive side i kroatiens regnskab.,"(0.99, 0.95)",0.8971148504974097,0.958,0.9545454545454546,0.9545454545454546,0.9545454495454548,0.9090909090909092,0.9090909090909092,0.9090909040909092,0.9545454545454546,0.9545454545454546,0.9545454495454548,0.99,0.95,da
derfor var det også rigtigt at reagere hurtigt.,and that is why it was right to react quickly.,Swap words,derfor var også det rigtigt at reagere hurtigt. ,"(0.95, 0.90)",0.5466325569645467,0.9561,0.8888888888888888,1.0,0.9411764656055364,0.5,0.5714285714285714,0.5333333283555556,0.7777777777777778,0.875,0.823529406782007,0.95,0.90,da
"det er lidt skuffende ved beslutningen eller ikke-beslutningen fra nice. kompleksiteten i processen med flertalsbeslutninger er vanskelig allerede for den nuværende udvidelse, men for en udvidelse mod sydøsteuropa vil det blive meget mere vanskeligt.","that makes the decision, or non-decision, of nice rather disappointing: the complexity of the majority-voting system makes things difficult enough for the current round of enlargement, but they will become much more difficult when it comes to enlargement towards south-eastern europe.",Replace Character,"det er lidt skuffende ved beslutningen eller ikke-beslutningen fra nice. komplsksiteten i processen med flertalsbeslutninger er vanskelig allerede for den nuværende udvidelse, men for en udvidelse mod sydøsteuropa vil det blive meget mere vanskeligt.","(0.99, 0.95)",0.9278982724420874,0.9729,0.967741935483871,0.967741935483871,0.9677419304838712,0.9393939393939394,0.9393939393939394,0.9393939343939396,0.967741935483871,0.967741935483871,0.9677419304838712,0.99,0.95,da
"hr. formand, vores gruppe støtter hr. baltas' indsats i forbindelse med betænkningen om muligheden for at gennemføre forhandlingen om stabiliserings- og associeringsaftaler med republikken kroatien.","mr president, our group supports the work done by mr baltas on the report on the feasibility of negotiating stabilisation and association agreements with the republic of croatia.",Swap characters,"hr. formand, vores gruppe støtter hr. baltas' indsats i forbindelse med betænkningen om muligheden ofr at gennemføre forhandlingen om stabiliserings- og associeringsaftaler med republikken kroatien.","(1.00, 1.00)",0.9095930632220222,0.9665,0.9545454545454546,0.9545454545454546,0.9545454495454548,0.9166666666666666,0.9166666666666666,0.9166666616666668,0.9545454545454546,0.9545454545454546,0.9545454495454548,1.00,1.00,da
her genfandt de deres ejendomme i ødelagt tilstand.,there they found their property and possessions in ruins.,Remove Token,her genfandt de deres i ødelagt tilstand.,"(0.85, 0.95)",0.5969491792019646,0.8919,1.0,0.875,0.9333333283555556,0.8333333333333334,0.7142857142857143,0.7692307642603551,1.0,0.875,0.9333333283555556,0.85,0.95,da
den samarbejder med domstolen i haag.,it is seeking to cooperate with the hague.,Remove Character,den samarbejder med dostolen i haag.,"(0.99, 0.99)",8.444843264428189e-78,0.8413,0.8333333333333334,0.8333333333333334,0.8333333283333335,0.6,0.6,0.5999999950000001,0.8333333333333334,0.8333333333333334,0.8333333283333335,0.99,0.99,da
"hr. formand, det glæder mig at kunne kommentere hr. baltas' fremragende betænkning, der, som adskillige medlemmer har sagt, er udarbejdet meget hurtigt, om kommissionens forundersøgelse af muligheden for en stabiliserings- og associeringsaftale med kroatien.","mr president, i am delighted to be able to comment on the excellent report by the honourable gentleman, mr baltas - produced, as several honourable gentlemen have said, with considerable expedition - on the commission's feasibility study for a stabilisation and association agreement with croatia.",Add random word,"hr . formand, det glæder mig svinge at kunne kommentere hr . baltas' fremragende betænkning, der, som adskillige medlemmer har sagt, er udarbejdet meget hurtigt, om kommissionens forundersøgelse af muligheden for en stabiliserings- og associeringsaftale med kroatien.","(0.99, 0.99)",0.9405662491609416,0.9976,0.9705882352941176,1.0,0.9850746218667856,0.9411764705882352,0.9696969696969696,0.9552238755981288,0.9705882352941176,1.0,0.9850746218667856,0.99,0.99,da
"vi startede passende nok forhandlingerne ved zagreb-topmødet for 14 dage siden, og det første fulde forhandlingsmøde finder sted på mandag i bruxelles.",we initiated those negotiations appropriately enough at the zagreb summit a fortnight ago and the first full negotiating session takes place on monday in brussels.,Duplicate Token,"vi startede passende nok forhandlingerne ved zagreb-topmødet for 14 dage siden, og det første fulde forhandlingsmøde finder sted på mandag i i bruxelles.","(0.99, 0.95)",0.9246707643923312,0.9956,1.0,1.0,0.999999995,0.9545454545454546,1.0,0.976744181049216,1.0,1.0,0.999999995,0.99,0.95,da
"vi håber, at disse forhandlinger kommer til at skride hurtigt frem, og at vi kan afslutte dem hurtigt.",we hope to make swift progress in these negotiations and to be able to conclude them rapidly.,Replace Token with Random Word,"vi håber, at disse forhandlinger kommer til at skride hurtigt orne, og at vi kan afslutte dem hurtigt.","(0.95, 0.99)",0.8656030552541708,0.9519,0.9285714285714286,0.9285714285714286,0.9285714235714286,0.8823529411764706,0.8823529411764706,0.8823529361764706,0.9285714285714286,0.9285714285714286,0.9285714235714286,0.95,0.99,da
"kroatien har f.eks. modigt forandret sit forhold til haag på grundlag af præsidentens kloge udtalelse om, at et land kun kan frikendes for sin kollektive skyld, hvis man placerer den individuelle skyld.","croatia has, for example, bravely transformed its relations with the hague, based on the wise assertion of her president that it is only by establishing individual guilt that a country can truly be absolved of collective guilt.",Replace Token with Random Word,"kroatien har f.eks . modigt forandret sit forhold til haag på grundlag af præsidentens kravle udtalelse om, at et land kun kan frikendes for sin kollektive skyld, hvis man placerer den individuelle skyld.","(0.95, 0.95)",0.9257518071011758,0.9721,0.9696969696969696,0.9696969696969696,0.96969696469697,0.9375,0.9375,0.937499995,0.9696969696969696,0.9696969696969696,0.96969696469697,0.95,0.95,da
"først og fremmest skal vi se løbende økonomisk og institutionel reform, etablering af en ægte fri økonomi, reform af ejendomsretten, styrkelse af domstolenes uafhængighed og beskyttelse af mindretallenes rettigheder.","above all we will need to see continuing economic and institutional reform, the establishment of a genuinely free economy, reform of property law, the strengthening of the independence of the judiciary and the protection of the rights of minorities.",Swap words,"først og fremmest skal vi se løbende økonomisk og institutionel reform, etablering af en ægte fri økonomi, reform af ejendomsretten, styrkelse af domstolenes uafhængighed og af beskyttelse mindretallenes rettigheder. ","(0.99, 0.95)",0.9005694513489713,0.9991,0.96,1.0,0.9795918317367764,0.8620689655172413,0.8928571428571429,0.8771929774576792,0.96,1.0,0.9795918317367764,0.99,0.95,da
"kroatien har fået mange venner i europa på grund af den rolle, det har spillet i det seneste år, og på grund af de fremskridt, det har opnået.",croatia has won many friends in europe for the role it has played in the last year and for the progress it has achieved.,Swap words,"kroatien har fået mange venner i europa på grund af den rolle, det har spillet i det seneste år, og på grund af de fremskridt, har det opnået. ","(0.98, 0.95)",0.9063534879188424,0.999,0.9523809523809524,1.0,0.9756097511005354,0.8461538461538461,0.9166666666666666,0.879999995008,0.9523809523809524,1.0,0.9756097511005354,0.98,0.95,da
"jeg tror, at det var af største vigtighed for hele regionen.",i think it was remarkably important for the whole region.,Remove Token,"jeg tror, at var af største vigtighed for hele regionen.","(0.95, 0.98)",0.7611606003349892,0.9281,1.0,0.9090909090909092,0.9523809473922904,0.8888888888888888,0.8,0.8421052581717452,1.0,0.9090909090909092,0.9523809473922904,0.95,0.98,da
nærmere forbindelser mellem indonesien og eu,developing closer relations with indonesia,Add random word,nærmere forbindelser ræbe mellem indonesien og eu,"(0.95, 0.98)",0.5115078115793242,0.9654,0.8571428571428571,1.0,0.9230769181065088,0.6666666666666666,0.8,0.7272727223140496,0.8571428571428571,1.0,0.9230769181065088,0.95,0.98,da
"nu, et år senere, er billedet meget mindre optimistisk.","a year on, the picture looks far less optimistic.",Add random word,"planke nu, et år senere, er billedet meget mindre optimistisk.","(0.98, 0.95)",0.9200444146293232,0.9914,0.9,1.0,0.947368416066482,0.8888888888888888,1.0,0.9411764656055364,0.9,1.0,0.947368416066482,0.98,0.95,da
"det er i denne forbindelse uforståeligt, at laskar jihad-krigerne i foråret fik chancen for i tusindvis at tage til molukkerne for endnu en gang at fremprovokere konflikterne.","it is incomprehensible, in this respect, that the laskar jihad was given the chance this spring to go to the moluccas in their thousands, in order to stoke up the conflicts there again.",Duplicate character,"det er i denne forbindelse uforståeligt, at laskar jihad-krigerne i foråret fik chancen for i tusindvis at tage til molukkerne for endnu en gang at frremprovokere konflikterne.","(0.99, 1.00)",0.9163140145331566,0.9653,0.9545454545454546,0.9545454545454546,0.9545454495454548,0.9230769230769232,0.9230769230769232,0.9230769180769232,0.9545454545454546,0.9545454545454546,0.9545454495454548,0.99,1.00,da
"i øjeblikket hersker der stor angst, også blandt de 50.000 molukkiske borgere i nederlandene, for, at situationen vil eskalere omkring jul.",people are very afraid at present - and that includes the 50 000 moluccan citizens in the netherlands - that the situation will escalate further around christmas.,Replace Character,"i øjeblikket hersker der stor angst, også blandt de 50.000 molukkiske borgere i nederlandene, for, at situationen vil eskalerc omkring jul.","(0.99, 1.00)",0.8895260356363631,0.9597,0.9523809523809524,0.9523809523809524,0.9523809473809524,0.9047619047619048,0.9047619047619048,0.9047618997619048,0.9523809523809524,0.9523809523809524,0.9523809473809524,0.99,1.00,da
"vi har fået beretninger om, at laskar jihad på ny forbereder en offensiv bl.a. i den vestlige del af irian, men også i retning af små øer som gorom og lusalaut.","we have received reports to the effect that the laskar jihad is preparing to launch a new offensive, in west-irian among other places, but also in small countries such as gorom and lusalaut.",Remove Character,"vi har fået beretninger om, at laskar jihad på ny forbereder en offensiv bl.a. i den vestlige del af irian, men også i retning af små øer som gorm og lusalaut.","(0.99, 0.95)",0.9234732618882052,0.9713,0.9666666666666668,0.9666666666666668,0.9666666616666668,0.935483870967742,0.935483870967742,0.935483865967742,0.9666666666666668,0.9666666666666668,0.9666666616666668,0.99,0.95,da
mennesker lukkes inde i kirker og tvinges til at lade sig omvende til muslimer.,people are being locked up in churches and forced to convert to islam.,Add random word,faktoid mennesker lukkes inde i kirker og tvinges til at lade sig omvende til muslimer.,"(0.95, 0.95)",0.9355069850316178,0.9932,0.9285714285714286,1.0,0.9629629579698218,0.9285714285714286,1.0,0.9629629579698218,0.9285714285714286,1.0,0.9629629579698218,0.95,0.95,da
"som ordfører synes jeg, det er uacceptabelt, og jeg spørger derfor kommissæren, hvad den europæiske union kan gøre over for wahid-regeringen for at forhindre yderligere blodsudgydelser.",as rapporteur i find that intolerable and i would therefore ask the commissioner what the european union can do with respect to the wahid government in order to prevent further bloodshed.,Swap words,"som ordfører synes jeg, det er uacceptabelt, og jeg spørger derfor kommissæren, den hvad europæiske union kan gøre over for wahid-regeringen for at forhindre yderligere blodsudgydelser. ","(0.95, 0.99)",0.8895530831783369,0.9988,0.9615384615384616,1.0,0.9803921518646674,0.8461538461538461,0.88,0.862745093041138,0.9230769230769232,0.96,0.9411764655901576,0.95,0.99,da
også papua-lederne er stadig fængslet.,there are still some papuan leaders under lock and key too.,Swap characters,også papua-lederen er stadig fængslet.,"(0.95, 0.95)",0.537284965911771,0.8067,0.8,0.8,0.7999999950000002,0.5,0.5,0.4999999950000001,0.8,0.8,0.7999999950000002,0.95,0.95,da
men netop disse problemer i regionerne er stadig tydelige.,but it is precisely these problems in the regions that are still very much apparent.,Swap words,men disse netop problemer i regionerne er stadig tydelige. ,"(0.95, 0.9)",0.6985342056580097,0.968,0.9,1.0,0.947368416066482,0.5555555555555556,0.625,0.5882352891349482,0.8,0.8888888888888888,0.8421052581717452,0.95,0.9,da
"asean-landene har hidtil gjort ringe fremskridt i forbindelse med den økonomiske integration, selv om der i årevis er talt om oprettelsen af en frihandelszone mellem medlemmerne.","so far, the asean countries have made little progress as regards economic integration, even though the establishment of a free-trade zone between the members has been mooted for years now.",Remove Token,"har hidtil gjort ringe fremskridt i forbindelse med den økonomiske integration, selv om der i årevis er talt om oprettelsen af en frihandelszone mellem medlemmerne.","(0.95, 0.95)",0.9621954581957616,0.9677,1.0,0.9583333333333334,0.9787233992575828,1.0,0.96,0.9795918317367764,1.0,0.9583333333333334,0.9787233992575828,0.95,0.95,da
"derfor anmoder industriudvalget om, at der indgås en bilateral samarbejdsaftale mellem den europæiske union og indonesien.",my committee has therefore asked to conclude a bilateral cooperation agreement between the european union and indonesia.,Remove Token,"derfor anmoder industriudvalget om, at der indgås en samarbejdsaftale mellem den europæiske union og indonesien.","(0.95, 0.98)",0.8394327083733336,0.9489,1.0,0.9375,0.967741930489074,0.9285714285714286,0.8666666666666667,0.8965517191438764,1.0,0.9375,0.967741930489074,0.95,0.98,da
"jeg beder hermed kommissær patten om at undersøge denne mulighed sammen med sin kollega, hr. lamy.","i will take this opportunity to ask commissioner patten to investigate this possibility, along with his colleague mr lamy.",Add random word,"jeg beder hermed kommissær patten om at undersøge denne mulighed sammen med sin kollega, hr . vink lamy.","(0.95, 0.98)",0.8766961461103245,0.9942,0.9411764705882352,1.0,0.9696969647015612,0.875,0.9333333333333332,0.903225801456816,0.9411764705882352,1.0,0.9696969647015612,0.95,0.98,da
"hr. formand, hr. kommissær, kære kolleger, jeg vil gerne først lykønske fru maij­weggen for det fremragende arbejde, som hun har udført.","mr president, commissioner, ladies and gentlemen, i should like to begin by congratulating mrs maij-weggen on the excellent job she has done.",Add random word,"hr . formand, hr . kommissær, kære kolleger, jeg vil gerne først lykønske fru trope maij­weggen for det fremragende arbejde, som hun har udført.","(0.98, 0.95)",0.9074485692010054,0.9963,0.9523809523809524,1.0,0.9756097511005354,0.9047619047619048,0.95,0.9268292632956572,0.9523809523809524,1.0,0.9756097511005354,0.98,0.95,da
"modsigelser som disse består fortsat i indonesien, både på molukkerne, i aceh, i irian jaya, og de kommer også endnu i dag til udtryk i østtimor.","there are still contradictions like this in indonesia, whether in the moluccas, aceh or irian jaya, and they are still manifest in east timor too.",Duplicate Token,"modsigelser som disse består fortsat i indonesien indonesien, både på molukkerne, i aceh, i irian jaya, og de kommer også endnu i dag til udtryk i østtimor.","(0.99, 0.99)",0.9421809915034964,0.9967,0.9565217391304348,1.0,0.977777772780247,0.9230769230769232,0.96,0.9411764655901576,0.9565217391304348,1.0,0.977777772780247,0.99,0.99,da
et hybridt samfund skal gøres gennemsigtigt.,a hybrid society must be turned into a transparent one.,Remove Character,et hybridt samfund skal gøres ennemsigtigt.,"(0.99, 0.99)",0.6434588841607617,0.8413,0.8333333333333334,0.8333333333333334,0.8333333283333335,0.8,0.8,0.7999999950000002,0.8333333333333334,0.8333333333333334,0.8333333283333335,0.99,0.99,da
"mange aktuelle problemer forårsages af manglende demokratisk kontrol med f.eks. dele af hæren, som modsætter sig forandring og tab af privilegier.","many current problems are down to a lack of democratic control, for example over those parts of the army that resist change and loss of privilege.",Duplicate character,"mange aktuelle problemer forårsages af manglende demokratisk kontrol med f.eeks. dele af hæren, som modsætter sig forandring og tab af privilegier.","(0.99, 0.95)",0.8843865924896842,0.958,0.95,0.95,0.949999995,0.9047619047619048,0.9047619047619048,0.9047618997619048,0.95,0.95,0.949999995,0.99,0.95,da
de er jo i mange tilfælde medskyldige i forbrydelserne.,this is hardly surprising given that they have been accessories to crimes in many cases.,Duplicate Token,de er jo i mange tilfælde medskyldige i forbrydelserne forbrydelserne.,"(0.95, 0.9)",0.8420460979216616,0.9861,1.0,1.0,0.999999995,0.8888888888888888,1.0,0.9411764656055364,1.0,1.0,0.999999995,0.95,0.9,da
"forbindelserne mellem indonesien og eu kan kun forbedres yderligere, hvis vi ved, at vores samtalepartnere dér også virkelig repræsenterer autoriteter, og at retsstaten fungerer behørigt.","relations between indonesia and the eu can only improve further if we know that our allies really hold sway there, and that the constitutional state is functioning properly.",Replace Character,"forbindelserne mellem indonesien og eu kan kun forbedres yderligere, hvis vi ved, at vores samtalepartnere dér også virkelig ropræsenterer autoriteter, og at retsstaten fungerer behørigt.","(0.98, 0.95)",0.9061874434879644,0.9653,0.9565217391304348,0.9565217391304348,0.9565217341304348,0.9166666666666666,0.9166666666666666,0.9166666616666668,0.9565217391304348,0.9565217391304348,0.9565217341304348,0.98,0.95,da
situationen på disse øer er stadig alarmerende.,the situation on these islands is still alarming.,Duplicate character,situationen på disse øer er stadig alarrmerende.,"(0.99, 1.00)",0.7071067811865475,0.8648,0.8571428571428571,0.8571428571428571,0.8571428521428571,0.8333333333333334,0.8333333333333334,0.8333333283333335,0.8571428571428571,0.8571428571428571,0.8571428521428571,0.99,1.00,da
"fru maij-weggen har skrevet en fortræffelig betænkning, og jeg konkluderer derfor, at europa skal gøre alt for at støtte landet på vejen mod demokrati, men det er i sidste instans op til indoneserne selv at udviske sporene efter suhartos regime.","mrs maij-weggen has written an outstanding report and i would therefore conclude that europe must do all it can to support the country on its way to democracy, but at the end of the day, it is up to the indonesians themselves to erase the traces of the suharto regime.",Replace Token with Random Word,"fru maij-weggen har skrevet en fortræffelig betænkning, og jeg konkluderer derfor, at europa skal gøre alt for at støtte landet slibe vejen mod demokrati, men det er i sidste instans op til indoneserne selv at udviske sporene efter suhartos regime.","(0.95, 0.95)",0.940028651976138,0.9772,0.9736842105263158,0.9736842105263158,0.973684205526316,0.9487179487179488,0.9487179487179488,0.9487179437179488,0.9736842105263158,0.9736842105263158,0.973684205526316,0.95,0.95,da
"stagnationen af fornyelserne indebærer på ingen måde, at vejen mod en demokratisk retsstat, jeg citerer ordføreren, ""virkelig ender blindt"".",stagnation of the reformation in no way implies that the way to a democratic constitutional state - and i quote the rapporteur - 'is truly leading nowhere' .,Replace Character,"stagnationen ao fornyelserne indebærer på ingen måde, at vejen mod en demokratisk retsstat, jeg citerer ordføreren, ""virkelig ender blindt"".","(1.00, 1.00)",0.9244754047211334,0.9597,0.9473684210526316,0.9473684210526316,0.9473684160526316,0.8888888888888888,0.8888888888888888,0.888888883888889,0.9473684210526316,0.9473684210526316,0.9473684160526316,1.00,1.00,da
"man skal holde op med at sikre sine egne gruppers interesse og udvise medfølelse med sine medmennesker, også muslimerne, ud fra kristus' kærlighed, forsoningsperspektivet for hele det til tider så hårdt ramte øhav.","they want people to stop working to secure the interests of their own groups and show sympathy towards their fellow human beings, including muslims, out of the love of christ, which offers hope of reconciliation to the entire, and sometimes sorely afflicted, archipelago.",Replace Character,"man skal holde op med at sikre sine egne gruppers interesse og udvise medfølelse med sine medmennesker, også zuslimerne, ud fra kristus' kærlighed, forsoningsperspektivet for hele det til tider så hårdt ramte øhav.","(0.99, 0.95)",0.9299238452109287,0.9736,0.967741935483871,0.967741935483871,0.9677419304838712,0.9375,0.9375,0.937499995,0.967741935483871,0.967741935483871,0.9677419304838712,0.99,0.95,da
vores holdning til indonesiens territoriale integritet er enkel. vi skal overholde folkeretten og fn's resolution 2504 af december 1969.,the position we have to take regarding the territorial integrity of indonesia is simple: we have to abide by international law and by the united nations resolution 2504 of december 1969.,Swap characters,vores holdning til indonesiens territoriale integritet er enkel. vi skal overholde folkeretten og fn's resolution 2504 af december 1699.,"(0.95, 0.99)",0.9132027013286008,0.9541,0.9473684210526316,0.9473684210526316,0.9473684160526316,0.9444444444444444,0.9444444444444444,0.9444444394444445,0.9473684210526316,0.9473684210526316,0.9473684160526316,0.95,0.99,da
"det er noget, som alle vores lande har aftalt, som de har skrevet under på, og som de er forpligtet til at støtte.","it is something that all our countries have agreed to, have signed up to, and have a responsibility to support.",Replace Token with Random Word,"det er noget, som alle vores lande har aftalt, som flekse har skrevet under på, og som de er forpligtet til at støtte.","(0.95, 0.99)",0.8985396083419646,0.9627,0.9473684210526316,1.0,0.9729729679766254,0.9090909090909092,0.9523809523809524,0.9302325531422392,0.9473684210526316,1.0,0.9729729679766254,0.95,0.99,da
det har østtimor aldrig været.,east timor never was.,Duplicate Token,det det har østtimor aldrig været.,"(0.95, 0.90)",0.846481724890614,0.9813,1.0,1.0,0.999999995,0.8,1.0,0.8888888839506174,1.0,1.0,0.999999995,0.95,0.90,da
"hr. formand, jeg bifalder denne betænkning, men jeg synes, at den er lidt for optimistisk.","mr president, i welcome this report but i feel it is a little up-beat.",Add random word,"hr . formand, jeg bifalder denne betænkning minde, men jeg synes, at den er lidt for optimistisk.","(0.95, 0.95)",0.8680538146126793,0.9945,0.8666666666666667,0.9285714285714286,0.8965517191438764,0.8,0.8571428571428571,0.8275862019024971,0.8666666666666667,0.9285714285714286,0.8965517191438764,0.95,0.95,da
tiden har sandelig ikke stået stille i indonesien siden da.,since then time has certainly not stood still in indonesia.,Negation,tiden har sandelig stået stille i indonesien siden da.,"(0.95, 0.95)",0.7016879391277372,0.9138,1.0,0.9,0.947368416066482,0.875,0.7777777777777778,0.823529406782007,1.0,0.9,0.947368416066482,0.95,0.95,da
den støtte skal tilvejebringes gennem øget politisk og økonomisk dialog samt øget målrettet udviklingssamarbejde.,"that support is to be provided through an enhanced political and economic dialogue, as well as enhanced targeted development cooperation.",Replace Token with Random Word,den støtte skal tilvejebringes gennem øget politisk og økonomisk dialog samt øget målrettet blod.,"(0.75, 0.95)",0.8666415730847504,0.932,0.9230769230769232,0.9230769230769232,0.9230769180769232,0.9230769230769232,0.9230769230769232,0.9230769180769232,0.9230769230769232,0.9230769230769232,0.9230769180769232,0.75,0.95,da
meddelelsen blev skrevet i en positiv ånd og afspejlede vores nye forhold.,"the communication was written in a positive spirit, reflecting the new dawn in our relationship.",Replace Character,mvddelelsen blev skrevet i en positiv ånd og afspejlede vores nye forhold.,"(0.99, 0.99)",0.912167909070388,0.9228,0.9166666666666666,0.9166666666666666,0.9166666616666668,0.9090909090909092,0.9090909090909092,0.9090909040909092,0.9166666666666666,0.9166666666666666,0.9166666616666668,0.99,0.99,da
kommissionen og rådet har bekræftet deres støtte til indonesiens territoriale integritet.,the commission and the council have reconfirmed their support for the territorial integrity of indonesia.,Replace Token with Random Word,kommissionen og rådet har bekræftet deres grammatik til indonesiens territoriale integritet.,"(0.80, 0.95)",0.7348889200874658,0.9139,0.9090909090909092,0.9090909090909092,0.9090909040909092,0.8,0.8,0.7999999950000002,0.9090909090909092,0.9090909090909092,0.9090909040909092,0.80,0.95,da
